72,"Are You Getting Any Sunshine? , Lou Christie","Is It Because I'm Black , Syl Johnson","I'm Just A Prisoner (Of Your Good Lovin') , Candi Staton","I'm Just A Prisoner (Of Your Good Lovin') , Candi Staton","Won't Find Better (Than Me) , The New Hope","Always Something There To Remind Me , R.B. Greaves","Always Something There To Remind Me , R.B. Greaves","House Of The Rising Sun , Frijid Pink","The Bells , The Originals","Something's Burning , Kenny Rogers & The First Edition","Something's Burning , Kenny Rogers & The First Edition","Heartbreaker , Grand Funk Railroad","1984 , Spirit","1984 , Spirit","1984 , Spirit","Mighty Joe , The Shocking Blue","Ticket To Ride , Carpenters","Ticket To Ride , Carpenters","Is Anybody Goin' To San Antone , Charley Pride","Which Way You Goin' Billy? , The Poppy Family (Featuring Susan Jacks)","Which Way You Goin' Billy? , The Poppy Family (Featuring Susan Jacks)","So Excited , B.B. King","Brown Paper Bag , Syndicate Of Sound","Open Up My Heart/Nadine , The Dells","Open Up My Heart/Nadine , The Dells","Grover Henson Feels Forgotten , Bill Cosby","Into The Mystic , Johnny Rivers","Into The Mystic , Johnny Rivers","Who's Gonna Take The Blame , Smokey Robinson & The Miracles","Are You Ready? , Pacific Gas And Electric","Tighter, Tighter , Alive & Kicking","Tighter, Tighter , Alive & Kicking","That Same Old Feeling , Pickettywitch","(How Bout A Little Hand For) The Boys In The Band , The Boys In The Band","(How Bout A Little Hand For) The Boys In The Band , The Boys In The Band","What Am I Gonna Do , Smith","Pearl , Tommy Roe","She Cried , The Lettermen","She Cried , The Lettermen","Gimme Shelter , Merry Clayton","Superman , The Ides Of March","Superman , The Ides Of March","Superman , The Ides Of March","Hummingbird , B.B. King","Big Yellow Taxi , Joni Mitchell","Big Yellow Taxi , Joni Mitchell","Long Long Time , Linda Ronstadt","Riki Tiki Tavi , Donovan","Riki Tiki Tavi , Donovan","Do What You Wanna Do , Five Flights Up","Funk # 49 , James Gang","Gypsy Woman , Brian Hyland","Gypsy Woman , Brian Hyland","Montego Bay , Bobby Bloom","Only You Know And I Know , Dave Mason","Only You Know And I Know , Dave Mason","Funk # 49 , James Gang","Part Time Love , Ann Peebles","Share The Land , The Guess Who","Share The Land , The Guess Who","If You Were Mine , Ray Charles","Stoney End , Barbra Streisand","Stoney End , Barbra Streisand","You Better Think Twice , Poco","Let Me Back In , Tyrone Davis","I Can't Believe That You've Stopped Loving Me , Charley Pride","I Can't Believe That You've Stopped Loving Me , Charley Pride","Where Did All The Good Times Go , Dennis Yost And The Classics IV","Carolina In My Mind , Crystal Mansion Featuring Johnny Caswell","Carolina In My Mind , Crystal Mansion Featuring Johnny Caswell","Amazing Grace , Judy Collins","Heartbreak Hotel , Frijid Pink","Bridget The Midget (The Queen Of The Blues) , Ray Stevens"
73,"I Love You , Otis Leavill","My Honey And Me , Luther Ingram","He Ain't Heavy, He's My Brother , The Hollies","He Ain't Heavy, He's My Brother , The Hollies","How Can I Tell My Mom & Dad , The Lovelites","How Can I Tell My Mom & Dad , The Lovelites","How Can I Tell My Mom & Dad , The Lovelites","Good Guys Only Win In The Movies , Mel And Tim","Save The Country , Thelma Houston","Can't Help Falling In Love , Al Martino","Can't Help Falling In Love , Al Martino","Superstar , Murray Head With The Trinidad Singers","California Girl , Eddie Floyd","California Girl , Eddie Floyd","How Can I Tell My Mom & Dad , The Lovelites","Add Some Music To Your Day , The Beach Boys","Everybody's Out Of Town , B.J. Thomas","Everybody's Out Of Town , B.J. Thomas","Everything Is Beautiful , Ray Stevens","Chicken Strut , The Meters","Chicken Strut , The Meters","He Made A Woman Out Of Me , Bobbie Gentry","Hum A Song (From Your Heart) , Lulu with The Dixie Flyers","Band Of Gold , Freda Payne","Band Of Gold , Freda Payne","Farther On Down The Road , Joe Simon","My Way , Brook Benton","My Way , Brook Benton","Spirit In The Dark , Aretha Franklin with The Dixie Flyers","Killer Joe , Quincy Jones","That Same Old Feeling , The Fortunes","That Same Old Feeling , The Fortunes","(How Bout A Little Hand For) The Boys In The Band , The Boys In The Band","What Am I Gonna Do , Smith","What Am I Gonna Do , Smith","Whoever Finds This, I Love You , Mac Davis","Whoever Finds This, I Love You , Mac Davis","In The Summertime , Mungo Jerry","In The Summertime , Mungo Jerry","Everybody's Got The Right To Love , The Supremes","Wigwam , Bob Dylan","Wigwam , Bob Dylan","Long Lonely Nights , The Dells","Long Lonely Nights , The Dells","Ball And Chain , Tommy James","Ball And Chain , Tommy James","Stay Away From Me (I Love You Too Much) , Major Lance","Morning Much Better , Ten Wheel Drive With Genya Ravan","Morning Much Better , Ten Wheel Drive With Genya Ravan","She Said Yes , Wilson Pickett","We Can Make It Baby , The Originals","We Can Make It Baby , The Originals","We Can Make It Baby , The Originals","I Just Wanna Keep It Together , Paul Davis","Come On And Say It , The Grass Roots","Come On And Say It , The Grass Roots","5-10-15-20 (25-30 Years Of Love) , The Presidents","Let Me Back In , Tyrone Davis","You Don't Have To Say You Love Me/Patch It Up , Elvis Presley","You Don't Have To Say You Love Me/Patch It Up , Elvis Presley","Don't Try To Lay No Boogie Woogie On The ""King Of Rock & Roll"" , CROW","Jerusalem , Herb Alpert & The Tijuana Brass","Jerusalem , Herb Alpert & The Tijuana Brass","Empty Pages , Traffic","Border Song (Holy Moses)/You And Me , Aretha Franklin","Carolina In My Mind , Crystal Mansion Featuring Johnny Caswell","Carolina In My Mind , Crystal Mansion Featuring Johnny Caswell","Carolina In My Mind , Crystal Mansion Featuring Johnny Caswell","Ruby Tuesday , Melanie","Ruby Tuesday , Melanie","Gypsy Queen - Part 1 , Gypsy","Remember Me , Diana Ross","1900 Yesterday , Liz Damon's Orient Express"
74,"Bold Soul Sister , Ike & Tina Turner","I'm Just A Prisoner (Of Your Good Lovin') , Candi Staton","Jennifer Tomkins , Street People","Jennifer Tomkins , Street People","Can't Take My Eyes Off You , Nancy Wilson","If Walls Could Talk , Little Milton","If Walls Could Talk , Little Milton","Easy Come, Easy Go , Bobby Sherman","If Walls Could Talk , Little Milton","Superstar , Murray Head With The Trinidad Singers","Superstar , Murray Head With The Trinidad Singers","Down In The Alley , Ronnie Hawkins","Keep On Doin' , The Isley Brothers","Keep On Doin' , The Isley Brothers","Gonna Give Her All The Love I've Got , Marvin Gaye","Heartbreaker , Grand Funk Railroad","Living Loving Maid (She's Just A Woman) , Led Zeppelin","Living Loving Maid (She's Just A Woman) , Led Zeppelin","Vehicle , The Ides Of March","So Excited , B.B. King","So Excited , B.B. King","You Make Me Real/Roadhouse Blues , The Doors","The Funniest Thing , Dennis Yost And The Classics IV","Farther On Down The Road , Joe Simon","Farther On Down The Road , Joe Simon","Can You Feel It , Bobby Goldsboro","I Can't Leave Your Love Alone , Clarence Carter","I Can't Leave Your Love Alone , Clarence Carter","I Call My Baby Candy , The Jaggerz","You, Me And Mexico , Edward Bear","Free The People , Delaney & Bonnie & Friends","Free The People , Delaney & Bonnie & Friends","Free The People , Delaney & Bonnie & Friends","Long And Lonesome Road , The Shocking Blue","Long And Lonesome Road , The Shocking Blue","Cottage Cheese , CROW","Your Own Back Yard , Dion","Your Own Back Yard , Dion","Your Own Back Yard , Dion","You've Been My Inspiration , The Main Ingredient","Long Lonely Nights , The Dells","Long Lonely Nights , The Dells","Girls Will Be Girls, Boys Will Be Boys , The Isley Brothers","Down By The River , Buddy Miles","Rainbow , The Marmalade","Rainbow , The Marmalade","Express Yourself , Charles Wright And The Watts 103rd Street Rhythm Band","Mongoose , Elephant's Memory","Mongoose , Elephant's Memory","Going To The Country , The Steve Miller Band","Somebody's Been Sleeping , 100 Proof Aged in Soul","(Baby) Turn On To Me , The Impressions","(Baby) Turn On To Me , The Impressions","See Me, Feel Me , The Who","Something , Shirley Bassey","Something , Shirley Bassey","I Think I Love You , The Partridge Family Starring Shirley Jones Featuring David Cassidy","After Midnight , Eric Clapton","Love Uprising , Otis Leaville","Love Uprising , Otis Leaville","Easy Rider (Let The Wind Pay The Way) , Iron Butterfly","Be My Baby , Andy Kim","Be My Baby , Andy Kim","I Can't Believe That You've Stopped Loving Me , Charley Pride","Simply Call It Love , Gene Chandler","Simply Call It Love , Gene Chandler","Simply Call It Love , Gene Chandler","Silver Moon , Michael Nesmith & The First National Band","Black Night , Deep Purple","Black Night , Deep Purple","Black Night , Deep Purple","When The Party Is Over , Robert John","He Called Me Baby , Candi Staton"
75,"Oh Me Oh My (I'm A Fool For You Baby) , Lulu","Jennifer Tomkins , Street People","To Be Young, Gifted And Black , Nina Simone","To Be Young, Gifted And Black , Nina Simone","If Walls Could Talk , Little Milton","Hello It's Me , Nazz","Hello It's Me , Nazz","Save The Country , Thelma Houston","Oh Well - Pt. I , Fleetwood Mac","Down In The Alley , Ronnie Hawkins","Down In The Alley , Ronnie Hawkins","Welfare Cadilac , Guy Drake","Superstar , Murray Head With The Trinidad Singers","Superstar , Murray Head With The Trinidad Singers","Come Together , Ike & Tina Turner & The Ikettes","Living Loving Maid (She's Just A Woman) , Led Zeppelin","Silly, Silly, Fool , Dusty Springfield","Silly, Silly, Fool , Dusty Springfield","Which Way You Goin' Billy? , The Poppy Family (Featuring Susan Jacks)","Run Sally Run , The Cuff Links","Run Sally Run , The Cuff Links","Viva Tirado - Part I , El Chicano","Ticket To Ride , Carpenters","Sugar Sugar/Cole, Cooke & Redding , Wilson Pickett","Sugar Sugar/Cole, Cooke & Redding , Wilson Pickett","It's All In The Game , Four Tops","Check Out Your Mind , The Impressions","Check Out Your Mind , The Impressions","I Want To Take You Higher , Sly & The Family Stone","A Little Bit Of Soap , Paul Davis","What Am I Gonna Do , Smith","What Am I Gonna Do , Smith","What Am I Gonna Do , Smith","Song From M*A*S*H , Al DeLory","Song From M*A*S*H , Al DeLory","When We Get Married , The Intruders","Cinnamon Girl , The Gentrys","Gimme Shelter , Merry Clayton","Gimme Shelter , Merry Clayton","Stealing In The Name Of The Lord , Paul Kelly","Girls Will Be Girls, Boys Will Be Boys , The Isley Brothers","Girls Will Be Girls, Boys Will Be Boys , The Isley Brothers","It's A Shame , The Spinners","Only You Know And I Know , Dave Mason","Something , Booker T. & The MG's","Something , Booker T. & The MG's","Morning Much Better , Ten Wheel Drive With Genya Ravan","Where Are You Going To My Love , The Brotherhood Of Man","Where Are You Going To My Love , The Brotherhood Of Man","Funk # 49 , James Gang","We Can Make Music , Tommy Roe","She Said Yes , Wilson Pickett","She Said Yes , Wilson Pickett","Something , Shirley Bassey","And The Grass Won't Pay No Mind , Mark Lindsay","And The Grass Won't Pay No Mind , Mark Lindsay","Love Uprising , Otis Leaville","Love Uprising , Otis Leaville","I'm Not My Brothers Keeper , The Flaming Ember","I'm Not My Brothers Keeper , The Flaming Ember","Only Love Can Break Your Heart , Neil Young","Empty Pages , Traffic","Empty Pages , Traffic","Who Needs Ya , Steppenwolf","Ace Of Spade , O.V. Wright","All I Have , The Moments","All I Have , The Moments","Paranoid , Black Sabbath","Amazing Grace , Judy Collins","Amazing Grace , Judy Collins","Flesh And Blood , Johnny Cash","If You Could Read My Mind , Gordon Lightfoot","(Do The) Push And Pull Part I , Rufus Thomas"
76,"Blowing Away , The 5th Dimension","To Be Young, Gifted And Black , Nina Simone","Didn't I (Blow Your Mind This Time) , The Delfonics","Didn't I (Blow Your Mind This Time) , The Delfonics","Hello It's Me , Nazz","Oh What A Day , The Dells","Oh What A Day , The Dells","Oh Well - Pt. I , Fleetwood Mac","Down In The Alley , Ronnie Hawkins","Walking Through The Country , The Grass Roots","Walking Through The Country , The Grass Roots","Ticket To Ride , Carpenters","Heartbreaker , Grand Funk Railroad","Heartbreaker , Grand Funk Railroad","Why Should I Cry , The Gentrys","Get Ready , Rare Earth","Run Sally Run , The Cuff Links","Run Sally Run , The Cuff Links","Run Sally Run , The Cuff Links","Hey Lawdy Mama , Steppenwolf","Hey Lawdy Mama , Steppenwolf","Hitchin' A Ride , Vanity Fare","Cinnamon Girl , The Gentrys","Brother Rapp (Part 1) , James Brown","Brother Rapp (Part 1) , James Brown","Welfare Cadilac , Guy Drake","Come To Me , Tommy James And The Shondells","Come To Me , Tommy James And The Shondells","So Much Love , Faith, Hope And Charity","Cottage Cheese , CROW","(How Bout A Little Hand For) The Boys In The Band , The Boys In The Band","(How Bout A Little Hand For) The Boys In The Band , The Boys In The Band","Long And Lonesome Road , The Shocking Blue","Steal Away , Johnnie Taylor","Steal Away , Johnnie Taylor","That Same Old Feeling , The Fortunes","That Same Old Feeling , The Fortunes","One Day Of Your Life , Andy Williams","One Day Of Your Life , Andy Williams","Groovy Situation , Gene Chandler","Glory Glory , The Rascals","Glory Glory , The Rascals","Que Sera, Sera (Whatever Will Be, Will Be) , Mary Hopkin","Que Sera, Sera (Whatever Will Be, Will Be) , Mary Hopkin","We're All Playing In The Same Band , Bert Sommer","We're All Playing In The Same Band , Bert Sommer","Where Are You Going To My Love , The Brotherhood Of Man","Going To The Country , The Steve Miller Band","Going To The Country , The Steve Miller Band","Don't Make Me Over , Brenda & The Tabulations","Gypsy Woman , Brian Hyland","Deeper & Deeper , Freda Payne","Deeper & Deeper , Freda Payne","Come On And Say It , The Grass Roots","Just Let It Come , Alive 'N Kickin'","Just Let It Come , Alive 'N Kickin'","Just Let It Come , Alive 'N Kickin'","I Am Somebody Part II , Johnnie Taylor","Time Waits For No One , The Friends Of Distinction","Time Waits For No One , The Friends Of Distinction","Time To Kill , The Band","You Better Think Twice , Poco","You Better Think Twice , Poco","Ace Of Spade , O.V. Wright","Carolina In My Mind , Crystal Mansion Featuring Johnny Caswell","Stoned Cowboy , Fantasy","Stoned Cowboy , Fantasy","Carolina In My Mind , James Taylor","Gypsy Queen - Part 1 , Gypsy","Gypsy Queen - Part 1 , Gypsy","I Can't Get Next To You , Al Green","Bridget The Midget (The Queen Of The Blues) , Ray Stevens","Are You My Woman? (Tell Me So) , The Chi-lites"
77,"Volunteers , Jefferson Airplane","Volunteers , Jefferson Airplane","Honey Come Back , Glen Campbell","Honey Come Back , Glen Campbell","The Touch Of You , Brenda & The Tabulations","Barbara, I Love You , New Colony Six","Barbara, I Love You , New Colony Six","Mornin Mornin , Bobby Goldsboro","Shilo , Neil Diamond","Rag Mama Rag , The Band","Rag Mama Rag , The Band","1984 , Spirit","Come Together , Ike & Tina Turner & The Ikettes","Come Together , Ike & Tina Turner & The Ikettes","The Cat Walk , The Village Soul Choir","Silly, Silly, Fool , Dusty Springfield","Victoria , The Kinks","Victoria , The Kinks","Come Running , Van Morrison","Brown Paper Bag , Syndicate Of Sound","Brown Paper Bag , Syndicate Of Sound","Brown Paper Bag , Syndicate Of Sound","The Seeker , The Who","Can You Feel It , Bobby Goldsboro","Can You Feel It , Bobby Goldsboro","Question , The Moody Blues","I Call My Baby Candy , The Jaggerz","I Call My Baby Candy , The Jaggerz","I Want To Take You Higher , Ike & Tina Turner & The Ikettes","Free The People , Delaney & Bonnie & Friends","Lay A Little Lovin' On Me , Robin McNamara","Lay A Little Lovin' On Me , Robin McNamara","Steal Away , Johnnie Taylor","The Sly, Slick, And The Wicked , The Lost Generation","The Sly, Slick, And The Wicked , The Lost Generation","Sweet Feeling , Candi Staton","One Day Of Your Life , Andy Williams","Everything A Man Could Ever Need , Glen Campbell","Everything A Man Could Ever Need , Glen Campbell","Hello Darlin' , Conway Twitty","Let The Music Take Your Mind , Kool & The Gang","Let The Music Take Your Mind , Kool & The Gang","Humphrey The Camel , Jack Blanchard & Misty Morgan","Drop By My Place , Little Carl Carlton","That's Where I Went Wrong , The Poppy Family (Featuring Susan Jacks)","That's Where I Went Wrong , The Poppy Family (Featuring Susan Jacks)","Mongoose , Elephant's Memory","Don't Make Me Over , Brenda & The Tabulations","Don't Make Me Over , Brenda & The Tabulations","I Like Your Lovin' (Do You Like Mine) , The Chi-lites","Yours Love , Joe Simon","Going To The Country , The Steve Miller Band","Going To The Country , The Steve Miller Band","It Don't Matter To Me , Bread","Holy Man , Diane Kolby","Holy Man , Diane Kolby","Holy Man , Diane Kolby","Heaven Help Us All , Stevie Wonder","If You Were Mine , Ray Charles","If You Were Mine , Ray Charles","I Need Help (I Can't Do It Alone) Pt. 1 , Bobby Byrd","Do It , Neil Diamond","Do It , Neil Diamond","Pay To The Piper , Chairman Of The Board","It's Impossible , Perry Como","(Don't Worry) If There's A Hell Below We're All Going To Go , Curtis Mayfield","(Don't Worry) If There's A Hell Below We're All Going To Go , Curtis Mayfield","Stealer , Free","Precious, Precious , Jackie Moore","Precious, Precious , Jackie Moore","Mean Mistreater , Grand Funk Railroad","1900 Yesterday , Liz Damon's Orient Express","One Bad Apple , The Osmonds"
78,"Is It Because I'm Black , Syl Johnson","Six White Horses , Tommy Cash","Six White Horses , Tommy Cash","Six White Horses , Tommy Cash","To Be Young, Gifted And Black , Nina Simone","The Rapper , The Jaggerz","The Rapper , The Jaggerz","Down In The Alley , Ronnie Hawkins","Superstar , Murray Head With The Trinidad Singers","Gotta Get Back To You , Tommy James And The Shondells","Gotta Get Back To You , Tommy James And The Shondells","Temma Harbour , Mary Hopkin","She's Ready , Spiral Starecase Featuring: Pat Upton","She's Ready , Spiral Starecase Featuring: Pat Upton","She's Ready , Spiral Starecase Featuring: Pat Upton","Run Sally Run , The Cuff Links","I Could Write A Book , Jerry Butler","I Could Write A Book , Jerry Butler","But For Love , Jerry Naylor","He Made A Woman Out Of Me , Bobbie Gentry","He Made A Woman Out Of Me , Bobbie Gentry","My Wife, The Dancer , Eddie & Dutch","United We Stand , The Brotherhood Of Man","Welfare Cadilac , Guy Drake","Welfare Cadilac , Guy Drake","Baby Hold On , The Grass Roots","Killer Joe , Quincy Jones","Killer Joe , Quincy Jones","Killer Joe , Quincy Jones","Red Red Wine , Vic Dana","Red Red Wine , Vic Dana","Red Red Wine , Vic Dana","Song From M*A*S*H , Al DeLory","Friends , Feather","Friends , Feather","Friends , Feather","Song From M*A*S*H , Al DeLory","You've Been My Inspiration , The Main Ingredient","You've Been My Inspiration , The Main Ingredient","Let The Music Take Your Mind , Kool & The Gang","The Witch , The Rattles","The Witch , The Rattles","Hummingbird , B.B. King","Black Hands White Cotton , The Caboose","Black Hands White Cotton , The Caboose","Black Hands White Cotton , The Caboose","Uncle John's Band , The Grateful Dead","Funk # 49 , James Gang","Funk # 49 , James Gang","Yours Love , Joe Simon","(Baby) Turn On To Me , The Impressions","Stay Away From Me (I Love You Too Much) , Major Lance","Stay Away From Me (I Love You Too Much) , Major Lance","Stay Away From Me (I Love You Too Much) , Major Lance","Love Uprising , Otis Leaville","Love Uprising , Otis Leaville","Part Time Love , Ann Peebles","Time Waits For No One , The Friends Of Distinction","Woodstock , The Assembled Multitude","Woodstock , The Assembled Multitude","No Matter What , Badfinger","It's All In Your Mind , Clarence Carter","It's All In Your Mind , Clarence Carter","Groove Me , King Floyd","I Need Help (I Can't Do It Alone) Pt. 1 , Bobby Byrd","Where Did All The Good Times Go , Dennis Yost And The Classics IV","Where Did All The Good Times Go , Dennis Yost And The Classics IV","The Green Grass Starts To Grow , Dionne Warwick","I Can't Get Next To You , Al Green","I Can't Get Next To You , Al Green","Heartbreak Hotel , Frijid Pink","Watching Scotty Grow , Bobby Goldsboro","Let Your Love Go , Bread"
79,"Together , The Illusion","Are You Getting Any Sunshine? , Lou Christie","Won't Find Better (Than Me) , The New Hope","Won't Find Better (Than Me) , The New Hope","If I Were A Carpenter , Johnny Cash & June Carter","I've Gotta Make You Love Me , Steam","I've Gotta Make You Love Me , Steam","Barbara, I Love You , New Colony Six","The Court Of The Crimson King - Part 1 , King Crimson","A Change Is Gonna Come & People Gotta Be Free/The Declaration , The 5th Dimension","A Change Is Gonna Come & People Gotta Be Free/The Declaration , The 5th Dimension","Keep On Doin' , The Isley Brothers","Easy To Be Free , Rick Nelson","Easy To Be Free , Rick Nelson","Superstar , Murray Head With The Trinidad Singers","My Woman, My Woman, My Wife , Marty Robbins","Is Anybody Goin' To San Antone , Charley Pride","Is Anybody Goin' To San Antone , Charley Pride","I Got A Thing, You Got A Thing, Everybody's Got A Thing , Funkadelic","I Got A Thing, You Got A Thing, Everybody's Got A Thing , Funkadelic","I Got A Thing, You Got A Thing, Everybody's Got A Thing , Funkadelic","Don't Stop Now/Since I Don't Have You , Eddie Holman","Welfare Cadilac , Guy Drake","Grover Henson Feels Forgotten , Bill Cosby","Grover Henson Feels Forgotten , Bill Cosby","(You've Got Me) Dangling On A String , Chairman Of The Board","Go Back , Crabby Appleton","Go Back , Crabby Appleton","Ball Of Confusion (That's What The World Is Today) , The Temptations","She Didn't Know (She Kept On Talking) , Dee Dee Warwick","Friends , Feather","Friends , Feather","Friends , Feather","Spill The Wine , Eric Burdon And War","Spill The Wine , Eric Burdon And War","She Didn't Know (She Kept On Talking) , Dee Dee Warwick","Everything A Man Could Ever Need , Glen Campbell","Summertime Blues , The Who","Summertime Blues , The Who","Solitary Man , Neil Diamond","Snowbird , Anne Murray","Snowbird , Anne Murray","Down By The River , Buddy Miles","Yellow River , Christie","Yellow River , Christie","Yellow River , Christie","On The Beach (In The Summertime) , The 5th Dimension","I Stand Accused , Isaac Hayes","I Stand Accused , Isaac Hayes","Morning Much Better , Ten Wheel Drive With Genya Ravan","I Do Take You , The Three Degrees","Montego Bay , Bobby Bloom","Montego Bay , Bobby Bloom","We Can Make It Baby , The Originals","Stay Away From Me (I Love You Too Much) , Major Lance","Stay Away From Me (I Love You Too Much) , Major Lance","Fresh Air , Quicksilver Messenger Service","Woodstock , The Assembled Multitude","Got To Believe In Love , Robin McNamara","Got To Believe In Love , Robin McNamara","Got To Believe In Love , Robin McNamara","I Can't Believe That You've Stopped Loving Me , Charley Pride","I Can't Believe That You've Stopped Loving Me , Charley Pride","Stoned Cowboy , Fantasy","Stoned Cowboy , Fantasy","Carolina In My Mind , James Taylor","Carolina In My Mind , James Taylor","When The Party Is Over , Robert John","Stoned Cowboy , Fantasy","Stoned Cowboy , Fantasy","Church Street Soul Revival , Tommy James","Maggie , Redbone","Maggie , Redbone"
