24,"Up On Cripple Creek , The Band","Ain't It Funky Now (Part 1) , James Brown","Ain't It Funky Now (Part 1) , James Brown","Ain't It Funky Now (Part 1) , James Brown","Wonderful World, Beautiful People , Jimmy Cliff","Baby Take Me In Your Arms , Jefferson","Baby Take Me In Your Arms , Jefferson","Honey Come Back , Glen Campbell","Didn't I (Blow Your Mind This Time) , The Delfonics","Don't Cry Daddy/Rubberneckin' , Elvis Presley","Don't Cry Daddy/Rubberneckin' , Elvis Presley","House Of The Rising Sun , Frijid Pink","Honey Come Back , Glen Campbell","Honey Come Back , Glen Campbell","Gotta Hold On To This Feeling , Jr. Walker & The All Stars","Up The Ladder To The Roof , The Supremes","The Bells , The Originals","The Bells , The Originals","Kentucky Rain , Elvis Presley","Shilo , Neil Diamond","Shilo , Neil Diamond","Shilo , Neil Diamond","The Rapper , The Jaggerz","You Need Love Like I Do (Don't You) , Gladys Knight And The Pips","You Need Love Like I Do (Don't You) , Gladys Knight And The Pips","Make Me Smile , Chicago","Come Saturday Morning , The Sandpipers","Come Saturday Morning , The Sandpipers","Puppet Man , The 5th Dimension","My Baby Loves Lovin' , White Plains","My Baby Loves Lovin' , White Plains","My Baby Loves Lovin' , White Plains","Reflections Of My Life , The Marmalade","It's All In The Game , Four Tops","It's All In The Game , Four Tops","It's All In The Game , Four Tops","Sugar Sugar/Cole, Cooke & Redding , Wilson Pickett","Sugar Sugar/Cole, Cooke & Redding , Wilson Pickett","Sugar Sugar/Cole, Cooke & Redding , Wilson Pickett","Mississippi Queen , Mountain","War , Edwin Starr","War , Edwin Starr","Silver Bird , Mark Lindsay","Overture From Tommy (A Rock Opera) , The Assembled Multitude","Hi-De-Ho , Blood, Sweat & Tears","Hi-De-Ho , Blood, Sweat & Tears","Everybody's Got The Right To Love , The Supremes","Groovy Situation , Gene Chandler","Groovy Situation , Gene Chandler","Tell It All Brother , Kenny Rogers & The First Edition","It's A Shame , The Spinners","It's A Shame , The Spinners","It's A Shame , The Spinners","Express Yourself , Charles Wright And The Watts 103rd Street Rhythm Band","Look What They've Done To My Song Ma , The New Seekers featuring Eve Graham","Look What They've Done To My Song Ma , The New Seekers featuring Eve Graham","Long Long Time , Linda Ronstadt","Long Long Time , Linda Ronstadt","Super Bad (Part 1 & Part 2) , James Brown","Super Bad (Part 1 & Part 2) , James Brown","Engine Number 9 , Wilson Pickett","Stand By Your Man , Candi Staton","Stand By Your Man , Candi Staton","See Me, Feel Me , The Who","Yellow River , Christie","One Less Bell To Answer , The 5th Dimension","One Less Bell To Answer , The 5th Dimension","It Don't Matter To Me , Bread","See Me, Feel Me , The Who","See Me, Feel Me , The Who","Pay To The Piper , Chairman Of The Board","Can't Stop Loving You , Tom Jones","Your Song , Elton John"
25,"Smile A Little Smile For Me , The Flying Machine","Friendship Train , Gladys Knight And The Pips","Friendship Train , Gladys Knight And The Pips","Friendship Train , Gladys Knight And The Pips","Walk A Mile In My Shoes , Joe South and The Believers","Wonderful World, Beautiful People , Jimmy Cliff","Wonderful World, Beautiful People , Jimmy Cliff","Rainy Night In Georgia/Rubberneckin' , Brook Benton","Winter World Of Love , Engelbert Humperdinck","Baby Take Me In Your Arms , Jefferson","Baby Take Me In Your Arms , Jefferson","Kentucky Rain , Elvis Presley","Never Had A Dream Come True , Stevie Wonder","Never Had A Dream Come True , Stevie Wonder","Never Had A Dream Come True , Stevie Wonder","The Bells , The Originals","Something's Burning , Kenny Rogers & The First Edition","Something's Burning , Kenny Rogers & The First Edition","Travelin' Band/Who'll Stop The Rain , Creedence Clearwater Revival","Long Lonesome Highway , Michael Parks","Long Lonesome Highway , Michael Parks","Call Me/Son Of A Preacher Man , Aretha Franklin","Everybody's Out Of Town , B.J. Thomas","Everybody's Out Of Town , B.J. Thomas","Everybody's Out Of Town , B.J. Thomas","The Letter , Joe Cocker with Leon Russell & The Shelter People","Puppet Man , The 5th Dimension","Puppet Man , The 5th Dimension","My Baby Loves Lovin' , White Plains","Lay Down (Candles In The Rain) , Melanie with The Edwin Hawkins Singers","Question , The Moody Blues","Question , The Moody Blues","It's All In The Game , Four Tops","Spirit In The Dark , Aretha Franklin with The Dixie Flyers","Spirit In The Dark , Aretha Franklin with The Dixie Flyers","Mississippi Queen , Mountain","Up Around The Bend/Run Through The Jungle , Creedence Clearwater Revival","Signed, Sealed, Delivered I'm Yours , Stevie Wonder","Signed, Sealed, Delivered I'm Yours , Stevie Wonder","Ohio , Crosby, Stills, Nash & Young","(If You Let Me Make Love To You Then) Why Can't I Touch You? , Ronnie Dyson","(If You Let Me Make Love To You Then) Why Can't I Touch You? , Ronnie Dyson","Westbound #9 , The Flaming Ember","Ride Captain Ride , Blues Image","Ain't No Mountain High Enough , Diana Ross","Ain't No Mountain High Enough , Diana Ross","Hand Me Down World , The Guess Who","Snowbird , Anne Murray","Snowbird , Anne Murray","Rubber Duckie , Ernie (Jim Henson)","All Right Now , Free","Express Yourself , Charles Wright And The Watts 103rd Street Rhythm Band","Express Yourself , Charles Wright And The Watts 103rd Street Rhythm Band","Indiana Wants Me , R. Dean Taylor","Long Long Time , Linda Ronstadt","Long Long Time , Linda Ronstadt","25 Or 6 To 4 , Chicago","Groovy Situation , Gene Chandler","God, Love And Rock & Roll , Teegarden & Van Winkle","God, Love And Rock & Roll , Teegarden & Van Winkle","Stand By Your Man , Candi Staton","See Me, Feel Me , The Who","See Me, Feel Me , The Who","Yellow River , Christie","Candida , Dawn","Let's Work Together , Canned Heat","Let's Work Together , Canned Heat","Let's Work Together , Canned Heat","Engine Number 9 , Wilson Pickett","Engine Number 9 , Wilson Pickett","Can't Stop Loving You , Tom Jones","Lonely Days , Bee Gees","Be My Baby , Andy Kim"
26,"A Brand New Me , Dusty Springfield","These Eyes , Jr. Walker & The All Stars","Wonderful World, Beautiful People , Jimmy Cliff","Wonderful World, Beautiful People , Jimmy Cliff","Evil Woman Don't Play Your Games With Me , CROW","Holly Holy , Neil Diamond","Holly Holy , Neil Diamond","The Thrill Is Gone , B.B. King","Give Me Just A Little More Time , Chairman Of The Board","Oh Me Oh My (I'm A Fool For You Baby) , Lulu","Oh Me Oh My (I'm A Fool For You Baby) , Lulu","Always Something There To Remind Me , R.B. Greaves","Always Something There To Remind Me , R.B. Greaves","Always Something There To Remind Me , R.B. Greaves","The Thrill Is Gone , B.B. King","Raindrops Keep Fallin' On My Head , B.J. Thomas","Hey There Lonely Girl , Eddie Holman","Hey There Lonely Girl , Eddie Holman","All I Have To Do Is Dream , Bobbie Gentry & Glen Campbell","Tennessee Bird Walk , Jack Blanchard & Misty Morgan","Tennessee Bird Walk , Jack Blanchard & Misty Morgan","He Ain't Heavy, He's My Brother , The Hollies","Cecilia , Simon & Garfunkel","House Of The Rising Sun , Frijid Pink","House Of The Rising Sun , Frijid Pink","Little Green Bag , George Baker Selection","Little Green Bag , George Baker Selection","Little Green Bag , George Baker Selection","Instant Karma (We All Shine On) , John Ono Lennon","United We Stand , The Brotherhood Of Man","Woodstock , Crosby, Stills, Nash & Young","Woodstock , Crosby, Stills, Nash & Young","Band Of Gold , Freda Payne","Come Saturday Morning , The Sandpipers","Come Saturday Morning , The Sandpipers","Sugar Sugar/Cole, Cooke & Redding , Wilson Pickett","Make Me Smile , Chicago","Question , The Moody Blues","Question , The Moody Blues","Save The Country , The 5th Dimension","Save The Country , The 5th Dimension","Save The Country , The 5th Dimension","Tell It All Brother , Kenny Rogers & The First Edition","25 Or 6 To 4 , Chicago","Summertime Blues , The Who","Summertime Blues , The Who","Summertime Blues , The Who","Mama Told Me (Not To Come) , Three Dog Night","Mama Told Me (Not To Come) , Three Dog Night","(I Know) I'm Losing You , Rare Earth","Everybody's Got The Right To Love , The Supremes","Neanderthal Man , Hotlegs","Neanderthal Man , Hotlegs","Long Long Time , Linda Ronstadt","Closer To Home (I'm Your Captain) , Grand Funk Railroad","Closer To Home (I'm Your Captain) , Grand Funk Railroad","Closer To Home (I'm Your Captain) , Grand Funk Railroad","Joanne , Michael Nesmith & The First National Band","Stand By Your Man , Candi Staton","Stand By Your Man , Candi Staton","The Tears Of A Clown , Smokey Robinson & The Miracles","Look What They've Done To My Song Ma , The New Seekers featuring Eve Graham","Look What They've Done To My Song Ma , The New Seekers featuring Eve Graham","Deeper & Deeper , Freda Payne","Let's Work Together , Canned Heat","Black Magic Woman , Santana","Black Magic Woman , Santana","Domino , Van Morrison","Yellow River , Christie","Yellow River , Christie","Stoney End , Barbra Streisand","Montego Bay , Bobby Bloom","Love The One You're With , Stephen Stills"
27,"She , Tommy James And The Shondells","Up On Cripple Creek , The Band","Backfield In Motion , Mel And Tim","Backfield In Motion , Mel And Tim","Walkin' In The Rain , Jay & The Americans","Down On The Corner/Fortunate Son , Creedence Clearwater Revival","Down On The Corner/Fortunate Son , Creedence Clearwater Revival","Didn't I (Blow Your Mind This Time) , The Delfonics","Walkin' In The Rain , Jay & The Americans","Walkin' In The Rain , Jay & The Americans","Walkin' In The Rain , Jay & The Americans","Love Grows (Where My Rosemary Goes) , Edison Lighthouse","Easy Come, Easy Go , Bobby Sherman","Easy Come, Easy Go , Bobby Sherman","Venus , The Shocking Blue","Do The Funky Chicken , Rufus Thomas","All I Have To Do Is Dream , Bobbie Gentry & Glen Campbell","All I Have To Do Is Dream , Bobbie Gentry & Glen Campbell","Long Lonesome Highway , Michael Parks","Didn't I (Blow Your Mind This Time) , The Delfonics","Didn't I (Blow Your Mind This Time) , The Delfonics","For The Love Of Him , Bobbi Martin","You Need Love Like I Do (Don't You) , Gladys Knight And The Pips","What Is Truth , Johnny Cash","What Is Truth , Johnny Cash","Tennessee Bird Walk , Jack Blanchard & Misty Morgan","Reach Out And Touch (Somebody's Hand) , Diana Ross","Reach Out And Touch (Somebody's Hand) , Diana Ross","Viva Tirado - Part I , El Chicano","Love Or Let Me Be Lonely , The Friends Of Distinction","Spirit In The Sky , Norman Greenbaum","Spirit In The Sky , Norman Greenbaum","Turn Back The Hands Of Time , Tyrone Davis","Sugar Sugar/Cole, Cooke & Redding , Wilson Pickett","Sugar Sugar/Cole, Cooke & Redding , Wilson Pickett","American Woman/No Sugar Tonight , The Guess Who","Check Out Your Mind , The Impressions","Check Out Your Mind , The Impressions","Check Out Your Mind , The Impressions","Check Out Your Mind , The Impressions","Silver Bird , Mark Lindsay","Silver Bird , Mark Lindsay","Overture From Tommy (A Rock Opera) , The Assembled Multitude","Summertime Blues , The Who","Everybody's Got The Right To Love , The Supremes","Everybody's Got The Right To Love , The Supremes","Solitary Man , Neil Diamond","O-o-h Child/Dear Prudence , The 5 Stairsteps","O-o-h Child/Dear Prudence , The 5 Stairsteps","Tighter, Tighter , Alive & Kicking","Overture From Tommy (A Rock Opera) , The Assembled Multitude","Joanne , Michael Nesmith & The First National Band","Joanne , Michael Nesmith & The First National Band","Solitary Man , Neil Diamond","Lola , The Kinks","Lola , The Kinks","Don't Play That Song , Aretha Franklin with The Dixie Flyers","Somebody's Been Sleeping , 100 Proof Aged in Soul","Cry Me A River , Joe Cocker","Cry Me A River , Joe Cocker","See Me, Feel Me , The Who","Yellow River , Christie","Yellow River , Christie","Share The Land , The Guess Who","One Less Bell To Answer , The 5th Dimension","Still Water (Love) , Four Tops","Still Water (Love) , Four Tops","Somebody's Been Sleeping , 100 Proof Aged in Soul","One Man Band , Three Dog Night","One Man Band , Three Dog Night","Groove Me , King Floyd","Immigrant Song , Led Zeppelin","We've Only Just Begun , Carpenters"
28,"Without Love (There Is Nothing) , Tom Jones","Wonderful World, Beautiful People , Jimmy Cliff","Take A Letter Maria , R.B. Greaves","Take A Letter Maria , R.B. Greaves","No Time , The Guess Who","Come Together/Something , The Beatles","Come Together/Something , The Beatles","Wonderful World, Beautiful People , Jimmy Cliff","He Ain't Heavy, He's My Brother , The Hollies","Someday We'll Be Together , Diana Ross & The Supremes","Someday We'll Be Together , Diana Ross & The Supremes","Blowing Away , The 5th Dimension","Gotta Hold On To This Feeling , Jr. Walker & The All Stars","Gotta Hold On To This Feeling , Jr. Walker & The All Stars","Spirit In The Sky , Norman Greenbaum","No Time , The Guess Who","Love Or Let Me Be Lonely , The Friends Of Distinction","Love Or Let Me Be Lonely , The Friends Of Distinction","Tennessee Bird Walk , Jack Blanchard & Misty Morgan","Ma Belle Amie , The Tee Set","Ma Belle Amie , The Tee Set","Gotta Hold On To This Feeling , Jr. Walker & The All Stars","Celebrate , Three Dog Night","Little Green Bag , George Baker Selection","Little Green Bag , George Baker Selection","Everybody's Out Of Town , B.J. Thomas","Come And Get It , Badfinger","Come And Get It , Badfinger","Hitchin' A Ride , Vanity Fare","Question , The Moody Blues","The Wonder Of You/Mama Liked The Roses , Elvis Presley","The Wonder Of You/Mama Liked The Roses , Elvis Presley","For The Love Of Him , Bobbi Martin","Mississippi Queen , Mountain","Mississippi Queen , Mountain","Love Land , Charles Wright And The Watts 103rd Street Rhythm Band","Are You Ready? , Pacific Gas And Electric","Everything Is Beautiful , Ray Stevens","Everything Is Beautiful , Ray Stevens","Silver Bird , Mark Lindsay","Mississippi Queen , Mountain","Mississippi Queen , Mountain","Patches , Clarence Carter","Maybe , The Three Degrees","Hand Me Down World , The Guess Who","Hand Me Down World , The Guess Who","Big Yellow Taxi , The Neighborhood","I (Who Have Nothing) , Tom Jones","I (Who Have Nothing) , Tom Jones","Cracklin' Rosie , Neil Diamond","Neanderthal Man , Hotlegs","Everybody's Got The Right To Love , The Supremes","Everybody's Got The Right To Love , The Supremes","Lola , The Kinks","Rubber Duckie , Ernie (Jim Henson)","Rubber Duckie , Ernie (Jim Henson)","El Condor Pasa (If I Could) , Simon & Garfunkel","That's Where I Went Wrong , The Poppy Family (Featuring Susan Jacks)","Engine Number 9 , Wilson Pickett","Engine Number 9 , Wilson Pickett","Montego Bay , Bobby Bloom","Lucretia Mac Evil , Blood, Sweat & Tears","Lucretia Mac Evil , Blood, Sweat & Tears","Look What They've Done To My Song Ma , The New Seekers featuring Eve Graham","Stand By Your Man , Candi Staton","After Midnight , Eric Clapton","After Midnight , Eric Clapton","Green-Eyed Lady , Sugarloaf","Can't Stop Loving You , Tom Jones","Can't Stop Loving You , Tom Jones","It's Impossible , Perry Como","Your Song , Elton John","I'll Be There , Jackson 5"
29,"Baby, I'm For Real , The Originals","A Brand New Me , Dusty Springfield","Cold Turkey , Plastic Ono Band","Cold Turkey , Plastic Ono Band","Eli's Coming , Three Dog Night","Honey Come Back , Glen Campbell","Honey Come Back , Glen Campbell","She Came In Through The Bathroom Window , Joe Cocker","She Came In Through The Bathroom Window , Joe Cocker","House Of The Rising Sun , Frijid Pink","House Of The Rising Sun , Frijid Pink","Never Had A Dream Come True , Stevie Wonder","I'll Never Fall In Love Again , Dionne Warwick","I'll Never Fall In Love Again , Dionne Warwick","Honey Come Back , Glen Campbell","The Thrill Is Gone , B.B. King","Raindrops Keep Fallin' On My Head , B.J. Thomas","Raindrops Keep Fallin' On My Head , B.J. Thomas","Shilo , Neil Diamond","Reflections Of My Life , The Marmalade","Reflections Of My Life , The Marmalade","You Need Love Like I Do (Don't You) , Gladys Knight And The Pips","Give Me Just A Little More Time , Chairman Of The Board","Up Around The Bend/Run Through The Jungle , Creedence Clearwater Revival","Up Around The Bend/Run Through The Jungle , Creedence Clearwater Revival","Reach Out And Touch (Somebody's Hand) , Diana Ross","Viva Tirado - Part I , El Chicano","Viva Tirado - Part I , El Chicano","United We Stand , The Brotherhood Of Man","Soolaimn (African Trilogy II) , Neil Diamond","ABC , Jackson 5","ABC , Jackson 5","Reach Out And Touch (Somebody's Hand) , Diana Ross","Check Out Your Mind , The Impressions","Check Out Your Mind , The Impressions","Check Out Your Mind , The Impressions","Teach Your Children , Crosby, Stills, Nash & Young","Ohio , Crosby, Stills, Nash & Young","Ohio , Crosby, Stills, Nash & Young","I Just Can't Help Believing , B.J. Thomas","Westbound #9 , The Flaming Ember","Westbound #9 , The Flaming Ember","Get Up (I Feel Like Being Like A) Sex Machine (Part 1) , James Brown","Big Yellow Taxi , The Neighborhood","Big Yellow Taxi , The Neighborhood","Big Yellow Taxi , The Neighborhood","The Sly, Slick, And The Wicked , The Lost Generation","Ball Of Confusion (That's What The World Is Today) , The Temptations","Ball Of Confusion (That's What The World Is Today) , The Temptations","Lay A Little Lovin' On Me , Robin McNamara","Joanne , Michael Nesmith & The First National Band","Long Long Time , Linda Ronstadt","Long Long Time , Linda Ronstadt","Out In The Country , Three Dog Night","Fire And Rain , James Taylor","Fire And Rain , James Taylor","That's Where I Went Wrong , The Poppy Family (Featuring Susan Jacks)","God, Love And Rock & Roll , Teegarden & Van Winkle","Long Long Time , Linda Ronstadt","Long Long Time , Linda Ronstadt","Our House , Crosby, Stills, Nash & Young","Our House , Crosby, Stills, Nash & Young","Our House , Crosby, Stills, Nash & Young","5-10-15-20 (25-30 Years Of Love) , The Presidents","It's Only Make Believe , Glen Campbell","For The Good Times , Ray Price","For The Good Times , Ray Price","Cry Me A River , Joe Cocker","Groove Me , King Floyd","Groove Me , King Floyd","River Deep - Mountain High , The Supremes & Four Tops","Share The Land , The Guess Who","Can't Stop Loving You , Tom Jones"
30,"Ain't It Funky Now (Part 1) , James Brown","Winter World Of Love , Engelbert Humperdinck","Walk A Mile In My Shoes , Joe South and The Believers","Walk A Mile In My Shoes , Joe South and The Believers","Blowing Away , The 5th Dimension","She Came In Through The Bathroom Window , Joe Cocker","She Came In Through The Bathroom Window , Joe Cocker","Fancy , Bobbie Gentry","Fancy , Bobbie Gentry","Winter World Of Love , Engelbert Humperdinck","Winter World Of Love , Engelbert Humperdinck","Gotta Hold On To This Feeling , Jr. Walker & The All Stars","Do The Funky Chicken , Rufus Thomas","Do The Funky Chicken , Rufus Thomas","Do The Funky Chicken , Rufus Thomas","Oh Me Oh My (I'm A Fool For You Baby) , Lulu","Do The Funky Chicken , Rufus Thomas","Do The Funky Chicken , Rufus Thomas","Reflections Of My Life , The Marmalade","Kentucky Rain , Elvis Presley","Kentucky Rain , Elvis Presley","Rainy Night In Georgia/Rubberneckin' , Brook Benton","What Is Truth , Johnny Cash","Long Lonesome Highway , Michael Parks","Long Lonesome Highway , Michael Parks","Daughter Of Darkness , Tom Jones","Airport Love Theme (Gwen And Vern) , Vincent Bell","Airport Love Theme (Gwen And Vern) , Vincent Bell","Soolaimn (African Trilogy II) , Neil Diamond","What Is Truth , Johnny Cash","It's All In The Game , Four Tops","It's All In The Game , Four Tops","Gimme Dat Ding , The Pipkins","Love Land , Charles Wright And The Watts 103rd Street Rhythm Band","Love Land , Charles Wright And The Watts 103rd Street Rhythm Band","Are You Ready? , Pacific Gas And Electric","Spirit In The Dark , Aretha Franklin with The Dixie Flyers","Save The Country , The 5th Dimension","Save The Country , The 5th Dimension","Westbound #9 , The Flaming Ember","Love Land , Charles Wright And The Watts 103rd Street Rhythm Band","Love Land , Charles Wright And The Watts 103rd Street Rhythm Band","Mississippi Queen , Mountain","The Sly, Slick, And The Wicked , The Lost Generation","The Sly, Slick, And The Wicked , The Lost Generation","The Sly, Slick, And The Wicked , The Lost Generation","The Love You Save/I Found That Girl , Jackson 5","(I Know) I'm Losing You , Rare Earth","(I Know) I'm Losing You , Rare Earth","Get Up (I Feel Like Being Like A) Sex Machine (Part 1) , James Brown","Long Long Time , Linda Ronstadt","Closer To Home (I'm Your Captain) , Grand Funk Railroad","Closer To Home (I'm Your Captain) , Grand Funk Railroad","Closer To Home (I'm Your Captain) , Grand Funk Railroad","(They Long To Be) Close To You , Carpenters","(They Long To Be) Close To You , Carpenters","Somebody's Been Sleeping , 100 Proof Aged in Soul","It Don't Matter To Me , Bread","See Me, Feel Me , The Who","See Me, Feel Me , The Who","Lucretia Mac Evil , Blood, Sweat & Tears","Ain't No Mountain High Enough , Diana Ross","Ain't No Mountain High Enough , Diana Ross","Let's Work Together , Canned Heat","As The Years Go By , Mashmakhan","As The Years Go By , Mashmakhan","As The Years Go By , Mashmakhan","He Ain't Heavy...He's My Brother , Neil Diamond","Let's Work Together , Canned Heat","Let's Work Together , Canned Heat","Immigrant Song , Led Zeppelin","Love The One You're With , Stephen Stills","Games , Redeye"
31,"Wedding Bell Blues , The 5th Dimension","Baby, I'm For Real , The Originals","These Eyes , Jr. Walker & The All Stars","These Eyes , Jr. Walker & The All Stars","Cold Turkey , Plastic Ono Band","The Thrill Is Gone , B.B. King","The Thrill Is Gone , B.B. King","Let's Work Together (Part 1) , Wilbert Harrison","Let's Work Together (Part 1) , Wilbert Harrison","Jingle Jangle , The Archies","Jingle Jangle , The Archies","Walkin' In The Rain , Jay & The Americans","Without Love (There Is Nothing) , Tom Jones","Without Love (There Is Nothing) , Tom Jones","Come And Get It , Badfinger","It's A New Day (Part 1) & (Part 2) , James Brown","Tennessee Bird Walk , Jack Blanchard & Misty Morgan","Tennessee Bird Walk , Jack Blanchard & Misty Morgan","Turn Back The Hands Of Time , Tyrone Davis","All I Have To Do Is Dream , Bobbie Gentry & Glen Campbell","All I Have To Do Is Dream , Bobbie Gentry & Glen Campbell","Vehicle , The Ides Of March","Get Ready , Rare Earth","Which Way You Goin' Billy? , The Poppy Family (Featuring Susan Jacks)","Which Way You Goin' Billy? , The Poppy Family (Featuring Susan Jacks)","Airport Love Theme (Gwen And Vern) , Vincent Bell","Everybody's Out Of Town , B.J. Thomas","Everybody's Out Of Town , B.J. Thomas","Let Me Go To Him , Dionne Warwick","Brother Rapp (Part 1) , James Brown","Band Of Gold , Freda Payne","Band Of Gold , Freda Payne","Hey, Mister Sun , Bobby Sherman","A Song Of Joy (Himno A La Alegria) , Miguel Rios","A Song Of Joy (Himno A La Alegria) , Miguel Rios","O-o-h Child/Dear Prudence , The 5 Stairsteps","Save The Country , The 5th Dimension","It's All In The Game , Four Tops","It's All In The Game , Four Tops","Mississippi , John Phillips","In The Summertime , Mungo Jerry","In The Summertime , Mungo Jerry","Love Land , Charles Wright And The Watts 103rd Street Rhythm Band","Everybody's Got The Right To Love , The Supremes","Lay Down (Candles In The Rain) , Melanie with The Edwin Hawkins Singers","Lay Down (Candles In The Rain) , Melanie with The Edwin Hawkins Singers","Do You See My Love (For You Growing) , Jr. Walker & The All Stars","I've Lost You/The Next Step Is Love , Elvis Presley","I've Lost You/The Next Step Is Love , Elvis Presley","I've Lost You/The Next Step Is Love , Elvis Presley","Get Up (I Feel Like Being Like A) Sex Machine (Part 1) , James Brown","Peace Will Come (According To Plan) , Melanie","Peace Will Come (According To Plan) , Melanie","Peace Will Come (According To Plan) , Melanie","It's Only Make Believe , Glen Campbell","It's Only Make Believe , Glen Campbell","Rubber Duckie , Ernie (Jim Henson)","Our House , Crosby, Stills, Nash & Young","Our House , Crosby, Stills, Nash & Young","Our House , Crosby, Stills, Nash & Young","(I Know) I'm Losing You , Rare Earth","Julie, Do Ya Love Me , Bobby Sherman","Julie, Do Ya Love Me , Bobby Sherman","As The Years Go By , Mashmakhan","After Midnight , Eric Clapton","Cracklin' Rosie , Neil Diamond","Cracklin' Rosie , Neil Diamond","Super Bad (Part 1 & Part 2) , James Brown","Pay To The Piper , Chairman Of The Board","Pay To The Piper , Chairman Of The Board","If I Were Your Woman , Gladys Knight And The Pips","You Don't Have To Say You Love Me/Patch It Up , Elvis Presley","We Gotta Get You A Woman , Runt"
