48,"Sunday Mornin' , Oliver","Cherry Hill Park , Billy Joe Royal","How Can I Forget/Gonna Give Her All The Love I've Got , Marvin Gaye","How Can I Forget/Gonna Give Her All The Love I've Got , Marvin Gaye","Traces/Memories Medley , The Lettermen","Love Bones , Johnnie Taylor","Love Bones , Johnnie Taylor","Bridge Over Troubled Water , Simon & Garfunkel","She Belongs To Me , Rick Nelson","I've Gotta Make You Love Me , Steam","I've Gotta Make You Love Me , Steam","Good Guys Only Win In The Movies , Mel And Tim","Walking Through The Country , The Grass Roots","Walking Through The Country , The Grass Roots","Gotta Get Back To You , Tommy James And The Shondells","If I Never Knew Your Name , Vic Dana","My Elusive Dreams , Bobby Vinton","My Elusive Dreams , Bobby Vinton","Take A Look Around , Smith","Jennifer Tomkins , Street People","Jennifer Tomkins , Street People","Who's Your Baby? , The Archies","Reach Out And Touch (Somebody's Hand) , Diana Ross","Daughter Of Darkness , Tom Jones","Daughter Of Darkness , Tom Jones","Come Running , Van Morrison","Sugar Sugar/Cole, Cooke & Redding , Wilson Pickett","Sugar Sugar/Cole, Cooke & Redding , Wilson Pickett","Tennessee Bird Walk , Jack Blanchard & Misty Morgan","Oh Happy Day , Glen Campbell","Who's Gonna Take The Blame , Smokey Robinson & The Miracles","Who's Gonna Take The Blame , Smokey Robinson & The Miracles","A Song Of Joy (Himno A La Alegria) , Miguel Rios","Go Back , Crabby Appleton","Go Back , Crabby Appleton","Signed, Sealed, Delivered I'm Yours , Stevie Wonder","Ohio , Crosby, Stills, Nash & Young","(If You Let Me Make Love To You Then) Why Can't I Touch You? , Ronnie Dyson","(If You Let Me Make Love To You Then) Why Can't I Touch You? , Ronnie Dyson","I Want To Take You Higher , Sly & The Family Stone","Paper Mache , Dionne Warwick","Paper Mache , Dionne Warwick","Hand Me Down World , The Guess Who","Julie, Do Ya Love Me , Bobby Sherman","Paper Mache , Dionne Warwick","Paper Mache , Dionne Warwick","Stealing In The Name Of The Lord , Paul Kelly","Closer To Home (I'm Your Captain) , Grand Funk Railroad","Closer To Home (I'm Your Captain) , Grand Funk Railroad","We're All Playing In The Same Band , Bert Sommer","Still Water (Love) , Four Tops","I Stand Accused , Isaac Hayes","I Stand Accused , Isaac Hayes","Sunday Morning Coming Down , Johnny Cash","We Can Make Music , Tommy Roe","We Can Make Music , Tommy Roe","We Can Make Music , Tommy Roe","Neanderthal Man , Hotlegs","Heaven Help Us All , Stevie Wonder","Heaven Help Us All , Stevie Wonder","You Don't Have To Say You Love Me/Patch It Up , Elvis Presley","Fresh Air , Quicksilver Messenger Service","Fresh Air , Quicksilver Messenger Service","Fresh Air , Quicksilver Messenger Service","I'm Not My Brothers Keeper , The Flaming Ember","So Close , Jake Holmes","So Close , Jake Holmes","If You Were Mine , Ray Charles","Your Song , Elton John","Your Song , Elton John","Morning , Jim Ed Brown","Most Of All , B.J. Thomas","Stealer , Free"
49,"Let's Work Together (Part 1) , Wilbert Harrison","Heaven Knows , The Grass Roots","Monster , Steppenwolf","Monster , Steppenwolf","One Tin Soldier , The Original Caste","Travelin' Band/Who'll Stop The Rain , Creedence Clearwater Revival","Travelin' Band/Who'll Stop The Rain , Creedence Clearwater Revival","The Rapper , The Jaggerz","The Touch Of You , Brenda & The Tabulations","The Touch Of You , Brenda & The Tabulations","The Touch Of You , Brenda & The Tabulations","Let's Work Together (Part 1) , Wilbert Harrison","Shilo , Neil Diamond","Shilo , Neil Diamond","If I Were A Carpenter , Johnny Cash & June Carter","Let's Give Adam And Eve Another Chance , Gary Puckett And The Union Gap","Stir It Up And Serve It , Tommy Roe","Stir It Up And Serve It , Tommy Roe","My Woman, My Woman, My Wife , Marty Robbins","To The Other Woman (I'm The Other Woman) , Doris Duke","To The Other Woman (I'm The Other Woman) , Doris Duke","Mighty Joe , The Shocking Blue","My Woman, My Woman, My Wife , Marty Robbins","You Make Me Real/Roadhouse Blues , The Doors","You Make Me Real/Roadhouse Blues , The Doors","Chicken Strut , The Meters","Come Running , Van Morrison","Come Running , Van Morrison","The Onion Song/California Soul , Marvin Gaye & Tammi Terrell","Airport Love Theme (Gwen And Vern) , Vincent Bell","Come To Me , Tommy James And The Shondells","Come To Me , Tommy James And The Shondells","Go Back , Crabby Appleton","Ain't That Loving You (For More Reasons Than One) , Luther Ingram","Ain't That Loving You (For More Reasons Than One) , Luther Ingram","(You've Got Me) Dangling On A String , Chairman Of The Board","Maybe , The Three Degrees","Ain't That Loving You (For More Reasons Than One) , Luther Ingram","Ain't That Loving You (For More Reasons Than One) , Luther Ingram","Ain't That Loving You (For More Reasons Than One) , Luther Ingram","25 Or 6 To 4 , Chicago","25 Or 6 To 4 , Chicago","Pearl , Tommy Roe","Pearl , Tommy Roe","Candida , Dawn","Candida , Dawn","Paper Mache , Dionne Warwick","All Right Now , Free","All Right Now , Free","Long Long Time , Linda Ronstadt","If I Didn't Care , The Moments","Fire And Rain , James Taylor","Fire And Rain , James Taylor","Do What You Wanna Do , Five Flights Up","As The Years Go By , Mashmakhan","As The Years Go By , Mashmakhan","Yellow River , Christie","Mongoose , Elephant's Memory","I Am Somebody Part II , Johnnie Taylor","I Am Somebody Part II , Johnnie Taylor","Heed The Call , Kenny Rogers & The First Edition","Seems Like I Gotta Do Wrong , The Whispers","Seems Like I Gotta Do Wrong , The Whispers","Does Anybody Really Know What Time It Is? , Chicago","Only Love Can Break Your Heart , Neil Young","I Don't Wanna Cry , Ronnie Dyson","I Don't Wanna Cry , Ronnie Dyson","Part Time Love , Ann Peebles","Games , Redeye","Games , Redeye","Chains And Things , B.B. King","Stop The War Now , Edwin Starr","Amos Moses , Jerry Reed"
50,"Baby Take Me In Your Arms , Jefferson","Okie From Muskogee , Merle Haggard And The Strangers","One Tin Soldier , The Original Caste","One Tin Soldier , The Original Caste","Take A Letter Maria , R.B. Greaves","Tonight I'll Say A Prayer , Eydie Gorme","Tonight I'll Say A Prayer , Eydie Gorme","Hold On , The Rascals","New World Coming , Mama Cass Elliot","The Bells , The Originals","The Bells , The Originals","The Touch Of You , Brenda & The Tabulations","Take A Look Around , Smith","Take A Look Around , Smith","Can't Help Falling In Love , Al Martino","Temma Harbour , Mary Hopkin","Reflections Of My Life , The Marmalade","Reflections Of My Life , The Marmalade","My Elusive Dreams , Bobby Vinton","Funky Drummer (Part 1) , James Brown","Funky Drummer (Part 1) , James Brown","Let's Give Adam And Eve Another Chance , Gary Puckett And The Union Gap","Children , Joe South","Chicken Strut , The Meters","Chicken Strut , The Meters","United We Stand , The Brotherhood Of Man","Love Land , Charles Wright And The Watts 103rd Street Rhythm Band","Love Land , Charles Wright And The Watts 103rd Street Rhythm Band","Don't Stop Now/Since I Don't Have You , Eddie Holman","Mississippi Queen , Mountain","Open Up My Heart/Nadine , The Dells","Open Up My Heart/Nadine , The Dells","Into The Mystic , Johnny Rivers","Brother Rapp (Part 1) , James Brown","Brother Rapp (Part 1) , James Brown","Steal Away , Johnnie Taylor","Freedom Blues , Little Richard","So Much Love , Faith, Hope And Charity","So Much Love , Faith, Hope And Charity","So Much Love , Faith, Hope And Charity","Big Yellow Taxi , The Neighborhood","Big Yellow Taxi , The Neighborhood","America, Communicate With Me , Ray Stevens","Stealing In The Name Of The Lord , Paul Kelly","Stealing In The Name Of The Lord , Paul Kelly","Stealing In The Name Of The Lord , Paul Kelly","Joanne , Michael Nesmith & The First National Band","Express Yourself , Charles Wright And The Watts 103rd Street Rhythm Band","Express Yourself , Charles Wright And The Watts 103rd Street Rhythm Band","Green-Eyed Lady , Sugarloaf","Rainbow , The Marmalade","Rainbow , The Marmalade","Rainbow , The Marmalade","As The Years Go By , Mashmakhan","Yellow River , Christie","Yellow River , Christie","See Me, Feel Me , The Who","I Do Take You , The Three Degrees","I Just Wanna Keep It Together , Paul Davis","I Just Wanna Keep It Together , Paul Davis","I Just Wanna Keep It Together , Paul Davis","I Do Take You , The Three Degrees","I Do Take You , The Three Degrees","I'm Not My Brothers Keeper , The Flaming Ember","So Close , Jake Holmes","River Deep - Mountain High , The Supremes & Four Tops","River Deep - Mountain High , The Supremes & Four Tops","It's All In Your Mind , Clarence Carter","It's All In Your Mind , Clarence Carter","It's All In Your Mind , Clarence Carter","It's All In Your Mind , Clarence Carter","Stealer , Free","Morning , Jim Ed Brown"
51,"What You Gave Me , Marvin Gaye & Tammi Terrell","Let A Man Come In And Do The Popcorn (Part Two) , James Brown","Traces/Memories Medley , The Lettermen","Traces/Memories Medley , The Lettermen","Oh Me Oh My (I'm A Fool For You Baby) , Lulu","Oh Me Oh My (I'm A Fool For You Baby) , Lulu","Oh Me Oh My (I'm A Fool For You Baby) , Lulu","Traces/Memories Medley , The Lettermen","You Got Me Hummin , Cold Blood","Easy Come, Easy Go , Bobby Sherman","Easy Come, Easy Go , Bobby Sherman","My Elusive Dreams , Bobby Vinton","Temma Harbour , Mary Hopkin","Temma Harbour , Mary Hopkin","Temma Harbour , Mary Hopkin","Stir It Up And Serve It , Tommy Roe","Easy To Be Free , Rick Nelson","Easy To Be Free , Rick Nelson","I Could Write A Book , Jerry Butler","Everything Is Beautiful , Ray Stevens","Everything Is Beautiful , Ray Stevens","Oh Happy Day , Glen Campbell","Hey Lawdy Mama , Steppenwolf","My Wife, The Dancer , Eddie & Dutch","My Wife, The Dancer , Eddie & Dutch","My Wife, The Dancer , Eddie & Dutch","Chicken Strut , The Meters","Chicken Strut , The Meters","Hey, Mister Sun , Bobby Sherman","Baby Hold On , The Grass Roots","Are You Ready? , Pacific Gas And Electric","Are You Ready? , Pacific Gas And Electric","Cinnamon Girl , The Gentrys","Canned Ham , Norman Greenbaum","Canned Ham , Norman Greenbaum","So Much Love , Faith, Hope And Charity","So Much Love , Faith, Hope And Charity","A Little Bit Of Soap , Paul Davis","A Little Bit Of Soap , Paul Davis","A Little Bit Of Soap , Paul Davis","I Want To Take You Higher , Ike & Tina Turner & The Ikettes","I Want To Take You Higher , Ike & Tina Turner & The Ikettes","When We Get Married , The Intruders","Steal Away , Johnnie Taylor","Everything A Man Could Ever Need , Glen Campbell","Everything A Man Could Ever Need , Glen Campbell","Closer To Home (I'm Your Captain) , Grand Funk Railroad","America, Communicate With Me , Ray Stevens","America, Communicate With Me , Ray Stevens","Rainbow , The Marmalade","Look What They've Done To My Song Ma , The New Seekers featuring Eve Graham","Somebody's Been Sleeping , 100 Proof Aged in Soul","Somebody's Been Sleeping , 100 Proof Aged in Soul","I've Lost You/The Next Step Is Love , Elvis Presley","God, Love And Rock & Roll , Teegarden & Van Winkle","God, Love And Rock & Roll , Teegarden & Van Winkle","Mongoose , Elephant's Memory","Baby, I Need Your Loving , O.C. Smith","Baby, I Need Your Loving , O.C. Smith","Baby, I Need Your Loving , O.C. Smith","And The Grass Won't Pay No Mind , Mark Lindsay","I'm Not My Brothers Keeper , The Flaming Ember","I'm Not My Brothers Keeper , The Flaming Ember","I Don't Wanna Cry , Ronnie Dyson","I Don't Wanna Cry , Ronnie Dyson","If You Were Mine , Ray Charles","If You Were Mine , Ray Charles","And The Grass Won't Pay No Mind , Mark Lindsay","Don't Try To Lay No Boogie Woogie On The ""King Of Rock & Roll"" , CROW","Don't Try To Lay No Boogie Woogie On The ""King Of Rock & Roll"" , CROW","Stealer , Free","Amos Moses , Jerry Reed","Ruby Tuesday , Melanie"
52,"No Time , The Guess Who","Monster , Steppenwolf","I'm So Glad I Fell For You , David Ruffin","I'm So Glad I Fell For You , David Ruffin","I'm So Glad I Fell For You , David Ruffin","Hold On , The Rascals","Hold On , The Rascals","Jennifer Tomkins , Street People","I've Gotta Make You Love Me , Steam","All I Have To Do Is Dream , Bobbie Gentry & Glen Campbell","All I Have To Do Is Dream , Bobbie Gentry & Glen Campbell","If I Never Knew Your Name , Vic Dana","Until It's Time For You To Go , Neil Diamond","Until It's Time For You To Go , Neil Diamond","Until It's Time For You To Go , Neil Diamond","Who's Your Baby? , The Archies","Mighty Joe , The Shocking Blue","Mighty Joe , The Shocking Blue","To The Other Woman (I'm The Other Woman) , Doris Duke","Gotta Get Back To You , Tommy James And The Shondells","Gotta Get Back To You , Tommy James And The Shondells","I Could Write A Book , Jerry Butler","Hitchin' A Ride , Vanity Fare","Don't Stop Now/Since I Don't Have You , Eddie Holman","Don't Stop Now/Since I Don't Have You , Eddie Holman","Love Land , Charles Wright And The Watts 103rd Street Rhythm Band","Question , The Moody Blues","Question , The Moody Blues","Open Up My Heart/Nadine , The Dells","Open Up My Heart/Nadine , The Dells","Cinnamon Girl , The Gentrys","Cinnamon Girl , The Gentrys","Whoever Finds This, I Love You , Mac Davis","Whoever Finds This, I Love You , Mac Davis","Whoever Finds This, I Love You , Mac Davis","Freedom Blues , Little Richard","I Just Can't Help Believing , B.J. Thomas","I Want To Take You Higher , Ike & Tina Turner & The Ikettes","I Want To Take You Higher , Ike & Tina Turner & The Ikettes","I Want To Take You Higher , Ike & Tina Turner & The Ikettes","Pearl , Tommy Roe","Pearl , Tommy Roe","I'll Be Right Here , Tyrone Davis","I'll Be Right Here , Tyrone Davis","It's A Shame , The Spinners","It's A Shame , The Spinners","Everything's Tuesday , Chairman Of The Board","Soul Shake , Delaney & Bonnie & Friends","Soul Shake , Delaney & Bonnie & Friends","Still Water (Love) , Four Tops","I Stand Accused , Isaac Hayes","Sunday Morning Coming Down , Johnny Cash","Sunday Morning Coming Down , Johnny Cash","Yellow River , Christie","It Don't Matter To Me , Bread","It Don't Matter To Me , Bread","Sunday Morning Coming Down , Johnny Cash","I Just Wanna Keep It Together , Paul Davis","And The Grass Won't Pay No Mind , Mark Lindsay","And The Grass Won't Pay No Mind , Mark Lindsay","When You Get Right Down To It , The Delfonics","Part Time Love , Ann Peebles","Part Time Love , Ann Peebles","So Close , Jake Holmes","If You Were Mine , Ray Charles","Chains And Things , B.B. King","Chains And Things , B.B. King","Sweetheart , Engelbert Humperdinck","Morning , Jim Ed Brown","Morning , Jim Ed Brown","(Don't Worry) If There's A Hell Below We're All Going To Go , Curtis Mayfield","Born To Wander , Rare Earth","Get Up, Get Into It, Get Involved (Pt. 1) , James Brown"
53,"Walk A Mile In My Shoes , Joe South and The Believers","Don't Let Him Take Your Love From Me , Four Tops","The Thrill Is Gone , B.B. King","The Thrill Is Gone , B.B. King","Tonight I'll Say A Prayer , Eydie Gorme","Breaking Up Is Hard To Do , Lenny Welch","Breaking Up Is Hard To Do , Lenny Welch","You Got Me Hummin , Cold Blood","Moon Walk Part 1 , Joe Simon","Come And Get It , Badfinger","Come And Get It , Badfinger","Something's Burning , Kenny Rogers & The First Edition","Gotta Get Back To You , Tommy James And The Shondells","Gotta Get Back To You , Tommy James And The Shondells","Breaking Up Is Hard To Do , Lenny Welch","Can't Help Falling In Love , Al Martino","If I Never Knew Your Name , Vic Dana","If I Never Knew Your Name , Vic Dana","California Girl , Eddie Floyd","Children , Joe South","Children , Joe South","Children , Joe South","Viva Tirado - Part I , El Chicano","So Excited , B.B. King","So Excited , B.B. King","Ticket To Ride , Carpenters","Hum A Song (From Your Heart) , Lulu with The Dixie Flyers","Hum A Song (From Your Heart) , Lulu with The Dixie Flyers","Cinnamon Girl , The Gentrys","Cinnamon Girl , The Gentrys","Into The Mystic , Johnny Rivers","Into The Mystic , Johnny Rivers","Westbound #9 , The Flaming Ember","Freedom Blues , Little Richard","Freedom Blues , Little Richard","A Little Bit Of Soap , Paul Davis","A Little Bit Of Soap , Paul Davis","(How Bout A Little Hand For) The Boys In The Band , The Boys In The Band","(How Bout A Little Hand For) The Boys In The Band , The Boys In The Band","I'll Be Right Here , Tyrone Davis","I'll Be Right Here , Tyrone Davis","I'll Be Right Here , Tyrone Davis","Everything A Man Could Ever Need , Glen Campbell","Everything A Man Could Ever Need , Glen Campbell","I'll Be Right Here , Tyrone Davis","I'll Be Right Here , Tyrone Davis","Everything A Man Could Ever Need , Glen Campbell","We're All Playing In The Same Band , Bert Sommer","We're All Playing In The Same Band , Bert Sommer","Wigwam , Bob Dylan","El Condor Pasa (If I Could) , Simon & Garfunkel","On The Beach (In The Summertime) , The 5th Dimension","On The Beach (In The Summertime) , The 5th Dimension","Mongoose , Elephant's Memory","Mongoose , Elephant's Memory","Mongoose , Elephant's Memory","Super Bad (Part 1 & Part 2) , James Brown","We Can Make Music , Tommy Roe","Seems Like I Gotta Do Wrong , The Whispers","Seems Like I Gotta Do Wrong , The Whispers","Seems Like I Gotta Do Wrong , The Whispers","I Don't Wanna Cry , Ronnie Dyson","I Don't Wanna Cry , Ronnie Dyson","He Ain't Heavy...He's My Brother , Neil Diamond","Chains And Things , B.B. King","Border Song (Holy Moses)/You And Me , Aretha Franklin","Border Song (Holy Moses)/You And Me , Aretha Franklin","We Gotta Get You A Woman , Runt","Who Needs Ya , Steppenwolf","Who Needs Ya , Steppenwolf","Ace Of Spade , O.V. Wright","Ace Of Spade , O.V. Wright","Somebody's Watching You , Little Sister"
54,"When Julie Comes Around , The Cuff Links","Blowing Away , The 5th Dimension","Okie From Muskogee , Merle Haggard And The Strangers","Okie From Muskogee , Merle Haggard And The Strangers","Honey Come Back , Glen Campbell","Point It Out , Smokey Robinson & The Miracles","Point It Out , Smokey Robinson & The Miracles","If I Were A Carpenter , Johnny Cash & June Carter","My Honey And Me , Luther Ingram","It's A New Day (Part 1) & (Part 2) , James Brown","It's A New Day (Part 1) & (Part 2) , James Brown","Walking Through The Country , The Grass Roots","Can't Help Falling In Love , Al Martino","Can't Help Falling In Love , Al Martino","Oh Well - Pt. I , Fleetwood Mac","Until It's Time For You To Go , Neil Diamond","Can't Help Falling In Love , Al Martino","Can't Help Falling In Love , Al Martino","The Cat Walk , The Village Soul Choir","The Cat Walk , The Village Soul Choir","The Cat Walk , The Village Soul Choir","The Cat Walk , The Village Soul Choir","You Make Me Real/Roadhouse Blues , The Doors","Ticket To Ride , Carpenters","Ticket To Ride , Carpenters","Hum A Song (From Your Heart) , Lulu with The Dixie Flyers","Cinnamon Girl , The Gentrys","Cinnamon Girl , The Gentrys","Mississippi Queen , Mountain","Into The Mystic , Johnny Rivers","O-o-h Child/Dear Prudence , The 5 Stairsteps","O-o-h Child/Dear Prudence , The 5 Stairsteps","Don't It Make You Want To Go Home , Brook Benton With The Dixie Flyers","A Little Bit Of Soap , Paul Davis","A Little Bit Of Soap , Paul Davis","Silver Bird , Mark Lindsay","Lay A Little Lovin' On Me , Robin McNamara","When We Get Married , The Intruders","When We Get Married , The Intruders","Freedom Blues , Little Richard","Cinnamon Girl , Neil Young & Crazy Horse","Cinnamon Girl , Neil Young & Crazy Horse","Cinnamon Girl , Neil Young & Crazy Horse","Cinnamon Girl , Neil Young & Crazy Horse","Pearl , Tommy Roe","Pearl , Tommy Roe","Peace Will Come (According To Plan) , Melanie","Sing A Song For Freedom , Frijid Pink","Sing A Song For Freedom , Frijid Pink","Yellow River , Christie","On The Beach (In The Summertime) , The 5th Dimension","Mongoose , Elephant's Memory","Mongoose , Elephant's Memory","Riki Tiki Tavi , Donovan","Riki Tiki Tavi , Donovan","Riki Tiki Tavi , Donovan","I Do Take You , The Three Degrees","When You Get Right Down To It , The Delfonics","When You Get Right Down To It , The Delfonics","When You Get Right Down To It , The Delfonics","Fresh Air , Quicksilver Messenger Service","Something , Shirley Bassey","Something , Shirley Bassey","Black Magic Woman , Santana","One Man Band , Three Dog Night","Don't Try To Lay No Boogie Woogie On The ""King Of Rock & Roll"" , CROW","Don't Try To Lay No Boogie Woogie On The ""King Of Rock & Roll"" , CROW","Don't Try To Lay No Boogie Woogie On The ""King Of Rock & Roll"" , CROW","Ace Of Spade , O.V. Wright","Ace Of Spade , O.V. Wright","Most Of All , B.J. Thomas","It's All In Your Mind , Clarence Carter","Flesh And Blood , Johnny Cash"
55,"Let A Man Come In And Do The Popcorn (Part Two) , James Brown","Tonight I'll Say A Prayer , Eydie Gorme","Tonight I'll Say A Prayer , Eydie Gorme","Tonight I'll Say A Prayer , Eydie Gorme","Hold On , The Rascals","Look-Ka Py Py , The Meters","Look-Ka Py Py , The Meters","Moon Walk Part 1 , Joe Simon","I'm Just A Prisoner (Of Your Good Lovin') , Candi Staton","I'm Just A Prisoner (Of Your Good Lovin') , Candi Staton","I'm Just A Prisoner (Of Your Good Lovin') , Candi Staton","Shilo , Neil Diamond","Oh Well - Pt. I , Fleetwood Mac","Oh Well - Pt. I , Fleetwood Mac","Good Guys Only Win In The Movies , Mel And Tim","Oh Well - Pt. I , Fleetwood Mac","My Woman, My Woman, My Wife , Marty Robbins","My Woman, My Woman, My Wife , Marty Robbins","Funky Drummer (Part 1) , James Brown","Love On A Two-Way Street , The Moments","Love On A Two-Way Street , The Moments","Funky Drummer (Part 1) , James Brown","Puppet Man , The 5th Dimension","Love Land , Charles Wright And The Watts 103rd Street Rhythm Band","Love Land , Charles Wright And The Watts 103rd Street Rhythm Band","You Make Me Real/Roadhouse Blues , The Doors","The Onion Song/California Soul , Marvin Gaye & Tammi Terrell","The Onion Song/California Soul , Marvin Gaye & Tammi Terrell","Baby Hold On , The Grass Roots","Farther On Down The Road , Joe Simon","Westbound #9 , The Flaming Ember","Westbound #9 , The Flaming Ember","Teach Your Children , Crosby, Stills, Nash & Young","(They Long To Be) Close To You , Carpenters","(They Long To Be) Close To You , Carpenters","Lay A Little Lovin' On Me , Robin McNamara","I Want To Take You Higher , Ike & Tina Turner & The Ikettes","The Sly, Slick, And The Wicked , The Lost Generation","The Sly, Slick, And The Wicked , The Lost Generation","Big Yellow Taxi , The Neighborhood","Do You See My Love (For You Growing) , Jr. Walker & The All Stars","Do You See My Love (For You Growing) , Jr. Walker & The All Stars","Cottage Cheese , CROW","Lookin' Out My Back Door/Long As I Can See The Light , Creedence Clearwater Revival","Hummingbird , B.B. King","Hummingbird , B.B. King","We're All Playing In The Same Band , Bert Sommer","Stealing In The Name Of The Lord , Paul Kelly","Stealing In The Name Of The Lord , Paul Kelly","On The Beach (In The Summertime) , The 5th Dimension","Black Fox , Freddy Robinson","Only You Know And I Know , Dave Mason","Only You Know And I Know , Dave Mason","Rainbow , The Marmalade","(Baby) Turn On To Me , The Impressions","(Baby) Turn On To Me , The Impressions","(Baby) Turn On To Me , The Impressions","Seems Like I Gotta Do Wrong , The Whispers","Fresh Air , Quicksilver Messenger Service","Fresh Air , Quicksilver Messenger Service","Let's Work Together , Canned Heat","When You Get Right Down To It , The Delfonics","When You Get Right Down To It , The Delfonics","Chains And Things , B.B. King","Do It , Neil Diamond","Stoney End , Barbra Streisand","Stoney End , Barbra Streisand","Games , Redeye","Lonely Days , Bee Gees","Lonely Days , Bee Gees","Silver Moon , Michael Nesmith & The First National Band","I Really Don't Want To Know/There Goes My Everything , Elvis Presley","Precious, Precious , Jackie Moore"
