70,"Break Away , Art Garfunkel","Bohemian Rhapsody , Queen","Full Of Fire , Al Green","Full Of Fire , Al Green","Chain Gang Medley , Jim Croce","Quiet Storm , Smokey Robinson","Quiet Storm , Smokey Robinson","Growin' Up , Dan Hill","Venus , Frankie Avalon","He's A Friend , Eddie Kendricks","He's A Friend , Eddie Kendricks","Since I Fell For You , Charlie Rich","Without Your Love (mr. Jordan) , Charlie Ross","Without Your Love (mr. Jordan) , Charlie Ross","Strange Magic , Electric Light Orchestra","Mighty High , Mighty Clouds Of Joy","Shout It Out Loud , KISS","Shout It Out Loud , KISS","Slow Ride , Foghat","Love Really Hurts Without You , Billy Ocean","Love Really Hurts Without You , Billy Ocean","One Piece At A Time , Johnny Cash And The Tennessee Three","Jasper , Jim Stafford","Love Machine (Part 1) , The Miracles","Love Machine (Part 1) , The Miracles","Jasper , Jim Stafford","Bigfoot , Bro Smith","Bigfoot , Bro Smith","Better Days , Melissa Manchester","Better Days , Melissa Manchester","Good Vibrations , Todd Rundgren","Good Vibrations , Todd Rundgren","C'mon Marianne , Donny Osmond","Crazy On You , Heart","Crazy On You , Heart","Crazy On You , Heart","Who'd She Coo? , Ohio Players","Who'd She Coo? , Ohio Players","I'll Get Over You , Crystal Gayle","Somebody's Gettin' It , Johnnie Taylor","Wake Up Susan , The Spinners","Wake Up Susan , The Spinners","Devil With A Blue Dress , Pratt & McClain","Devil With A Blue Dress , Pratt & McClain","(Don't Fear) The Reaper , Blue Oyster Cult","(Don't Fear) The Reaper , Blue Oyster Cult","That'll Be The Day , Linda Ronstadt","Party , Van Mccoy","Party , Van Mccoy","Party , Van Mccoy","Queen Of My Soul , Average White Band","Message In Our Music , The O'Jays","Message In Our Music , The O'Jays","Hard Work , John Handy","Baby, I Love Your Way , Peter Frampton","Baby, I Love Your Way , Peter Frampton","Tonight's The Night (Gonna Be Alright) , Rod Stewart","Home Tonight , Aerosmith","California Day , Starland Vocal Band","California Day , Starland Vocal Band","Let's Be Young Tonight , Jermaine Jackson","You Ought To Be Havin' Fun , Tower Of Power","You Ought To Be Havin' Fun , Tower Of Power","Down To Love Town , The Originals","Keep Me Cryin' , Al Green","Ain't Nothing Like The Real Thing , Donny & Marie Osmond","Ain't Nothing Like The Real Thing , Donny & Marie Osmond","Catfish , Four Tops","I Like To Do It , KC And The Sunshine Band","I Like To Do It , KC And The Sunshine Band","Night Moves , Bob Seger","Ob-la-di, Ob-la-da , The Beatles","Ob-la-di, Ob-la-da , The Beatles"
71,"Sweet Love , Commodores","My Little Town , Simon & Garfunkel","Sweet Thing , Rufus Featuring Chaka Khan","Sweet Thing , Rufus Featuring Chaka Khan","Renegade , Michael Murphey","I Could Have Danced All Night/Jump For Joy , Biddu Orchestra","I Could Have Danced All Night/Jump For Joy , Biddu Orchestra","Amazing Grace (used To Be Her Favorite Song) , Amazing Rhythm Aces","Tell It Like It Is , Andy Williams","I Heard It Through The Grapevine , Creedence Clearwater Revival Featuring John Fogerty","I Heard It Through The Grapevine , Creedence Clearwater Revival Featuring John Fogerty","The Jam , Graham Central Station","Sara Smile , Daryl Hall John Oates","Sara Smile , Daryl Hall John Oates","Convoy , C.W. McCall","Young Blood , Bad Company","Ophelia , The Band","Ophelia , The Band","Venus , Frankie Avalon","Eh! Cumpari , Gaylord & Holiday","Eh! Cumpari , Gaylord & Holiday","Takin' It To The Streets , The Doobie Brothers","Hey Baby , Ted Nugent","Lookin' Out For #1 , Bachman-Turner Overdrive","Lookin' Out For #1 , Bachman-Turner Overdrive","I'll Be Good To You , The Brothers Johnson","Sixteen Tons , The Don Harrison Band","Sixteen Tons , The Don Harrison Band","It's Cool , The Tymes","Only Sixteen , Dr. Hook","Silver Star , The 4 Seasons","Silver Star , The 4 Seasons","Livin' Ain't Livin' , Firefall","Everything's Coming Up Love , David Ruffin","Everything's Coming Up Love , David Ruffin","Johnny Cool , The Steve Gibbons Band","I'll Get Over You , Crystal Gayle","I'll Get Over You , Crystal Gayle","I Wanna Stay With You , Gallagher And Lyle","Springtime Mama , Henry Gross","Street Singin' , Lady Flash","Street Singin' , Lady Flash","Rainbow In Your Eyes , Leon & Mary Russell","Struttin' My Stuff , Elvin Bishop","Honey Child , Bad Company","Honey Child , Bad Company","Can You Do It , Grand Funk Railroad","You Are The Woman , Firefall","You Are The Woman , Firefall","Harvest For The World , The Isley Brothers","Teddy Bear , Red Sovine","I Got To Know , Starbuck","I Got To Know , Starbuck","(The System Of) Doctor Tarr And Professor Fether , The Alan Parsons Project","Superstar , Paul Davis","Superstar , Paul Davis","Love Is Alive , Gary Wright","Love Is Alive , Gary Wright","Jump , Aretha Franklin","Jump , Aretha Franklin","Jump , Aretha Franklin","Keep Me Cryin' , Al Green","Keep Me Cryin' , Al Green","Living It Down , Freddy Fender","You Ought To Be Havin' Fun , Tower Of Power","What Can I Say , Boz Scaggs","What Can I Say , Boz Scaggs","Blinded By The Light , Manfred Mann's Earth Band","Evergreen (Love Theme From ""A Star Is Born"") , Barbra Streisand","Evergreen (Love Theme From ""A Star Is Born"") , Barbra Streisand","Don't Fight The Hands (That Need You) , Hamilton, Joe Frank & Dennison","Dreamboat Annie , Heart","Dreamboat Annie , Heart"
72,"Back To The Island , Leon Russell","This Old Man , Purple Reign","Play On Love , Jefferson Starship","Play On Love , Jefferson Starship","Take Me , Grand Funk Railroad","What's The Name Of This Funk (spider Man) , Ramsey Lewis","What's The Name Of This Funk (spider Man) , Ramsey Lewis","Remember Me , Willie Nelson","If I Only Knew , Ozark Mountain Daredevils","Since I Fell For You , Charlie Rich","Since I Fell For You , Charlie Rich","We Can't Hide It Anymore , Larry Santos","Times Of Your Life , Paul Anka","Times Of Your Life , Paul Anka","Street Talk , B.C.G. (B.C. Generation)","Get Up And Boogie (That's Right) , Silver Convention","Queen Of Clubs , KC And The Sunshine Band","Queen Of Clubs , KC And The Sunshine Band","Just You And I , Melissa Manchester","Falling Apart At The Seams , Marmalade","Falling Apart At The Seams , Marmalade","There Won't Be No Country Music (There Won't Be No Rock 'N' Roll) , C.W. McCall","Love Is Alive , Gary Wright","Jealousy , Major Harris","Jealousy , Major Harris","Turn The Beat Around , Vicki Sue Robinson","Better Days , Melissa Manchester","Better Days , Melissa Manchester","Let Her In , John Travolta","Young Hearts Run Free , Candi Staton","Lipstick , Michel Polnareff","Lipstick , Michel Polnareff","Nutbush City Limits , Bob Seger","Johnny Cool , The Steve Gibbons Band","Johnny Cool , The Steve Gibbons Band","A Little Bit More , Dr. Hook","Roots, Rock, Reggae , Bob Marley And The Wailers","Roots, Rock, Reggae , Bob Marley And The Wailers","Shower The People , James Taylor","Dancin' Kid , Disco Tex & The Sex-O-Lettes Featuring Sir Monti Rock III","She's Gone , Daryl Hall John Oates","She's Gone , Daryl Hall John Oates","Struttin' My Stuff , Elvin Bishop","Magic Man , Heart","Funny How Time Slips Away , Dorothy Moore","Funny How Time Slips Away , Dorothy Moore","Get The Funk Out Ma Face , The Brothers Johnson","Take A Hand , Rick Springfield","Take A Hand , Rick Springfield","You Are My Starship , Norman Connors","Last Child , Aerosmith","Last Child , Aerosmith","Last Child , Aerosmith","Satin Sheets , Bellamy Brothers","Home Tonight , Aerosmith","Home Tonight , Aerosmith","Home Tonight , Aerosmith","So Sad The Song , Gladys Knight And The Pips","My Sweet Summer Suite , Love Unlimited Orchestra","My Sweet Summer Suite , Love Unlimited Orchestra","You Ought To Be Havin' Fun , Tower Of Power","Lets Get It Together , El Coco","Lets Get It Together , El Coco","Keep Me Cryin' , Al Green","Flight '76 , The Walter Murphy Band","Catfish , Four Tops","Catfish , Four Tops","Nice 'N' Naasty , The Salsoul Orchestra","Don't Fight The Hands (That Need You) , Hamilton, Joe Frank & Dennison","Don't Fight The Hands (That Need You) , Hamilton, Joe Frank & Dennison","Fly Like An Eagle , Steve Miller","Lucky Man , Starbuck","Lucky Man , Starbuck"
73,"December, 1963 (Oh, What a Night) , The 4 Seasons","Free Ride , Tavares","That's Why I Love You , Andrew Gold","That's Why I Love You , Andrew Gold","Amazing Grace (used To Be Her Favorite Song) , Amazing Rhythm Aces","Amazing Grace (used To Be Her Favorite Song) , Amazing Rhythm Aces","Amazing Grace (used To Be Her Favorite Song) , Amazing Rhythm Aces","Tell It Like It Is , Andy Williams","Keep Holding On , The Temptations","Boogie Fever , The Sylvers","Boogie Fever , The Sylvers","Union Man , Cate Bros.","Union Man , Cate Bros.","Union Man , Cate Bros.","Mozambique , Bob Dylan","New Orleans , The Staple Singers","Here, There And Everywhere , Emmylou Harris","Here, There And Everywhere , Emmylou Harris","Eh! Cumpari , Gaylord & Holiday","I Thought It Took A Little Time (But Today I Fell In Love) , Diana Ross","I Thought It Took A Little Time (But Today I Fell In Love) , Diana Ross","I Thought It Took A Little Time (But Today I Fell In Love) , Diana Ross","I Thought It Took A Little Time (But Today I Fell In Love) , Diana Ross","Get Closer , Seals & Crofts (Featuring Carolyn Willis)","Get Closer , Seals & Crofts (Featuring Carolyn Willis)","Could It Be Magic , Donna Summer","Yes, Yes, Yes , Bill Cosby","Yes, Yes, Yes , Bill Cosby","I'm Easy , Keith Carradine","Lonely Teardrops , Narvel Felts","Foxy Lady , Crown Heights Affair","Foxy Lady , Crown Heights Affair","I Wanna Stay With You , Gallagher And Lyle","Flaming Youth , KISS","Flaming Youth , KISS","I'll Get Over You , Crystal Gayle","Say You Love Me , Fleetwood Mac","Say You Love Me , Fleetwood Mac","Wham Bam (Shang-A-Lang) , Silver","Hell Cat , Bellamy Brothers","Devil With A Blue Dress , Pratt & McClain","Devil With A Blue Dress , Pratt & McClain","Magic Man , Heart","(The System Of) Doctor Tarr And Professor Fether , The Alan Parsons Project","Showdown , Electric Light Orchestra","Showdown , Electric Light Orchestra","Highfly , John Miles","After The Dance , Marvin Gaye","After The Dance , Marvin Gaye","After The Dance , Marvin Gaye","Like A Sad Song , John Denver","Anything You Want , John Valenti","Anything You Want , John Valenti","It's Only Love , ZZ Top","The End Is Not In Sight (the Cowboy Tune) , Amazing Rhythm Aces","The End Is Not In Sight (the Cowboy Tune) , Amazing Rhythm Aces","Stand Tall , Burton Cummings","Hot Line , The Sylvers","Shake Your Rump To The Funk , The Bar-Kays","Shake Your Rump To The Funk , The Bar-Kays","If I Only Could , The Rowans","If I Only Could , The Rowans","If I Only Could , The Rowans","Baby Boy , Mary Kay Place As Loretta Haggers","Help Wanted , The Hudson Brothers","Baby, I'll Give It To You , Seals & Crofts","Baby, I'll Give It To You , Seals & Crofts","If Not You , Dr. Hook","Living Next Door To Alice , Smokie","Living Next Door To Alice , Smokie","Hard Luck Woman , KISS","Free , Deniece Williams","Free , Deniece Williams"
74,"Soul Train ""75"" , Soul Train Gang","Only Sixteen , Dr. Hook","'til It's Time To Say Goodbye , Jonathan Cain","'til It's Time To Say Goodbye , Jonathan Cain","Quiet Storm , Smokey Robinson","Growin' Up , Dan Hill","Growin' Up , Dan Hill","If I Only Knew , Ozark Mountain Daredevils","Since I Fell For You , Charlie Rich","You'll Lose A Good Thing , Freddy Fender","You'll Lose A Good Thing , Freddy Fender","There's A Kind Of Hush (All Over The World) , Carpenters","Highfly , John Miles","Highfly , John Miles","Fooled Around And Fell In Love , Elvin Bishop","Queen Of Clubs , KC And The Sunshine Band","Scotch On The Rocks , The Band Of The Black Watch","Scotch On The Rocks , The Band Of The Black Watch","Hurt/for The Heart , Elvis Presley","There Won't Be No Country Music (There Won't Be No Rock 'N' Roll) , C.W. McCall","There Won't Be No Country Music (There Won't Be No Rock 'N' Roll) , C.W. McCall","Jasper , Jim Stafford","Jealousy , Major Harris","Still Crazy After All These Years , Paul Simon","Still Crazy After All These Years , Paul Simon","Dance Wit Me , Rufus Featuring Chaka Khan","Take The Money And Run , Steve Miller","Take The Money And Run , Steve Miller","Save Your Kisses For Me , Brotherhood Of Man","You're My Everything , Lee Garrett","Rock And Roll Music , The Beach Boys","Rock And Roll Music , The Beach Boys","Save Your Kisses For Me , Bobby Vinton","I'll Get Over You , Crystal Gayle","I'll Get Over You , Crystal Gayle","Another Rainy Day In New York City , Chicago","Hold On , Sons Of Champlin","Hold On , Sons Of Champlin","The Lonely One , Special Delivery Featuring Terry Huff","The Lonely One , Special Delivery Featuring Terry Huff","Rainbow In Your Eyes , Leon & Mary Russell","Rainbow In Your Eyes , Leon & Mary Russell","Light Up The World With Sunshine , Hamilton, Joe Frank & Dennison","I Never Cry , Alice Cooper","Popsicle Toes , Michael Franks","Popsicle Toes , Michael Franks","Party , Van Mccoy","Howzat , Sherbet","Howzat , Sherbet","Did You Boogie (With Your Baby) , Flash Cadillac And The Continental Kids","Amber Cascades , America","Satin Sheets , Bellamy Brothers","Satin Sheets , Bellamy Brothers","Nice 'N' Naasty , The Salsoul Orchestra","Don't Stop Believin' , Olivia Newton-John","Don't Stop Believin' , Olivia Newton-John","Love Me , Yvonne Elliman","Jump , Aretha Franklin","You Ought To Be Havin' Fun , Tower Of Power","You Ought To Be Havin' Fun , Tower Of Power","Do What You Want, Be What You Are , Daryl Hall John Oates","Living It Down , Freddy Fender","Living It Down , Freddy Fender","Car Wash , Rose Royce","Catfish , Four Tops","Drivin' Wheel , Foghat","Drivin' Wheel , Foghat","You Ought To Be Havin' Fun , Tower Of Power","9,999,999 Tears , Dickey Lee","9,999,999 Tears , Dickey Lee","Man Smart, Woman Smarter , Robert Palmer","Don't Leave Me This Way , Thelma Houston","Don't Leave Me This Way , Thelma Houston"
75,"I Cheat The Hangman , The Doobie Brothers","Sweet Thing , Rufus Featuring Chaka Khan","Honey I , George McCrae","Honey I , George McCrae","I Could Have Danced All Night/Jump For Joy , Biddu Orchestra","Funky Weekend , The Stylistics","Funky Weekend , The Stylistics","Make Love To Your Mind , Bill Withers","Love Me Tonight , Head East","I Do, I Do, I Do, I Do, I Do , ABBA","I Do, I Do, I Do, I Do, I Do , ABBA","Fopp , Ohio Players","Shannon , Henry Gross","Shannon , Henry Gross","Mighty High , Mighty Clouds Of Joy","Scotch On The Rocks , The Band Of The Black Watch","Eh! Cumpari , Gaylord & Holiday","Eh! Cumpari , Gaylord & Holiday","The White Knight , Cledus Maggard And The Citizen's Band","Baretta's Theme (""Keep Your Eye On The Sparrow"") , Rhythm Heritage","Baretta's Theme (""Keep Your Eye On The Sparrow"") , Rhythm Heritage","It's Over , Boz Scaggs","Crazy On You , Heart","Moonlight Feels Right , Starbuck","Moonlight Feels Right , Starbuck","Forever Lovers , Mac Davis","It's Cool , The Tymes","It's Cool , The Tymes","Lonely Night (angel Face) , Captain & Tennille","High Out Of Time , Carole King","High Out Of Time , Carole King","High Out Of Time , Carole King","Heaven Must Be Missing An Angel (part 1) , Tavares","This Masquerade , George Benson","This Masquerade , George Benson","Rain, Oh Rain , Fools Gold","Rain, Oh Rain , Fools Gold","Rain, Oh Rain , Fools Gold","Crazy On You , Heart","I Want You , Marvin Gaye","Honey Child , Bad Company","Honey Child , Bad Company","(The System Of) Doctor Tarr And Professor Fether , The Alan Parsons Project","You To Me Are Everything , The Real Thing","Superstar , Paul Davis","Superstar , Paul Davis","Sunrise , Eric Carmen","The More You Do It (The More I Like It Done To Me) , Ronnie Dyson","The More You Do It (The More I Like It Done To Me) , Ronnie Dyson","Amber Cascades , America","Rocky Mountain Music , Eddie Rabbitt","Mr. Melody , Natalie Cole","Mr. Melody , Natalie Cole","More Than A Feeling , Boston","Kiss And Say Goodbye , The Manhattans","Kiss And Say Goodbye , The Manhattans","Nights Are Forever Without You , England Dan & John Ford Coley","My Sweet Summer Suite , Love Unlimited Orchestra","Wanna Make Love (Come Flick My BIC) , Sun","Wanna Make Love (Come Flick My BIC) , Sun","Keep Me Cryin' , Al Green","Every Face Tells A Story , Olivia Newton-John","Every Face Tells A Story , Olivia Newton-John","Help Wanted , The Hudson Brothers","Whispering/Cherchez La Femme/Se Si Bon , Dr. Buzzard's Original Savannah Band","Torn Between Two Lovers , Mary Macgregor","Torn Between Two Lovers , Mary Macgregor","Play That Funky Music , Wild Cherry","Rock'n Me , Steve Miller","Rock'n Me , Steve Miller","Dancing Queen , ABBA","Happier , Paul Anka","Happier , Paul Anka"
76,"The White Knight , Cledus Maggard And The Citizen's Band","Fire On The Mountain , The Marshall Tucker Band","My Little Town , Simon & Garfunkel","My Little Town , Simon & Garfunkel","Funky Weekend , The Stylistics","Remember Me , Willie Nelson","Remember Me , Willie Nelson","In France They Kiss On Main Street , Joni Mitchell","Only Love Is Real , Carole King","Tell It Like It Is , Andy Williams","Tell It Like It Is , Andy Williams","Show Me The Way , Peter Frampton","Somewhere In The Night , Helen Reddy","Somewhere In The Night , Helen Reddy","Scotch On The Rocks , The Band Of The Black Watch","Happy Music , The Blackbyrds","Heavy Love , David Ruffin","Heavy Love , David Ruffin","Anytime (i'll Be There) , Paul Anka","50 Ways To Leave Your Lover , Paul Simon","50 Ways To Leave Your Lover , Paul Simon","Jealousy , Major Harris","Only Love Is Real , Carole King","Kiss And Say Goodbye , The Manhattans","Kiss And Say Goodbye , The Manhattans","Love And Understanding (Come Together) , Kool & The Gang","Afternoon Delight , Starland Vocal Band","Afternoon Delight , Starland Vocal Band","Let It Shine , Santana","Let It Shine , Santana","Vaya Con Dios , Freddy Fender","Vaya Con Dios , Freddy Fender","Johnny Cool , The Steve Gibbons Band","I'd Really Love To See You Tonight , England Dan & John Ford Coley","I'd Really Love To See You Tonight , England Dan & John Ford Coley","Baby, I Love Your Way , Peter Frampton","The Lonely One , Special Delivery Featuring Terry Huff","The Lonely One , Special Delivery Featuring Terry Huff","Devil Woman , Cliff Richard","Fool For The City , Foghat","Ode To Billie Joe , Bobbie Gentry","Ode To Billie Joe , Bobbie Gentry","I Never Cry , Alice Cooper","Funny How Time Slips Away , Dorothy Moore","Wake Up Susan , The Spinners","Wake Up Susan , The Spinners","After The Dance , Marvin Gaye","It's O.k. , The Beach Boys","It's O.k. , The Beach Boys","Fernando , ABBA","Goofus , Carpenters","Do You Feel Like We Do , Peter Frampton","Do You Feel Like We Do , Peter Frampton","You Gotta Make Your Own Sunshine , Neil Sedaka","Love Ballad , L.T.D.","Love Ballad , L.T.D.","Jump , Aretha Franklin","Daylight , Vicki Sue Robinson","Breezin' , George Benson","Breezin' , George Benson","Cowboy Song , Thin Lizzy","Cowboy Song , Thin Lizzy","Cowboy Song , Thin Lizzy","Catfish , Four Tops","It Keeps You Runnin' , The Doobie Brothers","Do It To My Mind , Johnny Bristol","Do It To My Mind , Johnny Bristol","Don't Fight The Hands (That Need You) , Hamilton, Joe Frank & Dennison","Yesterday's Hero , Bay City Rollers","Yesterday's Hero , Bay City Rollers","Save It For A Rainy Day , Stephen Bishop","Open Sesame - Part 1 , Kool & The Gang","Open Sesame - Part 1 , Kool & The Gang"
77,"Don't Cry Joni , Conway Twitty with Joni Lee","That's Why I Love You , Andrew Gold","Dream Weaver , Gary Wright","Dream Weaver , Gary Wright","What's The Name Of This Funk (spider Man) , Ramsey Lewis","For The Love Of You (Part 1&2) , The Isley Brothers","For The Love Of You (Part 1&2) , The Isley Brothers","Let Your Love Flow , Bellamy Brothers","I Heard It Through The Grapevine , Creedence Clearwater Revival Featuring John Fogerty","Locomotive Breath , Jethro Tull","Locomotive Breath , Jethro Tull","Highfly , John Miles","Lady Bump , Penny Mclean","Lady Bump , Penny Mclean","Rhiannon (will You Ever Win) , Fleetwood Mac","If Love Must Go , Dobie Gray","More, More, More Pt. 1 , Andrea True Connection","More, More, More Pt. 1 , Andrea True Connection","Love Hangover , Diana Ross","Everyday Without You , Hamilton, Joe Frank & Reynolds","Everyday Without You , Hamilton, Joe Frank & Reynolds","Hey Baby , Ted Nugent","Get Closer , Seals & Crofts (Featuring Carolyn Willis)","Never Gonna Fall In Love Again , Eric Carmen","Never Gonna Fall In Love Again , Eric Carmen","Better Days , Melissa Manchester","I'm Easy , Keith Carradine","I'm Easy , Keith Carradine","You're My Best Friend , Queen","I Wanna Stay With You , Gallagher And Lyle","I Wanna Stay With You , Gallagher And Lyle","I Wanna Stay With You , Gallagher And Lyle","Flaming Youth , KISS","Rain, Oh Rain , Fools Gold","Rain, Oh Rain , Fools Gold","Ten Percent , Double Exposure","Wham Bam (Shang-A-Lang) , Silver","Wham Bam (Shang-A-Lang) , Silver","Play That Funky Music , Wild Cherry","Gotta Be The One , Maxine Nightingale","I Never Cry , Alice Cooper","I Never Cry , Alice Cooper","Rocky Mountain Music , Eddie Rabbitt","I Can't Hear You No More/Music Is My Life , Helen Reddy","Party , Van Mccoy","Party , Van Mccoy","Rescue Me , Melissa Manchester","We're All Alone , Frankie Valli","We're All Alone , Frankie Valli","Nadia's Theme (The Young And The Restless) , Barry DeVorzon and Perry Botkin, Jr.","Teddy Bear's Last Ride , Diana Williams","The Princess And The Punk , Barry Mann","The Princess And The Punk , Barry Mann","Give It Up (turn It Loose) , Tyrone Davis","I Never Cry , Alice Cooper","I Never Cry , Alice Cooper","Brand New Love Affair , Jigsaw","Wanna Make Love (Come Flick My BIC) , Sun","Groovy People , Lou Rawls","Groovy People , Lou Rawls","Lets Get It Together , El Coco","I Don't Wanna Lose Your Love , The Emotions","I Don't Wanna Lose Your Love , The Emotions","I Like Dreamin' , Kenny Nolan","Saturday Nite , Earth, Wind & Fire","Weekend In New England , Barry Manilow","Weekend In New England , Barry Manilow","Someone To Lay Down Beside Me , Linda Ronstadt","Slow Dancing , Funky Kings","Slow Dancing , Funky Kings","Free , Deniece Williams","Every Face Tells A Story , Olivia Newton-John","Every Face Tells A Story , Olivia Newton-John"
78,"Love Is The Drug , Roxy Music","'til It's Time To Say Goodbye , Jonathan Cain","Funky Weekend , The Stylistics","Funky Weekend , The Stylistics","Remember Me , Willie Nelson","If I Only Knew , Ozark Mountain Daredevils","If I Only Knew , Ozark Mountain Daredevils","Once You Hit The Road , Dionne Warwick","Love Fire , Jigsaw","Fox On The Run , Sweet","Fox On The Run , Sweet","Hit The Road Jack , Stampeders","Livin' For The Weekend , The O'Jays","Livin' For The Weekend , The O'Jays","The Game Is Over (What's The Matter With You) , Brown Sugar","The Game Is Over (What's The Matter With You) , Brown Sugar","Sally , Grand Funk Railroad","Sally , Grand Funk Railroad","There Won't Be No Country Music (There Won't Be No Rock 'N' Roll) , C.W. McCall","Happy Days , Pratt & McClain with Brother Love","Happy Days , Pratt & McClain with Brother Love","You Are Beautiful , The Stylistics","You Are Beautiful , The Stylistics","Forever Lovers , Mac Davis","Forever Lovers , Mac Davis","That's Where The Happy People Go , The Trammps","Lorelei , Styx","Lorelei , Styx","TVC15 , David Bowie","Foxy Lady , Crown Heights Affair","You'll Never Find Another Love Like Mine , Lou Rawls","You'll Never Find Another Love Like Mine , Lou Rawls","Still Crazy After All These Years , Paul Simon","Sixteen Tons , The Don Harrison Band","Sixteen Tons , The Don Harrison Band","Blt , Lee Oskar","Cotton Candy , The Sylvers","Cotton Candy , The Sylvers","(Shake, Shake, Shake) Shake Your Booty , KC And The Sunshine Band","Getaway , Earth, Wind & Fire","Light Up The World With Sunshine , Hamilton, Joe Frank & Dennison","Light Up The World With Sunshine , Hamilton, Joe Frank & Dennison","Mary Hartman, Mary Hartman , The Deadly Nightshade","Mary Hartman, Mary Hartman , The Deadly Nightshade","Highfly , John Miles","Highfly , John Miles","Disco Duck (Part I) , Rick Dees & His Cast Of Idiots","Amber Cascades , America","Amber Cascades , America","Beth/Detroit Rock City , KISS","The Princess And The Punk , Barry Mann","Love Of My Life , Gino Vannelli","Love Of My Life , Gino Vannelli","It's A Long Way There , Little River Band","The Fez , Steely Dan","The Fez , Steely Dan","Made To Love You , Gary Wright","I Can't Live A Dream , The Osmonds","Cowboy Song , Thin Lizzy","Cowboy Song , Thin Lizzy","Dazz , Brick","Car Wash , Rose Royce","Car Wash , Rose Royce","Mademoiselle , Styx","Ob-la-di, Ob-la-da , The Beatles","Heart On My Sleeve , Gallagher And Lyle","Heart On My Sleeve , Gallagher And Lyle","Baby, Baby I Love You , Terry Cashman","Man Smart, Woman Smarter , Robert Palmer","Man Smart, Woman Smarter , Robert Palmer","Open Sesame - Part 1 , Kool & The Gang","Baby, You Look Good To Me Tonight , John Denver","Baby, You Look Good To Me Tonight , John Denver"
