52,"Theme From S.W.A.T. , Rhythm Heritage","School Boy Crush , AWB","Sweet Love , Commodores","Sweet Love , Commodores","Only Sixteen , Dr. Hook","Back To The Island , Leon Russell","Back To The Island , Leon Russell","Take Me , Grand Funk Railroad","Cupid , Tony Orlando & Dawn","I Love Music (Part 1) , The O'Jays","I Love Music (Part 1) , The O'Jays","Action , Sweet","I Heard It Through The Grapevine , Creedence Clearwater Revival Featuring John Fogerty","I Heard It Through The Grapevine , Creedence Clearwater Revival Featuring John Fogerty","Fopp , Ohio Players","Union Man , Cate Bros.","The White Knight , Cledus Maggard And The Citizen's Band","The White Knight , Cledus Maggard And The Citizen's Band","Happy Music , The Blackbyrds","Can't Hide Love , Earth, Wind & Fire","Can't Hide Love , Earth, Wind & Fire","Hurt/for The Heart , Elvis Presley","Falling Apart At The Seams , Marmalade","Lorelei , Styx","Lorelei , Styx","Love Is Alive , Gary Wright","Dream Weaver , Gary Wright","Dream Weaver , Gary Wright","Dance Wit Me , Rufus Featuring Chaka Khan","Yes, Yes, Yes , Bill Cosby","Mamma Mia , ABBA","Mamma Mia , ABBA","Sophisticated Lady (She's A Different Lady) , Natalie Cole","Tryin' To Get The Feeling Again , Barry Manilow","Tryin' To Get The Feeling Again , Barry Manilow","Something He Can Feel , Aretha Franklin","Hot Stuff/fool To Cry , The Rolling Stones","Hot Stuff/fool To Cry , The Rolling Stones","Steppin' Out , Neil Sedaka","Say You Love Me , Fleetwood Mac","Shower The People , James Taylor","Shower The People , James Taylor","Silly Love Songs , Wings","She's Gone , Daryl Hall John Oates","Gotta Be The One , Maxine Nightingale","Gotta Be The One , Maxine Nightingale","Gotta Be The One , Maxine Nightingale","The Boys Are Back In Town , Thin Lizzy","The Boys Are Back In Town , Thin Lizzy","Got To Get You Into My Life , The Beatles","I'm Easy , Keith Carradine","Get Closer , Seals & Crofts (Featuring Carolyn Willis)","Get Closer , Seals & Crofts (Featuring Carolyn Willis)","Don't Think....Feel , Neil Diamond","Anything You Want , John Valenti","Anything You Want , John Valenti","Who'd She Coo? , Ohio Players","You Gotta Make Your Own Sunshine , Neil Sedaka","You Gotta Make Your Own Sunshine , Neil Sedaka","You Gotta Make Your Own Sunshine , Neil Sedaka","Don't Go Breaking My Heart , Elton John & Kiki Dee","Jeans On , David Dundas","Jeans On , David Dundas","Dazz , Brick","Do What You Want, Be What You Are , Daryl Hall John Oates","I Don't Wanna Lose Your Love , The Emotions","I Don't Wanna Lose Your Love , The Emotions","This Song , George Harrison","It Keeps You Runnin' , The Doobie Brothers","It Keeps You Runnin' , The Doobie Brothers","Do You Feel Like We Do , Peter Frampton","Living Next Door To Alice , Smokie","Living Next Door To Alice , Smokie"
53,"The Last Game Of The Season (A Blind Man In The Bleachers) , David Geddes","Love Or Leave , The Spinners","December, 1963 (Oh, What a Night) , The 4 Seasons","December, 1963 (Oh, What a Night) , The 4 Seasons","Easy As Pie , Billy ""Crash"" Craddock","Let's Do It Again , The Staple Singers","Let's Do It Again , The Staple Singers","Lady Bump , Penny Mclean","Good Hearted Woman , Waylon & Willie","Disco Lady , Johnnie Taylor","Disco Lady , Johnnie Taylor","Keep Holding On , The Temptations","Keep Holding On , The Temptations","Keep Holding On , The Temptations","Love Me Tonight , Head East","Grow Some Funk Of Your Own/I Feel Like A Bullet (In The Gun Of Robert Ford) , Elton John","Venus , Frankie Avalon","Venus , Frankie Avalon","Get Up And Boogie (That's Right) , Silver Convention","Mozambique , Bob Dylan","Mozambique , Bob Dylan","He's A Friend , Eddie Kendricks","Baretta's Theme (""Keep Your Eye On The Sparrow"") , Rhythm Heritage","Deep Purple , Donny & Marie Osmond","Deep Purple , Donny & Marie Osmond","Can't Hide Love , Earth, Wind & Fire","Still Crazy After All These Years , Paul Simon","Still Crazy After All These Years , Paul Simon","I Do, I Do, I Do, I Do, I Do , ABBA","Turn The Beat Around , Vicki Sue Robinson","Hurt/for The Heart , Elvis Presley","Hurt/for The Heart , Elvis Presley","Got To Get You Into My Life , The Beatles","Rock And Roll Love Letter , Bay City Rollers","Rock And Roll Love Letter , Bay City Rollers","I Wanna Stay With You , Gallagher And Lyle","This Masquerade , George Benson","This Masquerade , George Benson","I Want You , Marvin Gaye","Hold On , Sons Of Champlin","Wham Bam (Shang-A-Lang) , Silver","Wham Bam (Shang-A-Lang) , Silver","Misty Blue , Dorothy Moore","Ten Percent , Double Exposure","Ode To Billie Joe , Bobbie Gentry","Ode To Billie Joe , Bobbie Gentry","(The System Of) Doctor Tarr And Professor Fether , The Alan Parsons Project","Rainbow In Your Eyes , Leon & Mary Russell","Rainbow In Your Eyes , Leon & Mary Russell","Let Her In , John Travolta","I Only Want To Be With You , Bay City Rollers","Turn The Beat Around , Vicki Sue Robinson","Turn The Beat Around , Vicki Sue Robinson","Love Is Alive , Gary Wright","Love Is Alive , Gary Wright","Love Is Alive , Gary Wright","Shower The People , James Taylor","It's Only Love , ZZ Top","Love Me , Yvonne Elliman","Love Me , Yvonne Elliman","Hot Line , The Sylvers","Getaway , Earth, Wind & Fire","Getaway , Earth, Wind & Fire","Sorry Seems To Be The Hardest Word , Elton John","I Kinda Miss You , The Manhattans","Enjoy Yourself , The Jacksons","Enjoy Yourself , The Jacksons","Keep Me Cryin' , Al Green","Drivin' Wheel , Foghat","Drivin' Wheel , Foghat","Free Bird , Lynyrd Skynyrd","9,999,999 Tears , Dickey Lee","9,999,999 Tears , Dickey Lee"
54,"Take It To The Limit , Eagles","Inseparable , Natalie Cole","Easy As Pie , Billy ""Crash"" Craddock","Easy As Pie , Billy ""Crash"" Craddock","Grow Some Funk Of Your Own/I Feel Like A Bullet (In The Gun Of Robert Ford) , Elton John","'til It's Time To Say Goodbye , Jonathan Cain","'til It's Time To Say Goodbye , Jonathan Cain","'til It's Time To Say Goodbye , Jonathan Cain","Take Me , Grand Funk Railroad","Break Away , Art Garfunkel","Break Away , Art Garfunkel","Convoy , C.W. McCall","You'll Lose A Good Thing , Freddy Fender","You'll Lose A Good Thing , Freddy Fender","Breaking Up Is Hard To Do , Neil Sedaka","Strange Magic , Electric Light Orchestra","Mozambique , Bob Dylan","Mozambique , Bob Dylan","Mozambique , Bob Dylan","More, More, More Pt. 1 , Andrea True Connection","More, More, More Pt. 1 , Andrea True Connection","Love Really Hurts Without You , Billy Ocean","Take It To The Limit , Eagles","It's Over , Boz Scaggs","It's Over , Boz Scaggs","Crazy On You , Heart","Lonely Night (angel Face) , Captain & Tennille","Lonely Night (angel Face) , Captain & Tennille","Only Sixteen , Dr. Hook","Today's The Day , America","One Piece At A Time , Johnny Cash And The Tennessee Three","One Piece At A Time , Johnny Cash And The Tennessee Three","I Need To Be In Love , Carpenters","If You Know What I Mean , Neil Diamond","If You Know What I Mean , Neil Diamond","Framed , Cheech & Chong","Another Rainy Day In New York City , Chicago","Another Rainy Day In New York City , Chicago","It Keeps You Runnin' , Carly Simon","Foxy Lady , Crown Heights Affair","Getaway , Earth, Wind & Fire","Getaway , Earth, Wind & Fire","Sara Smile , Daryl Hall John Oates","Gotta Be The One , Maxine Nightingale","Hey Shirley (This Is Squirrely) , Shirley & Squirrely","Hey Shirley (This Is Squirrely) , Shirley & Squirrely","Hold On , Sons Of Champlin","Get Up Offa That Thing , James Brown","Get Up Offa That Thing , James Brown","Sunrise , Eric Carmen","Moonlight Feels Right , Starbuck","Rock And Roll Music , The Beach Boys","Rock And Roll Music , The Beach Boys","Get Closer , Seals & Crofts (Featuring Carolyn Willis)","More Than A Feeling , Boston","More Than A Feeling , Boston","Heaven Must Be Missing An Angel (part 1) , Tavares","I Never Cry , Alice Cooper","Mr. Melody , Natalie Cole","Mr. Melody , Natalie Cole","Wham Bam (Shang-A-Lang) , Silver","I'd Really Love To See You Tonight , England Dan & John Ford Coley","I'd Really Love To See You Tonight , England Dan & John Ford Coley","Do What You Want, Be What You Are , Daryl Hall John Oates","Anything You Want , John Valenti","I Like Dreamin' , Kenny Nolan","I Like Dreamin' , Kenny Nolan","Walk This Way , Aerosmith","Let's Be Young Tonight , Jermaine Jackson","Let's Be Young Tonight , Jermaine Jackson","Every Face Tells A Story , Olivia Newton-John","If Not You , Dr. Hook","If Not You , Dr. Hook"
55,"All By Myself , Eric Carmen","Easy As Pie , Billy ""Crash"" Craddock","Junk Food Junkie , Larry Groce","Junk Food Junkie , Larry Groce","Back To The Island , Leon Russell","Renegade , Michael Murphey","Renegade , Michael Murphey","Country Boy (You Got Your Feet In L.A.) , Glen Campbell","Can The Can , Suzi Quatro","Can The Can , Suzi Quatro","Can The Can , Suzi Quatro","Love Me Tonight , Head East","Love Me Tonight , Head East","Love Me Tonight , Head East","Hit The Road Jack , Stampeders","Shannon , Henry Gross","Rhiannon (will You Ever Win) , Fleetwood Mac","Rhiannon (will You Ever Win) , Fleetwood Mac","Street Talk , B.C.G. (B.C. Generation)","I've Got A Feeling (We'll Be Seeing Each Other Again) , Al Wilson","I've Got A Feeling (We'll Be Seeing Each Other Again) , Al Wilson","Anytime (i'll Be There) , Paul Anka","Love Machine (Part 1) , The Miracles","Golden Years , David Bowie","Golden Years , David Bowie","Rock And Roll Love Letter , Bay City Rollers","There's A Kind Of Hush (All Over The World) , Carpenters","There's A Kind Of Hush (All Over The World) , Carpenters","Take The Money And Run , Steve Miller","Tear The Roof Off The Sucker (Give Up The Funk) , Parliament","Disco Lady , Johnnie Taylor","Disco Lady , Johnnie Taylor","Can't Stop Groovin' Now, Wanna Do It Some More , B.T. Express","You'll Never Find Another Love Like Mine , Lou Rawls","You'll Never Find Another Love Like Mine , Lou Rawls","Heaven Must Be Missing An Angel (part 1) , Tavares","Baby, I Love Your Way , Peter Frampton","Baby, I Love Your Way , Peter Frampton","Fool For The City , Foghat","(Shake, Shake, Shake) Shake Your Booty , KC And The Sunshine Band","Lowdown , Boz Scaggs","Lowdown , Boz Scaggs","With Your Love , Jefferson Starship","Wake Up Susan , The Spinners","Rainbow In Your Eyes , Leon & Mary Russell","Rainbow In Your Eyes , Leon & Mary Russell","Rainbow In Your Eyes , Leon & Mary Russell","Rock'n Me , Steve Miller","Rock'n Me , Steve Miller","Teddy Bear , Red Sovine","Fernando , ABBA","Like A Sad Song , John Denver","Like A Sad Song , John Denver","Goofus , Carpenters","Goofus , Carpenters","Goofus , Carpenters","Let 'em In , Wings","Love Ballad , L.T.D.","You Should Be Dancing , Bee Gees","You Should Be Dancing , Bee Gees","You Should Be Dancing , Bee Gees","With Your Love , Jefferson Starship","With Your Love , Jefferson Starship","Get The Funk Out Ma Face , The Brothers Johnson","It's Only Love , ZZ Top","Every Face Tells A Story , Olivia Newton-John","Every Face Tells A Story , Olivia Newton-John","Let's Be Young Tonight , Jermaine Jackson","Do It To My Mind , Johnny Bristol","Do It To My Mind , Johnny Bristol","Someone To Lay Down Beside Me , Linda Ronstadt","Yesterday's Hero , Bay City Rollers","Yesterday's Hero , Bay City Rollers"
56,"Deep Purple , Donny & Marie Osmond","The White Knight , Cledus Maggard And The Citizen's Band","Nights On Broadway , Bee Gees","Nights On Broadway , Bee Gees","Fly, Robin, Fly , Silver Convention","Take Me , Grand Funk Railroad","Take Me , Grand Funk Railroad","Hold Back The Night , The Trammps","Just You And I , Melissa Manchester","Take Me , Grand Funk Railroad","Take Me , Grand Funk Railroad","Love Rollercoaster , Ohio Players","I Do, I Do, I Do, I Do, I Do , ABBA","I Do, I Do, I Do, I Do, I Do , ABBA","Sara Smile , Daryl Hall John Oates","Fooled Around And Fell In Love , Elvin Bishop","Tryin' To Get The Feeling Again , Barry Manilow","Tryin' To Get The Feeling Again , Barry Manilow","Inseparable , Natalie Cole","Fanny (Be Tender With My Love) , Bee Gees","Fanny (Be Tender With My Love) , Bee Gees","Happy Days , Pratt & McClain with Brother Love","All By Myself , Eric Carmen","Action , Sweet","Action , Sweet","Lorelei , Styx","Livin' For The Weekend , The O'Jays","Livin' For The Weekend , The O'Jays","That's Where The Happy People Go , The Trammps","Making Our Dreams Come True , Cyndi Grecco","Bigfoot , Bro Smith","Bigfoot , Bro Smith","Who Loves You Better - Part 1 , The Isley Brothers","Show Me The Way , Peter Frampton","Show Me The Way , Peter Frampton","Right Back Where We Started From , Maxine Nightingale","Steppin' Out , Neil Sedaka","Steppin' Out , Neil Sedaka","A Little Bit More , Dr. Hook","Summer , War","Devil Woman , Cliff Richard","Devil Woman , Cliff Richard","Gotta Be The One , Maxine Nightingale","Ode To Billie Joe , Bobbie Gentry","Hard Work , John Handy","Hard Work , John Handy","Don't Stop Believin' , Olivia Newton-John","That'll Be The Day , Linda Ronstadt","That'll Be The Day , Linda Ronstadt","The Wreck Of The Edmund Fitzgerald , Gordon Lightfoot","Beth/Detroit Rock City , KISS","Nadia's Theme (The Young And The Restless) , Barry DeVorzon and Perry Botkin, Jr.","Nadia's Theme (The Young And The Restless) , Barry DeVorzon and Perry Botkin, Jr.","Just To Be Close To You , Commodores","This Masquerade , George Benson","This Masquerade , George Benson","You Gotta Make Your Own Sunshine , Neil Sedaka","Mr. Melody , Natalie Cole","Queen Of My Soul , Average White Band","Queen Of My Soul , Average White Band","Say You Love Me , Fleetwood Mac","Mr. Melody , Natalie Cole","Mr. Melody , Natalie Cole","Mr. Melody , Natalie Cole","Don't Take Away The Music , Tavares","Down To Love Town , The Originals","Down To Love Town , The Originals","It Keeps You Runnin' , The Doobie Brothers","Every Face Tells A Story , Olivia Newton-John","Every Face Tells A Story , Olivia Newton-John","I Like To Do It , KC And The Sunshine Band","Just To Be Close To You , Commodores","Just To Be Close To You , Commodores"
57,"Christmas For Cowboys , John Denver","Feelings , Morris Albert","Back To The Island , Leon Russell","Back To The Island , Leon Russell","Woman Tonight , America","Inseparable , Natalie Cole","Inseparable , Natalie Cole","Over My Head , Fleetwood Mac","Winners And Losers , Hamilton, Joe Frank & Reynolds","Let Your Love Flow , Bellamy Brothers","Let Your Love Flow , Bellamy Brothers","Love Fire , Jigsaw","There's A Kind Of Hush (All Over The World) , Carpenters","There's A Kind Of Hush (All Over The World) , Carpenters","I Write The Songs , Barry Manilow","Venus , Frankie Avalon","Street Talk , B.C.G. (B.C. Generation)","Street Talk , B.C.G. (B.C. Generation)","50 Ways To Leave Your Lover , Paul Simon","Silly Love Songs , Wings","Silly Love Songs , Wings","Fallen Angel , Frankie Valli","One Piece At A Time , Johnny Cash And The Tennessee Three","Take It To The Limit , Eagles","Take It To The Limit , Eagles","Deep Purple , Donny & Marie Osmond","Get Closer , Seals & Crofts (Featuring Carolyn Willis)","Get Closer , Seals & Crofts (Featuring Carolyn Willis)","Thinking Of You , Paul Davis","Come On Over , Olivia Newton-John","I.O.U. , Jimmy Dean","I.O.U. , Jimmy Dean","Rock And Roll Music , The Beach Boys","Fool For The City , Foghat","Fool For The City , Foghat","You're My Everything , Lee Garrett","It Keeps You Runnin' , Carly Simon","It Keeps You Runnin' , Carly Simon","Heaven Must Be Missing An Angel (part 1) , Tavares","Good Vibrations , Todd Rundgren","Today's The Day , America","Today's The Day , America","Ten Percent , Double Exposure","One Love In My Lifetime , Diana Ross","Steppin' Out , Neil Sedaka","Steppin' Out , Neil Sedaka","Ode To Billie Joe , Bobbie Gentry","Popsicle Toes , Michael Franks","Popsicle Toes , Michael Franks","Last Child , Aerosmith","The Best Disco In Town , The Ritchie Family","Funny How Time Slips Away , Dorothy Moore","Funny How Time Slips Away , Dorothy Moore","Do You Feel Like We Do , Peter Frampton","A Dose Of Rock 'N' Roll , Ringo Starr","A Dose Of Rock 'N' Roll , Ringo Starr","Mr. Melody , Natalie Cole","Nights Are Forever Without You , England Dan & John Ford Coley","Summer , War","Summer , War","I Can't Live A Dream , The Osmonds","Get The Funk Out Ma Face , The Brothers Johnson","Get The Funk Out Ma Face , The Brothers Johnson","Let's Be Young Tonight , Jermaine Jackson","Let's Be Young Tonight , Jermaine Jackson","Let's Be Young Tonight , Jermaine Jackson","Let's Be Young Tonight , Jermaine Jackson","Every Face Tells A Story , Olivia Newton-John","Weekend In New England , Barry Manilow","Weekend In New England , Barry Manilow","Baby, I'll Give It To You , Seals & Crofts","Don't Take Away The Music , Tavares","Don't Take Away The Music , Tavares"
58,"Inseparable , Natalie Cole","The Homecoming , Hagood Hardy","Bohemian Rhapsody , Queen","Bohemian Rhapsody , Queen","Dream On , Aerosmith","Easy As Pie , Billy ""Crash"" Craddock","Easy As Pie , Billy ""Crash"" Craddock","Yesterday's Hero , John Paul Young","Fly Away , John Denver","Fly Away , John Denver","Fly Away , John Denver","Times Of Your Life , Paul Anka","Show Me The Way , Peter Frampton","Show Me The Way , Peter Frampton","Without Your Love (mr. Jordan) , Charlie Ross","I Thought It Took A Little Time (But Today I Fell In Love) , Diana Ross","Misty Blue , Dorothy Moore","Misty Blue , Dorothy Moore","Welcome Back , John Sebastian","Heavy Love , David Ruffin","Heavy Love , David Ruffin","Tangerine , The Salsoul Orchestra","Love Hurts , Nazareth","Don't Stop It Now , Hot Chocolate","Don't Stop It Now , Hot Chocolate","Action , Sweet","Sweet Thing , Rufus Featuring Chaka Khan","Sweet Thing , Rufus Featuring Chaka Khan","Turn The Beat Around , Vicki Sue Robinson","Bigfoot , Bro Smith","Bohemian Rhapsody , Queen","Bohemian Rhapsody , Queen","A Fifth Of Beethoven , Walter Murphy & The Big Apple Band","You're My Everything , Lee Garrett","You're My Everything , Lee Garrett","Vaya Con Dios , Freddy Fender","Let 'em In , Wings","Let 'em In , Wings","Foxy Lady , Crown Heights Affair","Play That Funky Music , Wild Cherry","Blt , Lee Oskar","Blt , Lee Oskar","Cotton Candy , The Sylvers","Honey Child , Bad Company","I Can't Hear You No More/Music Is My Life , Helen Reddy","I Can't Hear You No More/Music Is My Life , Helen Reddy","Get Up Offa That Thing , James Brown","Showdown , Electric Light Orchestra","Showdown , Electric Light Orchestra","You're My Best Friend , Queen","Funny How Time Slips Away , Dorothy Moore","Got To Get You Into My Life , The Beatles","Got To Get You Into My Life , The Beatles","Funny How Time Slips Away , Dorothy Moore","You Don't Have To Be A Star (To Be In My Show) , Marilyn McCoo & Billy Davis, Jr.","You Don't Have To Be A Star (To Be In My Show) , Marilyn McCoo & Billy Davis, Jr.","It's A Long Way There , Little River Band","The Fez , Steely Dan","The Fez , Steely Dan","The Fez , Steely Dan","My Sweet Summer Suite , Love Unlimited Orchestra","You Should Be Dancing , Bee Gees","You Should Be Dancing , Bee Gees","I Kinda Miss You , The Manhattans","Mr. Melody , Natalie Cole","Mademoiselle , Styx","Mademoiselle , Styx","Ob-la-di, Ob-la-da , The Beatles","Blinded By The Light , Manfred Mann's Earth Band","Blinded By The Light , Manfred Mann's Earth Band","If Not You , Dr. Hook","Night Moves , Bob Seger","Night Moves , Bob Seger"
59,"Let The Music Play , Barry White","Yesterday's Hero , John Paul Young","I Cheat The Hangman , The Doobie Brothers","I Cheat The Hangman , The Doobie Brothers","Dream Weaver , Gary Wright","Tangerine , The Salsoul Orchestra","Tangerine , The Salsoul Orchestra","Take It Like A Man , Bachman-Turner Overdrive","Break Away , Art Garfunkel","Venus , Frankie Avalon","Venus , Frankie Avalon","Boogie Fever , The Sylvers","Lorelei , Styx","Lorelei , Styx","If You Only Believe (Jesus For Tonite) , Michel Polnareff","Mozambique , Bob Dylan","Come On Over , Olivia Newton-John","Come On Over , Olivia Newton-John","Shout It Out Loud , KISS","He's A Friend , Eddie Kendricks","He's A Friend , Eddie Kendricks","Movin' , Brass Construction","I'm Mandy Fly Me , 10cc","I'm Mandy Fly Me , 10cc","I'm Mandy Fly Me , 10cc","Never Gonna Fall In Love Again , Eric Carmen","Thinking Of You , Paul Davis","Thinking Of You , Paul Davis","It Makes Me Giggle , John Denver","It Makes Me Giggle , John Denver","Young Hearts Run Free , Candi Staton","Young Hearts Run Free , Candi Staton","Good Vibrations , Todd Rundgren","Vaya Con Dios , Freddy Fender","Vaya Con Dios , Freddy Fender","I'd Really Love To See You Tonight , England Dan & John Ford Coley","I'm Gonna Let My Heart Do The Walking , The Supremes","I'm Gonna Let My Heart Do The Walking , The Supremes","That's Where The Happy People Go , The Trammps","Shower The People , James Taylor","Springtime Mama , Henry Gross","Springtime Mama , Henry Gross","Dancin' Kid , Disco Tex & The Sex-O-Lettes Featuring Sir Monti Rock III","Hey Shirley (This Is Squirrely) , Shirley & Squirrely","If You Leave Me Now , Chicago","If You Leave Me Now , Chicago","(Don't Fear) The Reaper , Blue Oyster Cult","No, No, Joe , Silver Convention","No, No, Joe , Silver Convention","No, No, Joe , Silver Convention","Got To Get You Into My Life , The Beatles","Queen Of My Soul , Average White Band","Queen Of My Soul , Average White Band","This One's For You , Barry Manilow","Mr. Melody , Natalie Cole","Mr. Melody , Natalie Cole","It's Only Love , ZZ Top","You'll Never Find Another Love Like Mine , Lou Rawls","Hello Old Friend , Eric Clapton","Hello Old Friend , Eric Clapton","Livin' Thing , Electric Light Orchestra","Whenever I'm Away From You , John Travolta","Whenever I'm Away From You , John Travolta","Still The One , Orleans","I Don't Wanna Lose Your Love , The Emotions","Whispering/Cherchez La Femme/Se Si Bon , Dr. Buzzard's Original Savannah Band","Whispering/Cherchez La Femme/Se Si Bon , Dr. Buzzard's Original Savannah Band","What Can I Say , Boz Scaggs","Baby, I'll Give It To You , Seals & Crofts","Baby, I'll Give It To You , Seals & Crofts","Baby Boy , Mary Kay Place As Loretta Haggers","You've Got Me Runnin' , Gene Cotton","You've Got Me Runnin' , Gene Cotton"
60,"Tracks Of My Tears , Linda Ronstadt","Break Away , Art Garfunkel","Love Is The Drug , Roxy Music","Love Is The Drug , Roxy Music","Inseparable , Natalie Cole","Fly, Robin, Fly , Silver Convention","Fly, Robin, Fly , Silver Convention","Banapple Gas , Cat Stevens","Rock And Roll All Nite (live) , KISS","Quiet Storm , Smokey Robinson","Quiet Storm , Smokey Robinson","He's A Friend , Eddie Kendricks","Looking For Space , John Denver","Looking For Space , John Denver","Squeeze Box , The Who","Street Talk , B.C.G. (B.C. Generation)","Young Blood , Bad Company","Young Blood , Bad Company","Heavy Love , David Ruffin","When Love Has Gone Away , Richard Cocciante","When Love Has Gone Away , Richard Cocciante","You'll Lose A Good Thing , Freddy Fender","Takin' It To The Streets , The Doobie Brothers","Money Honey , Bay City Rollers","Money Honey , Bay City Rollers","Take It To The Limit , Eagles","Turn The Beat Around , Vicki Sue Robinson","Turn The Beat Around , Vicki Sue Robinson","Bigfoot , Bro Smith","I'm Easy , Keith Carradine","Somebody's Gettin' It , Johnnie Taylor","Somebody's Gettin' It , Johnnie Taylor","Silver Star , The 4 Seasons","C'mon Marianne , Donny Osmond","C'mon Marianne , Donny Osmond","Lipstick , Michel Polnareff","Lipstick , Michel Polnareff","Lipstick , Michel Polnareff","Who'd She Coo? , Ohio Players","Silver Star , The 4 Seasons","Cotton Candy , The Sylvers","Cotton Candy , The Sylvers","Wake Up Susan , The Spinners","Hard Work , John Handy","Don't Touch Me There , The Tubes","Don't Touch Me There , The Tubes","No, No, Joe , Silver Convention","Get The Funk Out Ma Face , The Brothers Johnson","Get The Funk Out Ma Face , The Brothers Johnson","Funny How Time Slips Away , Dorothy Moore","Let Her In , John Travolta","Howzat , Sherbet","Howzat , Sherbet","Message In Our Music , The O'Jays","Nice 'N' Naasty , The Salsoul Orchestra","Nice 'N' Naasty , The Salsoul Orchestra","Nice 'N' Naasty , The Salsoul Orchestra","Sunrise , Eric Carmen","The End Is Not In Sight (the Cowboy Tune) , Amazing Rhythm Aces","The End Is Not In Sight (the Cowboy Tune) , Amazing Rhythm Aces","Message In Our Music , The O'Jays","Let's Be Young Tonight , Jermaine Jackson","Let's Be Young Tonight , Jermaine Jackson","Devil Woman , Cliff Richard","Down To Love Town , The Originals","Keep Me Cryin' , Al Green","Keep Me Cryin' , Al Green","Ain't Nothing Like The Real Thing , Donny & Marie Osmond","Lets Get It Together , El Coco","Lets Get It Together , El Coco","Evergreen (Love Theme From ""A Star Is Born"") , Barbra Streisand","Baby Boy , Mary Kay Place As Loretta Haggers","Baby Boy , Mary Kay Place As Loretta Haggers"
