25,"Winners And Losers , Hamilton, Joe Frank & Reynolds","For The Love Of You (Part 1&2) , The Isley Brothers","Somewhere In The Night , Helen Reddy","Somewhere In The Night , Helen Reddy","Squeeze Box , The Who","Paloma Blanca , George Baker Selection","Paloma Blanca , George Baker Selection","Golden Years , David Bowie","Tracks Of My Tears , Linda Ronstadt","Tracks Of My Tears , Linda Ronstadt","Tracks Of My Tears , Linda Ronstadt","Evil Woman , Electric Light Orchestra","Disco Lady , Johnnie Taylor","Disco Lady , Johnnie Taylor","Tangerine , The Salsoul Orchestra","Action , Sweet","Good Hearted Woman , Waylon & Willie","Good Hearted Woman , Waylon & Willie","I Do, I Do, I Do, I Do, I Do , ABBA","Shannon , Henry Gross","Shannon , Henry Gross","Love Machine (Part 1) , The Miracles","Rhiannon (will You Ever Win) , Fleetwood Mac","Happy Days , Pratt & McClain with Brother Love","Happy Days , Pratt & McClain with Brother Love","Young Blood , Bad Company","More, More, More Pt. 1 , Andrea True Connection","More, More, More Pt. 1 , Andrea True Connection","Disco Lady , Johnnie Taylor","Love Is Alive , Gary Wright","Show Me The Way , Peter Frampton","Show Me The Way , Peter Frampton","The Boys Are Back In Town , Thin Lizzy","Get Closer , Seals & Crofts (Featuring Carolyn Willis)","Get Closer , Seals & Crofts (Featuring Carolyn Willis)","Let Her In , John Travolta","Turn The Beat Around , Vicki Sue Robinson","Turn The Beat Around , Vicki Sue Robinson","I'm Easy , Keith Carradine","Last Child , Aerosmith","Young Hearts Run Free , Candi Staton","Young Hearts Run Free , Candi Staton","Sophisticated Lady (She's A Different Lady) , Natalie Cole","(Shake, Shake, Shake) Shake Your Booty , KC And The Sunshine Band","If You Know What I Mean , Neil Diamond","If You Know What I Mean , Neil Diamond","Who'd She Coo? , Ohio Players","Turn The Beat Around , Vicki Sue Robinson","Turn The Beat Around , Vicki Sue Robinson","Shower The People , James Taylor","Disco Duck (Part I) , Rick Dees & His Cast Of Idiots","Magic Man , Heart","Magic Man , Heart","One Love In My Lifetime , Diana Ross","The Wreck Of The Edmund Fitzgerald , Gordon Lightfoot","The Wreck Of The Edmund Fitzgerald , Gordon Lightfoot","One Love In My Lifetime , Diana Ross","Just To Be Close To You , Commodores","Do You Feel Like We Do , Peter Frampton","Do You Feel Like We Do , Peter Frampton","Still The One , Orleans","A Dose Of Rock 'N' Roll , Ringo Starr","A Dose Of Rock 'N' Roll , Ringo Starr","A Dose Of Rock 'N' Roll , Ringo Starr","Love Ballad , L.T.D.","(Don't Fear) The Reaper , Blue Oyster Cult","(Don't Fear) The Reaper , Blue Oyster Cult","Livin' Thing , Electric Light Orchestra","Somebody To Love , Queen","Somebody To Love , Queen","Lost Without Your Love , Bread","Saturday Nite , Earth, Wind & Fire","Saturday Nite , Earth, Wind & Fire"
26,"Wake Up Everybody (Part 1) , Harold Melvin And The Blue Notes","Baby Face , The Wing And A Prayer Fife & Drum Corps.","Theme From S.W.A.T. , Rhythm Heritage","Theme From S.W.A.T. , Rhythm Heritage","Paloma Blanca , George Baker Selection","Fanny (Be Tender With My Love) , Bee Gees","Fanny (Be Tender With My Love) , Bee Gees","Tracks Of My Tears , Linda Ronstadt","Dream Weaver , Gary Wright","Slow Ride , Foghat","Slow Ride , Foghat","Dream On , Aerosmith","I Write The Songs , Barry Manilow","I Write The Songs , Barry Manilow","Just You And I , Melissa Manchester","Just You And I , Melissa Manchester","Love Hurts , Nazareth","Love Hurts , Nazareth","Fooled Around And Fell In Love , Elvin Bishop","Livin' For The Weekend , The O'Jays","Livin' For The Weekend , The O'Jays","Strange Magic , Electric Light Orchestra","Lorelei , Styx","Sweet Thing , Rufus Featuring Chaka Khan","Sweet Thing , Rufus Featuring Chaka Khan","Don't Pull Your Love/then You Can Tell Me Goodbye , Glen Campbell","Don't Pull Your Love/then You Can Tell Me Goodbye , Glen Campbell","Don't Pull Your Love/then You Can Tell Me Goodbye , Glen Campbell","Bohemian Rhapsody , Queen","Baretta's Theme (""Keep Your Eye On The Sparrow"") , Rhythm Heritage","Kiss And Say Goodbye , The Manhattans","Kiss And Say Goodbye , The Manhattans","Right Back Where We Started From , Maxine Nightingale","You're My Best Friend , Queen","You're My Best Friend , Queen","That's Where The Happy People Go , The Trammps","Tear The Roof Off The Sucker (Give Up The Funk) , Parliament","Tear The Roof Off The Sucker (Give Up The Funk) , Parliament","Save Your Kisses For Me , Brotherhood Of Man","I Need To Be In Love , Carpenters","Sophisticated Lady (She's A Different Lady) , Natalie Cole","Sophisticated Lady (She's A Different Lady) , Natalie Cole","The Boys Are Back In Town , Thin Lizzy","Heaven Must Be Missing An Angel (part 1) , Tavares","Lowdown , Boz Scaggs","Lowdown , Boz Scaggs","Still The One , Orleans","She's Gone , Daryl Hall John Oates","She's Gone , Daryl Hall John Oates","Getaway , Earth, Wind & Fire","Rock'n Me , Steve Miller","Street Singin' , Lady Flash","Street Singin' , Lady Flash","(Don't Fear) The Reaper , Blue Oyster Cult","Who'd She Coo? , Ohio Players","Who'd She Coo? , Ohio Players","You Are The Woman , Firefall","The Best Disco In Town , The Ritchie Family","The Rubberband Man , The Spinners","The Rubberband Man , The Spinners","A Little Bit More , Dr. Hook","You Are My Starship , Norman Connors","You Are My Starship , Norman Connors","You Are My Starship , Norman Connors","Play That Funky Music , Wild Cherry","Hot Line , The Sylvers","Hot Line , The Sylvers","Hello Old Friend , Eric Clapton","The Best Disco In Town , The Ritchie Family","The Best Disco In Town , The Ritchie Family","Disco Duck (Part I) , Rick Dees & His Cast Of Idiots","This Song , George Harrison","This Song , George Harrison"
27,"Breaking Up Is Hard To Do , Neil Sedaka","Somewhere In The Night , Helen Reddy","Squeeze Box , The Who","Squeeze Box , The Who","Take It To The Limit , Eagles","Fox On The Run , Sweet","Fox On The Run , Sweet","December, 1963 (Oh, What a Night) , The 4 Seasons","Slow Ride , Foghat","Deep Purple , Donny & Marie Osmond","Deep Purple , Donny & Marie Osmond","Money Honey , Bay City Rollers","Cupid , Tony Orlando & Dawn","Cupid , Tony Orlando & Dawn","Let Your Love Flow , Bellamy Brothers","Good Hearted Woman , Waylon & Willie","Theme From S.W.A.T. , Rhythm Heritage","Theme From S.W.A.T. , Rhythm Heritage","Only Love Is Real , Carole King","Only Love Is Real , Carole King","Only Love Is Real , Carole King","Lorelei , Styx","Get Up And Boogie (That's Right) , Silver Convention","Don't Pull Your Love/then You Can Tell Me Goodbye , Glen Campbell","Don't Pull Your Love/then You Can Tell Me Goodbye , Glen Campbell","Love In The Shadows , Neil Sedaka","Union Man , Cate Bros.","Union Man , Cate Bros.","I Want You , Marvin Gaye","Hurt/for The Heart , Elvis Presley","Young Blood , Bad Company","Young Blood , Bad Company","Rock And Roll Love Letter , Bay City Rollers","That's Where The Happy People Go , The Trammps","That's Where The Happy People Go , The Trammps","Making Our Dreams Come True , Cyndi Grecco","Save Your Kisses For Me , Brotherhood Of Man","Save Your Kisses For Me , Brotherhood Of Man","Last Child , Aerosmith","Young Hearts Run Free , Candi Staton","Baby, I Love Your Way , Peter Frampton","Baby, I Love Your Way , Peter Frampton","I'd Really Love To See You Tonight , England Dan & John Ford Coley","I'll Be Good To You , The Brothers Johnson","Something He Can Feel , Aretha Franklin","Something He Can Feel , Aretha Franklin","If You Leave Me Now , Chicago","Shower The People , James Taylor","Shower The People , James Taylor","Rock And Roll Music , The Beach Boys","Street Singin' , Lady Flash","One Love In My Lifetime , Diana Ross","One Love In My Lifetime , Diana Ross","Heaven Must Be Missing An Angel (part 1) , Tavares","Don't Go Breaking My Heart , Elton John & Kiki Dee","Don't Go Breaking My Heart , Elton John & Kiki Dee","Nadia's Theme (The Young And The Restless) , Barry DeVorzon and Perry Botkin, Jr.","Do You Feel Like We Do , Peter Frampton","A Little Bit More , Dr. Hook","A Little Bit More , Dr. Hook","A Dose Of Rock 'N' Roll , Ringo Starr","I Never Cry , Alice Cooper","I Never Cry , Alice Cooper","You Make Me Feel Like Dancing , Leo Sayer","Sorry Seems To Be The Hardest Word , Elton John","Livin' Thing , Electric Light Orchestra","Livin' Thing , Electric Light Orchestra","It's A Long Way There , Little River Band","It's A Long Way There , Little River Band","It's A Long Way There , Little River Band","Jeans On , David Dundas","Walk This Way , Aerosmith","Walk This Way , Aerosmith"
28,"Baby Face , The Wing And A Prayer Fife & Drum Corps.","Fly, Robin, Fly , Silver Convention","Paloma Blanca , George Baker Selection","Paloma Blanca , George Baker Selection","Over My Head , Fleetwood Mac","Country Boy (You Got Your Feet In L.A.) , Glen Campbell","Country Boy (You Got Your Feet In L.A.) , Glen Campbell","The White Knight , Cledus Maggard And The Citizen's Band","Junk Food Junkie , Larry Groce","Convoy , C.W. McCall","Convoy , C.W. McCall","Bohemian Rhapsody , Queen","Tangerine , The Salsoul Orchestra","Tangerine , The Salsoul Orchestra","Love To Love You Baby , Donna Summer","50 Ways To Leave Your Lover , Paul Simon","50 Ways To Leave Your Lover , Paul Simon","50 Ways To Leave Your Lover , Paul Simon","Looking For Space , John Denver","Looking For Space , John Denver","Looking For Space , John Denver","Sara Smile , Daryl Hall John Oates","Love Hangover , Diana Ross","Come On Over , Olivia Newton-John","Come On Over , Olivia Newton-John","Love Really Hurts Without You , Billy Ocean","I've Got A Feeling (We'll Be Seeing Each Other Again) , Al Wilson","I've Got A Feeling (We'll Be Seeing Each Other Again) , Al Wilson","I've Got A Feeling (We'll Be Seeing Each Other Again) , Al Wilson","One Piece At A Time , Johnny Cash And The Tennessee Three","Rock And Roll Love Letter , Bay City Rollers","Rock And Roll Love Letter , Bay City Rollers","Tryin' To Get The Feeling Again , Barry Manilow","Got To Get You Into My Life , The Beatles","Got To Get You Into My Life , The Beatles","Tear The Roof Off The Sucker (Give Up The Funk) , Parliament","That's Where The Happy People Go , The Trammps","That's Where The Happy People Go , The Trammps","I Need To Be In Love , Carpenters","Sophisticated Lady (She's A Different Lady) , Natalie Cole","Misty Blue , Dorothy Moore","Misty Blue , Dorothy Moore","Something He Can Feel , Aretha Franklin","Something He Can Feel , Aretha Franklin","A Little Bit More , Dr. Hook","A Little Bit More , Dr. Hook","Wham Bam (Shang-A-Lang) , Silver","Getaway , Earth, Wind & Fire","Getaway , Earth, Wind & Fire","Street Singin' , Lady Flash","I Can't Hear You No More/Music Is My Life , Helen Reddy","This Masquerade , George Benson","This Masquerade , George Benson","Let 'em In , Wings","It's O.k. , The Beach Boys","It's O.k. , The Beach Boys","It's O.k. , The Beach Boys","The Rubberband Man , The Spinners","Did You Boogie (With Your Baby) , Flash Cadillac And The Continental Kids","Did You Boogie (With Your Baby) , Flash Cadillac And The Continental Kids","This One's For You , Barry Manilow","This One's For You , Barry Manilow","This One's For You , Barry Manilow","Love Me , Yvonne Elliman","After The Lovin' , Engelbert Humperdinck","Hello Old Friend , Eric Clapton","Hello Old Friend , Eric Clapton","If You Leave Me Now , Chicago","I Wish , Stevie Wonder","I Wish , Stevie Wonder","Shake Your Rump To The Funk , The Bar-Kays","Torn Between Two Lovers , Mary Macgregor","Torn Between Two Lovers , Mary Macgregor"
29,"Somewhere In The Night , Helen Reddy","Sky High , Jigsaw","Let It Shine/He Ain't Heavy...He's My Brother , Olivia Newton-John","Let It Shine/He Ain't Heavy...He's My Brother , Olivia Newton-John","Let It Shine/He Ain't Heavy...He's My Brother , Olivia Newton-John","Golden Years , David Bowie","Golden Years , David Bowie","Slow Ride , Foghat","Deep Purple , Donny & Marie Osmond","Dream On , Aerosmith","Dream On , Aerosmith","Only Sixteen , Dr. Hook","Just You And I , Melissa Manchester","Just You And I , Melissa Manchester","Action , Sweet","Love Is The Drug , Roxy Music","Only Love Is Real , Carole King","Only Love Is Real , Carole King","Love Fire , Jigsaw","Love Fire , Jigsaw","Love Fire , Jigsaw","Fopp , Ohio Players","Fopp , Ohio Players","Happy Music , The Blackbyrds","Happy Music , The Blackbyrds","More, More, More Pt. 1 , Andrea True Connection","Hurt/for The Heart , Elvis Presley","Hurt/for The Heart , Elvis Presley","Hurt/for The Heart , Elvis Presley","I'll Be Good To You , The Brothers Johnson","Take The Money And Run , Steve Miller","Take The Money And Run , Steve Miller","Get Closer , Seals & Crofts (Featuring Carolyn Willis)","Today's The Day , America","Today's The Day , America","Turn The Beat Around , Vicki Sue Robinson","I'm Easy , Keith Carradine","I'm Easy , Keith Carradine","Young Hearts Run Free , Candi Staton","Get Up And Boogie (That's Right) , Silver Convention","I'd Really Love To See You Tonight , England Dan & John Ford Coley","I'd Really Love To See You Tonight , England Dan & John Ford Coley","Say You Love Me , Fleetwood Mac","Summer , War","Who'd She Coo? , Ohio Players","Who'd She Coo? , Ohio Players","Devil Woman , Cliff Richard","Afternoon Delight , Starland Vocal Band","Afternoon Delight , Starland Vocal Band","I Can't Hear You No More/Music Is My Life , Helen Reddy","One Love In My Lifetime , Diana Ross","Baby, I Love Your Way , Peter Frampton","Baby, I Love Your Way , Peter Frampton","Beth/Detroit Rock City , KISS","Fernando , ABBA","Fernando , ABBA","Get The Funk Out Ma Face , The Brothers Johnson","Did You Boogie (With Your Baby) , Flash Cadillac And The Continental Kids","This One's For You , Barry Manilow","This One's For You , Barry Manilow","You Are My Starship , Norman Connors","Did You Boogie (With Your Baby) , Flash Cadillac And The Continental Kids","Did You Boogie (With Your Baby) , Flash Cadillac And The Continental Kids","Nice 'N' Naasty , The Salsoul Orchestra","Nice 'N' Naasty , The Salsoul Orchestra","Dazz , Brick","Dazz , Brick","Fernando , ABBA","Lost Without Your Love , Bread","Lost Without Your Love , Bread","Saturday Nite , Earth, Wind & Fire","I Like Dreamin' , Kenny Nolan","I Like Dreamin' , Kenny Nolan"
30,"Part Time Love , Gladys Knight And The Pips","Nights On Broadway , Bee Gees","Let's Do It Again , The Staple Singers","Let's Do It Again , The Staple Singers","All By Myself , Eric Carmen","Grow Some Funk Of Your Own/I Feel Like A Bullet (In The Gun Of Robert Ford) , Elton John","Grow Some Funk Of Your Own/I Feel Like A Bullet (In The Gun Of Robert Ford) , Elton John","Dream Weaver , Gary Wright","Sweet Thing , Rufus Featuring Chaka Khan","Bohemian Rhapsody , Queen","Bohemian Rhapsody , Queen","Cupid , Tony Orlando & Dawn","Sweet Love , Commodores","Sweet Love , Commodores","Love Is The Drug , Roxy Music","There's A Kind Of Hush (All Over The World) , Carpenters","Slow Ride , Foghat","Slow Ride , Foghat","Livin' For The Weekend , The O'Jays","Lorelei , Styx","Lorelei , Styx","Misty Blue , Dorothy Moore","Golden Years , David Bowie","Shout It Out Loud , KISS","Shout It Out Loud , KISS","Shout It Out Loud , KISS","Shop Around , Captain & Tennille","Shop Around , Captain & Tennille","Baretta's Theme (""Keep Your Eye On The Sparrow"") , Rhythm Heritage","Disco Lady , Johnnie Taylor","Moonlight Feels Right , Starbuck","Moonlight Feels Right , Starbuck","Love In The Shadows , Neil Sedaka","Let Her In , John Travolta","Let Her In , John Travolta","Save Your Kisses For Me , Brotherhood Of Man","Last Child , Aerosmith","Last Child , Aerosmith","Sophisticated Lady (She's A Different Lady) , Natalie Cole","This Masquerade , George Benson","Something He Can Feel , Aretha Franklin","Something He Can Feel , Aretha Franklin","Heaven Must Be Missing An Angel (part 1) , Tavares","Let Her In , John Travolta","Let Her In , John Travolta","Let Her In , John Travolta","Shower The People , James Taylor","Street Singin' , Lady Flash","Street Singin' , Lady Flash","Turn The Beat Around , Vicki Sue Robinson","Magic Man , Heart","(Don't Fear) The Reaper , Blue Oyster Cult","(Don't Fear) The Reaper , Blue Oyster Cult","This Masquerade , George Benson","Get The Funk Out Ma Face , The Brothers Johnson","Get The Funk Out Ma Face , The Brothers Johnson","The Best Disco In Town , The Ritchie Family","Wham Bam (Shang-A-Lang) , Silver","A Dose Of Rock 'N' Roll , Ringo Starr","A Dose Of Rock 'N' Roll , Ringo Starr","Did You Boogie (With Your Baby) , Flash Cadillac And The Continental Kids","You Don't Have To Be A Star (To Be In My Show) , Marilyn McCoo & Billy Davis, Jr.","You Don't Have To Be A Star (To Be In My Show) , Marilyn McCoo & Billy Davis, Jr.","Stand Tall , Burton Cummings","Hot Line , The Sylvers","Magic Man , Heart","Magic Man , Heart","(Don't Fear) The Reaper , Blue Oyster Cult","Jeans On , David Dundas","Jeans On , David Dundas","Enjoy Yourself , The Jacksons","Love So Right , Bee Gees","Love So Right , Bee Gees"
31,"Island Girl , Elton John","Part Time Love , Gladys Knight And The Pips","Take It To The Limit , Eagles","Take It To The Limit , Eagles","Fanny (Be Tender With My Love) , Bee Gees","Slow Ride , Foghat","Slow Ride , Foghat","Paloma Blanca , George Baker Selection","Let The Music Play , Barry White","Money Honey , Bay City Rollers","Money Honey , Bay City Rollers","Tangerine , The Salsoul Orchestra","Squeeze Box , The Who","Squeeze Box , The Who","Good Hearted Woman , Waylon & Willie","The White Knight , Cledus Maggard And The Citizen's Band","Inseparable , Natalie Cole","Inseparable , Natalie Cole","Love Hurts , Nazareth","You'll Lose A Good Thing , Freddy Fender","You'll Lose A Good Thing , Freddy Fender","Rhiannon (will You Ever Win) , Fleetwood Mac","Don't Pull Your Love/then You Can Tell Me Goodbye , Glen Campbell","Young Blood , Bad Company","Young Blood , Bad Company","Union Man , Cate Bros.","Movin' , Brass Construction","Movin' , Brass Construction","Takin' It To The Streets , The Doobie Brothers","Never Gonna Fall In Love Again , Eric Carmen","The Boys Are Back In Town , Thin Lizzy","The Boys Are Back In Town , Thin Lizzy","You're My Best Friend , Queen","Making Our Dreams Come True , Cyndi Grecco","Making Our Dreams Come True , Cyndi Grecco","Happy Days , Pratt & McClain with Brother Love","Mamma Mia , ABBA","Mamma Mia , ABBA","Mamma Mia , ABBA","You'll Never Find Another Love Like Mine , Lou Rawls","A Fifth Of Beethoven , Walter Murphy & The Big Apple Band","A Fifth Of Beethoven , Walter Murphy & The Big Apple Band","Take The Money And Run , Steve Miller","Another Rainy Day In New York City , Chicago","With Your Love , Jefferson Starship","With Your Love , Jefferson Starship","Getaway , Earth, Wind & Fire","I'm Easy , Keith Carradine","I'm Easy , Keith Carradine","One Love In My Lifetime , Diana Ross","Get Closer , Seals & Crofts (Featuring Carolyn Willis)","I Can't Hear You No More/Music Is My Life , Helen Reddy","I Can't Hear You No More/Music Is My Life , Helen Reddy","It's O.k. , The Beach Boys","Love So Right , Bee Gees","Love So Right , Bee Gees","Muskrat Love , Captain & Tennille","This One's For You , Barry Manilow","You Are My Starship , Norman Connors","You Are My Starship , Norman Connors","Devil Woman , Cliff Richard","Nice 'N' Naasty , The Salsoul Orchestra","Nice 'N' Naasty , The Salsoul Orchestra","Love Ballad , L.T.D.","Livin' Thing , Electric Light Orchestra","It's A Long Way There , Little River Band","It's A Long Way There , Little River Band","Magic Man , Heart","Shake Your Rump To The Funk , The Bar-Kays","Shake Your Rump To The Funk , The Bar-Kays","Just To Be Close To You , Commodores","Blinded By The Light , Manfred Mann's Earth Band","Blinded By The Light , Manfred Mann's Earth Band"
32,"School Boy Crush , AWB","Hurricane (Part 1) , Bob Dylan","Hurricane (Part 1) , Bob Dylan","Hurricane (Part 1) , Bob Dylan","Golden Years , David Bowie","Tracks Of My Tears , Linda Ronstadt","Tracks Of My Tears , Linda Ronstadt","Let The Music Play , Barry White","Bohemian Rhapsody , Queen","Love Rollercoaster , Ohio Players","Love Rollercoaster , Ohio Players","Sing A Song , Earth, Wind & Fire","Love Is The Drug , Roxy Music","Love Is The Drug , Roxy Music","Take It Like A Man , Bachman-Turner Overdrive","Only Love Is Real , Carole King","Love Fire , Jigsaw","Love Fire , Jigsaw","You'll Lose A Good Thing , Freddy Fender","Fopp , Ohio Players","Fopp , Ohio Players","All By Myself , Eric Carmen","Union Man , Cate Bros.","Union Man , Cate Bros.","Union Man , Cate Bros.","I've Got A Feeling (We'll Be Seeing Each Other Again) , Al Wilson","Anytime (i'll Be There) , Paul Anka","Anytime (i'll Be There) , Paul Anka","One Piece At A Time , Johnny Cash And The Tennessee Three","Rock And Roll Love Letter , Bay City Rollers","Afternoon Delight , Starland Vocal Band","Afternoon Delight , Starland Vocal Band","Show Me The Way , Peter Frampton","Tear The Roof Off The Sucker (Give Up The Funk) , Parliament","Tear The Roof Off The Sucker (Give Up The Funk) , Parliament","I'm Easy , Keith Carradine","Somebody's Gettin' It , Johnnie Taylor","Somebody's Gettin' It , Johnnie Taylor","Somebody's Gettin' It , Johnnie Taylor","Something He Can Feel , Aretha Franklin","Heaven Must Be Missing An Angel (part 1) , Tavares","Heaven Must Be Missing An Angel (part 1) , Tavares","Another Rainy Day In New York City , Chicago","Who'd She Coo? , Ohio Players","Wham Bam (Shang-A-Lang) , Silver","Wham Bam (Shang-A-Lang) , Silver","She's Gone , Daryl Hall John Oates","I Can't Hear You No More/Music Is My Life , Helen Reddy","I Can't Hear You No More/Music Is My Life , Helen Reddy","Young Hearts Run Free , Candi Staton","Love Is Alive , Gary Wright","Don't Stop Believin' , Olivia Newton-John","Don't Stop Believin' , Olivia Newton-John","Baby, I Love Your Way , Peter Frampton","You Are The Woman , Firefall","You Are The Woman , Firefall","Don't Go Breaking My Heart , Elton John & Kiki Dee","Get The Funk Out Ma Face , The Brothers Johnson","Getaway , Earth, Wind & Fire","Getaway , Earth, Wind & Fire","I'd Really Love To See You Tonight , England Dan & John Ford Coley","Lowdown , Boz Scaggs","Lowdown , Boz Scaggs","Lowdown , Boz Scaggs","Hello Old Friend , Eric Clapton","I Only Want To Be With You , Bay City Rollers","I Only Want To Be With You , Bay City Rollers","I Only Want To Be With You , Bay City Rollers","Do You Feel Like We Do , Peter Frampton","Do You Feel Like We Do , Peter Frampton","This Song , George Harrison","Whispering/Cherchez La Femme/Se Si Bon , Dr. Buzzard's Original Savannah Band","Whispering/Cherchez La Femme/Se Si Bon , Dr. Buzzard's Original Savannah Band"
33,"50 Ways To Leave Your Lover , Paul Simon","Let It Shine/He Ain't Heavy...He's My Brother , Olivia Newton-John","For The Love Of You (Part 1&2) , The Isley Brothers","For The Love Of You (Part 1&2) , The Isley Brothers","Slow Ride , Foghat","The White Knight , Cledus Maggard And The Citizen's Band","The White Knight , Cledus Maggard And The Citizen's Band","Junk Food Junkie , Larry Groce","Dream On , Aerosmith","Only Sixteen , Dr. Hook","Only Sixteen , Dr. Hook","Sweet Love , Commodores","Take It Like A Man , Bachman-Turner Overdrive","Take It Like A Man , Bachman-Turner Overdrive","Inseparable , Natalie Cole","Inseparable , Natalie Cole","Looking For Space , John Denver","Looking For Space , John Denver","Shannon , Henry Gross","Sara Smile , Daryl Hall John Oates","Sara Smile , Daryl Hall John Oates","Get Up And Boogie (That's Right) , Silver Convention","Happy Music , The Blackbyrds","Love In The Shadows , Neil Sedaka","Love In The Shadows , Neil Sedaka","Hurt/for The Heart , Elvis Presley","Baretta's Theme (""Keep Your Eye On The Sparrow"") , Rhythm Heritage","Baretta's Theme (""Keep Your Eye On The Sparrow"") , Rhythm Heritage","Love Is Alive , Gary Wright","Moonlight Feels Right , Starbuck","Get Closer , Seals & Crofts (Featuring Carolyn Willis)","Get Closer , Seals & Crofts (Featuring Carolyn Willis)","That's Where The Happy People Go , The Trammps","Fooled Around And Fell In Love , Elvin Bishop","Fooled Around And Fell In Love , Elvin Bishop","Last Child , Aerosmith","Movin' , Brass Construction","Movin' , Brass Construction","Good Vibrations , Todd Rundgren","A Fifth Of Beethoven , Walter Murphy & The Big Apple Band","Silly Love Songs , Wings","Silly Love Songs , Wings","Play That Funky Music , Wild Cherry","More, More, More Pt. 1 , Andrea True Connection","Devil Woman , Cliff Richard","Devil Woman , Cliff Richard","Moonlight Feels Right , Starbuck","Moonlight Feels Right , Starbuck","Moonlight Feels Right , Starbuck","Disco Duck (Part I) , Rick Dees & His Cast Of Idiots","Kiss And Say Goodbye , The Manhattans","Kiss And Say Goodbye , The Manhattans","Kiss And Say Goodbye , The Manhattans","Get The Funk Out Ma Face , The Brothers Johnson","Sunrise , Eric Carmen","Sunrise , Eric Carmen","Did You Boogie (With Your Baby) , Flash Cadillac And The Continental Kids","You Are My Starship , Norman Connors","Get The Funk Out Ma Face , The Brothers Johnson","Get The Funk Out Ma Face , The Brothers Johnson","I Never Cry , Alice Cooper","You Make Me Feel Like Dancing , Leo Sayer","You Make Me Feel Like Dancing , Leo Sayer","(Shake, Shake, Shake) Shake Your Booty , KC And The Sunshine Band","A Fifth Of Beethoven , Walter Murphy & The Big Apple Band","Play That Funky Music , Wild Cherry","Play That Funky Music , Wild Cherry","Jeans On , David Dundas","Saturday Nite , Earth, Wind & Fire","Saturday Nite , Earth, Wind & Fire","Don't Take Away The Music , Tavares","Love Ballad , L.T.D.","Love Ballad , L.T.D."
