54,"I Don't Wanna Lose You , Daryl Hall John Oates","I Don't Wanna Lose You , Daryl Hall John Oates","My Best Friend's Girl , The Cars","Sing For The Day , Styx","Lost In Your Love , John Paul Young","Lost In Your Love , John Paul Young","Forever In Blue Jeans , Neil Diamond","I Don't Know If It's Right , Evelyn ""Champagne"" King","I Don't Know If It's Right , Evelyn ""Champagne"" King","Chase , Giorgio Moroder","All The Time In The World , Dr. Hook","I'll Supply The Love , Toto","I'll Supply The Love , Toto","Shake Your Body (Down To The Ground) , The Jacksons","Blow Away , George Harrison","Blow Away , George Harrison","Here Comes The Night , The Beach Boys","Rock 'n' Roll Fantasy , Bad Company","A Little More Love , Olivia Newton-John","A Little More Love , Olivia Newton-John","The Logical Song , Supertramp","Rhumba Girl , Nicolette Larson","Rhumba Girl , Nicolette Larson","Diamonds , Chris Rea","Chuck E.'s In Love , Rickie Lee Jones","When You're In Love With A Beautiful Woman , Dr. Hook","When You're In Love With A Beautiful Woman , Dr. Hook","One More Minute , Saint Tropez","Bad Girls , Donna Summer","Bad Girls , Donna Summer","Heart Of The Night , Poco","Stumblin' In , Suzi Quatro & Chris Norman","Say Maybe , Neil Diamond","Say Maybe , Neil Diamond","Love Is The Answer , England Dan & John Ford Coley","Kiss In The Dark , Pink Lady","Kiss In The Dark , Pink Lady","The Devil Went Down To Georgia , The Charlie Daniels Band","Highway Song , Blackfoot","Married Men , Bette Midler","Married Men , Bette Midler","Hold On , Triumph","Saturdaynight , Herman Brood","Saturdaynight , Herman Brood","You've Got Another Thing Coming , Hotel","Why Leave Us Alone , Five Special","Children Of The Sun , Billy Thorpe","Children Of The Sun , Billy Thorpe","I Know A Heartache When I See One , Jennifer Warnes","Remember (Walking In The Sand) , Louise Goffin","Remember (Walking In The Sand) , Louise Goffin","So Good, So Right , Brenda Russell","When You're In Love With A Beautiful Woman , Dr. Hook","Sure Know Something , KISS","Sure Know Something , KISS","Rainbow Connection , Kermit (Jim Henson)","Different Worlds , Maureen McGovern","Different Worlds , Maureen McGovern","Better Love Next Time , Dr. Hook","Confusion , Electric Light Orchestra","Do That To Me One More Time , Captain & Tennille","Do That To Me One More Time , Captain & Tennille","Get It Up , Ronnie Milsap","Highway To Hell , AC/DC","Highway To Hell , AC/DC","I Still Have Dreams , Richie Furay","Ready For The 80's , Village People","Savannah Nights , Tom Johnston","Savannah Nights , Tom Johnston","Rise , Herb Alpert","Lonely Eyes , Robert John","Lonely Eyes , Robert John","Lonely Eyes , Robert John"
55,"Straight On , Heart","Straight On , Heart","MacArthur Park , Donna Summer","Lost In Your Love , John Paul Young","Dancin' Shoes , Faith Band","Dancin' Shoes , Faith Band","You Stepped Into My Life , Melba Moore","Get Down , Gene Chandler","Get Down , Gene Chandler","Superman , Herbie Mann","Bustin' Loose , Chuck Brown & The Soul Searchers","Oh Honey , Delegation","Oh Honey , Delegation","Survivor , Cindy Bullens","It Hurts So Bad , Kim Carnes","It Hurts So Bad , Kim Carnes","It Hurts So Bad , Kim Carnes","Bridge Over Troubled Water , Linda Clifford","At Midnight , T-Connection","At Midnight , T-Connection","I Need Your Help Barry Manilow , Ray Stevens","California Dreamin' , America","California Dreamin' , America","Makin' It , David Naughton","I Don't Want Nobody Else (To Dance With You) , Narada Michael Walden","Good Timin' , The Beach Boys","Good Timin' , The Beach Boys","You Can't Change That , Raydio","My Baby's Baby , Liquid Gold","My Baby's Baby , Liquid Gold","Such A Woman , Tycoon","Boogie Woogie Dancin' Shoes , Claudja Barry","Lead Me On , Maxine Nightingale","Lead Me On , Maxine Nightingale","Say Maybe , Neil Diamond","Do You Wanna Go Party , KC And The Sunshine Band","Do You Wanna Go Party , KC And The Sunshine Band","Amanda , Waylon","Hot Summer Nights , Night","Goodbye Stranger , Supertramp","Goodbye Stranger , Supertramp","Girl Of My Dreams , Bram Tchaikovsky","Weekend , Wet Willie","Weekend , Wet Willie","Why Leave Us Alone , Five Special","Where Were You When I Was Falling In Love , Lobo","Gone, Gone, Gone , Bad Company","Gone, Gone, Gone , Bad Company","Gone, Gone, Gone , Bad Company","Found A Cure , Ashford & Simpson","Found A Cure , Ashford & Simpson","Arrow Through Me , Wings","Groove Me , Fern Kinney","Boom Boom (Out Go The Lights) , Pat Travers","Boom Boom (Out Go The Lights) , Pat Travers","Boom Boom (Out Go The Lights) , Pat Travers","Dreaming , Blondie","Dreaming , Blondie","Starry Eyes , The Records","Starry Eyes , The Records","Ladies Night , Kool & The Gang","Ladies Night , Kool & The Gang","What Can I Do With This Broken Heart , England Dan & John Ford Coley","Don't Let Go , Isaac Hayes","Don't Let Go , Isaac Hayes","Third Time Lucky (First Time I Was A Fool) , Foghat","Dream Police , Cheap Trick","Yes, I'm Ready , Teri DeSario With K.C.","Yes, I'm Ready , Teri DeSario With K.C.","Romeo's Tune , Steve Forbert","Voices , Cheap Trick","Voices , Cheap Trick","Voices , Cheap Trick"
56,"Shake Your Groove Thing , Peaches & Herb","Shake Your Groove Thing , Peaches & Herb","What You Won't Do For Love , Bobby Caldwell","Dancin' Shoes , Faith Band","I Just Fall In Love Again , Anne Murray","I Just Fall In Love Again , Anne Murray","Sharing The Night Together , Dr. Hook","Goodbye, I Love You , Firefall","Goodbye, I Love You , Firefall","Livin' It Up (Friday Night) , Bell & James","Take Me Home , Cher","Heart Of Glass , Blondie","Heart Of Glass , Blondie","Our Love Is Insane , Desmond Child And Rouge","Somewhere In The Night , Barry Manilow","Somewhere In The Night , Barry Manilow","Roller , April Wine","Happiness , The Pointer Sisters","Good Times Roll , The Cars","Good Times Roll , The Cars","(If Loving You Is Wrong) I Don't Want To Be Right , Barbara Mandrell","Hot Number , Foxy","Hot Number , Foxy","Honesty , Billy Joel","Lady , Little River Band","Crazy Love , The Allman Brothers Band","Crazy Love , The Allman Brothers Band","Shine A Little Love , Electric Light Orchestra","(Wish I Could Fly Like) Superman , The Kinks","(Wish I Could Fly Like) Superman , The Kinks","Feel The Need , Leif Garrett","Feel The Need , Leif Garrett","Boogie Woogie Dancin' Shoes , Claudja Barry","Boogie Woogie Dancin' Shoes , Claudja Barry","Do You Wanna Go Party , KC And The Sunshine Band","Suspicions , Eddie Rabbitt","Suspicions , Eddie Rabbitt","Since I Don't Have You , Art Garfunkel","Rock Me , Nick Gilder","Last Of The Singing Cowboys , The Marshall Tucker Band","Last Of The Singing Cowboys , The Marshall Tucker Band","Oh Well , Rockets","Driver's Seat , Sniff 'n' the Tears","Driver's Seat , Sniff 'n' the Tears","Baby I Want You , Funky Communication Committee","What Cha Gonna Do With My Lovin' , Stephanie Mills","Firecracker , Mass Production","Firecracker , Mass Production","Dim All The Lights , Donna Summer","Girl Of My Dreams , Bram Tchaikovsky","Girl Of My Dreams , Bram Tchaikovsky","Groove Me , Fern Kinney","If You Remember Me , Chris Thompson & Night","Then You Can Tell Me Goodbye , Toby Beau","Then You Can Tell Me Goodbye , Toby Beau","Reason To Be , Kansas","Ships , Barry Manilow","Ships , Barry Manilow","Dream Police , Cheap Trick","If You Want It , Niteflyte","Pretty Girls , Melissa Manchester","Pretty Girls , Melissa Manchester","Sail On , Commodores","I Know A Heartache When I See One , Jennifer Warnes","I Know A Heartache When I See One , Jennifer Warnes","Come To Me , France Joli","Confusion , Electric Light Orchestra","Good Girls Don't , The Knack","Good Girls Don't , The Knack","She's In Love With You , Suzi Quatro","Since You Been Gone , Rainbow","Since You Been Gone , Rainbow","Since You Been Gone , Rainbow"
57,"Blue Morning, Blue Day , Foreigner","Blue Morning, Blue Day , Foreigner","Lost In Your Love , John Paul Young","This Moment In Time , Engelbert Humperdinck","You Make Me Feel (Mighty Real) , Sylvester","You Make Me Feel (Mighty Real) , Sylvester","Get Down , Gene Chandler","Free Me From My Freedom/Tie Me To A Tree (Handcuff Me) , Bonnie Pointer","Free Me From My Freedom/Tie Me To A Tree (Handcuff Me) , Bonnie Pointer","Big Shot , Billy Joel","Take Me To The River , Talking Heads","Watch Out For Lucy , Eric Clapton And His Band","Watch Out For Lucy , Eric Clapton And His Band","Rubber Biscuit , Blues Brothers","Souvenirs , Voyage","Souvenirs , Voyage","I Was Made For Dancin' , Leif Garrett","At Midnight , T-Connection","Feelin' Satisfied , Boston","Feelin' Satisfied , Boston","Big Shot , Billy Joel","Maybe I'm A Fool , Eddie Money","Maybe I'm A Fool , Eddie Money","I Don't Want Nobody Else (To Dance With You) , Narada Michael Walden","Dance The Night Away , Van Halen","Happiness , The Pointer Sisters","Happiness , The Pointer Sisters","Just The Same Way , Journey","Dance Away , Roxy Music","Dance Away , Roxy Music","Knock On Wood , Amii Stewart","People Of The South Wind , Kansas","Mama Can't Buy You Love , Elton John","Mama Can't Buy You Love , Elton John","Wasn't It Good , Cher","Since I Don't Have You , Art Garfunkel","Since I Don't Have You , Art Garfunkel","Morning Dance , Spyro Gyra","You Angel You , Manfred Mann's Earth Band","We've Got Love , Peaches & Herb","We've Got Love , Peaches & Herb","Different Worlds , Maureen McGovern","Going Through The Motions , Hot Chocolate","Going Through The Motions , Hot Chocolate","Lady Writer , Dire Straits","Boogie Wonderland , Earth, Wind & Fire with The Emotions","This Is Love , Oak","This Is Love , Oak","This Night Won't Last Forever , Michael Johnson","Groove Me , Fern Kinney","Groove Me , Fern Kinney","Please Don't Go , KC And The Sunshine Band","Then You Can Tell Me Goodbye , Toby Beau","You're Only Lonely , J.D. Souther","You're Only Lonely , J.D. Souther","Please Don't Leave , Lauren Wood","Do You Think I'm Disco? , Steve Dahl And Teenage Radiation","Do You Think I'm Disco? , Steve Dahl And Teenage Radiation","Do You Think I'm Disco? , Steve Dahl And Teenage Radiation","Cruisin' , Smokey Robinson","Love Pains , Yvonne Elliman","Love Pains , Yvonne Elliman","In The Stone , Earth, Wind & Fire","In The Stone , Earth, Wind & Fire","In The Stone , Earth, Wind & Fire","In The Stone , Earth, Wind & Fire","It's All I Can Do , The Cars","Forever Mine , The O'Jays","Forever Mine , The O'Jays","Since You Been Gone , Rainbow","Crazy Little Thing Called Love , Queen","Crazy Little Thing Called Love , Queen","Crazy Little Thing Called Love , Queen"
58,"Sweet Life , Paul Davis","Sweet Life , Paul Davis","Dancin' Shoes , Faith Band","Bicycle Race/Fat Bottomed Girls , Queen","Moment By Moment , Yvonne Elliman","Moment By Moment , Yvonne Elliman","I Go To Rio , Pablo Cruise","Pops, We Love You (A Tribute To Father) , Diana Ross, Marvin Gaye, Smokey Robinson & Stevie Wonder","Pops, We Love You (A Tribute To Father) , Diana Ross, Marvin Gaye, Smokey Robinson & Stevie Wonder","He's The Greatest Dancer , Sister Sledge","Oh Honey , Delegation","Now That We Found Love , Third World","Now That We Found Love , Third World","Keep On Dancin' , Gary's Gang","Roxanne , The Police","Roxanne , The Police","Just One Look , Linda Ronstadt","Such A Woman , Tycoon","Just When I Needed You Most , Randy VanWarmer","Just When I Needed You Most , Randy VanWarmer","California Dreamin' , America","It Must Be Love , Alton McClain & Destiny","It Must Be Love , Alton McClain & Destiny","Ain't Love A Bitch , Rod Stewart","You Take My Breath Away , Rex Smith","Georgy Porgy , Toto","Georgy Porgy , Toto","Don't Ever Wanna Lose Ya , New England","One Chain (Don't Make No Prison) , Santana","One Chain (Don't Make No Prison) , Santana","Boogie Woogie Dancin' Shoes , Claudja Barry","One Way Or Another , Blondie","Good Timin' , The Beach Boys","Good Timin' , The Beach Boys","The Main Event/Fight , Barbra Streisand","Amanda , Waylon","Amanda , Waylon","Rock Me , Nick Gilder","You Gonna Make Me Love Somebody Else , The Jones Girls","You're The Only One , Dolly Parton","You're The Only One , Dolly Parton","Minute By Minute , The Doobie Brothers","Why Leave Us Alone , Five Special","Why Leave Us Alone , Five Special","Got To Give In To Love , Bonnie Boyer","Rock And Roll Dancin' , Beckmeier Brothers","Dependin' On You , The Doobie Brothers","Dependin' On You , The Doobie Brothers","Rolene , Moon Martin","Get A Move On , Eddie Money","Get A Move On , Eddie Money","Hold On , Ian Gomm","Street Life , The Crusaders","Fins , Jimmy Buffett","Fins , Jimmy Buffett","The Main Event/Fight , Barbra Streisand","Hell On Wheels , Cher","Hell On Wheels , Cher","No More Tears (Enough Is Enough) , Barbra Streisand/Donna Summer","Cool Change , Little River Band","We Don't Talk Anymore , Cliff Richard","We Don't Talk Anymore , Cliff Richard","Highway To Hell , AC/DC","Rock With You , Michael Jackson","Rock With You , Michael Jackson","Ready For The 80's , Village People","Rotation , Herb Alpert","Pretty Girls , Melissa Manchester","Pretty Girls , Melissa Manchester","You Know That I Love You , Santana","Lost Her In The Sun , John Stewart","Lost Her In The Sun , John Stewart","Lost Her In The Sun , John Stewart"
59,"Lost In Your Love , John Paul Young","Lost In Your Love , John Paul Young","Easy Driver , Kenny Loggins","Stormy , Santana","Song On The Radio , Al Stewart","Song On The Radio , Al Stewart","Free Me From My Freedom/Tie Me To A Tree (Handcuff Me) , Bonnie Pointer","Lonely Wind , Kansas","Lonely Wind , Kansas","Ooh Baby Baby , Linda Ronstadt","Just One Look , Linda Ronstadt","Survivor , Cindy Bullens","Survivor , Cindy Bullens","All The Time In The World , Dr. Hook","Blue Morning, Blue Day , Foreigner","Blue Morning, Blue Day , Foreigner","No Tell Lover , Chicago","Heartaches , BTO","Can You Read My Mind , Maureen McGovern","Can You Read My Mind , Maureen McGovern","Old Time Rock & Roll , Bob Seger & The Silver Bullet Band","Saturday Night, Sunday Morning , Thelma Houston","Saturday Night, Sunday Morning , Thelma Houston","Shake Your Groove Thing , Peaches & Herb","Just The Same Way , Journey","Just The Same Way , Journey","Just The Same Way , Journey","One Chain (Don't Make No Prison) , Santana","Feel The Need , Leif Garrett","Feel The Need , Leif Garrett","I Was Made For Lovin' You , KISS","My Love Is Music , Space","Make Love To Me , Helen Reddy","Make Love To Me , Helen Reddy","Make Love To Me , Helen Reddy","Don't Ever Wanna Lose Ya , New England","Don't Ever Wanna Lose Ya , New England","Heaven Must Have Sent You , Bonnie Pointer","Born To Be Alive , Patrick Hernandez","I Do Love You , GQ","I Do Love You , GQ","Shakedown Cruise , Jay Ferguson","You've Got Another Thing Coming , Hotel","You've Got Another Thing Coming , Hotel","Totally Hot , Olivia Newton-John","Ain't That A Shame , Cheap Trick","I Know A Heartache When I See One , Jennifer Warnes","I Know A Heartache When I See One , Jennifer Warnes","Good Friend , Mary Macgregor","So Good, So Right , Brenda Russell","So Good, So Right , Brenda Russell","You Decorated My Life , Kenny Rogers","Sure Know Something , KISS","Reason To Be , Kansas","Reason To Be , Kansas","Killer Cut , Charlie","Half The Way , Crystal Gayle","Half The Way , Crystal Gayle","My Forbidden Lover , Chic","Do You Think I'm Disco? , Steve Dahl And Teenage Radiation","Escape (The Pina Colada Song) , Rupert Holmes","Escape (The Pina Colada Song) , Rupert Holmes","Peter Piper , Frank Mills","Chiquitita , ABBA","Chiquitita , ABBA","Deja Vu , Dionne Warwick","Slip Away , Ian Lloyd","Mistrusted Love , Mistress","Mistrusted Love , Mistress","Peter Piper , Frank Mills","Money , The Flying Lizards","Money , The Flying Lizards","Money , The Flying Lizards"
60,"I Will Survive , Gloria Gaynor","I Will Survive , Gloria Gaynor","Dancing In The City , Marshall Hain","Moment By Moment , Yvonne Elliman","Crazy Love , Poco","Crazy Love , Poco","A Little Lovin' (Keeps The Doctor Away) , The Raes","A Little Lovin' (Keeps The Doctor Away) , The Raes","A Little Lovin' (Keeps The Doctor Away) , The Raes","Dog + Butterfly , Heart","New York Groove , Ace Frehley","Four Strong Winds , Neil Young","Four Strong Winds , Neil Young","Four Strong Winds , Neil Young","Too Much Heaven , Bee Gees","Too Much Heaven , Bee Gees","Love Is The Answer , England Dan & John Ford Coley","Sweet Lui-Louise , Ironhorse","Get Used To It , Roger Voudouris","Get Used To It , Roger Voudouris","Crazy Love , Poco","Little Bit Of Soap , Nigel Olsson","Little Bit Of Soap , Nigel Olsson","She Believes In Me , Kenny Rogers","Dancin' Fool , Frank Zappa","Ain't No Stoppin' Us Now , McFadden & Whitehead","Ain't No Stoppin' Us Now , McFadden & Whitehead","Love Ballad , George Benson","Boogie Woogie Dancin' Shoes , Claudja Barry","Boogie Woogie Dancin' Shoes , Claudja Barry","Shadows In The Moonlight , Anne Murray","Say Maybe , Neil Diamond","If I Said You Have A Beautiful Body Would You Hold It Against Me , Bellamy Brothers","If I Said You Have A Beautiful Body Would You Hold It Against Me , Bellamy Brothers","Vengeance , Carly Simon","Love Is The Answer , England Dan & John Ford Coley","Love Is The Answer , England Dan & John Ford Coley","You Angel You , Manfred Mann's Earth Band","Long Live Rock , The Who","Hold On , Triumph","Hold On , Triumph","The Boss , Diana Ross","Heart Of The Night , Poco","Heart Of The Night , Poco","Pop Muzik , M","This Is Love , Oak","I Want You To Want Me , Cheap Trick","I Want You To Want Me , Cheap Trick","Midnight Wind , John Stewart","Good Girls Don't , The Knack","Good Girls Don't , The Knack","Then You Can Tell Me Goodbye , Toby Beau","Boom Boom (Out Go The Lights) , Pat Travers","Killer Cut , Charlie","Killer Cut , Charlie","Hell On Wheels , Cher","5:15 , The Who","5:15 , The Who","I Need A Lover , John Cougar","Dependin' On You , The Doobie Brothers","Slip Away , Ian Lloyd","Slip Away , Ian Lloyd","Don't Let Go , Isaac Hayes","No Chance , Moon Martin","No Chance , Moon Martin","Don't Do Me Like That , Tom Petty And The Heartbreakers","Rapper's Delight , Sugarhill Gang","Since You Been Gone , Rainbow","Since You Been Gone , Rainbow","Lonely Eyes , Robert John","Move Your Boogie Body , Bar-Kays","Move Your Boogie Body , Bar-Kays","Move Your Boogie Body , Bar-Kays"
61,"Easy Driver , Kenny Loggins","Easy Driver , Kenny Loggins","Silver Lining , Player","Time Passages , Al Stewart","What A Fool Believes , The Doobie Brothers","What A Fool Believes , The Doobie Brothers","Lonely Wind , Kansas","Chase , Giorgio Moroder","Chase , Giorgio Moroder","All The Time In The World , Dr. Hook","Baby, I Need Your Lovin' , Eric Carmen","Our Love Is Insane , Desmond Child And Rouge","Our Love Is Insane , Desmond Child And Rouge","It Hurts So Bad , Kim Carnes","Stay The Night , The Faragher Bros.","Stay The Night , The Faragher Bros.","Elena , The Marc Tanner Band","Disco Nights (Rock-Freak) , G.Q.","I Need Your Help Barry Manilow , Ray Stevens","I Need Your Help Barry Manilow , Ray Stevens","Saturday Night, Sunday Morning , Thelma Houston","Diamonds , Chris Rea","Diamonds , Chris Rea","Just The Same Way , Journey","I Want You To Want Me , Cheap Trick","One Chain (Don't Make No Prison) , Santana","One Chain (Don't Make No Prison) , Santana","Star Love , Cheryl Lynn","My Love Is Music , Space","My Love Is Music , Space","My Love Is Music , Space","Sad Eyes , Robert John","Married Men , Bette Midler","Married Men , Bette Midler","Good Times , Chic","Hot Number , Foxy","Hot Number , Foxy","Highway Song , Blackfoot","You're The Only One , Dolly Parton","Girl Of My Dreams , Bram Tchaikovsky","Girl Of My Dreams , Bram Tchaikovsky","You Take My Breath Away , Rex Smith","Turn Off The Lights , Teddy Pendergrass","Turn Off The Lights , Teddy Pendergrass","Where Were You When I Was Falling In Love , Lobo","Love Me Tonight , Blackjack","Spooky , Atlanta Rhythm Section","Spooky , Atlanta Rhythm Section","Remember (Walking In The Sand) , Louise Goffin","Then You Can Tell Me Goodbye , Toby Beau","Then You Can Tell Me Goodbye , Toby Beau","If You Remember Me , Chris Thompson & Night","You're Only Lonely , J.D. Souther","Let's Go , The Cars","Let's Go , The Cars","Let Me Know (I Have A Right) , Gloria Gaynor","The Devil Went Down To Georgia , The Charlie Daniels Band","The Devil Went Down To Georgia , The Charlie Daniels Band","Damned If I Do , The Alan Parsons Project","It's All I Can Do , The Cars","In The Stone , Earth, Wind & Fire","In The Stone , Earth, Wind & Fire","Wait For Me , Daryl Hall John Oates","Train, Train , Blackfoot","Train, Train , Blackfoot","I'll Never Love This Way Again , Dionne Warwick","I'd Rather Leave While I'm In Love , Rita Coolidge","If You Want It , Niteflyte","If You Want It , Niteflyte","Voices , Cheap Trick","Dig The Gold , Joyce Cobb","Dig The Gold , Joyce Cobb","Dig The Gold , Joyce Cobb"
62,"What You Won't Do For Love , Bobby Caldwell","What You Won't Do For Love , Bobby Caldwell","You Can Do It , Dobie Gray","Instant Replay , Dan Hartman","Free Me From My Freedom/Tie Me To A Tree (Handcuff Me) , Bonnie Pointer","Free Me From My Freedom/Tie Me To A Tree (Handcuff Me) , Bonnie Pointer","Pops, We Love You (A Tribute To Father) , Diana Ross, Marvin Gaye, Smokey Robinson & Stevie Wonder","Baby, I Need Your Lovin' , Eric Carmen","Baby, I Need Your Lovin' , Eric Carmen","Baby, I Need Your Lovin' , Eric Carmen","Four Strong Winds , Neil Young","Shake Your Body (Down To The Ground) , The Jacksons","Shake Your Body (Down To The Ground) , The Jacksons","Love Ballad , George Benson","Here Comes The Night , The Beach Boys","Here Comes The Night , The Beach Boys","Renegade , Styx","Crazy Love , The Allman Brothers Band","(If Loving You Is Wrong) I Don't Want To Be Right , Barbara Mandrell","(If Loving You Is Wrong) I Don't Want To Be Right , Barbara Mandrell","Rhumba Girl , Nicolette Larson","Makin' It , David Naughton","Makin' It , David Naughton","We Are Family , Sister Sledge","When You're In Love With A Beautiful Woman , Dr. Hook","Sweet Lui-Louise , Ironhorse","Sweet Lui-Louise , Ironhorse","(Wish I Could Fly Like) Superman , The Kinks","Does Your Mother Know , ABBA","Does Your Mother Know , ABBA","Can't Keep A Good Man Down , Eddie Money","Weekend , Wet Willie","Is She Really Going Out With Him? , Joe Jackson","Is She Really Going Out With Him? , Joe Jackson","Kiss In The Dark , Pink Lady","Heart Of Glass , Blondie","Heart Of Glass , Blondie","Renegade , Styx","Hold On , Triumph","Lonesome Loser , Little River Band","Lonesome Loser , Little River Band","Sweets For My Sweet , Tony Orlando","Young Blood , Rickie Lee Jones","Young Blood , Rickie Lee Jones","Cruel To Be Kind , Nick Lowe","Gone, Gone, Gone , Bad Company","Ghost Dancer , Addrisi Brothers","Ghost Dancer , Addrisi Brothers","Found A Cure , Ashford & Simpson","Arrow Through Me , Wings","Arrow Through Me , Wings","Where Will Your Heart Take You , Buckeye","Come To Me , France Joli","Broken Hearted Me , Anne Murray","Broken Hearted Me , Anne Murray","Victim Of Love , Elton John","What Cha Gonna Do With My Lovin' , Stephanie Mills","What Cha Gonna Do With My Lovin' , Stephanie Mills","I Want You Tonight , Pablo Cruise","Ladies Night , Kool & The Gang","This Is It , Kenny Loggins","This Is It , Kenny Loggins","Head Games , Foreigner","Coward Of The County , Kenny Rogers","Coward Of The County , Kenny Rogers","Rapper's Delight , Sugarhill Gang","Savannah Nights , Tom Johnston","This Night Won't Last Forever , Michael Johnson","This Night Won't Last Forever , Michael Johnson","Please Don't Leave , Lauren Wood","Last Train To London , Electric Light Orchestra","Last Train To London , Electric Light Orchestra","Last Train To London , Electric Light Orchestra"
