27,"Don't Hold Back , Chanson","Don't Hold Back , Chanson","Soul Man , Blues Brothers","The Gambler , Kenny Rogers","Take Me To The River , Talking Heads","Take Me To The River , Talking Heads","Home And Dry , Gerry Rafferty","Home And Dry , Gerry Rafferty","Home And Dry , Gerry Rafferty","What You Won't Do For Love , Bobby Caldwell","Crazy Love , Poco","Forever In Blue Jeans , Neil Diamond","Forever In Blue Jeans , Neil Diamond","Blue Morning, Blue Day , Foreigner","I Want Your Love , Chic","I Want Your Love , Chic","Livin' It Up (Friday Night) , Bell & James","In The Navy , Village People","Superman , Herbie Mann","Superman , Herbie Mann","Love Takes Time , Orleans","Disco Nights (Rock-Freak) , G.Q.","Disco Nights (Rock-Freak) , G.Q.","Just When I Needed You Most , Randy VanWarmer","Sultans Of Swing , Dire Straits","Love Ballad , George Benson","Love Ballad , George Benson","Ain't Love A Bitch , Rod Stewart","Old Time Rock & Roll , Bob Seger & The Silver Bullet Band","Old Time Rock & Roll , Bob Seger & The Silver Bullet Band","Old Time Rock & Roll , Bob Seger & The Silver Bullet Band","Bad Girls , Donna Summer","I Can't Stand It No More , Peter Frampton","I Can't Stand It No More , Peter Frampton","Does Your Mother Know , ABBA","Do It Or Die , Atlanta Rhythm Section","Do It Or Die , Atlanta Rhythm Section","Minute By Minute , The Doobie Brothers","People Of The South Wind , Kansas","Up On The Roof , James Taylor","Up On The Roof , James Taylor","Up On The Roof , James Taylor","She Believes In Me , Kenny Rogers","She Believes In Me , Kenny Rogers","Heaven Must Have Sent You , Bonnie Pointer","I Do Love You , GQ","Born To Be Alive , Patrick Hernandez","Born To Be Alive , Patrick Hernandez","Different Worlds , Maureen McGovern","The Boss , Diana Ross","The Boss , Diana Ross","Don't Stop 'til You Get Enough , Michael Jackson","Get It Right Next Time , Gerry Rafferty","Dependin' On You , The Doobie Brothers","Dependin' On You , The Doobie Brothers","Where Were You When I Was Falling In Love , Lobo","Please Don't Go , KC And The Sunshine Band","Please Don't Go , KC And The Sunshine Band","Midnight Wind , John Stewart","Midnight Wind , John Stewart","Heaven Must Have Sent You , Bonnie Pointer","Heaven Must Have Sent You , Bonnie Pointer","Please Don't Leave , Lauren Wood","Half The Way , Crystal Gayle","Half The Way , Crystal Gayle","Dreaming , Blondie","Cruisin' , Smokey Robinson","If You Remember Me , Chris Thompson & Night","If You Remember Me , Chris Thompson & Night","I Need A Lover , John Cougar","Don't Let Go , Isaac Hayes","Don't Let Go , Isaac Hayes","Don't Let Go , Isaac Hayes"
28,"Instant Replay , Dan Hartman","Instant Replay , Dan Hartman","Instant Replay , Dan Hartman","Don't Cry Out Loud , Melissa Manchester","Blue Morning, Blue Day , Foreigner","Blue Morning, Blue Day , Foreigner","Baby I'm Burnin' , Dolly Parton","Tragedy , Bee Gees","Tragedy , Bee Gees","Take Me To The River , Talking Heads","Sultans Of Swing , Dire Straits","Song On The Radio , Al Stewart","Song On The Radio , Al Stewart","Song On The Radio , Al Stewart","Maybe I'm A Fool , Eddie Money","Maybe I'm A Fool , Eddie Money","He's The Greatest Dancer , Sister Sledge","Love Ballad , George Benson","Don't Cry Out Loud , Melissa Manchester","Don't Cry Out Loud , Melissa Manchester","What You Won't Do For Love , Bobby Caldwell","Renegade , Styx","Renegade , Styx","Hot Stuff , Donna Summer","Crazy Love , The Allman Brothers Band","Such A Woman , Tycoon","Such A Woman , Tycoon","Get Used To It , Roger Voudouris","Knock On Wood , Amii Stewart","Knock On Wood , Amii Stewart","Stumblin' In , Suzi Quatro & Chris Norman","Dance The Night Away , Van Halen","Deeper Than The Night , Olivia Newton-John","Deeper Than The Night , Olivia Newton-John","Disco Nights (Rock-Freak) , G.Q.","Get Used To It , Roger Voudouris","Get Used To It , Roger Voudouris","Shadows In The Moonlight , Anne Murray","Love You Inside Out , Bee Gees","One Way Or Another , Blondie","One Way Or Another , Blondie","Weekend , Wet Willie","I'll Never Love This Way Again , Dionne Warwick","I'll Never Love This Way Again , Dionne Warwick","Does Your Mother Know , ABBA","Highway Song , Blackfoot","Driver's Seat , Sniff 'n' the Tears","Driver's Seat , Sniff 'n' the Tears","Ring My Bell , Anita Ward","Lovin', Touchin', Squeezin' , Journey","Lovin', Touchin', Squeezin' , Journey","Suspicions , Eddie Rabbitt","Let's Go , The Cars","Good Girls Don't , The Knack","Good Girls Don't , The Knack","Lead Me On , Maxine Nightingale","Arrow Through Me , Wings","Arrow Through Me , Wings","Cruel To Be Kind , Nick Lowe","If You Remember Me , Chris Thompson & Night","Rainbow Connection , Kermit (Jim Henson)","Rainbow Connection , Kermit (Jim Henson)","Dream Police , Cheap Trick","Do That To Me One More Time , Captain & Tennille","Do That To Me One More Time , Captain & Tennille","I Want You Tonight , Pablo Cruise","Rock With You , Michael Jackson","I Need A Lover , John Cougar","I Need A Lover , John Cougar","Damned If I Do , The Alan Parsons Project","Ships , Barry Manilow","Ships , Barry Manilow","Ships , Barry Manilow"
29,"I Will Be In Love With You , Livingston Taylor","I Will Be In Love With You , Livingston Taylor","I Will Be In Love With You , Livingston Taylor","Take Me To The River , Talking Heads","Home And Dry , Gerry Rafferty","Home And Dry , Gerry Rafferty","Shake Your Groove Thing , Peaches & Herb","Every Time I Think Of You , The Babys","Every Time I Think Of You , The Babys","I Just Fall In Love Again , Anne Murray","Too Much Heaven , Bee Gees","Stumblin' In , Suzi Quatro & Chris Norman","Stumblin' In , Suzi Quatro & Chris Norman","Music Box Dancer , Frank Mills","I Don't Know If It's Right , Evelyn ""Champagne"" King","I Don't Know If It's Right , Evelyn ""Champagne"" King","Every Which Way But Loose , Eddie Rabbitt","I Got My Mind Made Up (You Can Get It Girl) , Instant Funk","Shake Your Body (Down To The Ground) , The Jacksons","Shake Your Body (Down To The Ground) , The Jacksons","I Don't Know If It's Right , Evelyn ""Champagne"" King","Heaven Knows , Donna Summer With Brooklyn Dreams","Heaven Knows , Donna Summer With Brooklyn Dreams","Crazy Love , The Allman Brothers Band","Happiness , The Pointer Sisters","You Take My Breath Away , Rex Smith","You Take My Breath Away , Rex Smith","Old Time Rock & Roll , Bob Seger & The Silver Bullet Band","Makin' It , David Naughton","Makin' It , David Naughton","Love Takes Time , Orleans","Gold , John Stewart","Days Gone Down (Still Got The Light In Your Eyes) , Gerry Rafferty","Days Gone Down (Still Got The Light In Your Eyes) , Gerry Rafferty","I Was Made For Lovin' You , KISS","Mama Can't Buy You Love , Elton John","Mama Can't Buy You Love , Elton John","People Of The South Wind , Kansas","Up On The Roof , James Taylor","Weekend , Wet Willie","Weekend , Wet Willie","Suspicions , Eddie Rabbitt","Does Your Mother Know , ABBA","Does Your Mother Know , ABBA","Morning Dance , Spyro Gyra","Bad Case Of Loving You (Doctor, Doctor) , Robert Palmer","Cruel To Be Kind , Nick Lowe","Cruel To Be Kind , Nick Lowe","Oh Well , Rockets","Oh Well , Rockets","Oh Well , Rockets","Spooky , Atlanta Rhythm Section","Dependin' On You , The Doobie Brothers","You Decorated My Life , Kenny Rogers","You Decorated My Life , Kenny Rogers","Arrow Through Me , Wings","Rolene , Moon Martin","Rolene , Moon Martin","After The Love Has Gone , Earth, Wind & Fire","Spooky , Atlanta Rhythm Section","So Good, So Right , Brenda Russell","So Good, So Right , Brenda Russell","So Good, So Right , Brenda Russell","Dreaming , Blondie","Dreaming , Blondie","Head Games , Foreigner","Jane , Jefferson Starship","Coward Of The County , Kenny Rogers","Coward Of The County , Kenny Rogers","Wait For Me , Daryl Hall John Oates","Third Time Lucky (First Time I Was A Fool) , Foghat","Third Time Lucky (First Time I Was A Fool) , Foghat","Third Time Lucky (First Time I Was A Fool) , Foghat"
30,"Somewhere In The Night , Barry Manilow","Somewhere In The Night , Barry Manilow","A Man I'll Never Be , Boston","A Man I'll Never Be , Boston","Baby I'm Burnin' , Dolly Parton","Baby I'm Burnin' , Dolly Parton","Shattered , The Rolling Stones","Lady , Little River Band","Lady , Little River Band","Crazy Love , Poco","Haven't Stopped Dancing Yet , Gonzalez","Somewhere In The Night , Barry Manilow","Somewhere In The Night , Barry Manilow","I Was Made For Dancin' , Leif Garrett","Every Which Way But Loose , Eddie Rabbitt","Every Which Way But Loose , Eddie Rabbitt","Precious Love , Bob Welch","Superman , Herbie Mann","Big Shot , Billy Joel","Big Shot , Billy Joel","Maybe I'm A Fool , Eddie Money","What You Won't Do For Love , Bobby Caldwell","What You Won't Do For Love , Bobby Caldwell","Happiness , The Pointer Sisters","Hot Number , Foxy","Ain't Love A Bitch , Rod Stewart","Ain't Love A Bitch , Rod Stewart","I Got My Mind Made Up (You Can Get It Girl) , Instant Funk","Minute By Minute , The Doobie Brothers","Minute By Minute , The Doobie Brothers","(If Loving You Is Wrong) I Don't Want To Be Right , Barbara Mandrell","(If Loving You Is Wrong) I Don't Want To Be Right , Barbara Mandrell","Heart Of The Night , Poco","Heart Of The Night , Poco","Shakedown Cruise , Jay Ferguson","Shakedown Cruise , Jay Ferguson","Shakedown Cruise , Jay Ferguson","Getting Closer , Wings","Lead Me On , Maxine Nightingale","Is She Really Going Out With Him? , Joe Jackson","Is She Really Going Out With Him? , Joe Jackson","After The Love Has Gone , Earth, Wind & Fire","Shadows In The Moonlight , Anne Murray","Shadows In The Moonlight , Anne Murray","Let's Go , The Cars","I Want You To Want Me , Cheap Trick","Makin' It , David Naughton","Makin' It , David Naughton","Pop Muzik , M","What Cha Gonna Do With My Lovin' , Stephanie Mills","What Cha Gonna Do With My Lovin' , Stephanie Mills","Bad Girls , Donna Summer","Good Girls Don't , The Knack","Where Were You When I Was Falling In Love , Lobo","Where Were You When I Was Falling In Love , Lobo","Rolene , Moon Martin","Midnight Wind , John Stewart","Midnight Wind , John Stewart","Dependin' On You , The Doobie Brothers","So Good, So Right , Brenda Russell","Take The Long Way Home , Supertramp","Take The Long Way Home , Supertramp","Half The Way , Crystal Gayle","Victim Of Love , Elton John","Victim Of Love , Elton John","Cruisin' , Smokey Robinson","I Need A Lover , John Cougar","Dreaming , Blondie","Dreaming , Blondie","Don't Do Me Like That , Tom Petty And The Heartbreakers","Chiquitita , ABBA","Chiquitita , ABBA","Chiquitita , ABBA"
31,"Soul Man , Blues Brothers","Soul Man , Blues Brothers","The Gambler , Kenny Rogers","Home And Dry , Gerry Rafferty","Shattered , The Rolling Stones","Shattered , The Rolling Stones","Love Don't Live Here Anymore , Rose Royce","What A Fool Believes , The Doobie Brothers","What A Fool Believes , The Doobie Brothers","My Life , Billy Joel","Stormy , Santana","Stormy , Santana","Stormy , Santana","Somewhere In The Night , Barry Manilow","Livin' It Up (Friday Night) , Bell & James","Livin' It Up (Friday Night) , Bell & James","Take Me Home , Cher","Blow Away , George Harrison","Love Is The Answer , England Dan & John Ford Coley","Love Is The Answer , England Dan & John Ford Coley","Disco Nights (Rock-Freak) , G.Q.","Rock 'n' Roll Fantasy , Bad Company","Rock 'n' Roll Fantasy , Bad Company","Roxanne , The Police","Roxanne , The Police","Old Time Rock & Roll , Bob Seger & The Silver Bullet Band","Old Time Rock & Roll , Bob Seger & The Silver Bullet Band","Makin' It , David Naughton","I Want You To Want Me , Cheap Trick","I Want You To Want Me , Cheap Trick","Shine A Little Love , Electric Light Orchestra","It Must Be Love , Alton McClain & Destiny","You Can't Change That , Raydio","You Can't Change That , Raydio","Do It Or Die , Atlanta Rhythm Section","Shadows In The Moonlight , Anne Murray","Shadows In The Moonlight , Anne Murray","Up On The Roof , James Taylor","Just When I Needed You Most , Randy VanWarmer","Sad Eyes , Robert John","Sad Eyes , Robert John","Heart Of The Night , Poco","Goodbye Stranger , Supertramp","Goodbye Stranger , Supertramp","I Do Love You , GQ","Born To Be Alive , Patrick Hernandez","Different Worlds , Maureen McGovern","Different Worlds , Maureen McGovern","The Boss , Diana Ross","Don't Stop 'til You Get Enough , Michael Jackson","Don't Stop 'til You Get Enough , Michael Jackson","Get It Right Next Time , Gerry Rafferty","Where Were You When I Was Falling In Love , Lobo","The Main Event/Fight , Barbra Streisand","The Main Event/Fight , Barbra Streisand","Come To Me , France Joli","This Night Won't Last Forever , Michael Johnson","This Night Won't Last Forever , Michael Johnson","If You Remember Me , Chris Thompson & Night","Get It Right Next Time , Gerry Rafferty","Please Don't Leave , Lauren Wood","Please Don't Leave , Lauren Wood","Victim Of Love , Elton John","Better Love Next Time , Dr. Hook","Better Love Next Time , Dr. Hook","We Don't Talk Anymore , Cliff Richard","Rise , Herb Alpert","Damned If I Do , The Alan Parsons Project","Damned If I Do , The Alan Parsons Project","Don't Let Go , Isaac Hayes","Pop Muzik , M","Pop Muzik , M","Pop Muzik , M"
32,"A Man I'll Never Be , Boston","A Man I'll Never Be , Boston","Don't Cry Out Loud , Melissa Manchester","Shattered , The Rolling Stones","Love Don't Live Here Anymore , Rose Royce","Love Don't Live Here Anymore , Rose Royce","Dancin' Shoes , Nigel Olsson","What You Won't Do For Love , Bobby Caldwell","What You Won't Do For Love , Bobby Caldwell","Sultans Of Swing , Dire Straits","Song On The Radio , Al Stewart","Shake It , Ian Matthews","Shake It , Ian Matthews","Maybe I'm A Fool , Eddie Money","He's The Greatest Dancer , Sister Sledge","He's The Greatest Dancer , Sister Sledge","Superman , Herbie Mann","Chase , Giorgio Moroder","Crazy Love , Poco","Crazy Love , Poco","Renegade , Styx","Crazy Love , The Allman Brothers Band","Crazy Love , The Allman Brothers Band","I Just Fall In Love Again , Anne Murray","Such A Woman , Tycoon","Don't You Write Her Off , McGuinn, Clark & Hillman","Don't You Write Her Off , McGuinn, Clark & Hillman","Don't You Write Her Off , McGuinn, Clark & Hillman","(If Loving You Is Wrong) I Don't Want To Be Right , Barbara Mandrell","(If Loving You Is Wrong) I Don't Want To Be Right , Barbara Mandrell","It Must Be Love , Alton McClain & Destiny","When You're In Love With A Beautiful Woman , Dr. Hook","Does Your Mother Know , ABBA","Does Your Mother Know , ABBA","Goodnight Tonight , Wings","People Of The South Wind , Kansas","People Of The South Wind , Kansas","The Main Event/Fight , Barbra Streisand","Weekend , Wet Willie","Suspicions , Eddie Rabbitt","Suspicions , Eddie Rabbitt","The Devil Went Down To Georgia , The Charlie Daniels Band","Lonesome Loser , Little River Band","Lonesome Loser , Little River Band","Do It Or Die , Atlanta Rhythm Section","Cruel To Be Kind , Nick Lowe","Oh Well , Rockets","Oh Well , Rockets","Lovin', Touchin', Squeezin' , Journey","Morning Dance , Spyro Gyra","Morning Dance , Spyro Gyra","When You're In Love With A Beautiful Woman , Dr. Hook","Hot Summer Nights , Night","Arrow Through Me , Wings","Arrow Through Me , Wings","I Know A Heartache When I See One , Jennifer Warnes","Gotta Serve Somebody , Bob Dylan","Gotta Serve Somebody , Bob Dylan","So Good, So Right , Brenda Russell","No More Tears (Enough Is Enough) , Barbra Streisand/Donna Summer","Dream Police , Cheap Trick","Dream Police , Cheap Trick","Dreaming , Blondie","I Want You Tonight , Pablo Cruise","I Want You Tonight , Pablo Cruise","I Need A Lover , John Cougar","Good Girls Don't , The Knack","The Long Run , Eagles","The Long Run , Eagles","Third Time Lucky (First Time I Was A Fool) , Foghat","I Need A Lover , John Cougar","I Need A Lover , John Cougar","I Need A Lover , John Cougar"
33,"The Gambler , Kenny Rogers","The Gambler , Kenny Rogers","Take Me To The River , Talking Heads","Love Don't Live Here Anymore , Rose Royce","Sharing The Night Together , Dr. Hook","Sharing The Night Together , Dr. Hook","Promises , Eric Clapton And His Band","Hold The Line , Toto","Hold The Line , Toto","Haven't Stopped Dancing Yet , Gonzalez","Forever In Blue Jeans , Neil Diamond","Soul Man , Blues Brothers","Soul Man , Blues Brothers","I Don't Know If It's Right , Evelyn ""Champagne"" King","I Was Made For Dancin' , Leif Garrett","I Was Made For Dancin' , Leif Garrett","Chase , Giorgio Moroder","Dog + Butterfly , Heart","Bustin' Loose , Chuck Brown & The Soul Searchers","Bustin' Loose , Chuck Brown & The Soul Searchers","Bustin' Loose , Chuck Brown & The Soul Searchers","Roxanne , The Police","Roxanne , The Police","Roller , April Wine","Roller , April Wine","Get Used To It , Roger Voudouris","Get Used To It , Roger Voudouris","Music Box Dancer , Frank Mills","Boogie Wonderland , Earth, Wind & Fire with The Emotions","Boogie Wonderland , Earth, Wind & Fire with The Emotions","Saturday Night, Sunday Morning , Thelma Houston","Little Bit Of Soap , Nigel Olsson","Shakedown Cruise , Jay Ferguson","Shakedown Cruise , Jay Ferguson","Renegade , Styx","Shake Your Body (Down To The Ground) , The Jacksons","Shake Your Body (Down To The Ground) , The Jacksons","One Way Or Another , Blondie","Sad Eyes , Robert John","My Sharona , The Knack","My Sharona , The Knack","Days Gone Down (Still Got The Light In Your Eyes) , Gerry Rafferty","Morning Dance , Spyro Gyra","Morning Dance , Spyro Gyra","Highway Song , Blackfoot","Driver's Seat , Sniff 'n' the Tears","Rise , Herb Alpert","Rise , Herb Alpert","You Can't Change That , Raydio","Highway Song , Blackfoot","Highway Song , Blackfoot","Morning Dance , Spyro Gyra","Mama Can't Buy You Love , Elton John","Rolene , Moon Martin","Rolene , Moon Martin","Hold On , Ian Gomm","Bad Case Of Loving You (Doctor, Doctor) , Robert Palmer","Bad Case Of Loving You (Doctor, Doctor) , Robert Palmer","Broken Hearted Me , Anne Murray","Rainbow Connection , Kermit (Jim Henson)","Lonesome Loser , Little River Band","Lonesome Loser , Little River Band","Better Love Next Time , Dr. Hook","So Good, So Right , Brenda Russell","So Good, So Right , Brenda Russell","Jane , Jefferson Starship","Damned If I Do , The Alan Parsons Project","Love Pains , Yvonne Elliman","Love Pains , Yvonne Elliman","Love Pains , Yvonne Elliman","Deja Vu , Dionne Warwick","Deja Vu , Dionne Warwick","Deja Vu , Dionne Warwick"
34,"My Best Friend's Girl , The Cars","My Best Friend's Girl , The Cars","Home And Dry , Gerry Rafferty","I Will Survive , Gloria Gaynor","(Our Love) Don't Throw It All Away , Andy Gibb","(Our Love) Don't Throw It All Away , Andy Gibb","One Last Kiss , The J. Geils Band","Ooh Baby Baby , Linda Ronstadt","Ooh Baby Baby , Linda Ronstadt","New York Groove , Ace Frehley","September , Earth, Wind & Fire","Too Much Heaven , Bee Gees","Too Much Heaven , Bee Gees","Every Which Way But Loose , Eddie Rabbitt","Chase , Giorgio Moroder","Chase , Giorgio Moroder","Dog + Butterfly , Heart","Shake Your Body (Down To The Ground) , The Jacksons","Love Takes Time , Orleans","Love Takes Time , Orleans","Crazy Love , The Allman Brothers Band","Happiness , The Pointer Sisters","Happiness , The Pointer Sisters","Hot Number , Foxy","Deeper Than The Night , Olivia Newton-John","Chuck E.'s In Love , Rickie Lee Jones","Chuck E.'s In Love , Rickie Lee Jones","(If Loving You Is Wrong) I Don't Want To Be Right , Barbara Mandrell","Saturday Night, Sunday Morning , Thelma Houston","Saturday Night, Sunday Morning , Thelma Houston","Little Bit Of Soap , Nigel Olsson","Ain't No Stoppin' Us Now , McFadden & Whitehead","I Was Made For Lovin' You , KISS","I Was Made For Lovin' You , KISS","In The Navy , Village People","One Way Or Another , Blondie","One Way Or Another , Blondie","Weekend , Wet Willie","Is She Really Going Out With Him? , Joe Jackson","We Are Family , Sister Sledge","We Are Family , Sister Sledge","I'll Never Love This Way Again , Dionne Warwick","Let's Go , The Cars","Let's Go , The Cars","Hot Summer Nights , Night","Oh Well , Rockets","Gold , John Stewart","Gold , John Stewart","Don't Stop 'til You Get Enough , Michael Jackson","Saturdaynight , Herman Brood","Saturdaynight , Herman Brood","Saturdaynight , Herman Brood","Dirty White Boy , Foreigner","Ain't That A Shame , Cheap Trick","Ain't That A Shame , Cheap Trick","This Night Won't Last Forever , Michael Johnson","Driver's Seat , Sniff 'n' the Tears","Driver's Seat , Sniff 'n' the Tears","Ships , Barry Manilow","You're Only Lonely , J.D. Souther","Fins , Jimmy Buffett","Fins , Jimmy Buffett","I Want You Tonight , Pablo Cruise","I Need A Lover , John Cougar","I Need A Lover , John Cougar","Rock With You , Michael Jackson","This Is It , Kenny Loggins","Wait For Me , Daryl Hall John Oates","Wait For Me , Daryl Hall John Oates","Chiquitita , ABBA","Sara , Fleetwood Mac","Sara , Fleetwood Mac","Sara , Fleetwood Mac"
35,"Take Me To The River , Talking Heads","Take Me To The River , Talking Heads","Got To Be Real , Cheryl Lynn","Baby I'm Burnin' , Dolly Parton","Shake Your Groove Thing , Peaches & Herb","Shake Your Groove Thing , Peaches & Herb","Lady , Little River Band","You Don't Bring Me Flowers , Barbra Streisand & Neil Diamond","You Don't Bring Me Flowers , Barbra Streisand & Neil Diamond","Stormy , Santana","You Make Me Feel (Mighty Real) , Sylvester","You Make Me Feel (Mighty Real) , Sylvester","You Make Me Feel (Mighty Real) , Sylvester","Too Much Heaven , Bee Gees","Precious Love , Bob Welch","Precious Love , Bob Welch","Bustin' Loose , Chuck Brown & The Soul Searchers","Bustin' Loose , Chuck Brown & The Soul Searchers","Every Time I Think Of You , The Babys","Every Time I Think Of You , The Babys","Roxanne , The Police","Roller , April Wine","Roller , April Wine","The Logical Song , Supertramp","Sweet Lui-Louise , Ironhorse","She Believes In Me , Kenny Rogers","She Believes In Me , Kenny Rogers","Minute By Minute , The Doobie Brothers","It Must Be Love , Alton McClain & Destiny","It Must Be Love , Alton McClain & Destiny","Dance The Night Away , Van Halen","I Can't Stand It No More , Peter Frampton","Ain't Love A Bitch , Rod Stewart","Ain't Love A Bitch , Rod Stewart","Shadows In The Moonlight , Anne Murray","Up On The Roof , James Taylor","Up On The Roof , James Taylor","Sad Eyes , Robert John","You Take My Breath Away , Rex Smith","Dance The Night Away , Van Halen","Dance The Night Away , Van Halen","Morning Dance , Spyro Gyra","Heaven Must Have Sent You , Bonnie Pointer","Heaven Must Have Sent You , Bonnie Pointer","Born To Be Alive , Patrick Hernandez","Different Worlds , Maureen McGovern","The Boss , Diana Ross","The Boss , Diana Ross","What Cha Gonna Do With My Lovin' , Stephanie Mills","Get It Right Next Time , Gerry Rafferty","Get It Right Next Time , Gerry Rafferty","Where Were You When I Was Falling In Love , Lobo","Ain't That A Shame , Cheap Trick","I Know A Heartache When I See One , Jennifer Warnes","I Know A Heartache When I See One , Jennifer Warnes","Midnight Wind , John Stewart","Found A Cure , Ashford & Simpson","Found A Cure , Ashford & Simpson","Found A Cure , Ashford & Simpson","Fins , Jimmy Buffett","Victim Of Love , Elton John","Victim Of Love , Elton John","Street Life , The Crusaders","Cruisin' , Smokey Robinson","Cruisin' , Smokey Robinson","Damned If I Do , The Alan Parsons Project","Coward Of The County , Kenny Rogers","Don't Let Go , Isaac Hayes","Don't Let Go , Isaac Hayes","Dim All The Lights , Donna Summer","Yes, I'm Ready , Teri DeSario With K.C.","Yes, I'm Ready , Teri DeSario With K.C.","Yes, I'm Ready , Teri DeSario With K.C."
