45,"Nobody's Fool , Cinderella","I'll Be Alright Without You , Journey","I Wanna Go Back , Eddie Money","I Wanna Go Back , Eddie Money","Caught Up In The Rapture , Anita Baker","Let's Wait Awhile , Janet Jackson","Let's Wait Awhile , Janet Jackson","We Connect , Stacey Q","As We Lay , Shirley Murdock","Don't Leave Me This Way , The Communards","Don't Leave Me This Way , The Communards","Fire , Bruce Springsteen","Fire , Bruce Springsteen","Fire , Bruce Springsteen","Light Of Day , The Barbusters (Joan Jett And The Blackhearts)","Skin Trade , Duran Duran","Boom Boom (Let's Go Back To My Room) , Paul Lekakis","Boom Boom (Let's Go Back To My Room) , Paul Lekakis","Keep Your Eye On Me , Herb Alpert","Boom Boom (Let's Go Back To My Room) , Paul Lekakis","Boom Boom (Let's Go Back To My Room) , Paul Lekakis","Wanted Dead Or Alive , Bon Jovi","Show Me , The Cover Girls","Let's Go! , Wang Chung","Let's Go! , Wang Chung","Don't Disturb This Groove , The System","Dominoes , Robbie Nevil","Dominoes , Robbie Nevil","I'll Still Be Loving You , Restless Heart","I Knew You Were Waiting (For Me) , Aretha Franklin & George Michael","Girls, Girls, Girls , Motley Crue","Girls, Girls, Girls , Motley Crue","Flames Of Paradise , Jennifer Rush (Duet With Elton John)","Only In My Dreams , Debbie Gibson","Only In My Dreams , Debbie Gibson","Rock Steady , The Whispers","Nothing's Gonna Change My Love For You , Glenn Medeiros","The Lady In Red , Chris de Burgh","The Lady In Red , Chris de Burgh","Endless Nights , Eddie Money","When Smokey Sings , ABC","When Smokey Sings , ABC","One For The Mockingbird , Cutting Crew","Moonlighting (Theme) , Al Jarreau","Carrie , Europe","Carrie , Europe","Who Will You Run To , Heart","Fake , Alexander O'Neal","Fake , Alexander O'Neal","Shakedown (From ""Beverly Hills Cop II"") , Bob Seger","Breakout , Swing Out Sister","Misfit , Curiosity Killed The Cat","Misfit , Curiosity Killed The Cat","Notorious , Loverboy","Let's Work , Mick Jagger","Let's Work , Mick Jagger","I Need Love , LL Cool J","No One In The World , Anita Baker","La Bamba , Los Lobos","La Bamba , Los Lobos","Dude (Looks Like A Lady) , Aerosmith","Beat Patrol , Starship","Beat Patrol , Starship","Who Will You Run To , Heart","In My Dreams , REO Speedwagon","Casanova , Levert","Casanova , Levert","It's A Sin , Pet Shop Boys","Pop Goes The World , Men Without Hats","Pop Goes The World , Men Without Hats","Just Like Heaven , The Cure","Pump Up The Volume , M/A/R/R/S","Pump Up The Volume , M/A/R/R/S"
46,"Tasty Love , Freddie Jackson","Big Time , Peter Gabriel","Can't Help Falling In Love , Corey Hart","Can't Help Falling In Love , Corey Hart","Don't Get Me Wrong , Pretenders","Candy , Cameo","Candy , Cameo","As We Lay , Shirley Murdock","Lean On Me , Club Nouveau","Fire , Bruce Springsteen","Fire , Bruce Springsteen","Shake You Down , Gregory Abbott","Shelter , Lone Justice","Shelter , Lone Justice","Shelter , Lone Justice","Nothing's Gonna Change My Love For You , Glenn Medeiros","Keep Your Hands To Yourself , The Georgia Satellites","Keep Your Hands To Yourself , The Georgia Satellites","(You Gotta) Fight For Your Right (To Party!) , Beastie Boys","Show Me , The Cover Girls","Show Me , The Cover Girls","Show Me , The Cover Girls","Diamonds , Herb Alpert","Lessons In Love , Level 42","Lessons In Love , Level 42","Same Ole Love (365 Days A Year) , Anita Baker","Show Me , The Cover Girls","Show Me , The Cover Girls","Every Little Kiss , Bruce Hornsby & The Range","Nothing's Gonna Stop Us Now , Starship","Rhythm Is Gonna Get You , Gloria Estefan & Miami Sound Machine","Rhythm Is Gonna Get You , Gloria Estefan & Miami Sound Machine","I Want Your Sex (From ""Beverly Hills Cop II"") , George Michael","I Know What I Like , Huey Lewis & The News","I Know What I Like , Huey Lewis & The News","Luka , Suzanne Vega","I'll Still Be Loving You , Restless Heart","Soul City , Partland Brothers","Soul City , Partland Brothers","Meet Me Half Way , Kenny Loggins","Flames Of Paradise , Jennifer Rush (Duet With Elton John)","Flames Of Paradise , Jennifer Rush (Duet With Elton John)","Good Times (From ""The Lost Boys"") , INXS & Jimmy Barnes","Touch Of Grey , Grateful Dead","Jump Start , Natalie Cole","Jump Start , Natalie Cole","Back To Paradise (From ""Revenge Of The Nerds II"") , Thirty Eight Special","Let Me Be The One , Expose","Let Me Be The One , Expose","Little Lies , Fleetwood Mac","Misfit , Curiosity Killed The Cat","Don't Make Me Wait For Love , Kenny G. (Vocal By Lenny Williams)","Don't Make Me Wait For Love , Kenny G. (Vocal By Lenny Williams)","Holiday , The Other Ones","I Won't Forget You , Poison","I Won't Forget You , Poison","Don't Look Down - The Sequel , Go West","Only In My Dreams , Debbie Gibson","Valerie , Steve Winwood","Valerie , Steve Winwood","So Emotional , Whitney Houston","Paper In Fire , John Mellencamp","Paper In Fire , John Mellencamp","Silent Morning , Noel","I Don't Mind At All , Bourgeois Tagg","Motortown , The Kane Gang","Motortown , The Kane Gang","Causing A Commotion , Madonna","Tunnel Of Love , Bruce Springsteen","Tunnel Of Love , Bruce Springsteen","I've Been In Love Before , Cutting Crew","I Don't Mind At All , Bourgeois Tagg","I Don't Mind At All , Bourgeois Tagg"
47,"Livin' On A Prayer , Bon Jovi","Jimmy Lee , Aretha Franklin","I Need Your Loving , The Human League","I Need Your Loving , The Human League","Two People , Tina Turner","We Connect , Stacey Q","We Connect , Stacey Q","The Final Countdown , Europe","Don't Need A Gun , Billy Idol","Midnight Blue , Lou Gramm","Midnight Blue , Lou Gramm","Someday , Glass Tiger","Stone Love , Kool & The Gang","Stone Love , Kool & The Gang","Serious , Donna Allen","We Connect , Stacey Q","I'll Be Alright Without You , Journey","I'll Be Alright Without You , Journey","Right On Track , The Breakfast Club","Livin' On A Prayer , Bon Jovi","Livin' On A Prayer , Bon Jovi","Heartbreak Beat , Psychedelic Furs","Brass Monkey , Beastie Boys","Songbird , Kenny G","Songbird , Kenny G","Jammin' Me , Tom Petty And The Heartbreakers","Sweet Sixteen , Billy Idol","Sweet Sixteen , Billy Idol","Show Me , The Cover Girls","Heart And Soul , T'Pau","The Finer Things , Steve Winwood","The Finer Things , Steve Winwood","Wot's It To Ya , Robbie Nevil","Back In The High Life Again , Steve Winwood","Back In The High Life Again , Steve Winwood","Right On Track , The Breakfast Club","Hypnotize Me (From ""Innerspace"") , Wang Chung","La Bamba , Los Lobos","La Bamba , Los Lobos","You Keep Me Hangin' On , Kim Wilde","Lies , Jonathan Butler","Lies , Jonathan Butler","Who Found Who , Jellybean Featuring Elisa Fiorillo","One Heartbeat , Smokey Robinson","Kiss And Tell , The Breakfast Club","Kiss And Tell , The Breakfast Club","Shattered Glass , Laura Branigan","Never Let Me Down , David Bowie","Never Let Me Down , David Bowie","In My Dreams , REO Speedwagon","Don't Look Down - The Sequel , Go West","Making Love In The Rain , Herb Alpert","Making Love In The Rain , Herb Alpert","I Want Your Sex (From ""Beverly Hills Cop II"") , George Michael","Dinner With Gershwin , Donna Summer","Dinner With Gershwin , Donna Summer","Come On, Let's Go , Los Lobos","Victim Of Love , Bryan Adams","Wipeout , Fat Boys & The Beach Boys","Wipeout , Fat Boys & The Beach Boys","Beat Patrol , Starship","Animal , Def Leppard","Animal , Def Leppard","Beat Patrol , Starship","Here I Go Again , Whitesnake","U Got The Look , Prince","U Got The Look , Prince","Pop Goes The World , Men Without Hats","Honestly , Stryper","Honestly , Stryper","What Have I Done To Deserve This? , Pet Shop Boys & Dusty Springfield","I Can't Help It , Bananarama","I Can't Help It , Bananarama"
48,"I'll Be Alright Without You , Journey","Human , The Human League","You Know I Love You ... Don't You? , Howard Jones","You Know I Love You ... Don't You? , Howard Jones","Facts Of Love , Jeff Lorber & Karyn White","I Need Your Loving , The Human League","I Need Your Loving , The Human League","Everybody Have Fun Tonight , Wang Chung","Is This Love , Survivor","Control , Janet Jackson","Control , Janet Jackson","Skin Trade , Duran Duran","Dominoes , Robbie Nevil","Dominoes , Robbie Nevil","I Will Be There , Glass Tiger","La Isla Bonita , Madonna","Keep Your Eye On Me , Herb Alpert","Keep Your Eye On Me , Herb Alpert","The Right Thing , Simply Red","Keep Your Eye On Me , Herb Alpert","Keep Your Eye On Me , Herb Alpert","As We Lay , Shirley Murdock","What You Get Is What You See , Tina Turner","Brass Monkey , Beastie Boys","Brass Monkey , Beastie Boys","I'm No Angel , The Gregg Allman Band","Endless Nights , Eddie Money","Endless Nights , Eddie Money","Stone Love , Kool & The Gang","Sign 'O' The Times , Prince","Flames Of Paradise , Jennifer Rush (Duet With Elton John)","Flames Of Paradise , Jennifer Rush (Duet With Elton John)","Day-In Day-Out , David Bowie","Heat Of The Night , Bryan Adams","Heat Of The Night , Bryan Adams","One For The Mockingbird , Cutting Crew","It's Not Over ('til It's Over) , Starship","Living In A Box , Living In A Box","Living In A Box , Living In A Box","Love Power , Dionne Warwick & Jeffrey Osborne","Jam Tonight , Freddie Jackson","Jam Tonight , Freddie Jackson","Why You Treat Me So Bad , Club Nouveau","I Need Love , LL Cool J","Lost In Emotion , Lisa Lisa And Cult Jam","Lost In Emotion , Lisa Lisa And Cult Jam","Kiss Him Goodbye , The Nylons","Be There (From ""Beverly Hills Cop II"") , The Pointer Sisters","Be There (From ""Beverly Hills Cop II"") , The Pointer Sisters","You Are The Girl , The Cars","Be There (From ""Beverly Hills Cop II"") , The Pointer Sisters","I Still Haven't Found What I'm Looking For , U2","I Still Haven't Found What I'm Looking For , U2","Heart And Soul , T'Pau","Silent Morning , Noel","Silent Morning , Noel","Betcha Say That , Gloria Estefan & Miami Sound Machine","Sugar Free , Wa Wa Nee","Beat Patrol , Starship","Beat Patrol , Starship","Jump Start , Natalie Cole","Betcha Say That , Gloria Estefan & Miami Sound Machine","Betcha Say That , Gloria Estefan & Miami Sound Machine","Candle In The Wind , Elton John","Crazy , Icehouse","Just Like Heaven , The Cure","Just Like Heaven , The Cure","Don't Shed A Tear , Paul Carrack","Say You Will , Foreigner","Say You Will , Foreigner","Push It , Salt-N-Pepa","Skeletons , Stevie Wonder","Skeletons , Stevie Wonder"
49,"Big Time , Peter Gabriel","I Need Your Loving , The Human League","You Be Illin' , Run-D.M.C.","You Be Illin' , Run-D.M.C.","Without Your Love , Toto","For Tonight , Nancy Martinez","For Tonight , Nancy Martinez","Falling In Love (Uh-Oh) , Miami Sound Machine","Fire , Bruce Springsteen","What You Get Is What You See , Tina Turner","What You Get Is What You See , Tina Turner","The Honeythief , Hipsway","C'est La Vie , Robbie Nevil","C'est La Vie , Robbie Nevil","Cry Wolf , a-ha","Boom Boom (Let's Go Back To My Room) , Paul Lekakis","Talk Dirty To Me , Poison","Talk Dirty To Me , Poison","I Wanna Go Back , Eddie Money","Jacob's Ladder , Huey Lewis & The News","Jacob's Ladder , Huey Lewis & The News","Meet Me Half Way , Kenny Loggins","Mandolin Rain , Bruce Hornsby & The Range","Let's Wait Awhile , Janet Jackson","Let's Wait Awhile , Janet Jackson","There's Nothing Better Than Love , Luther Vandross with Gregory Hines","I'll Still Be Loving You , Restless Heart","I'll Still Be Loving You , Restless Heart","Rock The Night , Europe","Back And Forth , Cameo","The Pleasure Principle , Janet Jackson","The Pleasure Principle , Janet Jackson","Cross My Broken Heart (From ""Beverly Hills Cop II"") , The Jets","Moonlighting (Theme) , Al Jarreau","Moonlighting (Theme) , Al Jarreau","Don't Mean Nothing , Richard Marx","Jammin' Me , Tom Petty And The Heartbreakers","Since You've Been Gone , The Outfield","Since You've Been Gone , The Outfield","Mary's Prayer , Danny Wilson","I Want Action , Poison","I Want Action , Poison","Didn't We Almost Have It All , Whitney Houston","Good Times (From ""The Lost Boys"") , INXS & Jimmy Barnes","Good Times (From ""The Lost Boys"") , INXS & Jimmy Barnes","Good Times (From ""The Lost Boys"") , INXS & Jimmy Barnes","Dreamin' , Will To Power","Wot's It To Ya , Robbie Nevil","Wot's It To Ya , Robbie Nevil","Rhythm Is Gonna Get You , Gloria Estefan & Miami Sound Machine","I Think We're Alone Now , Tiffany","Lies , Jonathan Butler","Lies , Jonathan Butler","Dinner With Gershwin , Donna Summer","Misfit , Curiosity Killed The Cat","Misfit , Curiosity Killed The Cat","No One In The World , Anita Baker","Catch Me (I'm Falling) (From The Film ""Hiding Out"") , Pretty Poison","Can't We Try , Dan Hill (Duet With Vonda Shepard)","Can't We Try , Dan Hill (Duet With Vonda Shepard)","One Heartbeat , Smokey Robinson","Cherry Bomb , John Mellencamp","Cherry Bomb , John Mellencamp","I Don't Mind At All , Bourgeois Tagg","True Faith , New Order","Boys Night Out , Timothy B. Schmit","Boys Night Out , Timothy B. Schmit","Let Me Be The One , Expose","Everywhere , Fleetwood Mac","Everywhere , Fleetwood Mac","(Baby Tell Me) Can You Dance , Shanice Wilson","I Do You , The Jets","I Do You , The Jets"
50,"Wild Wild Life , Talking Heads","Goldmine , The Pointer Sisters","Hip To Be Square , Huey Lewis & The News","Hip To Be Square , Huey Lewis & The News","Mandolin Rain , Bruce Hornsby & The Range","Love Is Forever , Billy Ocean","Love Is Forever , Billy Ocean","Don't Need A Gun , Billy Idol","That Ain't Love , REO Speedwagon","This Is The Time , Billy Joel","This Is The Time , Billy Joel","Shelter , Lone Justice","Ain't So Easy , David & David","Ain't So Easy , David & David","(I Just) Died In Your Arms , Cutting Crew","Ballerina Girl , Lionel Richie","How Much Love , Survivor","How Much Love , Survivor","Show Me , The Cover Girls","You Keep Me Hangin' On , Kim Wilde","You Keep Me Hangin' On , Kim Wilde","Day-In Day-Out , David Bowie","In Too Deep , Genesis","Smoking Gun , The Robert Cray Band","Smoking Gun , The Robert Cray Band","Endless Nights , Eddie Money","There's Nothing Better Than Love , Luther Vandross with Gregory Hines","There's Nothing Better Than Love , Luther Vandross with Gregory Hines","Soul City , Partland Brothers","I'd Still Say Yes , Klymaxx","I Want Your Sex (From ""Beverly Hills Cop II"") , George Michael","I Want Your Sex (From ""Beverly Hills Cop II"") , George Michael","I Still Haven't Found What I'm Looking For , U2","Hearts On Fire , Bryan Adams","Hearts On Fire , Bryan Adams","Why You Treat Me So Bad , Club Nouveau","With or Without You , U2","Can't We Try , Dan Hill (Duet With Vonda Shepard)","Can't We Try , Dan Hill (Duet With Vonda Shepard)","The Lady In Red , Chris de Burgh","Here I Go Again , Whitesnake","Here I Go Again , Whitesnake","Always , Atlantic Starr","Hypnotize Me (From ""Innerspace"") , Wang Chung","Don't Disturb This Groove , The System","Don't Disturb This Groove , The System","Good Times (From ""The Lost Boys"") , INXS & Jimmy Barnes","I'd Still Say Yes , Klymaxx","I'd Still Say Yes , Klymaxx","Misfit , Curiosity Killed The Cat","Mony Mony , Billy Idol","Notorious , Loverboy","Notorious , Loverboy","Oh Yeah , Yello","Should've Known Better , Richard Marx","Should've Known Better , Richard Marx","Hourglass , Squeeze","Shake Your Love , Debbie Gibson","Something Real (Inside Me/Inside You) , Mr. Mister","Something Real (Inside Me/Inside You) , Mr. Mister","No One In The World , Anita Baker","I Heard A Rumour (From ""Disorderlies"") , Bananarama","I Heard A Rumour (From ""Disorderlies"") , Bananarama","There's The Girl , Heart","Just Like Heaven , The Cure","Hungry Eyes (From ""Dirty Dancing"") , Eric Carmen","Hungry Eyes (From ""Dirty Dancing"") , Eric Carmen","(Baby Tell Me) Can You Dance , Shanice Wilson","(Baby Tell Me) Can You Dance , Shanice Wilson","(Baby Tell Me) Can You Dance , Shanice Wilson","I Found Someone , Cher","Because Of You , The Cover Girls","Because Of You , The Cover Girls"
51,"Jimmy Lee , Aretha Franklin","Can't Help Falling In Love , Corey Hart","(You Gotta) Fight For Your Right (To Party!) , Beastie Boys","(You Gotta) Fight For Your Right (To Party!) , Beastie Boys","You Be Illin' , Run-D.M.C.","War , Bruce Springsteen","War , Bruce Springsteen","Don't Dream It's Over , Crowded House","Victory , Kool & The Gang","Shelter , Lone Justice","Shelter , Lone Justice","Without Your Love , Toto","We're Ready , Boston","We're Ready , Boston","The Lady In Red , Chris de Burgh","Love You Down , Ready For The World","Big Love , Fleetwood Mac","Big Love , Fleetwood Mac","Se La , Lionel Richie","Heartbreak Beat , Psychedelic Furs","Heartbreak Beat , Psychedelic Furs","Brass Monkey , Beastie Boys","Somewhere Out There (From ""An American Tail"") , Linda Ronstadt & James Ingram","Same Ole Love (365 Days A Year) , Anita Baker","Same Ole Love (365 Days A Year) , Anita Baker","Brass Monkey , Beastie Boys","Something So Strong , Crowded House","Something So Strong , Crowded House","Shakedown (From ""Beverly Hills Cop II"") , Bob Seger","Get That Love , Thompson Twins","Same Ole Love (365 Days A Year) , Anita Baker","Same Ole Love (365 Days A Year) , Anita Baker","Only In My Dreams , Debbie Gibson","Seven Wonders , Fleetwood Mac","Seven Wonders , Fleetwood Mac","If She Would Have Been Faithful. . . , Chicago","Since You've Been Gone , The Outfield","Give To Live , Sammy Hagar","Give To Live , Sammy Hagar","Wanted Dead Or Alive , Bon Jovi","Good Times (From ""The Lost Boys"") , INXS & Jimmy Barnes","Good Times (From ""The Lost Boys"") , INXS & Jimmy Barnes","I Need Love , LL Cool J","Head To Toe , Lisa Lisa And Cult Jam","Making Love In The Rain , Herb Alpert","Making Love In The Rain , Herb Alpert","Fake , Alexander O'Neal","I Wanna Dance With Somebody (Who Loves Me) , Whitney Houston","I Wanna Dance With Somebody (Who Loves Me) , Whitney Houston","Don't Look Down - The Sequel , Go West","It's A Sin , Pet Shop Boys","Oh Yeah , Yello","Oh Yeah , Yello","Luka , Suzanne Vega","Come On, Let's Go , Los Lobos","Come On, Let's Go , Los Lobos","Silent Morning , Noel","Silent Morning , Noel","Silent Morning , Noel","Silent Morning , Noel","Silent Morning , Noel","Didn't We Almost Have It All , Whitney Houston","Didn't We Almost Have It All , Whitney Houston","You Are The Girl , The Cars","Silent Morning , Noel","I Live For Your Love , Natalie Cole","I Live For Your Love , Natalie Cole","Could've Been , Tiffany","Little Lies , Fleetwood Mac","Little Lies , Fleetwood Mac","Can't Stay Away From You , Gloria Estefan & Miami Sound Machine","Mony Mony , Billy Idol","Mony Mony , Billy Idol"
52,"Crazay , Jesse Johnson (Featuring Sly Stone)","Crazay , Jesse Johnson (Featuring Sly Stone)","Brand New Lover , Dead Or Alive","Brand New Lover , Dead Or Alive","The Future's So Bright, I Gotta Wear Shades , Timbuk 3","Let's Go! , Wang Chung","Let's Go! , Wang Chung","All I Wanted , Kansas","Don't Leave Me This Way , The Communards","Skin Trade , Duran Duran","Skin Trade , Duran Duran","The Finer Things , Steve Winwood","Cry Wolf , a-ha","Cry Wolf , a-ha","Can'tcha Say (You Believe In Me)/Still In Love , Boston","At This Moment , Billy Vera & The Beaters","The Right Thing , Simply Red","The Right Thing , Simply Red","If She Would Have Been Faithful. . . , Chicago","Brass Monkey , Beastie Boys","Brass Monkey , Beastie Boys","Boom Boom (Let's Go Back To My Room) , Paul Lekakis","Head To Toe , Lisa Lisa And Cult Jam","The Final Countdown , Europe","The Final Countdown , Europe","I'll Still Be Loving You , Restless Heart","Alone , Heart","Alone , Heart","Lean On Me , Club Nouveau","We Are What We Are , The Other Ones","Nothing's Gonna Stop Us Now , Starship","Nothing's Gonna Stop Us Now , Starship","Back In The High Life Again , Steve Winwood","One For The Mockingbird , Cutting Crew","One For The Mockingbird , Cutting Crew","Looking For A New Love , Jody Watley","Give To Live , Sammy Hagar","Nothing's Gonna Change My Love For You , Glenn Medeiros","Nothing's Gonna Change My Love For You , Glenn Medeiros","Lies , Jonathan Butler","Meet Me Half Way , Kenny Loggins","Meet Me Half Way , Kenny Loggins","These Times Are Hard For Lovers , John Waite","Dreamin' , Will To Power","Shattered Glass , Laura Branigan","Shattered Glass , Laura Branigan","Say You Really Want Me , Kim Wilde","Shattered Glass , Laura Branigan","Shattered Glass , Laura Branigan","Alone , Heart","Don't Make Me Wait For Love , Kenny G. (Vocal By Lenny Williams)","Holiday , The Other Ones","Holiday , The Other Ones","I Won't Forget You , Poison","Betcha Say That , Gloria Estefan & Miami Sound Machine","Betcha Say That , Gloria Estefan & Miami Sound Machine","Boys Night Out , Timothy B. Schmit","That's What Love Is All About , Michael Bolton","Is This Love , Whitesnake","Is This Love , Whitesnake","Tell It To My Heart(Dub) , Taylor Dayne","Silent Morning , Noel","Silent Morning , Noel","Just Like Heaven , The Cure","Motortown , The Kane Gang","I Want To Be Your Man , Roger","I Want To Be Your Man , Roger","Honestly , Stryper","Push It , Salt-N-Pepa","Push It , Salt-N-Pepa","I Can't Help It , Bananarama","In God's Country , U2","In God's Country , U2"
53,"I Need Your Loving , The Human League","Caught Up In The Rapture , Anita Baker","Caught Up In The Rapture , Anita Baker","Caught Up In The Rapture , Anita Baker","You Give Love A Bad Name , Bon Jovi","You Be Illin' , Run-D.M.C.","You Be Illin' , Run-D.M.C.","That Ain't Love , REO Speedwagon","Midnight Blue , Lou Gramm","The Honeythief , Hipsway","The Honeythief , Hipsway","Ain't So Easy , David & David","Come As You Are , Peter Wolf","Come As You Are , Peter Wolf","Winner Takes It All , Sammy Hagar","Keep Your Eye On Me , Herb Alpert","Heat Of The Night , Bryan Adams","Heat Of The Night , Bryan Adams","I Know What I Like , Huey Lewis & The News","Get That Love , Thompson Twins","Get That Love , Thompson Twins","Fascinated , Company B","Boom Boom (Let's Go Back To My Room) , Paul Lekakis","Boom Boom (Let's Go Back To My Room) , Paul Lekakis","Boom Boom (Let's Go Back To My Room) , Paul Lekakis","Sweet Sixteen , Billy Idol","I'm No Angel , The Gregg Allman Band","I'm No Angel , The Gregg Allman Band","Back And Forth , Cameo","Show Me , The Cover Girls","Happy , Surface","Happy , Surface","Ready Or Not , Lou Gramm","Ready Or Not , Lou Gramm","Ready Or Not , Lou Gramm","Hypnotize Me (From ""Innerspace"") , Wang Chung","Right On Track , The Breakfast Club","Mary's Prayer , Danny Wilson","Mary's Prayer , Danny Wilson","Good Times (From ""The Lost Boys"") , INXS & Jimmy Barnes","Diamonds , Herb Alpert","Diamonds , Herb Alpert","I Heard A Rumour (From ""Disorderlies"") , Bananarama","Why Can't I Be You? , The Cure","U Got The Look , Prince","U Got The Look , Prince","Girls, Girls, Girls , Motley Crue","Victim Of Love , Bryan Adams","Victim Of Love , Bryan Adams","Oh Yeah , Yello","Oh Yeah , Yello","I've Been In Love Before , Cutting Crew","I've Been In Love Before , Cutting Crew","Betcha Say That , Gloria Estefan & Miami Sound Machine","(I've Had) The Time Of My Life , Bill Medley & Jennifer Warnes","(I've Had) The Time Of My Life , Bill Medley & Jennifer Warnes","Dinner With Gershwin , Donna Summer","Love Will Find A Way , Yes","Faith , George Michael","Faith , George Michael","Got My Mind Set On You , George Harrison","Need You Tonight , INXS","Need You Tonight , INXS","Power Of Love , Laura Branigan","Lost In Emotion , Lisa Lisa And Cult Jam","(Baby Tell Me) Can You Dance , Shanice Wilson","(Baby Tell Me) Can You Dance , Shanice Wilson","Everywhere , Fleetwood Mac","Love Will Find A Way , Yes","Love Will Find A Way , Yes","I Won't Forget You , Poison","You And Me Tonight , Deja","You And Me Tonight , Deja"
