80,"The Chemicals Between Us , Bush","We Can't Be Friends , Deborah Cox With R.L.","Tha Block Is Hot , Lil' Wayne Featuring Juvenile & B.G.","Tha Block Is Hot , Lil' Wayne Featuring Juvenile & B.G.","Tha Block Is Hot , Lil' Wayne Featuring Juvenile & B.G.","Put Your Hand In Mine , Tracy Byrd","Breathe And Stop , Q-Tip","Breathe And Stop , Q-Tip","Angels , Robbie Williams","No Leaf Clover , Metallica","Do What You Gotta Do , Garth Brooks","Do What You Gotta Do , Garth Brooks","U Don't Love Me , Kumbia Kings Featuring A.B. Quintanilla","She's More , Andy Griggs","She's More , Andy Griggs","Daddy Won't Sell The Farm , Montgomery Gentry","No More Rain (In This Cloud) , Angie Stone","Daddy Won't Sell The Farm , Montgomery Gentry","Daddy Won't Sell The Farm , Montgomery Gentry","Kryptonite , 3 Doors Down","Graduation (Friends Forever) , Vitamin C","Graduation (Friends Forever) , Vitamin C","Where I Wanna Be , Donell Jones","Real Live Woman , Trisha Yearwood","Lessons Learned , Tracy Lawrence","Lessons Learned , Tracy Lawrence","From The Bottom Of My Broken Heart , Britney Spears","It's So Hard , Big Punisher Featuring Donell Jones","It's So Hard , Big Punisher Featuring Donell Jones","It's So Hard , Big Punisher Featuring Donell Jones","I Disappear , Metallica","I Disappear , Metallica","I Disappear , Metallica","Someday Out Of The Blue , Elton John","I Disappear , Metallica","I Disappear , Metallica","I Disappear , Metallica","Best Of Me , Mya Featuring Jadakiss","Your Everything , Keith Urban","Your Everything , Keith Urban","Faded , SoulDecision Featuring Thrust","The Chain Of Love , Clay Walker","The Chain Of Love , Clay Walker","I Think God Can Explain , Splender","It's Always Somethin' , Joe Diffie","I'll Be , Reba McEntire","I'll Be , Reba McEntire","No Matter What They Say , Lil' Kim","Change Your Mind , Sister Hazel","Change Your Mind , Sister Hazel","The Little Girl , John Michael Montgomery","Could I Have This Kiss Forever , Whitney Houston & Enrique Iglesias","Whatever , Ideal Featuring Lil' Mo","Whatever , Ideal Featuring Lil' Mo","Just Another Day In Paradise , Phil Vassar","Just Another Day In Paradise , Phil Vassar","Just Another Day In Paradise , Phil Vassar","He Loves U Not , Dream","My Baby You , Marc Anthony","Country Comes To Town , Toby Keith","Country Comes To Town , Toby Keith","That's The Kind Of Mood I'm In , Patty Loveless","I Will...But , SHeDAISY","I Will...But , SHeDAISY","No More (Baby I'ma Do Right) , 3LW","Bad Boyz , Shyne Featuring Barrington Levy","Meanwhile Back At The Ranch , The Clark Family Experience","Meanwhile Back At The Ranch , The Clark Family Experience","Can't Fight The Moonlight , LeAnn Rimes","If I Am , Nine Days","If I Am , Nine Days","But For The Grace Of God , Keith Urban","Angel , Shaggy Featuring Rayvon"
81,"Tha Block Is Hot , Lil' Wayne Featuring Juvenile & B.G.","Notorious B.I.G. , The Notorious B.I.G. Featuring Puff Daddy & Lil' Kim","Live, Laugh, Love , Clay Walker","Bling Bling , B.G. Featuring Baby, Turk, Mannie Fresh, Juvenile & Lil' Wayne","Bling Bling , B.G. Featuring Baby, Turk, Mannie Fresh, Juvenile & Lil' Wayne","The Chemicals Between Us , Bush","This Woman Needs , SHeDAISY","This Woman Needs , SHeDAISY","Breathe And Stop , Q-Tip","Girl On TV , LFO","The Best Man I Can Be , Ginuwine, R.L., Tyrese, Case","The Best Man I Can Be , Ginuwine, R.L., Tyrese, Case","Baby Don't Cry (Keep Ya Head Up II) , 2Pac + Outlawz","Stay Or Let It Go , Brian McKnight","Stay Or Let It Go , Brian McKnight","Got To Get It , Sisqo Featuring Make It Hot","G'd Up , Snoop Dogg Presents Tha Eastsidaz","This Woman Needs , SHeDAISY","This Woman Needs , SHeDAISY","Swear It Again , Westlife","Thank God I Found You , Mariah Carey Featuring Joe & 98 Degrees","Thank God I Found You , Mariah Carey Featuring Joe & 98 Degrees","Real Live Woman , Trisha Yearwood","I Learned From The Best , Whitney Houston","It's Gonna Be Me , 'N Sync","It's Gonna Be Me , 'N Sync","The Bad Touch , Bloodhound Gang","Flowers On The Wall , Eric Heatherly","Flowers On The Wall , Eric Heatherly","Flowers On The Wall , Eric Heatherly","Forgot About Dre , Dr. Dre Featuring Eminem","You Owe Me , NAS Featuring Ginuwine","You Owe Me , NAS Featuring Ginuwine","Feelin' So Good , Jennifer Lopez Featuring Big Pun & Fat Joe","Buy Me A Rose , Kenny Rogers With Alison Krauss & Billy Dean","Buy Me A Rose , Kenny Rogers With Alison Krauss & Billy Dean","One Voice , Billy Gilman","Mirror Mirror , M2M","As We Lay , Kelly Price","As We Lay , Kelly Price","You'll Always Be Loved By Me , Brooks & Dunn","I Disappear , Metallica","I Disappear , Metallica","Country Comes To Town , Toby Keith","Dance With Me , Debelah Morgan","Broadway , Goo Goo Dolls","Broadway , Goo Goo Dolls","As We Lay , Kelly Price","Feels Like Love , Vince Gill","Feels Like Love , Vince Gill","Can't Fight The Moonlight , LeAnn Rimes","My Baby You , Marc Anthony","Summer Rain , Carl Thomas","Summer Rain , Carl Thomas","Summer Rain , Carl Thomas","Bad Boyz , Shyne Featuring Barrington Levy","Bad Boyz , Shyne Featuring Barrington Levy","My Baby You , Marc Anthony","Summer Rain , Carl Thomas","That's The Kind Of Mood I'm In , Patty Loveless","That's The Kind Of Mood I'm In , Patty Loveless","The Light , Common","Summer Rain , Carl Thomas","Summer Rain , Carl Thomas","You Won't Be Lonely Now , Billy Ray Cyrus","There You Are , Martina McBride","Bow Wow (That's My Name) , Lil Bow Wow","Bow Wow (That's My Name) , Lil Bow Wow","It's Over Now , 112","South Side , Moby Featuring Gwen Stefani","South Side , Moby Featuring Gwen Stefani","A Little Gasoline , Terri Clark","Meanwhile Back At The Ranch , The Clark Family Experience"
82,"Guerrilla Radio , Rage Against The Machine","All I Want For Christmas Is You , Mariah Carey","Guerrilla Radio , Rage Against The Machine","The Best Man I Can Be , Ginuwine, R.L., Tyrese, Case","The Best Man I Can Be , Ginuwine, R.L., Tyrese, Case","Because You Love Me , Jo Dee Messina","Angels , Robbie Williams","Angels , Robbie Williams","U Understand , Juvenile","I Learned From The Best , Whitney Houston","I Learned From The Best , Whitney Houston","I Learned From The Best , Whitney Houston","I Learned From The Best , Whitney Houston","Daddy Won't Sell The Farm , Montgomery Gentry","Daddy Won't Sell The Farm , Montgomery Gentry","G'd Up , Snoop Dogg Presents Tha Eastsidaz","Mr. Too Damn Good , Gerald Levert","Mr. Too Damn Good , Gerald Levert","Mr. Too Damn Good , Gerald Levert","Real Live Woman , Trisha Yearwood","Real Live Woman , Trisha Yearwood","Real Live Woman , Trisha Yearwood","Unconditional , Clay Davidson","I Belong To You , Lenny Kravitz","Another Nine Minutes , Yankee Grey","Another Nine Minutes , Yankee Grey","I Hope You Dance , Lee Ann Womack","I Like It , Sammie","I Like It , Sammie","Another Nine Minutes , Yankee Grey","I Don't Wanna , Aaliyah","Carlene , Phil Vassar","Carlene , Phil Vassar","Shut Up , Trick Daddy Featuring Duece Poppito, Trina, Co","Shut Up , Trick Daddy Featuring Duece Poppito, Trina, Co","Shut Up , Trick Daddy Featuring Duece Poppito, Trina, Co","More , Trace Adkins","You'll Always Be Loved By Me , Brooks & Dunn","You'll Always Be Loved By Me , Brooks & Dunn","You'll Always Be Loved By Me , Brooks & Dunn","I Disappear , Metallica","Callin' Me , Lil' Zane Featuring 112","Callin' Me , Lil' Zane Featuring 112","Unconditional , Clay Davidson","Let's Make Love , Faith Hill With Tim McGraw","Let's Make Love , Faith Hill With Tim McGraw","Let's Make Love , Faith Hill With Tim McGraw","The Real Slim Shady , Eminem","Flowers On The Wall , Eric Heatherly","Flowers On The Wall , Eric Heatherly","Hey Papi , Jay-Z Featuring Memphis Bleek & Amil","Hey Papi , Jay-Z Featuring Memphis Bleek & Amil","Taking You Home , Don Henley","Taking You Home , Don Henley","Can't Fight The Moonlight , LeAnn Rimes","What's Your Fantasy , Ludacris Featuring Shawnna","What's Your Fantasy , Ludacris Featuring Shawnna","Taking You Home , Don Henley","Just Friends (Sunny) , Musiq","Summer Rain , Carl Thomas","Summer Rain , Carl Thomas","Can't Fight The Moonlight , LeAnn Rimes","Aaron's Party (Come Get It) , Aaron Carter","Aaron's Party (Come Get It) , Aaron Carter","What Means The World To You , Cam'ron","My Love Goes On And On , Chris Cagle","Straight Up , Chante Moore","Straight Up , Chante Moore","Straight Up , Chante Moore","My Baby You , Marc Anthony","My Baby You , Marc Anthony","My Love Goes On And On , Chris Cagle","Oklahoma , Billy Gilman"
83,"Live, Laugh, Love , Clay Walker","There She Goes , Sixpence None The Richer","N 2 Gether Now , Limp Bizkit Featuring Method Man","She Thinks My Tractor's Sexy , Kenny Chesney","She Thinks My Tractor's Sexy , Kenny Chesney","I Don't Wanna , Aaliyah","The Best Man I Can Be , Ginuwine, R.L., Tyrese, Case","The Best Man I Can Be , Ginuwine, R.L., Tyrese, Case","When I Said I Do , Clint Black","Do It Again (Put Ya Hands Up) , Jay-Z Featuring Beanie Sigel & Amil","When I Said I Do , Clint Black","When I Said I Do , Clint Black","If You Love Me , Mint Condition","24/7 , Kevon Edmonds","24/7 , Kevon Edmonds","Mr. Too Damn Good , Gerald Levert","Can't Stay , Dave Hollister","Can't Stay , Dave Hollister","Can't Stay , Dave Hollister","Ryde Or Die, Chick , The Lox Featuring Timbaland And EVE","Whistle While You Twurk , Ying Yang Twins","Whistle While You Twurk , Ying Yang Twins","Back At One , Mark Wills","More , Trace Adkins","More , Trace Adkins","More , Trace Adkins","With Arms Wide Open , Creed","I Disappear , Metallica","I Disappear , Metallica","Nothing As It Seems , Pearl Jam","Been There , Clint Black With Steve Wariner","Whoa! , Black Rob","Whoa! , Black Rob","Carlene , Phil Vassar","It's So Hard , Big Punisher Featuring Donell Jones","It's So Hard , Big Punisher Featuring Donell Jones","Best Of Me , Mya Featuring Jadakiss","Buy Me A Rose , Kenny Rogers With Alison Krauss & Billy Dean","I Disappear , Metallica","I Disappear , Metallica","When You Need My Love , Darryl Worley","Shackles (Praise You) , Mary Mary","Shackles (Praise You) , Mary Mary","With Arms Wide Open , Creed","West Side Story , LFO","Cold Day In July , Dixie Chicks","Cold Day In July , Dixie Chicks","I'll Be , Reba McEntire","Dance Tonight , Lucy Pearl","Dance Tonight , Lucy Pearl","Dance Tonight , Lucy Pearl","Californication , Red Hot Chili Peppers","Change Your Mind , Sister Hazel","Change Your Mind , Sister Hazel","Can't Go For That , Tamia","Your Everything , Keith Urban","Your Everything , Keith Urban","Callin' Me , Lil' Zane Featuring 112","Treat Her Like A Lady , Joe","It Must Be Love , Alan Jackson","It Must Be Love , Alan Jackson","Summer Rain , Carl Thomas","What Means The World To You , Cam'ron","What Means The World To You , Cam'ron","My Love Goes On And On , Chris Cagle","Just Be A Man About It , Toni Braxton","Who Let The Dogs Out , Baha Men","Who Let The Dogs Out , Baha Men","It's My Life , Bon Jovi","Give Me Just One Night (Una Noche) , 98 Degrees","Give Me Just One Night (Una Noche) , 98 Degrees","Oklahoma , Billy Gilman","Girls Dem Sugar , Beenie Man Featuring Mya"
84,"Notorious B.I.G. , The Notorious B.I.G. Featuring Puff Daddy & Lil' Kim","The Greatest Romance Ever Sold , Prince","She Thinks My Tractor's Sexy , Kenny Chesney","The Chemicals Between Us , Bush","The Chemicals Between Us , Bush","I Like It , Sammie","U Understand , Juvenile","U Understand , Juvenile","Deep Inside , Mary J. Blige","The Best Man I Can Be , Ginuwine, R.L., Tyrese, Case","If You Love Me , Mint Condition","If You Love Me , Mint Condition","None Of Ur Friends Business , Ginuwine","None Of Ur Friends Business , Ginuwine","None Of Ur Friends Business , Ginuwine","The Best Man I Can Be , Ginuwine, R.L., Tyrese, Case","Couldn't Last A Moment , Collin Raye","Real Live Woman , Trisha Yearwood","Real Live Woman , Trisha Yearwood","Whistle While You Twurk , Ying Yang Twins","Best Of Me , Mya Featuring Jadakiss","Best Of Me , Mya Featuring Jadakiss","Smile , Lonestar","It Was , Chely Wright","Absolutely (Story Of A Girl) , Nine Days","Absolutely (Story Of A Girl) , Nine Days","Whistle While You Twurk , Ying Yang Twins","Me Neither , Brad Paisley","Me Neither , Brad Paisley","Wifey , Next","Whoa! , Black Rob","Been There , Clint Black With Steve Wariner","Been There , Clint Black With Steve Wariner","You'll Always Be Loved By Me , Brooks & Dunn","You'll Always Be Loved By Me , Brooks & Dunn","You'll Always Be Loved By Me , Brooks & Dunn","You'll Always Be Loved By Me , Brooks & Dunn","When You Need My Love , Darryl Worley","When You Need My Love , Darryl Worley","When You Need My Love , Darryl Worley","She's More , Andy Griggs","Wobble Wobble , 504 Boyz","Wobble Wobble , 504 Boyz","Who Let The Dogs Out , Baha Men","Most Girls , P!nk","Oops!...I Did It Again , Britney Spears","Oops!...I Did It Again , Britney Spears","Broadway , Goo Goo Dolls","Simple Kind Of Life , No Doubt","Simple Kind Of Life , No Doubt","Gotta Tell You , Samantha Mumba","Between Me And You , Ja Rule Featuring Christina Milian","Californication , Red Hot Chili Peppers","Californication , Red Hot Chili Peppers","Taking You Home , Don Henley","One Voice , Billy Gilman","One Voice , Billy Gilman","It's Always Somethin' , Joe Diffie","Hey Papi , Jay-Z Featuring Memphis Bleek & Amil","Treat Her Like A Lady , Joe","Treat Her Like A Lady , Joe","You Won't Be Lonely Now , Billy Ray Cyrus","No More (Baby I'ma Do Right) , 3LW","No More (Baby I'ma Do Right) , 3LW","I Will...But , SHeDAISY","Straight Up , Chante Moore","That Other Woman , Changing Faces","That Other Woman , Changing Faces","That's The Kind Of Mood I'm In , Patty Loveless","It's My Life , Bon Jovi","It's My Life , Bon Jovi","Can't Fight The Moonlight , LeAnn Rimes","Put It On Me , Ja Rule Featuring Lil' Mo & Vita"
85,"She Thinks My Tractor's Sexy , Kenny Chesney","I Wanna Know , Joe","Bug A Boo , Destiny's Child","N 2 Gether Now , Limp Bizkit Featuring Method Man","N 2 Gether Now , Limp Bizkit Featuring Method Man","Tha Block Is Hot , Lil' Wayne Featuring Juvenile & B.G.","Home To You , John Michael Montgomery","Home To You , John Michael Montgomery","No Leaf Clover , Metallica","Do What You Gotta Do , Garth Brooks","Put Your Hand In Mine , Tracy Byrd","Put Your Hand In Mine , Tracy Byrd","It Was , Chely Wright","Candy , Mandy Moore","Candy , Mandy Moore","Ryde Or Die, Chick , The Lox Featuring Timbaland And EVE","No Leaf Clover , Metallica","Left, Right, Left , Drama","Left, Right, Left , Drama","Anything , JAY-Z","Mr. Too Damn Good , Gerald Levert","Mr. Too Damn Good , Gerald Levert","Mr. Too Damn Good , Gerald Levert","Another Nine Minutes , Yankee Grey","Back Here , BBMak","Back Here , BBMak","I Disappear , Metallica","Mirror Mirror , M2M","Mirror Mirror , M2M","Goodbye Earl , Dixie Chicks","From The Bottom Of My Broken Heart , Britney Spears","I Don't Wanna , Aaliyah","I Don't Wanna , Aaliyah","One Voice , Billy Gilman","One Voice , Billy Gilman","One Voice , Billy Gilman","Buy Me A Rose , Kenny Rogers With Alison Krauss & Billy Dean","Take That , Torrey Carter Featuring Missy ""Misdemeanor"" Elliott","Best Of Me , Mya Featuring Jadakiss","Best Of Me , Mya Featuring Jadakiss","Best Of Me , Mya Featuring Jadakiss","What You Want , DMX Featuring Sisqo","What You Want , DMX Featuring Sisqo","Dance With Me , Debelah Morgan","With Arms Wide Open , Creed","Better Off Alone , Alice Deejay","Better Off Alone , Alice Deejay","Best Of Intentions , Travis Tritt","No Matter What They Say , Lil' Kim","No Matter What They Say , Lil' Kim","When You Need My Love , Darryl Worley","Dance Tonight , Lucy Pearl","Can't Go For That , Tamia","Can't Go For That , Tamia","You'll Always Be Loved By Me , Brooks & Dunn","Summer Rain , Carl Thomas","Summer Rain , Carl Thomas","Lucky , Britney Spears","You Should've Told Me , Kelly Price","The Way I Am , Eminem","The Way I Am , Eminem","I Will...But , SHeDAISY","The Light , Common","The Light , Common","Aaron's Party (Come Get It) , Aaron Carter","Meanwhile Back At The Ranch , The Clark Family Experience","The Itch , Vitamin C","The Itch , Vitamin C","One Woman Man , Dave Hollister","How Many Licks? , Lil' Kim Featuring Sisqo","How Many Licks? , Lil' Kim Featuring Sisqo","How Many Licks? , Lil' Kim Featuring Sisqo","Can't Fight The Moonlight , LeAnn Rimes"
86,"Larger Than Life , Backstreet Boys","Give You What You Want (Fa Sure) , Chico DeBarge","Larger Than Life , Backstreet Boys","(You Drive Me) Crazy , Britney Spears","(You Drive Me) Crazy , Britney Spears","4, 5, 6 , Sole Featuring JT Money & Kandi","Tha Block Is Hot , Lil' Wayne Featuring Juvenile & B.G.","Tha Block Is Hot , Lil' Wayne Featuring Juvenile & B.G.","Tricky, Tricky , Lou Bega","Been There , Clint Black With Steve Wariner","Baby Don't Cry (Keep Ya Head Up II) , 2Pac + Outlawz","Baby Don't Cry (Keep Ya Head Up II) , 2Pac + Outlawz","Daddy Won't Sell The Farm , Montgomery Gentry","Shake Your Bon-Bon , Ricky Martin","Shake Your Bon-Bon , Ricky Martin","24/7 , Kevon Edmonds","Baby Don't Cry (Keep Ya Head Up II) , 2Pac + Outlawz","Mirror Mirror , M2M","Mirror Mirror , M2M","Mirror Mirror , M2M","Love Is Blind , Eve Featuring Faith Evans","Love Is Blind , Eve Featuring Faith Evans","U Don't Love Me , Kumbia Kings Featuring A.B. Quintanilla","It's So Hard , Big Punisher Featuring Donell Jones","Prayin' For Daylight , Rascal Flatts","Prayin' For Daylight , Rascal Flatts","Me Neither , Brad Paisley","This Time Around , Hanson","This Time Around , Hanson","Monica , Before Dark","Shut Up , Trick Daddy Featuring Duece Poppito, Trina, Co","Shut Up , Trick Daddy Featuring Duece Poppito, Trina, Co","Shut Up , Trick Daddy Featuring Duece Poppito, Trina, Co","Been There , Clint Black With Steve Wariner","Monica , Before Dark","Monica , Before Dark","Graduation (Friends Forever) , Vitamin C","Shut Up , Trick Daddy Featuring Duece Poppito, Trina, Co","Mirror Mirror , M2M","Mirror Mirror , M2M","What You Want , DMX Featuring Sisqo","Take That , Torrey Carter Featuring Missy ""Misdemeanor"" Elliott","Take That , Torrey Carter Featuring Missy ""Misdemeanor"" Elliott","I Disappear , Metallica","Sour Girl , Stone Temple Pilots","Crash And Burn , Savage Garden","Crash And Burn , Savage Garden","The Way I Am , Eminem","Broadway , Goo Goo Dolls","Broadway , Goo Goo Dolls","The Hardest Part Of Breaking Up (Is Getting Back Your Stuff) , 2Gether","Bad Boyz , Shyne Featuring Barrington Levy","Could I Have This Kiss Forever , Whitney Houston & Enrique Iglesias","Could I Have This Kiss Forever , Whitney Houston & Enrique Iglesias","Change Your Mind , Sister Hazel","Taking You Home , Don Henley","Taking You Home , Don Henley","You Should've Told Me , Kelly Price","What You Want , DMX Featuring Sisqo","Taking You Home , Don Henley","Taking You Home , Don Henley","Taking You Home , Don Henley","My Love Goes On And On , Chris Cagle","My Love Goes On And On , Chris Cagle","Meanwhile Back At The Ranch , The Clark Family Experience","I Will...But , SHeDAISY","What Means The World To You , Cam'ron","What Means The World To You , Cam'ron","My Baby You , Marc Anthony","Kiss This , Aaron Tippin","Kiss This , Aaron Tippin","It's My Life , Bon Jovi","Could It Be , Jaheim"
87,"There She Goes , Sixpence None The Richer","Bug A Boo , Destiny's Child","Notorious B.I.G. , The Notorious B.I.G. Featuring Puff Daddy & Lil' Kim","Bug A Boo , Destiny's Child","Bug A Boo , Destiny's Child","All Things Considered , Yankee Grey","Re-arranged , Limp Bizkit","Re-arranged , Limp Bizkit","The Best Man I Can Be , Ginuwine, R.L., Tyrese, Case","Angels , Robbie Williams","Party Up (Up In Here) , DMX","Party Up (Up In Here) , DMX","Put Your Hand In Mine , Tracy Byrd","Still In My Heart , Tracie Spencer","Still In My Heart , Tracie Spencer","Rhythm Divine , Enrique Iglesias","Got To Get It , Sisqo Featuring Make It Hot","Stay Or Let It Go , Brian McKnight","Stay Or Let It Go , Brian McKnight","One Night Stand , J-Shin Featuring LaTocha Scott","American Pie , Madonna","American Pie , Madonna","Blue (Da Ba Dee) , Eiffel 65","Mr. Too Damn Good , Gerald Levert","Flowers On The Wall , Eric Heatherly","Flowers On The Wall , Eric Heatherly","Flowers On The Wall , Eric Heatherly","Desert Rose , Sting Featuring Cheb Mami","Desert Rose , Sting Featuring Cheb Mami","I Disappear , Metallica","Goodbye Earl , Dixie Chicks","Another Nine Minutes , Yankee Grey","Another Nine Minutes , Yankee Grey","When You Need My Love , Darryl Worley","You Owe Me , NAS Featuring Ginuwine","You Owe Me , NAS Featuring Ginuwine","Take That , Torrey Carter Featuring Missy ""Misdemeanor"" Elliott","It's So Hard , Big Punisher Featuring Donell Jones","Buy Me A Rose , Kenny Rogers With Alison Krauss & Billy Dean","Buy Me A Rose , Kenny Rogers With Alison Krauss & Billy Dean","Got It All , Eve & Jadakiss","Got It All , Eve & Jadakiss","Got It All , Eve & Jadakiss","Same Script, Different Cast , Whitney Houston & Deborah Cox","I Disappear , Metallica","West Side Story , LFO","West Side Story , LFO","Sour Girl , Stone Temple Pilots","The Real Slim Shady , Eminem","The Real Slim Shady , Eminem","Simple Kind Of Life , No Doubt","Don't Call Me Baby , Madison Avenue","Don't Call Me Baby , Madison Avenue","Don't Call Me Baby , Madison Avenue","Don't Call Me Baby , Madison Avenue","Can't Go For That , Tamia","Can't Go For That , Tamia","That's The Kind Of Mood I'm In , Patty Loveless","That's The Kind Of Mood I'm In , Patty Loveless","You Won't Be Lonely Now , Billy Ray Cyrus","You Won't Be Lonely Now , Billy Ray Cyrus","Let's Make Love , Faith Hill With Tim McGraw","Hey Papi , Jay-Z Featuring Memphis Bleek & Amil","Hey Papi , Jay-Z Featuring Memphis Bleek & Amil","Summer Rain , Carl Thomas","What Means The World To You , Cam'ron","Bad Boyz , Shyne Featuring Barrington Levy","Bad Boyz , Shyne Featuring Barrington Levy","Oklahoma , Billy Gilman","Can't Fight The Moonlight , LeAnn Rimes","Can't Fight The Moonlight , LeAnn Rimes","Go On , George Strait","A Little Gasoline , Terri Clark"
88,"The Greatest Romance Ever Sold , Prince","(You Drive Me) Crazy , Britney Spears","Back At One , Mark Wills","G'd Up , Snoop Dogg Presents Tha Eastsidaz","G'd Up , Snoop Dogg Presents Tha Eastsidaz","Home To You , John Michael Montgomery","The Chemicals Between Us , Bush","The Chemicals Between Us , Bush","Re-arranged , Limp Bizkit","You Can Do It , Ice Cube Featuring Mack 10 & Ms. Toi","Left, Right, Left , Drama","Left, Right, Left , Drama","Candy , Mandy Moore","Re-arranged , Limp Bizkit","Re-arranged , Limp Bizkit","Angels , Robbie Williams","The Best Man I Can Be , Ginuwine, R.L., Tyrese, Case","No More Rain (In This Cloud) , Angie Stone","No More Rain (In This Cloud) , Angie Stone","Private Emotion , Ricky Martin Featuring Meja","If You Don't Wanna Love Me , Tamar Braxton","If You Don't Wanna Love Me , Tamar Braxton","Thank God I Found You , Mariah Carey Featuring Joe & 98 Degrees","U Don't Love Me , Kumbia Kings Featuring A.B. Quintanilla","Falls Apart , Sugar Ray","Falls Apart , Sugar Ray","I'll Be , Reba McEntire","Whistle While You Twurk , Ying Yang Twins","Whistle While You Twurk , Ying Yang Twins","Give Me You , Mary J. Blige","Nothing As It Seems , Pearl Jam","I Like It , Sammie","I Like It , Sammie","3 Little Words , Nu Flavor","3 Little Words , Nu Flavor","3 Little Words , Nu Flavor","Shut Up , Trick Daddy Featuring Duece Poppito, Trina, Co","Someday Out Of The Blue , Elton John","Got It All , Eve & Jadakiss","Got It All , Eve & Jadakiss","Take That , Torrey Carter Featuring Missy ""Misdemeanor"" Elliott","Couldn't Last A Moment , Collin Raye","Couldn't Last A Moment , Collin Raye","Callin' Me , Lil' Zane Featuring 112","I Think God Can Explain , Splender","Sour Girl , Stone Temple Pilots","Sour Girl , Stone Temple Pilots","Baby U Are , Gerald Levert","As We Lay , Kelly Price","As We Lay , Kelly Price","Flowers On The Wall , Eric Heatherly","I Disappear , Metallica","I Will Love Again , Lara Fabian","I Will Love Again , Lara Fabian","What's Your Fantasy , Ludacris Featuring Shawnna","I Think I'm In Love With You , Jessica Simpson","I Think I'm In Love With You , Jessica Simpson","Just Friends (Sunny) , Musiq","The Way I Am , Eminem","What You Want , DMX Featuring Sisqo","What You Want , DMX Featuring Sisqo","It Must Be Love , Alan Jackson","Treat Her Like A Lady , Joe","Treat Her Like A Lady , Joe","The Light , Common","Californication , Red Hot Chili Peppers","Just Be A Man About It , Toni Braxton","Just Be A Man About It , Toni Braxton","You Won't Be Lonely Now , Billy Ray Cyrus","Oklahoma , Billy Gilman","Oklahoma , Billy Gilman","My Baby You , Marc Anthony","How Many Licks? , Lil' Kim Featuring Sisqo"
