51,"All The Small Things , Blink-182","Cowboy Take Me Away , Dixie Chicks","Pop A Top , Alan Jackson","Satisfy You , Puff Daddy Featuring R. Kelly","Satisfy You , Puff Daddy Featuring R. Kelly","It Feels So Good , Sonique","He Didn't Have To Be , Brad Paisley","He Didn't Have To Be , Brad Paisley","From The Bottom Of My Broken Heart , Britney Spears","From The Bottom Of My Broken Heart , Britney Spears","Dear Lie , TLC","Dear Lie , TLC","Otherside , Red Hot Chili Peppers","Love's The Only House , Martina McBride","Love's The Only House , Martina McBride","Love's The Only House , Martina McBride","Whoa! , Black Rob","Back At One , Mark Wills","Back At One , Mark Wills","Falls Apart , Sugar Ray","The Bad Touch , Bloodhound Gang","The Bad Touch , Bloodhound Gang","She's More , Andy Griggs","Big Pimpin' , Jay-Z Featuring UGK","I Like It , Sammie","I Like It , Sammie","Carlene , Phil Vassar","Back Here , BBMak","Back Here , BBMak","Absolutely (Story Of A Girl) , Nine Days","How Do You Like Me Now?! , Toby Keith","Only God Knows Why , Kid Rock","Only God Knows Why , Kid Rock","Desert Rose , Sting Featuring Cheb Mami","Doesn't Really Matter , Janet","Doesn't Really Matter , Janet","Unconditional , Clay Davidson","I Think I'm In Love With You , Jessica Simpson","I Will Love Again , Lara Fabian","I Will Love Again , Lara Fabian","I'll Be , Reba McEntire","I Wish , Carl Thomas","I Wish , Carl Thomas","Could I Have This Kiss Forever , Whitney Houston & Enrique Iglesias","Simple Kind Of Life , No Doubt","I Will...But , SHeDAISY","I Will...But , SHeDAISY","Most Girls , P!nk","Case Of The Ex (Whatcha Gonna Do) , Mya","Case Of The Ex (Whatcha Gonna Do) , Mya","What You Want , DMX Featuring Sisqo","Liar , Profyle","Kiss This , Aaron Tippin","Kiss This , Aaron Tippin","The Next Episode , Dr. Dre Featuring Snoop Dogg","I Will...But , SHeDAISY","I Will...But , SHeDAISY","The Light , Common","If You're Gone , matchbox twenty","We Danced , Brad Paisley","We Danced , Brad Paisley","We Danced , Brad Paisley","My Next Thirty Years , Tim McGraw","My Next Thirty Years , Tim McGraw","Feels Like Love , Vince Gill","Just Friends (Sunny) , Musiq","Feels Like Love , Vince Gill","Feels Like Love , Vince Gill","Hemorrhage (In My Hands) , Fuel","No More (Baby I'ma Do Right) , 3LW","No More (Baby I'ma Do Right) , 3LW","The Itch , Vitamin C","Mamacita , Public Announcement"
52,"This Gift , 98 Degrees","What Do You Say , Reba","When I Said I Do , Clint Black","Angels , Robbie Williams","Angels , Robbie Williams","Got Your Money , Ol' Dirty Bastard Featuring Kelis","Everything You Want , Vertical Horizon","Everything You Want , Vertical Horizon","24/7 , Kevon Edmonds","How Do You Like Me Now?! , Toby Keith","Black Balloon , Goo Goo Dolls","Black Balloon , Goo Goo Dolls","Love's The Only House , Martina McBride","Because You Love Me , Jo Dee Messina","Because You Love Me , Jo Dee Messina","Whoa! , Black Rob","Try Again , Aaliyah","He Can't Love U , Jagged Edge","He Can't Love U , Jagged Edge","Carlene , Phil Vassar","I Learned From The Best , Whitney Houston","I Learned From The Best , Whitney Houston","Better Off Alone , Alice Deejay","Another Dumb Blonde , Hoku","Broadway , Goo Goo Dolls","Broadway , Goo Goo Dolls","Been There , Clint Black With Steve Wariner","Been There , Clint Black With Steve Wariner","Been There , Clint Black With Steve Wariner","Kryptonite , 3 Doors Down","The Best Day , George Strait","Wobble Wobble , 504 Boyz","Wobble Wobble , 504 Boyz","The Next Episode , Dr. Dre Featuring Snoop Dogg","Shackles (Praise You) , Mary Mary","Shackles (Praise You) , Mary Mary","The Chain Of Love , Clay Walker","Couldn't Last A Moment , Collin Raye","I Need You , LeAnn Rimes","I Need You , LeAnn Rimes","Wonderful , Everclear","Flowers On The Wall , Eric Heatherly","Flowers On The Wall , Eric Heatherly","I'll Be , Reba McEntire","Yes! , Chad Brock","The Light , Common","The Light , Common","Bag Lady , Erykah Badu","I Wanna Be With You , Mandy Moore","I Wanna Be With You , Mandy Moore","Your Everything , Keith Urban","Kiss This , Aaron Tippin","Go On , George Strait","Go On , George Strait","Who Let The Dogs Out , Baha Men","Who Let The Dogs Out , Baha Men","Who Let The Dogs Out , Baha Men","Just Be A Man About It , Toni Braxton","Just Be A Man About It , Toni Braxton","Just Another Day In Paradise , Phil Vassar","Just Another Day In Paradise , Phil Vassar","911 , Wyclef Jean Featuring Mary J. Blige","Feels Like Love , Vince Gill","Feels Like Love , Vince Gill","Bounce With Me , Lil Bow Wow Featuring Xscape","I Lost It , Kenny Chesney","Hemorrhage (In My Hands) , Fuel","Hemorrhage (In My Hands) , Fuel","So In Love With Two , Mikaila","So In Love With Two , Mikaila","So In Love With Two , Mikaila","Stronger , Britney Spears","911 , Wyclef Jean Featuring Mary J. Blige"
53,"Auld Lang Syne , Kenny G","Caught Out There , Kelis","Angels , Robbie Williams","Shake Your Bon-Bon , Ricky Martin","Shake Your Bon-Bon , Ricky Martin","Falls Apart , Sugar Ray","You Can Do It , Ice Cube Featuring Mack 10 & Ms. Toi","You Can Do It , Ice Cube Featuring Mack 10 & Ms. Toi","The Best Day , George Strait","Got Your Money , Ol' Dirty Bastard Featuring Kelis","I Wanna Love You Forever , Jessica Simpson","I Wanna Love You Forever , Jessica Simpson","You Sang To Me , Marc Anthony","Feelin' So Good , Jennifer Lopez Featuring Big Pun & Fat Joe","Feelin' So Good , Jennifer Lopez Featuring Big Pun & Fat Joe","Feelin' So Good , Jennifer Lopez Featuring Big Pun & Fat Joe","Feelin' So Good , Jennifer Lopez Featuring Big Pun & Fat Joe","Feelin' So Good , Jennifer Lopez Featuring Big Pun & Fat Joe","Feelin' So Good , Jennifer Lopez Featuring Big Pun & Fat Joe","Buy Me A Rose , Kenny Rogers With Alison Krauss & Billy Dean","Shackles (Praise You) , Mary Mary","Shackles (Praise You) , Mary Mary","From The Bottom Of My Broken Heart , Britney Spears","Graduation (Friends Forever) , Vitamin C","Graduation (Friends Forever) , Vitamin C","Graduation (Friends Forever) , Vitamin C","Whoa! , Black Rob","Kryptonite , 3 Doors Down","Kryptonite , 3 Doors Down","Buy Me A Rose , Kenny Rogers With Alison Krauss & Billy Dean","Unconditional , Clay Davidson","How Do You Like Me Now?! , Toby Keith","How Do You Like Me Now?! , Toby Keith","What'Chu Like , Da Brat Featuring Tyrese","What'Chu Like , Da Brat Featuring Tyrese","What'Chu Like , Da Brat Featuring Tyrese","I Wanna Be With You , Mandy Moore","Prayin' For Daylight , Rascal Flatts","That's The Way , Jo Dee Messina","That's The Way , Jo Dee Messina","Whatever , Ideal Featuring Lil' Mo","Whatever , Ideal Featuring Lil' Mo","Whatever , Ideal Featuring Lil' Mo","Whatever , Ideal Featuring Lil' Mo","Could I Have This Kiss Forever , Whitney Houston & Enrique Iglesias","Dance Tonight , Lucy Pearl","Dance Tonight , Lucy Pearl","Who Let The Dogs Out , Baha Men","I Hope You Dance , Lee Ann Womack","I Hope You Dance , Lee Ann Womack","Dance With Me , Debelah Morgan","Who Let The Dogs Out , Baha Men","Who Let The Dogs Out , Baha Men","Who Let The Dogs Out , Baha Men","What About Now , Lonestar","I Wish , R. Kelly","I Wish , R. Kelly","Country Comes To Town , Toby Keith","Let's Make Love , Faith Hill With Tim McGraw","Feels Like Love , Vince Gill","Feels Like Love , Vince Gill","Feels Like Love , Vince Gill","Just Friends (Sunny) , Musiq","Just Friends (Sunny) , Musiq","Just Friends (Sunny) , Musiq","www.memory , Alan Jackson","Girls Dem Sugar , Beenie Man Featuring Mya","Girls Dem Sugar , Beenie Man Featuring Mya","Liar , Profyle","Don't Tell Me , Madonna","Don't Tell Me , Madonna","Emotional , Carl Thomas","One Woman Man , Dave Hollister"
54,"Angels , Robbie Williams","My Best Friend , Tim McGraw","Show Me The Meaning Of Being Lonely , Backstreet Boys","Back At One , Mark Wills","Back At One , Mark Wills","Forgot About Dre , Dr. Dre Featuring Eminem","Pop A Top , Alan Jackson","Pop A Top , Alan Jackson","None Of Ur Friends Business , Ginuwine","Dear Lie , TLC","G'd Up , Snoop Dogg Presents Tha Eastsidaz","G'd Up , Snoop Dogg Presents Tha Eastsidaz","Because You Love Me , Jo Dee Messina","Anything , JAY-Z","Anything , JAY-Z","Anything , JAY-Z","He Wasn't Man Enough , Toni Braxton","The Bad Touch , Bloodhound Gang","The Bad Touch , Bloodhound Gang","The Bad Touch , Bloodhound Gang","She's More , Andy Griggs","She's More , Andy Griggs","Swear It Again , Westlife","Swear It Again , Westlife","Been There , Clint Black With Steve Wariner","Been There , Clint Black With Steve Wariner","Best Of Me , Mya Featuring Jadakiss","Let's Get Married , Jagged Edge","Let's Get Married , Jagged Edge","(Hot S**t) Country Grammar , Nelly","I Hope You Dance , Lee Ann Womack","Desert Rose , Sting Featuring Cheb Mami","Desert Rose , Sting Featuring Cheb Mami","Dance Tonight , Lucy Pearl","Unconditional , Clay Davidson","Unconditional , Clay Davidson","The Way You Love Me , Faith Hill","I'll Be , Reba McEntire","I'll Be , Reba McEntire","I'll Be , Reba McEntire","The One , Backstreet Boys","Incomplete , Sisqo","Incomplete , Sisqo","One Voice , Billy Gilman","The Light , Common","Simple Kind Of Life , No Doubt","Simple Kind Of Life , No Doubt","Where I Wanna Be , Donell Jones","You're A God , Vertical Horizon","You're A God , Vertical Horizon","You'll Always Be Loved By Me , Brooks & Dunn","What You Want , DMX Featuring Sisqo","Your Everything , Keith Urban","Your Everything , Keith Urban","Country Comes To Town , Toby Keith","Country Comes To Town , Toby Keith","Country Comes To Town , Toby Keith","Let's Make Love , Faith Hill With Tim McGraw","What's Your Fantasy , Ludacris Featuring Shawnna","Aaron's Party (Come Get It) , Aaron Carter","Aaron's Party (Come Get It) , Aaron Carter","Just Friends (Sunny) , Musiq","Ms. Jackson , OutKast","Ms. Jackson , OutKast","Born To Fly , Sara Evans","Feels Like Love , Vince Gill","Loser , 3 Doors Down","Loser , 3 Doors Down","Stronger , Britney Spears","Stronger , Britney Spears","Stronger , Britney Spears","Danger (Been So Long) , Mystikal Featuring Nivea","Stan , Eminem Featuring Dido"
55,"Say My Name , Destiny's Child","When I Said I Do , Clint Black","Caught Out There , Kelis","No More Rain (In This Cloud) , Angie Stone","No More Rain (In This Cloud) , Angie Stone","Untitled (How Does It Feel) , D'Angelo","No More Rain (In This Cloud) , Angie Stone","No More Rain (In This Cloud) , Angie Stone","Waiting For Tonight , Jennifer Lopez","Big Deal , LeAnn Rimes","Hanginaround , Counting Crows","Hanginaround , Counting Crows","Got Your Money , Ol' Dirty Bastard Featuring Kelis","Dear Lie , TLC","Dear Lie , TLC","Party Up (Up In Here) , DMX","Cowboy Take Me Away , Dixie Chicks","Blue (Da Ba Dee) , Eiffel 65","Blue (Da Ba Dee) , Eiffel 65","The Way You Love Me , Faith Hill","That's What I'm Looking For , Da Brat","That's What I'm Looking For , Da Brat","Someday Out Of The Blue , Elton John","Someday Out Of The Blue , Elton John","Another Dumb Blonde , Hoku","Another Dumb Blonde , Hoku","Couldn't Last A Moment , Collin Raye","Carlene , Phil Vassar","Carlene , Phil Vassar","Unconditional , Clay Davidson","Best Of Me , Mya Featuring Jadakiss","What I Need To Do , Kenny Chesney","What I Need To Do , Kenny Chesney","What I Need To Do , Kenny Chesney","What I Need To Do , Kenny Chesney","What I Need To Do , Kenny Chesney","Prayin' For Daylight , Rascal Flatts","What About Now , Lonestar","Whatever , Ideal Featuring Lil' Mo","Whatever , Ideal Featuring Lil' Mo","One Voice , Billy Gilman","One Voice , Billy Gilman","One Voice , Billy Gilman","Faded , SoulDecision Featuring Thrust","Swear It Again , Westlife","Could I Have This Kiss Forever , Whitney Houston & Enrique Iglesias","Could I Have This Kiss Forever , Whitney Houston & Enrique Iglesias","You'll Always Be Loved By Me , Brooks & Dunn","You'll Always Be Loved By Me , Brooks & Dunn","You'll Always Be Loved By Me , Brooks & Dunn","I Hope You Dance , Lee Ann Womack","Go On , George Strait","Best Of Intentions , Travis Tritt","Best Of Intentions , Travis Tritt","The Little Girl , John Michael Montgomery","The Light , Common","The Light , Common","I Will...But , SHeDAISY","The Light , Common","Without You , Dixie Chicks","Without You , Dixie Chicks","My Next Thirty Years , Tim McGraw","Girls Dem Sugar , Beenie Man Featuring Mya","Girls Dem Sugar , Beenie Man Featuring Mya","My First Love , Avant Featuring KeKe Wyatt","Go On , George Strait","Go On , George Strait","Go On , George Strait","Tell Her , Lonestar","Tell Her , Lonestar","Tell Her , Lonestar","Bag Lady , Erykah Badu","Ashes By Now , Lee Ann Womack"
56,"Pop A Top , Alan Jackson","Higher , Creed","Will 2K , Will Smith Featuring K-Ci","Love Is Blind , Eve Featuring Faith Evans","Love Is Blind , Eve Featuring Faith Evans","The Great Beyond , R.E.M.","G'd Up , Snoop Dogg Presents Tha Eastsidaz","G'd Up , Snoop Dogg Presents Tha Eastsidaz","He Didn't Have To Be , Brad Paisley","Got To Get It , Sisqo Featuring Make It Hot","Got Your Money , Ol' Dirty Bastard Featuring Kelis","Got Your Money , Ol' Dirty Bastard Featuring Kelis","This Woman Needs , SHeDAISY","This Woman Needs , SHeDAISY","This Woman Needs , SHeDAISY","Because You Love Me , Jo Dee Messina","Been There , Clint Black With Steve Wariner","Carlene , Phil Vassar","Carlene , Phil Vassar","Thank God I Found You , Mariah Carey Featuring Joe & 98 Degrees","Wobble Wobble , 504 Boyz","Wobble Wobble , 504 Boyz","The Bad Touch , Bloodhound Gang","The Chain Of Love , Clay Walker","The Chain Of Love , Clay Walker","The Chain Of Love , Clay Walker","Kryptonite , 3 Doors Down","Whoa! , Black Rob","Whoa! , Black Rob","What I Need To Do , Kenny Chesney","What I Need To Do , Kenny Chesney","Jumpin', Jumpin' , Destiny's Child","Jumpin', Jumpin' , Destiny's Child","Wobble Wobble , 504 Boyz","Graduation (Friends Forever) , Vitamin C","Graduation (Friends Forever) , Vitamin C","I'll Be , Reba McEntire","The Chain Of Love , Clay Walker","Better Off Alone , Alice Deejay","Better Off Alone , Alice Deejay","It Must Be Love , Alan Jackson","Broadway , Goo Goo Dolls","Broadway , Goo Goo Dolls","Come On Over Baby (All I Want Is You) , Christina Aguilera","Callin' Me , Lil' Zane Featuring 112","Flowers On The Wall , Eric Heatherly","Flowers On The Wall , Eric Heatherly","Case Of The Ex (Whatcha Gonna Do) , Mya","What You Want , DMX Featuring Sisqo","What You Want , DMX Featuring Sisqo","Aaron's Party (Come Get It) , Aaron Carter","It's Always Somethin' , Joe Diffie","I Think I'm In Love With You , Jessica Simpson","I Think I'm In Love With You , Jessica Simpson","What You Want , DMX Featuring Sisqo","Let's Make Love , Faith Hill With Tim McGraw","Let's Make Love , Faith Hill With Tim McGraw","E.I. , Nelly","Open My Heart , Yolanda Adams","Bad Boyz , Shyne Featuring Barrington Levy","Bad Boyz , Shyne Featuring Barrington Levy","It Wasn't Me , Shaggy Featuring Ricardo ""RikRok"" Ducent","Born To Fly , Sara Evans","Born To Fly , Sara Evans","Stan , Eminem Featuring Dido","Stan , Eminem Featuring Dido","Last Resort , Papa Roach","Last Resort , Papa Roach","Feels Like Love , Vince Gill","The Little Girl , John Michael Montgomery","The Little Girl , John Michael Montgomery","Stan , Eminem Featuring Dido","The Itch , Vitamin C"
57,"Caught Out There , Kelis","Will 2K , Will Smith Featuring K-Ci","Sexual (Li Da Di) , Amber","Sexual (Li Da Di) , Amber","Sexual (Li Da Di) , Amber","Dancin' , Guy","Dancin' , Guy","Dancin' , Guy","I Like It , Sammie","24/7 , Kevon Edmonds","Love's The Only House , Martina McBride","Love's The Only House , Martina McBride","Anything , JAY-Z","Been There , Clint Black With Steve Wariner","Been There , Clint Black With Steve Wariner","Been There , Clint Black With Steve Wariner","One Night Stand , J-Shin Featuring LaTocha Scott","Smile , Lonestar","Smile , Lonestar","American Pie , Madonna","Crash And Burn , Savage Garden","Crash And Burn , Savage Garden","That's What I'm Looking For , Da Brat","Broadway , Goo Goo Dolls","Whoa! , Black Rob","Whoa! , Black Rob","Forgot About Dre , Dr. Dre Featuring Eminem","What I Need To Do , Kenny Chesney","What I Need To Do , Kenny Chesney","The One , Backstreet Boys","Buy Me A Rose , Kenny Rogers With Alison Krauss & Billy Dean","The Next Episode , Dr. Dre Featuring Snoop Dogg","The Next Episode , Dr. Dre Featuring Snoop Dogg","Prayin' For Daylight , Rascal Flatts","Prayin' For Daylight , Rascal Flatts","Prayin' For Daylight , Rascal Flatts","Some Things Never Change , Tim McGraw","Some Things Never Change , Tim McGraw","Some Things Never Change , Tim McGraw","Some Things Never Change , Tim McGraw","Some Things Never Change , Tim McGraw","Crash And Burn , Savage Garden","Crash And Burn , Savage Garden","Taking You Home , Don Henley","Taking You Home , Don Henley","It's My Life , Bon Jovi","It's My Life , Bon Jovi","What You Want , DMX Featuring Sisqo","Dance With Me , Debelah Morgan","Dance With Me , Debelah Morgan","Who Let The Dogs Out , Baha Men","What'Chu Like , Da Brat Featuring Tyrese","Country Comes To Town , Toby Keith","Country Comes To Town , Toby Keith","The Way I Am , Eminem","The Next Episode , Dr. Dre Featuring Snoop Dogg","The Next Episode , Dr. Dre Featuring Snoop Dogg","Open My Heart , Yolanda Adams","Feels Like Love , Vince Gill","I Just Wanna Love U (Give It 2 Me) , JAY-Z","I Just Wanna Love U (Give It 2 Me) , JAY-Z","Crazy For This Girl , Evan And Jaron","I Lost It , Kenny Chesney","I Lost It , Kenny Chesney","I Lost It , Kenny Chesney","It's My Life , Bon Jovi","Tell Her , Lonestar","Tell Her , Lonestar","No More (Baby I'ma Do Right) , 3LW","Emotional , Carl Thomas","Emotional , Carl Thomas","Shake Ya Ass , Mystikal","Burn , Jo Dee Messina"
58,"15 Minutes , Marc Nelson","Sexual (Li Da Di) , Amber","Bling Bling , B.G. Featuring Baby, Turk, Mannie Fresh, Juvenile & Lil' Wayne","Caught Out There , Kelis","Caught Out There , Kelis","If You Love Me , Mint Condition","From The Bottom Of My Broken Heart , Britney Spears","From The Bottom Of My Broken Heart , Britney Spears","How Do You Like Me Now?! , Toby Keith","Best Friend , Puff Daddy Featuring Mario Winans & Hezekiah Walker & The Love Fe","The Great Beyond , R.E.M.","The Great Beyond , R.E.M.","Hanginaround , Counting Crows","Whoa! , Black Rob","Whoa! , Black Rob","Try Again , Aaliyah","Love Is Blind , Eve Featuring Faith Evans","Cowboy Take Me Away , Dixie Chicks","Cowboy Take Me Away , Dixie Chicks","Cowboy Take Me Away , Dixie Chicks","You Owe Me , NAS Featuring Ginuwine","You Owe Me , NAS Featuring Ginuwine","You Owe Me , NAS Featuring Ginuwine","You Owe Me , NAS Featuring Ginuwine","Yes! , Chad Brock","Yes! , Chad Brock","Someday Out Of The Blue , Elton John","Absolutely (Story Of A Girl) , Nine Days","Absolutely (Story Of A Girl) , Nine Days","Carlene , Phil Vassar","Desert Rose , Sting Featuring Cheb Mami","Dance Tonight , Lucy Pearl","Dance Tonight , Lucy Pearl","Doesn't Really Matter , Janet","I Need You , LeAnn Rimes","I Need You , LeAnn Rimes","I Need You , LeAnn Rimes","I Need You , LeAnn Rimes","Could I Have This Kiss Forever , Whitney Houston & Enrique Iglesias","Could I Have This Kiss Forever , Whitney Houston & Enrique Iglesias","Could I Have This Kiss Forever , Whitney Houston & Enrique Iglesias","Some Things Never Change , Tim McGraw","Some Things Never Change , Tim McGraw","Change Your Mind , Sister Hazel","I Will...But , SHeDAISY","Yes! , Chad Brock","Yes! , Chad Brock","Could I Have This Kiss Forever , Whitney Houston & Enrique Iglesias","Your Everything , Keith Urban","Your Everything , Keith Urban","The Way I Am , Eminem","Country Comes To Town , Toby Keith","The Way I Am , Eminem","The Way I Am , Eminem","Callin' Me , Lil' Zane Featuring 112","The Way I Am , Eminem","The Way I Am , Eminem","Feels Like Love , Vince Gill","He Loves U Not , Dream","Open My Heart , Yolanda Adams","Open My Heart , Yolanda Adams","That's The Way , Jo Dee Messina","www.memory , Alan Jackson","www.memory , Alan Jackson","www.memory , Alan Jackson","Again , Lenny Kravitz","Open My Heart , Yolanda Adams","Open My Heart , Yolanda Adams","Loser , 3 Doors Down","My Everything , 98 Degrees","My Everything , 98 Degrees","Mamacita , Public Announcement","South Side , Moby Featuring Gwen Stefani"
59,"Heartbreaker , Mariah Carey Featuring Jay-Z","None Of Ur Friends Business , Ginuwine","Higher , Creed","The Great Beyond , R.E.M.","The Great Beyond , R.E.M.","No More Rain (In This Cloud) , Angie Stone","Got Your Money , Ol' Dirty Bastard Featuring Kelis","Got Your Money , Ol' Dirty Bastard Featuring Kelis","No More Rain (In This Cloud) , Angie Stone","The Great Beyond , R.E.M.","What Do You Say , Reba","What Do You Say , Reba","The Great Beyond , R.E.M.","That's What I'm Looking For , Da Brat","That's What I'm Looking For , Da Brat","That's What I'm Looking For , Da Brat","That's What I'm Looking For , Da Brat","That's What I'm Looking For , Da Brat","That's What I'm Looking For , Da Brat","Blue (Da Ba Dee) , Eiffel 65","Falls Apart , Sugar Ray","Falls Apart , Sugar Ray","Untitled (How Does It Feel) , D'Angelo","Bent , matchbox twenty","Love's The Only House , Martina McBride","Love's The Only House , Martina McBride","Back Here , BBMak","Unconditional , Clay Davidson","Unconditional , Clay Davidson","Someday Out Of The Blue , Elton John","Purest Of Pain (A Puro Dolor) , Son By Four","Purest Of Pain (A Puro Dolor) , Son By Four","Purest Of Pain (A Puro Dolor) , Son By Four","Some Things Never Change , Tim McGraw","Some Things Never Change , Tim McGraw","Some Things Never Change , Tim McGraw","Shackles (Praise You) , Mary Mary","I Will Love Again , Lara Fabian","Flowers On The Wall , Eric Heatherly","Flowers On The Wall , Eric Heatherly","Flowers On The Wall , Eric Heatherly","Could I Have This Kiss Forever , Whitney Houston & Enrique Iglesias","Could I Have This Kiss Forever , Whitney Houston & Enrique Iglesias","No Matter What They Say , Lil' Kim","I'll Be , Reba McEntire","What You Want , DMX Featuring Sisqo","What You Want , DMX Featuring Sisqo","Your Everything , Keith Urban","Whatever , Ideal Featuring Lil' Mo","Whatever , Ideal Featuring Lil' Mo","It's Always Somethin' , Joe Diffie","Let's Make Love , Faith Hill With Tim McGraw","Let's Make Love , Faith Hill With Tim McGraw","Let's Make Love , Faith Hill With Tim McGraw","Let's Make Love , Faith Hill With Tim McGraw","What About Now , Lonestar","What About Now , Lonestar","Last Resort , Papa Roach","There You Are , Martina McBride","There You Are , Martina McBride","There You Are , Martina McBride","There You Are , Martina McBride","Kiss This , Aaron Tippin","Kiss This , Aaron Tippin","Pop Ya Collar , Usher","Pop Ya Collar , Usher","No More (Baby I'ma Do Right) , 3LW","No More (Baby I'ma Do Right) , 3LW","Girls Dem Sugar , Beenie Man Featuring Mya","Crazy , K-Ci & JoJo","Crazy , K-Ci & JoJo","Burn , Jo Dee Messina","Project Chick , Cash Money Millionaires"
60,"Higher , Creed","Deck The Halls , SHeDAISY","Heartbreaker , Mariah Carey Featuring Jay-Z","Higher , Creed","Higher , Creed","Everything You Want , Vertical Horizon","The Great Beyond , R.E.M.","The Great Beyond , R.E.M.","Lessons Learned , Tracy Lawrence","Lessons Learned , Tracy Lawrence","Rhythm Divine , Enrique Iglesias","Rhythm Divine , Enrique Iglesias","Rhythm Divine , Enrique Iglesias","Hanginaround , Counting Crows","Hanginaround , Counting Crows","This Woman Needs , SHeDAISY","Because You Love Me , Jo Dee Messina","Because You Love Me , Jo Dee Messina","Because You Love Me , Jo Dee Messina","Because You Love Me , Jo Dee Messina","Feelin' So Good , Jennifer Lopez Featuring Big Pun & Fat Joe","Feelin' So Good , Jennifer Lopez Featuring Big Pun & Fat Joe","I Don't Wanna Kiss You Goodnight , LFO","Yes! , Chad Brock","I Don't Wanna , Aaliyah","I Don't Wanna , Aaliyah","I Like It , Sammie","Goodbye Earl , Dixie Chicks","Goodbye Earl , Dixie Chicks","I Hope You Dance , Lee Ann Womack","Wifey , Next","Best Of Me , Mya Featuring Jadakiss","Best Of Me , Mya Featuring Jadakiss","Best Of Me , Mya Featuring Jadakiss","I'll Be , Reba McEntire","I'll Be , Reba McEntire","I Will Love Again , Lara Fabian","Incomplete , Sisqo","Incomplete , Sisqo","Incomplete , Sisqo","Incomplete , Sisqo","The One , Backstreet Boys","The One , Backstreet Boys","I Will...But , SHeDAISY","Lucky , Britney Spears","Taking You Home , Don Henley","Taking You Home , Don Henley","Don't Think I'm Not , Kandi","Who Let The Dogs Out , Baha Men","Who Let The Dogs Out , Baha Men","Last Resort , Papa Roach","Last Resort , Papa Roach","One Voice , Billy Gilman","One Voice , Billy Gilman","Between Me And You , Ja Rule Featuring Christina Milian","Open My Heart , Yolanda Adams","Open My Heart , Yolanda Adams","What About Now , Lonestar","Bad Boyz , Shyne Featuring Barrington Levy","911 , Wyclef Jean Featuring Mary J. Blige","911 , Wyclef Jean Featuring Mary J. Blige","I Lost It , Kenny Chesney","Beautiful Day , U2","Beautiful Day , U2","Open My Heart , Yolanda Adams","Bounce With Me , Lil Bow Wow Featuring Xscape","It's My Life , Bon Jovi","It's My Life , Bon Jovi","Emotional , Carl Thomas","Liar , Profyle","Liar , Profyle","Loser , 3 Doors Down","Loser , 3 Doors Down"
