21,"Learn To Fly , Foo Fighters","Dancin' , Guy","Steal My Sunshine , Len","Girl On TV , LFO","Girl On TV , LFO","Thank God I Found You , Mariah Carey Featuring Joe & 98 Degrees","Thank God I Found You , Mariah Carey Featuring Joe & 98 Degrees","Thank God I Found You , Mariah Carey Featuring Joe & 98 Degrees","Shake Your Bon-Bon , Ricky Martin","My Love Is Your Love , Whitney Houston","Never Let You Go , Third Eye Blind","Never Let You Go , Third Eye Blind","Never Let You Go , Third Eye Blind","Take A Picture , Filter","Take A Picture , Filter","Everything You Want , Vertical Horizon","I Need To Know , Marc Anthony","I Need To Know , Marc Anthony","I Need To Know , Marc Anthony","Back At One , Brian McKnight","Bring It All To Me , Blaque","Bring It All To Me , Blaque","This Time Around , Hanson","This Time Around , Hanson","Higher , Creed","Higher , Creed","Never Let You Go , Third Eye Blind","I Wish , Carl Thomas","I Wish , Carl Thomas","Bent , matchbox twenty","I Wish , Carl Thomas","Amazed , Lonestar","Amazed , Lonestar","Amazed , Lonestar","Otherside , Red Hot Chili Peppers","Otherside , Red Hot Chili Peppers","Yes! , Chad Brock","Jumpin', Jumpin' , Destiny's Child","Wifey , Next","Wifey , Next","Doesn't Really Matter , Janet","Kryptonite , 3 Doors Down","Kryptonite , 3 Doors Down","Breathe , Faith Hill","You Sang To Me , Marc Anthony","Breathe , Faith Hill","Breathe , Faith Hill","There You Go , P!nk","Wonderful , Everclear","Wonderful , Everclear","Faded , SoulDecision Featuring Thrust","Faded , SoulDecision Featuring Thrust","Shake Ya Ass , Mystikal","Shake Ya Ass , Mystikal","Try Again , Aaliyah","Back Here , BBMak","Back Here , BBMak","Bounce With Me , Lil Bow Wow Featuring Xscape","Between Me And You , Ja Rule Featuring Christina Milian","Between Me And You , Ja Rule Featuring Christina Milian","Between Me And You , Ja Rule Featuring Christina Milian","Give Me Just One Night (Una Noche) , 98 Degrees","I Wish , R. Kelly","I Wish , R. Kelly","E.I. , Nelly","No More , Ruff Endz","Come On Over Baby (All I Want Is You) , Christina Aguilera","Come On Over Baby (All I Want Is You) , Christina Aguilera","What's Your Fantasy , Ludacris Featuring Shawnna","She Bangs , Ricky Martin","She Bangs , Ricky Martin","Love Don't Cost A Thing , Jennifer Lopez","Pinch Me , Barenaked Ladies"
22,"Big Deal , LeAnn Rimes","Stay The Night , IMx","Amazed , Lonestar","Breathe , Faith Hill","Breathe , Faith Hill","Breathe , Faith Hill","U Know What's Up , Donell Jones","U Know What's Up , Donell Jones","It Feels So Good , Sonique","Never Let You Go , Third Eye Blind","Then The Morning Comes , Smash Mouth","Then The Morning Comes , Smash Mouth","Thong Song , Sisqo","I Need To Know , Marc Anthony","I Need To Know , Marc Anthony","Take A Picture , Filter","I Wanna Know , Joe","Hot Boyz , Missy ""Misdemeanor"" Elliott Featuring NAS, EVE & Q-Tip","Hot Boyz , Missy ""Misdemeanor"" Elliott Featuring NAS, EVE & Q-Tip","Only God Knows Why , Kid Rock","All The Small Things , Blink-182","All The Small Things , Blink-182","Be With You , Enrique Iglesias","Higher , Creed","Show Me The Meaning Of Being Lonely , Backstreet Boys","Show Me The Meaning Of Being Lonely , Backstreet Boys","Get It On Tonite , Montell Jordan","Separated , Avant","Separated , Avant","Smooth , Santana Featuring Rob Thomas","Smooth , Santana Featuring Rob Thomas","Big Pimpin' , Jay-Z Featuring UGK","Big Pimpin' , Jay-Z Featuring UGK","I Wish , Carl Thomas","Say My Name , Destiny's Child","Say My Name , Destiny's Child","Say My Name , Destiny's Child","Separated , Avant","Let's Get Married , Jagged Edge","Let's Get Married , Jagged Edge","(Hot S**t) Country Grammar , Nelly","The Next Episode , Dr. Dre Featuring Snoop Dogg","The Next Episode , Dr. Dre Featuring Snoop Dogg","I Think I'm In Love With You , Jessica Simpson","Breathe , Faith Hill","Music , Madonna","Music , Madonna","Wonderful , Everclear","Come On Over Baby (All I Want Is You) , Christina Aguilera","Come On Over Baby (All I Want Is You) , Christina Aguilera","Lucky , Britney Spears","Let's Get Married , Jagged Edge","Try Again , Aaliyah","Try Again , Aaliyah","It's Gonna Be Me , 'N Sync","The Way You Love Me , Faith Hill","The Way You Love Me , Faith Hill","He Wasn't Man Enough , Toni Braxton","Independent Women Part I , Destiny's Child","No More , Ruff Endz","No More , Ruff Endz","You're A God , Vertical Horizon","You're A God , Vertical Horizon","You're A God , Vertical Horizon","(Hot S**t) Country Grammar , Nelly","I Just Wanna Love U (Give It 2 Me) , JAY-Z","No More , Ruff Endz","No More , Ruff Endz","Come On Over Baby (All I Want Is You) , Christina Aguilera","Crazy For This Girl , Evan And Jaron","Crazy For This Girl , Evan And Jaron","Crazy For This Girl , Evan And Jaron","Crazy For This Girl , Evan And Jaron"
23,"Meet Virginia , Train","Meet Virginia , Train","Back That Thang Up , Juvenile Featuring Mannie Fresh & Lil' Wayne","24/7 , Kevon Edmonds","24/7 , Kevon Edmonds","Waiting For Tonight , Jennifer Lopez","Meet Virginia , Train","Meet Virginia , Train","Never Let You Go , Third Eye Blind","He Can't Love U , Jagged Edge","He Can't Love U , Jagged Edge","He Can't Love U , Jagged Edge","Then The Morning Comes , Smash Mouth","Blue (Da Ba Dee) , Eiffel 65","Blue (Da Ba Dee) , Eiffel 65","From The Bottom Of My Broken Heart , Britney Spears","Take A Picture , Filter","Goodbye Earl , Dixie Chicks","Goodbye Earl , Dixie Chicks","Goodbye Earl , Dixie Chicks","I Like It , Sammie","I Like It , Sammie","He Wasn't Man Enough , Toni Braxton","I Knew I Loved You , Savage Garden","I Wish , Carl Thomas","I Wish , Carl Thomas","Otherside , Red Hot Chili Peppers","Bent , matchbox twenty","Bent , matchbox twenty","Crash And Burn , Savage Garden","Crash And Burn , Savage Garden","(Hot S**t) Country Grammar , Nelly","(Hot S**t) Country Grammar , Nelly","(Hot S**t) Country Grammar , Nelly","I Wish , Carl Thomas","I Wish , Carl Thomas","Broadway , Goo Goo Dolls","Desert Rose , Sting Featuring Cheb Mami","Thong Song , Sisqo","Thong Song , Sisqo","Oops!...I Did It Again , Britney Spears","Wifey , Next","Wifey , Next","Be With You , Enrique Iglesias","I Wanna Be With You , Mandy Moore","Wonderful , Everclear","Wonderful , Everclear","Breathe , Faith Hill","Bounce With Me , Lil Bow Wow Featuring Xscape","Bounce With Me , Lil Bow Wow Featuring Xscape","Bounce With Me , Lil Bow Wow Featuring Xscape","Desert Rose , Sting Featuring Cheb Mami","Let's Get Married , Jagged Edge","Let's Get Married , Jagged Edge","Case Of The Ex (Whatcha Gonna Do) , Mya","Don't Think I'm Not , Kandi","Don't Think I'm Not , Kandi","Back Here , BBMak","I Need You , LeAnn Rimes","Shape Of My Heart , Backstreet Boys","Shape Of My Heart , Backstreet Boys","Dance With Me , Debelah Morgan","Liar , Profyle","Liar , Profyle","Bent , matchbox twenty","Jumpin', Jumpin' , Destiny's Child","Shake Ya Ass , Mystikal","Shake Ya Ass , Mystikal","No More , Ruff Endz","Again , Lenny Kravitz","Again , Lenny Kravitz","What's Your Fantasy , Ludacris Featuring Shawnna","What's Your Fantasy , Ludacris Featuring Shawnna"
24,"Unpretty , TLC","Unpretty , TLC","Unpretty , TLC","Show Me The Meaning Of Being Lonely , Backstreet Boys","Show Me The Meaning Of Being Lonely , Backstreet Boys","Big Deal , LeAnn Rimes","Never Let You Go , Third Eye Blind","Never Let You Go , Third Eye Blind","He Can't Love U , Jagged Edge","Untitled (How Does It Feel) , D'Angelo","Untitled (How Does It Feel) , D'Angelo","Untitled (How Does It Feel) , D'Angelo","There You Go , P!nk","Then The Morning Comes , Smash Mouth","Then The Morning Comes , Smash Mouth","I Wanna Know , Joe","Forgot About Dre , Dr. Dre Featuring Eminem","Forgot About Dre , Dr. Dre Featuring Eminem","Forgot About Dre , Dr. Dre Featuring Eminem","I Need To Know , Marc Anthony","I Need To Know , Marc Anthony","I Need To Know , Marc Anthony","Higher , Creed","Wobble Wobble , 504 Boyz","Only God Knows Why , Kid Rock","Only God Knows Why , Kid Rock","Only God Knows Why , Kid Rock","Never Let You Go , Third Eye Blind","Never Let You Go , Third Eye Blind","Big Pimpin' , Jay-Z Featuring UGK","Big Pimpin' , Jay-Z Featuring UGK","Broadway , Goo Goo Dolls","Broadway , Goo Goo Dolls","Swear It Again , Westlife","Amazed , Lonestar","Amazed , Lonestar","Separated , Avant","Wifey , Next","Swear It Again , Westlife","Swear It Again , Westlife","Wifey , Next","I Think I'm In Love With You , Jessica Simpson","I Think I'm In Love With You , Jessica Simpson","I Turn To You , Christina Aguilera","Wonderful , Everclear","You Sang To Me , Marc Anthony","You Sang To Me , Marc Anthony","That's The Way , Jo Dee Messina","Faded , SoulDecision Featuring Thrust","Faded , SoulDecision Featuring Thrust","Wonderful , Everclear","Shake Ya Ass , Mystikal","Wonderful , Everclear","Wonderful , Everclear","Liar , Profyle","Wifey , Next","Wifey , Next","Gotta Tell You , Samantha Mumba","Shape Of My Heart , Backstreet Boys","I Need You , LeAnn Rimes","I Need You , LeAnn Rimes","Doesn't Really Matter , Janet","Pinch Me , Barenaked Ladies","Pinch Me , Barenaked Ladies","You're A God , Vertical Horizon","Incomplete , Sisqo","What's Your Fantasy , Ludacris Featuring Shawnna","What's Your Fantasy , Ludacris Featuring Shawnna","Don't Think I'm Not , Kandi","Don't Think I'm Not , Kandi","Don't Think I'm Not , Kandi","Music , Madonna","Beautiful Day , U2"
25,"Breathe , Faith Hill","Learn To Fly , Foo Fighters","Where My Girls At? , 702","Thank God I Found You , Mariah Carey Featuring Joe & 98 Degrees","Thank God I Found You , Mariah Carey Featuring Joe & 98 Degrees","All The Small Things , Blink-182","Learn To Fly , Foo Fighters","Learn To Fly , Foo Fighters","Untitled (How Does It Feel) , D'Angelo","Thong Song , Sisqo","Thong Song , Sisqo","Thong Song , Sisqo","He Can't Love U , Jagged Edge","Everything You Want , Vertical Horizon","Everything You Want , Vertical Horizon","Forgot About Dre , Dr. Dre Featuring Eminem","Only God Knows Why , Kid Rock","Only God Knows Why , Kid Rock","Only God Knows Why , Kid Rock","Forgot About Dre , Dr. Dre Featuring Eminem","Forgot About Dre , Dr. Dre Featuring Eminem","Forgot About Dre , Dr. Dre Featuring Eminem","Bring It All To Me , Blaque","That's The Way It Is , Celine Dion","Oops!...I Did It Again , Britney Spears","Oops!...I Did It Again , Britney Spears","Show Me The Meaning Of Being Lonely , Backstreet Boys","Crash And Burn , Savage Garden","Crash And Burn , Savage Garden","Separated , Avant","It's Gonna Be Me , 'N Sync","I Wish , Carl Thomas","I Wish , Carl Thomas","Absolutely (Story Of A Girl) , Nine Days","Broadway , Goo Goo Dolls","Broadway , Goo Goo Dolls","Amazed , Lonestar","Let's Get Married , Jagged Edge","Maria Maria , Santana Featuring The Product G&B","Maria Maria , Santana Featuring The Product G&B","The Next Episode , Dr. Dre Featuring Snoop Dogg","Big Pimpin' , Jay-Z Featuring UGK","Big Pimpin' , Jay-Z Featuring UGK","The Next Episode , Dr. Dre Featuring Snoop Dogg","What'Chu Like , Da Brat Featuring Tyrese","Purest Of Pain (A Puro Dolor) , Son By Four","Purest Of Pain (A Puro Dolor) , Son By Four","You Sang To Me , Marc Anthony","Lucky , Britney Spears","Lucky , Britney Spears","Give Me Just One Night (Una Noche) , 98 Degrees","Give Me Just One Night (Una Noche) , 98 Degrees","Desert Rose , Sting Featuring Cheb Mami","Desert Rose , Sting Featuring Cheb Mami","Higher , Creed","Absolutely (Story Of A Girl) , Nine Days","Absolutely (Story Of A Girl) , Nine Days","Don't Think I'm Not , Kandi","Don't Think I'm Not , Kandi","You're A God , Vertical Horizon","You're A God , Vertical Horizon","Pinch Me , Barenaked Ladies","E.I. , Nelly","E.I. , Nelly","I Just Wanna Love U (Give It 2 Me) , JAY-Z","Bag Lady , Erykah Badu","Don't Think I'm Not , Kandi","Don't Think I'm Not , Kandi","Bag Lady , Erykah Badu","My First Love , Avant Featuring KeKe Wyatt","My First Love , Avant Featuring KeKe Wyatt","My First Love , Avant Featuring KeKe Wyatt","My First Love , Avant Featuring KeKe Wyatt"
26,"Back That Thang Up , Juvenile Featuring Mannie Fresh & Lil' Wayne","Steal My Sunshine , Len","Someday , Sugar Ray","Big Deal , LeAnn Rimes","Big Deal , LeAnn Rimes","Cowboy Take Me Away , Dixie Chicks","Cowboy Take Me Away , Dixie Chicks","Cowboy Take Me Away , Dixie Chicks","Cowboy Take Me Away , Dixie Chicks","U Know What's Up , Donell Jones","My Love Is Your Love , Whitney Houston","My Love Is Your Love , Whitney Houston","I Wanna Know , Joe","I Wanna Know , Joe","I Wanna Know , Joe","Then The Morning Comes , Smash Mouth","I Learned From The Best , Whitney Houston","You Sang To Me , Marc Anthony","You Sang To Me , Marc Anthony","Another Dumb Blonde , Hoku","Back At One , Brian McKnight","Back At One , Brian McKnight","Party Up (Up In Here) , DMX","Party Up (Up In Here) , DMX","Party Up (Up In Here) , DMX","Party Up (Up In Here) , DMX","Party Up (Up In Here) , DMX","Party Up (Up In Here) , DMX","Party Up (Up In Here) , DMX","Never Let You Go , Third Eye Blind","Better Off Alone , Alice Deejay","Smooth , Santana Featuring Rob Thomas","Smooth , Santana Featuring Rob Thomas","Bye Bye Bye , 'N Sync","Yes! , Chad Brock","Yes! , Chad Brock","I Wish , Carl Thomas","Yes! , Chad Brock","The Next Episode , Dr. Dre Featuring Snoop Dogg","The Next Episode , Dr. Dre Featuring Snoop Dogg","Separated , Avant","I Try , Macy Gray","I Try , Macy Gray","Separated , Avant","The Next Episode , Dr. Dre Featuring Snoop Dogg","That's The Way , Jo Dee Messina","That's The Way , Jo Dee Messina","Faded , SoulDecision Featuring Thrust","I Think I'm In Love With You , Jessica Simpson","I Think I'm In Love With You , Jessica Simpson","Most Girls , P!nk","Everything You Want , Vertical Horizon","Faded , SoulDecision Featuring Thrust","Faded , SoulDecision Featuring Thrust","Faded , SoulDecision Featuring Thrust","Faded , SoulDecision Featuring Thrust","Faded , SoulDecision Featuring Thrust","Between Me And You , Ja Rule Featuring Christina Milian","Bounce With Me , Lil Bow Wow Featuring Xscape","Bounce With Me , Lil Bow Wow Featuring Xscape","Bounce With Me , Lil Bow Wow Featuring Xscape","I Wish , R. Kelly","Don't Think I'm Not , Kandi","Don't Think I'm Not , Kandi","He Loves U Not , Dream","Ms. Jackson , OutKast","Best Of Intentions , Travis Tritt","Best Of Intentions , Travis Tritt","Bent , matchbox twenty","My Next Thirty Years , Tim McGraw","My Next Thirty Years , Tim McGraw","My Next Thirty Years , Tim McGraw","Music , Madonna"
27,"4, 5, 6 , Sole Featuring JT Money & Kandi","Where My Girls At? , 702","Big Deal , LeAnn Rimes","Back That Thang Up , Juvenile Featuring Mannie Fresh & Lil' Wayne","Back That Thang Up , Juvenile Featuring Mannie Fresh & Lil' Wayne","Hanginaround , Counting Crows","Shake Your Bon-Bon , Ricky Martin","Shake Your Bon-Bon , Ricky Martin","Meet Virginia , Train","I Wanna Know , Joe","I Wanna Know , Joe","I Wanna Know , Joe","Untitled (How Does It Feel) , D'Angelo","Untitled (How Does It Feel) , D'Angelo","Untitled (How Does It Feel) , D'Angelo","I Learned From The Best , Whitney Houston","Thank God I Found You , Mariah Carey Featuring Joe & 98 Degrees","I Learned From The Best , Whitney Houston","I Learned From The Best , Whitney Houston","Try Again , Aaliyah","Higher , Creed","Higher , Creed","Forgot About Dre , Dr. Dre Featuring Eminem","I Wish , Carl Thomas","I Turn To You , Christina Aguilera","I Turn To You , Christina Aguilera","Shackles (Praise You) , Mary Mary","Big Pimpin' , Jay-Z Featuring UGK","Big Pimpin' , Jay-Z Featuring UGK","Party Up (Up In Here) , DMX","Party Up (Up In Here) , DMX","Back Here , BBMak","Back Here , BBMak","Yes! , Chad Brock","Crybaby , Mariah Carey Featuring Snoop Dogg","Crybaby , Mariah Carey Featuring Snoop Dogg","Let's Get Married , Jagged Edge","I Wish , Carl Thomas","Separated , Avant","Separated , Avant","Kryptonite , 3 Doors Down","What'Chu Like , Da Brat Featuring Tyrese","What'Chu Like , Da Brat Featuring Tyrese","I Wanna Be With You , Mandy Moore","Be With You , Enrique Iglesias","What'Chu Like , Da Brat Featuring Tyrese","What'Chu Like , Da Brat Featuring Tyrese","Lucky , Britney Spears","Purest Of Pain (A Puro Dolor) , Son By Four","Purest Of Pain (A Puro Dolor) , Son By Four","That's The Way , Jo Dee Messina","Wonderful , Everclear","That's The Way , Jo Dee Messina","That's The Way , Jo Dee Messina","Don't Think I'm Not , Kandi","It's Gonna Be Me , 'N Sync","It's Gonna Be Me , 'N Sync","She Bangs , Ricky Martin","You're A God , Vertical Horizon","Don't Think I'm Not , Kandi","Don't Think I'm Not , Kandi","Wonderful , Everclear","Best Of Intentions , Travis Tritt","Best Of Intentions , Travis Tritt","Best Of Intentions , Travis Tritt","Best Of Intentions , Travis Tritt","Bent , matchbox twenty","Bent , matchbox twenty","Crazy For This Girl , Evan And Jaron","Love Don't Cost A Thing , Jennifer Lopez","Love Don't Cost A Thing , Jennifer Lopez","Beautiful Day , U2","My Next Thirty Years , Tim McGraw"
28,"Stay The Night , IMx","Back That Thang Up , Juvenile Featuring Mannie Fresh & Lil' Wayne","Hanginaround , Counting Crows","Hanginaround , Counting Crows","Hanginaround , Counting Crows","My Best Friend , Tim McGraw","My Best Friend , Tim McGraw","My Best Friend , Tim McGraw","U Know What's Up , Donell Jones","Falls Apart , Sugar Ray","Falls Apart , Sugar Ray","Falls Apart , Sugar Ray","American Pie , Madonna","American Pie , Madonna","American Pie , Madonna","I Like It , Sammie","Goodbye Earl , Dixie Chicks","I Like It , Sammie","I Like It , Sammie","I Like It , Sammie","Otherside , Red Hot Chili Peppers","Otherside , Red Hot Chili Peppers","Otherside , Red Hot Chili Peppers","Otherside , Red Hot Chili Peppers","Otherside , Red Hot Chili Peppers","Otherside , Red Hot Chili Peppers","Bent , matchbox twenty","Only God Knows Why , Kid Rock","Only God Knows Why , Kid Rock","Better Off Alone , Alice Deejay","Broadway , Goo Goo Dolls","Crash And Burn , Savage Garden","Crash And Burn , Savage Garden","Broadway , Goo Goo Dolls","Let's Get Married , Jagged Edge","Let's Get Married , Jagged Edge","Otherside , Red Hot Chili Peppers","Where I Wanna Be , Donell Jones","Doesn't Really Matter , Janet","Doesn't Really Matter , Janet","I Think I'm In Love With You , Jessica Simpson","Separated , Avant","Separated , Avant","Big Pimpin' , Jay-Z Featuring UGK","I Turn To You , Christina Aguilera","I Turn To You , Christina Aguilera","I Turn To You , Christina Aguilera","Come On Over Baby (All I Want Is You) , Christina Aguilera","You Sang To Me , Marc Anthony","You Sang To Me , Marc Anthony","With Arms Wide Open , Creed","Lucky , Britney Spears","Everything You Want , Vertical Horizon","Everything You Want , Vertical Horizon","Let's Get Married , Jagged Edge","Higher , Creed","Higher , Creed","You're A God , Vertical Horizon","He Wasn't Man Enough , Toni Braxton","Pinch Me , Barenaked Ladies","Pinch Me , Barenaked Ladies","Don't Think I'm Not , Kandi","Give Me Just One Night (Una Noche) , 98 Degrees","Give Me Just One Night (Una Noche) , 98 Degrees","If You're Gone , matchbox twenty","Bent , matchbox twenty","Bag Lady , Erykah Badu","Bag Lady , Erykah Badu","Best Of Intentions , Travis Tritt","We Danced , Brad Paisley","We Danced , Brad Paisley","She Bangs , Ricky Martin","Stronger , Britney Spears"
29,"Don't Say You Love Me , M2M","Big Deal , LeAnn Rimes","Breathe , Faith Hill","Steal My Sunshine , Len","Steal My Sunshine , Len","Where My Girls At? , 702","It Feels So Good , Sonique","It Feels So Good , Sonique","Learn To Fly , Foo Fighters","Meet Virginia , Train","Forgot About Dre , Dr. Dre Featuring Eminem","Forgot About Dre , Dr. Dre Featuring Eminem","Forgot About Dre , Dr. Dre Featuring Eminem","I Like It , Sammie","I Like It , Sammie","I Try , Macy Gray","You Sang To Me , Marc Anthony","Another Dumb Blonde , Hoku","Another Dumb Blonde , Hoku","Hot Boyz , Missy ""Misdemeanor"" Elliott Featuring NAS, EVE & Q-Tip","What A Girl Wants , Christina Aguilera","What A Girl Wants , Christina Aguilera","I Need To Know , Marc Anthony","I Turn To You , Christina Aguilera","I Knew I Loved You , Savage Garden","I Knew I Loved You , Savage Garden","Separated , Avant","Get It On Tonite , Montell Jordan","Get It On Tonite , Montell Jordan","Shackles (Praise You) , Mary Mary","Separated , Avant","Better Off Alone , Alice Deejay","Better Off Alone , Alice Deejay","Smooth , Santana Featuring Rob Thomas","(Hot S**t) Country Grammar , Nelly","(Hot S**t) Country Grammar , Nelly","The One , Backstreet Boys","Doesn't Really Matter , Janet","(Hot S**t) Country Grammar , Nelly","(Hot S**t) Country Grammar , Nelly","Swear It Again , Westlife","Purest Of Pain (A Puro Dolor) , Son By Four","Purest Of Pain (A Puro Dolor) , Son By Four","The Real Slim Shady , Eminem","That's The Way , Jo Dee Messina","What About Now , Lonestar","What About Now , Lonestar","What About Now , Lonestar","Breathe , Faith Hill","Breathe , Faith Hill","Purest Of Pain (A Puro Dolor) , Son By Four","That's The Way , Jo Dee Messina","Lucky , Britney Spears","Lucky , Britney Spears","Desert Rose , Sting Featuring Cheb Mami","You're A God , Vertical Horizon","You're A God , Vertical Horizon","Absolutely (Story Of A Girl) , Nine Days","Back Here , BBMak","Faded , SoulDecision Featuring Thrust","Faded , SoulDecision Featuring Thrust","I Need You , LeAnn Rimes","If You're Gone , matchbox twenty","If You're Gone , matchbox twenty","It Wasn't Me , Shaggy Featuring Ricardo ""RikRok"" Ducent","What's Your Fantasy , Ludacris Featuring Shawnna","Jumpin', Jumpin' , Destiny's Child","Jumpin', Jumpin' , Destiny's Child","Shake Ya Ass , Mystikal","Bent , matchbox twenty","Bent , matchbox twenty","Don't Think I'm Not , Kandi","Don't Tell Me , Madonna"
30,"Where My Girls At? , 702","Someday , Sugar Ray","Take A Picture , Filter","Cowboy Take Me Away , Dixie Chicks","Cowboy Take Me Away , Dixie Chicks","What Do You Say , Reba","Big Deal , LeAnn Rimes","Big Deal , LeAnn Rimes","I Wanna Love You Forever , Jessica Simpson","Cowboy Take Me Away , Dixie Chicks","My Best Friend , Tim McGraw","My Best Friend , Tim McGraw","Everything You Want , Vertical Horizon","Forgot About Dre , Dr. Dre Featuring Eminem","Forgot About Dre , Dr. Dre Featuring Eminem","Untitled (How Does It Feel) , D'Angelo","Then The Morning Comes , Smash Mouth","Take A Picture , Filter","Take A Picture , Filter","How Do You Like Me Now?! , Toby Keith","How Do You Like Me Now?! , Toby Keith","How Do You Like Me Now?! , Toby Keith","The Best Day , George Strait","I Need To Know , Marc Anthony","That's The Way It Is , Celine Dion","That's The Way It Is , Celine Dion","Crash And Burn , Savage Garden","Wobble Wobble , 504 Boyz","Wobble Wobble , 504 Boyz","Broadway , Goo Goo Dolls","Shackles (Praise You) , Mary Mary","Yes! , Chad Brock","Yes! , Chad Brock","It Feels So Good , Sonique","The One , Backstreet Boys","The One , Backstreet Boys","Wifey , Next","Amazed , Lonestar","Yes! , Chad Brock","Yes! , Chad Brock","Thong Song , Sisqo","I Wanna Be With You , Mandy Moore","I Wanna Be With You , Mandy Moore","What'Chu Like , Da Brat Featuring Tyrese","Separated , Avant","Separated , Avant","Separated , Avant","Purest Of Pain (A Puro Dolor) , Son By Four","That's The Way , Jo Dee Messina","That's The Way , Jo Dee Messina","Breathe , Faith Hill","Breathe , Faith Hill","Case Of The Ex (Whatcha Gonna Do) , Mya","Case Of The Ex (Whatcha Gonna Do) , Mya","You're A God , Vertical Horizon","This I Promise You , 'N Sync","This I Promise You , 'N Sync","Faded , SoulDecision Featuring Thrust","Faded , SoulDecision Featuring Thrust","Dance With Me , Debelah Morgan","Dance With Me , Debelah Morgan","Best Of Intentions , Travis Tritt","Faded , SoulDecision Featuring Thrust","Faded , SoulDecision Featuring Thrust","Don't Think I'm Not , Kandi","Don't Think I'm Not , Kandi","Incomplete , Sisqo","Incomplete , Sisqo","My Next Thirty Years , Tim McGraw","Best Of Intentions , Travis Tritt","Best Of Intentions , Travis Tritt","Without You , Dixie Chicks","Just Friends (Sunny) , Musiq"
