46,"Blurry , Puddle Of Mudd","The World's Greatest , R. Kelly","The World's Greatest , R. Kelly","The World's Greatest , R. Kelly","Blurry , Puddle Of Mudd","Blurry , Puddle Of Mudd","Hanging By A Moment , Lifehouse","Only Time , Enya","Where Were You (When The World Stopped Turning) , Alan Jackson","Where Were You (When The World Stopped Turning) , Alan Jackson","I Do!! , Toya","Escape , Enrique Iglesias","Escape , Enrique Iglesias","Youth Of The Nation , P.O.D.","Drops Of Jupiter (Tell Me) , Train","I Breathe In, I Breathe Out , Chris Cagle","I Breathe In, I Breathe Out , Chris Cagle","Roll Out (My Business) , Ludacris","I'm Movin' On , Rascal Flatts","I'm Movin' On , Rascal Flatts","That's When I Love You , Phil Vassar","What About Us? , Brandy","Family Affair , Mary J. Blige","Family Affair , Mary J. Blige","Oh Boy , Cam'Ron Featuring Juelz Santana","Soak Up The Sun , Sheryl Crow","Soak Up The Sun , Sheryl Crow","One Mic , Nas","I Love You , Faith Evans","I'm Gonna Miss Her (The Fishin' Song) , Brad Paisley","I'm Gonna Miss Her (The Fishin' Song) , Brad Paisley","A New Day Has Come , Celine Dion","Not A Day Goes By , Lonestar","Not A Day Goes By , Lonestar","Escape , Enrique Iglesias","Courtesy Of The Red, White And Blue (The Angry American) , Toby Keith","By The Way , Red Hot Chili Peppers","By The Way , Red Hot Chili Peppers","By The Way , Red Hot Chili Peppers","Gangsta Lovin' , Eve Featuring Alicia Keys","Gangsta Lovin' , Eve Featuring Alicia Keys","My Neck, My Back , Khia Featuring DSD","Full Moon , Brandy","My Neck, My Back , Khia Featuring DSD","My Neck, My Back , Khia Featuring DSD","I Need A Girl (Part One) , P. Diddy Featuring Usher & Loon","Hella Good , No Doubt","Hella Good , No Doubt","Stingy , Ginuwine","Foolish , Ashanti","Without Me , Eminem","Without Me , Eminem","Sk8er Boi , Avril Lavigne","By The Way , Red Hot Chili Peppers","By The Way , Red Hot Chili Peppers","Where Are You Going , Dave Matthews Band","Where Would You Be , Martina McBride","Landslide , Dixie Chicks","Landslide , Dixie Chicks","My Town , Montgomery Gentry","My Town , Montgomery Gentry","My Town , Montgomery Gentry","Cleanin' Out My Closet , Eminem","You Know You're Right , Nirvana","Goodbye To You , Michelle Branch","Goodbye To You , Michelle Branch","Red Rag Top , Tim McGraw","You Know You're Right , Nirvana","You Know You're Right , Nirvana","You Know You're Right , Nirvana","Po' Folks , Nappy Roots Featuring Anthony Hamilton","Lifestyles Of The Rich And Famous , Good Charlotte","Lifestyles Of The Rich And Famous , Good Charlotte"
47,"No More Drama , Mary J. Blige","Can't Fight The Moonlight , LeAnn Rimes","Can't Fight The Moonlight , LeAnn Rimes","Wrapped Around , Brad Paisley","The World's Greatest , R. Kelly","The World's Greatest , R. Kelly","Take Away , Missy ""Misdemeanor"" Elliott Featuring Ginuwine & Tweet","Hanging By A Moment , Lifehouse","Uh Huh , B2K","Uh Huh , B2K","It's Been Awhile , Staind","Young'n (Holla Back) , Fabolous","Young'n (Holla Back) , Fabolous","Break Ya Neck , Busta Rhymes","Young'n (Holla Back) , Fabolous","Caramel , City High Featuring Eve","Caramel , City High Featuring Eve","No More Drama , Mary J. Blige","Get The Party Started , P!nk","Get The Party Started , P!nk","The Cowboy In Me , Tim McGraw","Blessed , Martina McBride","Too Bad , Nickelback","Too Bad , Nickelback","Lights, Camera, Action! , Mr. Cheeks","I'm Movin' On , Rascal Flatts","I'm Movin' On , Rascal Flatts","I Should Be Sleeping , Emerson Drive","Hero , Chad Kroeger Featuring Josey Scott","I Love You , Faith Evans","I Love You , Faith Evans","Don't Say Goodbye , Paulina Rubio","A New Day Has Come , Celine Dion","A New Day Has Come , Celine Dion","Here Is Gone , Goo Goo Dolls","The One , Gary Allan","Happy , Ashanti","Happy , Ashanti","More Than A Woman , Aaliyah","By The Way , Red Hot Chili Peppers","By The Way , Red Hot Chili Peppers","My Heart Is Lost To You , Brooks & Dunn","U Don't Have To Call , Usher","Feel It Boy , Beenie Man Featuring Janet","Feel It Boy , Beenie Man Featuring Janet","I Keep Looking , Sara Evans","The One , Gary Allan","The One , Gary Allan","Baby , Ashanti","Underneath It All , No Doubt Featuring Lady Saw","Stingy , Ginuwine","Stingy , Ginuwine","Po' Folks , Nappy Roots Featuring Anthony Hamilton","I'm Gonna Be Alright , Jennifer Lopez Featuring Nas","I'm Gonna Be Alright , Jennifer Lopez Featuring Nas","Dirrty , Christina Aguilera Featuring Redman","Dirrty , Christina Aguilera Featuring Redman","American Child , Phil Vassar","American Child , Phil Vassar","American Child , Phil Vassar","Where Would You Be , Martina McBride","Where Would You Be , Martina McBride","Stingy , Ginuwine","Cry , Faith Hill","I Need A Girl (Part Two) , P. Diddy & Ginuwine Featuring Loon, Mario Winans & Tammy Ruggeri","I Need A Girl (Part Two) , P. Diddy & Ginuwine Featuring Loon, Mario Winans & Tammy Ruggeri","Beautiful Mess , Diamond Rio","Stingy , Ginuwine","Stingy , Ginuwine","Thug Lovin' , Ja Rule Featuring Bobby Brown","Baby , Ashanti","React , Erick Sermon Featuring Redman","React , Erick Sermon Featuring Redman"
48,"Can't Fight The Moonlight , LeAnn Rimes","Wrapped Up In You , Garth Brooks","Wrapped Up In You , Garth Brooks","Take Away , Missy ""Misdemeanor"" Elliott Featuring Ginuwine & Tweet","Take Away , Missy ""Misdemeanor"" Elliott Featuring Ginuwine & Tweet","Take Away , Missy ""Misdemeanor"" Elliott Featuring Ginuwine & Tweet","I'm Real , Jennifer Lopez Featuring Ja Rule","Hands Clean , Alanis Morissette","Hanging By A Moment , Lifehouse","Hanging By A Moment , Lifehouse","Rock The Boat , Aaliyah","Break Ya Neck , Busta Rhymes","Break Ya Neck , Busta Rhymes","Wasting My Time , Default","Standing Still , Jewel","Uh Huh , B2K","Uh Huh , B2K","I Need A Girl (Part One) , P. Diddy Featuring Usher & Loon","Whenever, Wherever , Shakira","Whenever, Wherever , Shakira","Makin' Good Love , Avant","Hey Baby , No Doubt Featuring Bounty Killer","Hero , Enrique Iglesias","Hero , Enrique Iglesias","Hot In Herre , Nelly","My Sacrifice , Creed","My Sacrifice , Creed","Gots Ta Be , B2K","Still Fly , Big Tymers","Oops (Oh My) , Tweet","Oops (Oh My) , Tweet","Not A Day Goes By , Lonestar","I Love You , Faith Evans","I Love You , Faith Evans","Someone To Love You , Ruff Endz","Someone To Love You , Ruff Endz","My Heart Is Lost To You , Brooks & Dunn","My Heart Is Lost To You , Brooks & Dunn","My Heart Is Lost To You , Brooks & Dunn","My Heart Is Lost To You , Brooks & Dunn","My Heart Is Lost To You , Brooks & Dunn","Don't Let Me Get Me , P!nk","I Miss My Friend , Darryl Worley","Love At First Sight , Kylie Minogue","Love At First Sight , Kylie Minogue","The Impossible , Joe Nichols","The Impossible , Joe Nichols","The Impossible , Joe Nichols","Wasting My Time , Default","Blurry , Puddle Of Mudd","Two Wrongs , Wyclef Jean Featuring Claudette Ortiz","Two Wrongs , Wyclef Jean Featuring Claudette Ortiz","Foolish , Ashanti","Dirrty , Christina Aguilera Featuring Redman","Dirrty , Christina Aguilera Featuring Redman","The Good Stuff , Kenny Chesney","Where Are You Going , Dave Matthews Band","Work In Progress , Alan Jackson","Work In Progress , Alan Jackson","The Middle , Jimmy Eat World","Don't Mess With My Man , Nivea Featuring Brian & Brandon Casey","Don't Mess With My Man , Nivea Featuring Brian & Brandon Casey","You Know You're Right , Nirvana","Stingy , Ginuwine","The Zephyr Song , Red Hot Chili Peppers","The Zephyr Song , Red Hot Chili Peppers","The Zephyr Song , Red Hot Chili Peppers","All My Life , Foo Fighters","All My Life , Foo Fighters","Girl Talk , TLC","When I'm Gone , 3 Doors Down","Wanksta , 50 Cent","Wanksta , 50 Cent"
49,"Take Away , Missy ""Misdemeanor"" Elliott Featuring Ginuwine & Tweet","I'm Tryin' , Trace Adkins","I'm Tryin' , Trace Adkins","I'm Tryin' , Trace Adkins","I Wanna Talk About Me , Toby Keith","I Wanna Talk About Me , Toby Keith","Can't Get You Out Of My Head , Kylie Minogue","Where The Stars And Stripes And The Eagle Fly , Aaron Tippin","I Love You , Faith Evans","I Love You , Faith Evans","U Don't Have To Call , Usher","Blessed , Martina McBride","Blessed , Martina McBride","Uh Huh , B2K","Good Morning Beautiful , Steve Holy","Young , Kenny Chesney","Young , Kenny Chesney","The Long Goodbye , Brooks & Dunn","Rapture (Tastes So Sweet) , iio","Rapture (Tastes So Sweet) , iio","Drive (For Daddy Gene) , Alan Jackson","What If She's An Angel , Tommy Shane Steiner","Welcome To Atlanta , Jermaine Dupri & Ludacris","Welcome To Atlanta , Jermaine Dupri & Ludacris","Hero , Enrique Iglesias","Hero , Enrique Iglesias","Hero , Enrique Iglesias","Hero , Enrique Iglesias","I'm Gonna Miss Her (The Fishin' Song) , Brad Paisley","Uh Huh , B2K","Uh Huh , B2K","Walking Away , Craig David","Walking Away , Craig David","Walking Away , Craig David","Walking Away , Craig David","Don't Say Goodbye , Paulina Rubio","Don't Say Goodbye , Paulina Rubio","Don't Say Goodbye , Paulina Rubio","A Little Less Conversation , Elvis Presley vs JXL","Grindin' , Clipse","Grindin' , Clipse","I'm Gonna Miss Her (The Fishin' Song) , Brad Paisley","Not A Day Goes By , Lonestar","How You Remind Me , Nickelback","How You Remind Me , Nickelback","Call Me , Tweet","Wasting My Time , Default","Wasting My Time , Default","Hey Ma , Cam'Ron Featuring Juelz Santana, Freekey Zekey & Toya","Somebody Like You , Keith Urban","Foolish , Ashanti","Foolish , Ashanti","Goodbye To You , Michelle Branch","I Keep Looking , Sara Evans","I Keep Looking , Sara Evans","I Miss My Friend , Darryl Worley","When The Last Time , Clipse","Dirrty , Christina Aguilera Featuring Redman","Dirrty , Christina Aguilera Featuring Redman","Running Away , Hoobastank","You Know You're Right , Nirvana","You Know You're Right , Nirvana","No Such Thing , John Mayer","React , Erick Sermon Featuring Redman","Cry , Faith Hill","Cry , Faith Hill","I Need A Girl (Part Two) , P. Diddy & Ginuwine Featuring Loon, Mario Winans & Tammy Ruggeri","Thugz Mansion , 2Pac","Thugz Mansion , 2Pac","I Care 4 U , Aaliyah","Wanksta , 50 Cent","All My Life , Foo Fighters","All My Life , Foo Fighters"
50,"The World's Greatest , R. Kelly","Wrapped Around , Brad Paisley","Wrapped Around , Brad Paisley","Dig In , Lenny Kravitz","Wrapped Up In You , Garth Brooks","Wrapped Up In You , Garth Brooks","Bring On The Rain , Jo Dee Messina With Tim McGraw","Bring On The Rain , Jo Dee Messina With Tim McGraw","Welcome To Atlanta , Jermaine Dupri & Ludacris","Welcome To Atlanta , Jermaine Dupri & Ludacris","Bouncin' Back (Bumpin' Me Against The Wall) , Mystikal","Foolish , Ashanti","Foolish , Ashanti","All You Wanted , Michelle Branch","Young , Kenny Chesney","Bring On The Rain , Jo Dee Messina With Tim McGraw","Bring On The Rain , Jo Dee Messina With Tim McGraw","Welcome To Atlanta , Jermaine Dupri & Ludacris","Rainy Dayz , Mary J. Blige Featuring Ja Rule","Rainy Dayz , Mary J. Blige Featuring Ja Rule","Nothing In This World , KeKe Wyatt Featuring Avant","Welcome To Atlanta , Jermaine Dupri & Ludacris","I Don't Have To Be Me ('til Monday) , Steve Azar","I Don't Have To Be Me ('til Monday) , Steve Azar","Down A** Chick , Ja Rule Featuring Charli ""Chuck"" Baltimore","Welcome To Atlanta , Jermaine Dupri & Ludacris","Welcome To Atlanta , Jermaine Dupri & Ludacris","Awnaw , Nappy Roots","Awnaw , Nappy Roots","Saturday (Oooh! Ooooh!) , Ludacris Featuring Sleepy Brown","Saturday (Oooh! Ooooh!) , Ludacris Featuring Sleepy Brown","Complicated , Avril Lavigne","My List , Toby Keith","My List , Toby Keith","Heaven , DJ Sammy & Yanou Featuring Do","By The Way , Red Hot Chili Peppers","Pass The Courvoisier Part II , Busta Rhymes Featuring P. Diddy & Pharrell","Pass The Courvoisier Part II , Busta Rhymes Featuring P. Diddy & Pharrell","One Last Breath , Creed","Long Time Gone , Dixie Chicks","Long Time Gone , Dixie Chicks","Walking Away , Craig David","Living And Living Well , George Strait","A Little Less Conversation , Elvis Presley vs JXL","A Little Less Conversation , Elvis Presley vs JXL","Ten Rounds With Jose Cuervo , Tracy Byrd","Days Go By , Dirty Vegas","Days Go By , Dirty Vegas","Beautiful Mess , Diamond Rio","Courtesy Of The Red, White And Blue (The Angry American) , Toby Keith","Baby , Ashanti","Baby , Ashanti","Two Wrongs , Wyclef Jean Featuring Claudette Ortiz","Gimme The Light , Sean Paul","Gimme The Light , Sean Paul","Work In Progress , Alan Jackson","The Good Stuff , Kenny Chesney","Ten Rounds With Jose Cuervo , Tracy Byrd","Ten Rounds With Jose Cuervo , Tracy Byrd","You Know You're Right , Nirvana","I'm Gonna Getcha Good! , Shania Twain","I'm Gonna Getcha Good! , Shania Twain","Who's Your Daddy? , Toby Keith","Just Like A Pill , P!nk","All My Life , Foo Fighters","All My Life , Foo Fighters","All My Life , Foo Fighters","Thug Lovin' , Ja Rule Featuring Bobby Brown","Thug Lovin' , Ja Rule Featuring Bobby Brown","Ignition , R. Kelly","I Care 4 U , Aaliyah","Talkin' To Me , Amerie","Talkin' To Me , Amerie"
51,"Brotha , Angie Stone","Brotha , Angie Stone","Brotha , Angie Stone","Brotha , Angie Stone","Bring On The Rain , Jo Dee Messina With Tim McGraw","Bring On The Rain , Jo Dee Messina With Tim McGraw","The Long Goodbye , Brooks & Dunn","The Cowboy In Me , Tim McGraw","Run , George Strait","Run , George Strait","Blessed , Martina McBride","Wasting My Time , Default","Wasting My Time , Default","Young , Kenny Chesney","I Breathe In, I Breathe Out , Chris Cagle","Butterflies , Michael Jackson","Butterflies , Michael Jackson","Young , Kenny Chesney","No More Drama , Mary J. Blige","No More Drama , Mary J. Blige","Uh Huh , B2K","The Cowboy In Me , Tim McGraw","Living And Living Well , George Strait","Living And Living Well , George Strait","I'm Gonna Be Alright , Jennifer Lopez Featuring Nas","I Should Be Sleeping , Emerson Drive","I Should Be Sleeping , Emerson Drive","That's When I Love You , Phil Vassar","Can't Get You Out Of My Head , Kylie Minogue","Don't Say Goodbye , Paulina Rubio","Don't Say Goodbye , Paulina Rubio","The One , Gary Allan","The One , Gary Allan","The One , Gary Allan","The One , Gary Allan","Anything , Jaheim Featuring Next","Why Don't We Fall In Love , Amerie","Why Don't We Fall In Love , Amerie","Grindin' , Clipse","Gots Ta Be , B2K","Gots Ta Be , B2K","Gots Ta Be , B2K","The Rising , Bruce Springsteen","Tonight I Wanna Be Your Man , Andy Griggs","Tonight I Wanna Be Your Man , Andy Griggs","If I Could Go! , Angie Martinez Featuring Lil' Mo & Sacario","Where Are You Going , Dave Matthews Band","Where Are You Going , Dave Matthews Band","Addictive , Truth Hurts Featuring Rakim","Trade It All , Fabolous Featuring P. Diddy & Jagged Edge","Goodbye To You , Michelle Branch","Goodbye To You , Michelle Branch","Love At First Sight , Kylie Minogue","A Moment Like This , Kelly Clarkson","A Moment Like This , Kelly Clarkson","By The Way , Red Hot Chili Peppers","Running Away , Hoobastank","My Town , Montgomery Gentry","My Town , Montgomery Gentry","These Days , Rascal Flatts","American Child , Phil Vassar","American Child , Phil Vassar","Trade It All , Fabolous Featuring P. Diddy & Jagged Edge","Red Rag Top , Tim McGraw","Red Rag Top , Tim McGraw","Red Rag Top , Tim McGraw","Don't Know Why , Norah Jones","19 Somethin' , Mark Wills","19 Somethin' , Mark Wills","When I'm Gone , 3 Doors Down","You Know You're Right , Nirvana","Red Rag Top , Tim McGraw","Red Rag Top , Tim McGraw"
52,"Ain't It Funny , Jennifer Lopez Featuring Ja Rule","Ain't It Funny , Jennifer Lopez Featuring Ja Rule","Ain't It Funny , Jennifer Lopez Featuring Ja Rule","Wrapped Up In You , Garth Brooks","Son Of A Gun , Janet Featuring Missy Elliott, P. Diddy & Carly Simon","Son Of A Gun , Janet Featuring Missy Elliott, P. Diddy & Carly Simon","Welcome To Atlanta , Jermaine Dupri & Ludacris","Welcome To Atlanta , Jermaine Dupri & Ludacris","Don't You Forget It , Glenn Lewis","Don't You Forget It , Glenn Lewis","More Than A Woman , Aaliyah","Youth Of The Nation , P.O.D.","Youth Of The Nation , P.O.D.","We Thuggin' , Fat Joe Featuring R. Kelly","Break Ya Neck , Busta Rhymes","My List , Toby Keith","My List , Toby Keith","Underneath Your Clothes , Shakira","That's When I Love You , Phil Vassar","That's When I Love You , Phil Vassar","Don't You Forget It , Glenn Lewis","Too Bad , Nickelback","Addictive , Truth Hurts Featuring Rakim","Addictive , Truth Hurts Featuring Rakim","Welcome To Atlanta , Jermaine Dupri & Ludacris","Full Moon , Brandy","Full Moon , Brandy","I'm Gonna Miss Her (The Fishin' Song) , Brad Paisley","Feels Good (Don't Worry Bout A Thing) , Naughty By Nature Featuring 3LW","Not A Day Goes By , Lonestar","Not A Day Goes By , Lonestar","I Love You , Faith Evans","Call Me , Tweet","Call Me , Tweet","By The Way , Red Hot Chili Peppers","Makin' Good Love , Avant","One Last Breath , Creed","One Last Breath , Creed","Long Time Gone , Dixie Chicks","Drive (For Daddy Gene) , Alan Jackson","Drive (For Daddy Gene) , Alan Jackson","I Miss My Friend , Darryl Worley","A Little Less Conversation , Elvis Presley vs JXL","The Impossible , Joe Nichols","The Impossible , Joe Nichols","My Neck, My Back , Khia Featuring DSD","Baby , Ashanti","Baby , Ashanti","Hella Good , No Doubt","Running Away , Hoobastank","Running Away , Hoobastank","Running Away , Hoobastank","Running Away , Hoobastank","Work In Progress , Alan Jackson","Work In Progress , Alan Jackson","Where Would You Be , Martina McBride","American Child , Phil Vassar","Oh Yeah! , Big Tymers Featuring Tateeze, Boo & Gotti","Oh Yeah! , Big Tymers Featuring Tateeze, Boo & Gotti","She Hates Me , Puddle Of Mudd","Disease , matchbox twenty","Disease , matchbox twenty","Ordinary Day , Vanessa Carlton","Somewhere Out There , Our Lady Peace","Family Portrait , P!nk","Family Portrait , P!nk","Fabulous , Jaheim Featuring Tha Rayne","Beautiful Mess , Diamond Rio","Beautiful Mess , Diamond Rio","The Zephyr Song , Red Hot Chili Peppers","Lifestyles Of The Rich And Famous , Good Charlotte","Paradise , LL Cool J Featuring Amerie","Paradise , LL Cool J Featuring Amerie"
53,"You Gets No Love , Faith Evans","Blurry , Puddle Of Mudd","Blurry , Puddle Of Mudd","Blurry , Puddle Of Mudd","I'm Tryin' , Trace Adkins","I'm Tryin' , Trace Adkins","I Wanna Talk About Me , Toby Keith","Oops (Oh My) , Tweet","#1 , Nelly","#1 , Nelly","Where Were You (When The World Stopped Turning) , Alan Jackson","Take Away , Missy ""Misdemeanor"" Elliott Featuring Ginuwine & Tweet","Take Away , Missy ""Misdemeanor"" Elliott Featuring Ginuwine & Tweet","I Breathe In, I Breathe Out , Chris Cagle","Anything , Jaheim Featuring Next","Saturday (Oooh! Ooooh!) , Ludacris Featuring Sleepy Brown","Saturday (Oooh! Ooooh!) , Ludacris Featuring Sleepy Brown","Butterflies , Michael Jackson","Welcome To Atlanta , Jermaine Dupri & Ludacris","Welcome To Atlanta , Jermaine Dupri & Ludacris","What If She's An Angel , Tommy Shane Steiner","7 Days , Craig David","Blessed , Martina McBride","Blessed , Martina McBride","Hands Clean , Alanis Morissette","Awnaw , Nappy Roots","Awnaw , Nappy Roots","Young , Kenny Chesney","That's When I Love You , Phil Vassar","You Know That I Love You , Donell Jones","You Know That I Love You , Donell Jones","I Don't Want You To Go , Carolyn Dawn Johnson","Someone To Love You , Ruff Endz","Someone To Love You , Ruff Endz","The Good Stuff , Kenny Chesney","My Heart Is Lost To You , Brooks & Dunn","Anything , Jaheim Featuring Next","Anything , Jaheim Featuring Next","Dilemma , Nelly Featuring Kelly Rowland","When You Lie Next To Me , Kellie Coffey","When You Lie Next To Me , Kellie Coffey","Unbroken , Tim McGraw","Cleanin' Out My Closet , Eminem","Ten Rounds With Jose Cuervo , Tracy Byrd","Ten Rounds With Jose Cuervo , Tracy Byrd","Days Go By , Dirty Vegas","Stingy , Ginuwine","Stingy , Ginuwine","Running Away , Hoobastank","Ordinary Day , Vanessa Carlton","Somewhere Out There , Our Lady Peace","Somewhere Out There , Our Lady Peace","Somewhere Out There , Our Lady Peace","American Child , Phil Vassar","American Child , Phil Vassar","American Child , Phil Vassar","Work In Progress , Alan Jackson","Running Away , Hoobastank","Running Away , Hoobastank","Somewhere Out There , Our Lady Peace","Starry Eyed Surprise , Oakenfold Featuring Shifty Shellshock","Starry Eyed Surprise , Oakenfold Featuring Shifty Shellshock","The Ketchup Song (Hey Hah) , Las Ketchup","Running Away , Hoobastank","Starry Eyed Surprise , Oakenfold Featuring Shifty Shellshock","Starry Eyed Surprise , Oakenfold Featuring Shifty Shellshock","Cry , Faith Hill","The Zephyr Song , Red Hot Chili Peppers","The Zephyr Song , Red Hot Chili Peppers","Fall Into Me , Emerson Drive","Do That... , Baby Featuring P. Diddy","I Care 4 U , Aaliyah","I Care 4 U , Aaliyah"
54,"Young'n (Holla Back) , Fabolous","Young'n (Holla Back) , Fabolous","Young'n (Holla Back) , Fabolous","Young'n (Holla Back) , Fabolous","Emotion , Destiny's Child","Emotion , Destiny's Child","Wrapped Up In You , Garth Brooks","Uh Huh , B2K","Girlfriend , 'N Sync Featuring Nelly","Girlfriend , 'N Sync Featuring Nelly","Take Away , Missy ""Misdemeanor"" Elliott Featuring Ginuwine & Tweet","Young , Kenny Chesney","Young , Kenny Chesney","Some Days You Gotta Dance , Dixie Chicks","A New Day Has Come , Celine Dion","Good Morning Beautiful , Steve Holy","Good Morning Beautiful , Steve Holy","Uh Huh , B2K","The Long Goodbye , Brooks & Dunn","The Long Goodbye , Brooks & Dunn","Roc The Mic , Beanie Sigel & Freeway","Roc The Mic , Beanie Sigel & Freeway","I Breathe In, I Breathe Out , Chris Cagle","I Breathe In, I Breathe Out , Chris Cagle","Soak Up The Sun , Sheryl Crow","Gots Ta Be , B2K","Gots Ta Be , B2K","Modern Day Bonnie And Clyde , Travis Tritt","Days Go By , Dirty Vegas","I Don't Want You To Go , Carolyn Dawn Johnson","I Don't Want You To Go , Carolyn Dawn Johnson","I Need A Girl (Part Two) , P. Diddy & Ginuwine Featuring Loon, Mario Winans & Tammy Ruggeri","By The Way , Red Hot Chili Peppers","By The Way , Red Hot Chili Peppers","My List , Toby Keith","I Don't Have To Be Me ('til Monday) , Steve Azar","When You Lie Next To Me , Kellie Coffey","When You Lie Next To Me , Kellie Coffey","When You Lie Next To Me , Kellie Coffey","My Neck, My Back , Khia Featuring DSD","My Neck, My Back , Khia Featuring DSD","Drive (For Daddy Gene) , Alan Jackson","My Heart Is Lost To You , Brooks & Dunn","I Keep Looking , Sara Evans","I Keep Looking , Sara Evans","Tonight I Wanna Be Your Man , Andy Griggs","Call Me , Tweet","Call Me , Tweet","Days Go By , Dirty Vegas","Aerials , System Of A Down","Courtesy Of The Red, White And Blue (The Angry American) , Toby Keith","Courtesy Of The Red, White And Blue (The Angry American) , Toby Keith","Without Me , Eminem","Objection (Tango) , Shakira","Objection (Tango) , Shakira","Objection (Tango) , Shakira","Oh Yeah! , Big Tymers Featuring Tateeze, Boo & Gotti","You Know You're Right , Nirvana","You Know You're Right , Nirvana","Love Of My Life (An Ode To Hip Hop) , Erykah Badu Featuring Common","Girl Talk , TLC","Girl Talk , TLC","Cry , Faith Hill","The Zephyr Song , Red Hot Chili Peppers","Don't Know Why , Norah Jones","Don't Know Why , Norah Jones","Miss You , Aaliyah","Don't Know Why , Norah Jones","Don't Know Why , Norah Jones","Don't Know Why , Norah Jones","A Lot Of Things Different , Kenny Chesney","Thug Lovin' , Ja Rule Featuring Bobby Brown","Thug Lovin' , Ja Rule Featuring Bobby Brown"
