17,"We Thuggin' , Fat Joe Featuring R. Kelly","Rock The Boat , Aaliyah","Rock The Boat , Aaliyah","Rock The Boat , Aaliyah","Gone , 'N Sync","Gone , 'N Sync","Caramel , City High Featuring Eve","No More Drama , Mary J. Blige","Hero , Enrique Iglesias","Hero , Enrique Iglesias","Family Affair , Mary J. Blige","Oops (Oh My) , Tweet","Oops (Oh My) , Tweet","Girlfriend , 'N Sync Featuring Nelly","I Love You , Faith Evans","I Love You , Faith Evans","I Love You , Faith Evans","U Got It Bad , Usher","Can't Fight The Moonlight , LeAnn Rimes","Can't Fight The Moonlight , LeAnn Rimes","All You Wanted , Michelle Branch","I Love You , Faith Evans","Can't Get You Out Of My Head , Kylie Minogue","Can't Get You Out Of My Head , Kylie Minogue","Rainy Dayz , Mary J. Blige Featuring Ja Rule","Rainy Dayz , Mary J. Blige Featuring Ja Rule","Rainy Dayz , Mary J. Blige Featuring Ja Rule","Wasting My Time , Default","Here Is Gone , Goo Goo Dolls","I'm Gonna Be Alright , Jennifer Lopez Featuring Nas","I'm Gonna Be Alright , Jennifer Lopez Featuring Nas","Hero , Chad Kroeger Featuring Josey Scott","Don't Let Me Get Me , P!nk","Don't Let Me Get Me , P!nk","Rainy Dayz , Mary J. Blige Featuring Ja Rule","Complicated , Avril Lavigne","Full Moon , Brandy","Full Moon , Brandy","Soak Up The Sun , Sheryl Crow","Days Go By , Dirty Vegas","Days Go By , Dirty Vegas","No Such Thing , John Mayer","No Such Thing , John Mayer","Gangsta Lovin' , Eve Featuring Alicia Keys","Gangsta Lovin' , Eve Featuring Alicia Keys","Still Fly , Big Tymers","I'm Gonna Be Alright , Jennifer Lopez Featuring Nas","I'm Gonna Be Alright , Jennifer Lopez Featuring Nas","One Last Breath , Creed","Hero , Chad Kroeger Featuring Josey Scott","Hero , Chad Kroeger Featuring Josey Scott","Hero , Chad Kroeger Featuring Josey Scott","Hey Ma , Cam'Ron Featuring Juelz Santana, Freekey Zekey & Toya","A Thousand Miles , Vanessa Carlton","A Thousand Miles , Vanessa Carlton","Underneath It All , No Doubt Featuring Lady Saw","Lose Yourself , Eminem","Gimme The Light , Sean Paul","Gimme The Light , Sean Paul","If I Could Go! , Angie Martinez Featuring Lil' Mo & Sacario","Die Another Day , Madonna","Die Another Day , Madonna","dontchange , Musiq","dontchange , Musiq","Landslide , Dixie Chicks","Landslide , Dixie Chicks","Like I Love You , Justin Timberlake","dontchange , Musiq","dontchange , Musiq","One Last Breath , Creed","Dilemma , Nelly Featuring Kelly Rowland","dontchange , Musiq","dontchange , Musiq"
18,"Butterflies , Michael Jackson","Fallin' , Alicia Keys","Fallin' , Alicia Keys","Superman (It's Not Easy) , Five For Fighting","Rock The Boat , Aaliyah","Rock The Boat , Aaliyah","Livin' It Up , Ja Rule Featuring Case","Can't Fight The Moonlight , LeAnn Rimes","Roll Out (My Business) , Ludacris","Roll Out (My Business) , Ludacris","The Whole World , OutKast Featuring Killer Mike","The Whole World , OutKast Featuring Killer Mike","The Whole World , OutKast Featuring Killer Mike","The Whole World , OutKast Featuring Killer Mike","U Don't Have To Call , Usher","7 Days , Craig David","7 Days , Craig David","Hey Baby , No Doubt Featuring Bounty Killer","All You Wanted , Michelle Branch","All You Wanted , Michelle Branch","Can't Fight The Moonlight , LeAnn Rimes","Pass The Courvoisier Part II , Busta Rhymes Featuring P. Diddy & Pharrell","Underneath Your Clothes , Shakira","Underneath Your Clothes , Shakira","Here Is Gone , Goo Goo Dolls","Here Is Gone , Goo Goo Dolls","Here Is Gone , Goo Goo Dolls","Here Is Gone , Goo Goo Dolls","Ain't It Funny , Jennifer Lopez Featuring Ja Rule","Pass The Courvoisier Part II , Busta Rhymes Featuring P. Diddy & Pharrell","Pass The Courvoisier Part II , Busta Rhymes Featuring P. Diddy & Pharrell","Pass The Courvoisier Part II , Busta Rhymes Featuring P. Diddy & Pharrell","halfcrazy , Musiq","halfcrazy , Musiq","Still Fly , Big Tymers","Soak Up The Sun , Sheryl Crow","Soak Up The Sun , Sheryl Crow","Soak Up The Sun , Sheryl Crow","Down 4 U , Irv Gotti Presents The Inc. Featuring Ja Rule, Ashanti, Charli Baltimore & Vita","What's Luv? , Fat Joe Featuring Ashanti","What's Luv? , Fat Joe Featuring Ashanti","Soak Up The Sun , Sheryl Crow","Nothin' , N.O.R.E.","Still Fly , Big Tymers","Still Fly , Big Tymers","Oh Boy , Cam'Ron Featuring Juelz Santana","Move B***h , Ludacris Featuring Mystikal & Infamous 2.0","Move B***h , Ludacris Featuring Mystikal & Infamous 2.0","The Middle , Jimmy Eat World","The Middle , Jimmy Eat World","The Middle , Jimmy Eat World","The Middle , Jimmy Eat World","If I Could Go! , Angie Martinez Featuring Lil' Mo & Sacario","I Care 4 U , Aaliyah","I Care 4 U , Aaliyah","I Care 4 U , Aaliyah","I Care 4 U , Aaliyah","I Care 4 U , Aaliyah","I Care 4 U , Aaliyah","Move B***h , Ludacris Featuring Mystikal & Infamous 2.0","If I Could Go! , Angie Martinez Featuring Lil' Mo & Sacario","If I Could Go! , Angie Martinez Featuring Lil' Mo & Sacario","I Care 4 U , Aaliyah","Baby , Ashanti","Complicated , Avril Lavigne","Complicated , Avril Lavigne","dontchange , Musiq","She Hates Me , Puddle Of Mudd","She Hates Me , Puddle Of Mudd","dontchange , Musiq","When The Last Time , Clipse","Thugz Mansion , 2Pac","Thugz Mansion , 2Pac"
19,"Hey Baby , No Doubt Featuring Bounty Killer","Hey Baby , No Doubt Featuring Bounty Killer","Hey Baby , No Doubt Featuring Bounty Killer","Turn Off The Light , Nelly Furtado","7 Days , Craig David","7 Days , Craig David","Rock The Boat , Aaliyah","Caramel , City High Featuring Eve","Can't Get You Out Of My Head , Kylie Minogue","Can't Get You Out Of My Head , Kylie Minogue","Hero , Enrique Iglesias","A Woman's Worth , Alicia Keys","A Woman's Worth , Alicia Keys","Get The Party Started , P!nk","Foolish , Ashanti","Lights, Camera, Action! , Mr. Cheeks","Lights, Camera, Action! , Mr. Cheeks","My Sacrifice , Creed","My Sacrifice , Creed","My Sacrifice , Creed","What About Us? , Brandy","Here Is Gone , Goo Goo Dolls","Here Is Gone , Goo Goo Dolls","Here Is Gone , Goo Goo Dolls","I Love You , Faith Evans","The Middle , Jimmy Eat World","The Middle , Jimmy Eat World","Without Me , Eminem","In The End , Linkin Park","halfcrazy , Musiq","halfcrazy , Musiq","halfcrazy , Musiq","Days Go By , Dirty Vegas","Days Go By , Dirty Vegas","Wasting My Time , Default","Blurry , Puddle Of Mudd","Blurry , Puddle Of Mudd","Blurry , Puddle Of Mudd","Heaven , DJ Sammy & Yanou Featuring Do","Full Moon , Brandy","Full Moon , Brandy","Nothin' , N.O.R.E.","Addictive , Truth Hurts Featuring Rakim","Foolish , Ashanti","Foolish , Ashanti","Move B***h , Ludacris Featuring Mystikal & Infamous 2.0","One Last Breath , Creed","One Last Breath , Creed","Gotta Get Thru This , Daniel Bedingfield","Long Time Gone , Dixie Chicks","If I Could Go! , Angie Martinez Featuring Lil' Mo & Sacario","If I Could Go! , Angie Martinez Featuring Lil' Mo & Sacario","Hero , Chad Kroeger Featuring Josey Scott","Trade It All , Fabolous Featuring P. Diddy & Jagged Edge","Trade It All , Fabolous Featuring P. Diddy & Jagged Edge","Trade It All , Fabolous Featuring P. Diddy & Jagged Edge","Trade It All , Fabolous Featuring P. Diddy & Jagged Edge","Nothin' , N.O.R.E.","Nothin' , N.O.R.E.","Gotta Get Thru This , Daniel Bedingfield","Gotta Get Thru This , Daniel Bedingfield","Gotta Get Thru This , Daniel Bedingfield","If I Could Go! , Angie Martinez Featuring Lil' Mo & Sacario","Landslide , Dixie Chicks","Baby , Ashanti","Baby , Ashanti","She Hates Me , Puddle Of Mudd","Sk8er Boi , Avril Lavigne","Sk8er Boi , Avril Lavigne","When The Last Time , Clipse","One Last Breath , Creed","Hey Ma , Cam'Ron Featuring Juelz Santana, Freekey Zekey & Toya","Hey Ma , Cam'Ron Featuring Juelz Santana, Freekey Zekey & Toya"
20,"Superman (It's Not Easy) , Five For Fighting","We Thuggin' , Fat Joe Featuring R. Kelly","We Thuggin' , Fat Joe Featuring R. Kelly","Caramel , City High Featuring Eve","Superman (It's Not Easy) , Five For Fighting","Superman (It's Not Easy) , Five For Fighting","We Thuggin' , Fat Joe Featuring R. Kelly","We Thuggin' , Fat Joe Featuring R. Kelly","Blurry , Puddle Of Mudd","Blurry , Puddle Of Mudd","Butterflies , Michael Jackson","Family Affair , Mary J. Blige","Family Affair , Mary J. Blige","No More Drama , Mary J. Blige","Whenever, Wherever , Shakira","Escape , Enrique Iglesias","Escape , Enrique Iglesias","7 Days , Craig David","Lights, Camera, Action! , Mr. Cheeks","Lights, Camera, Action! , Mr. Cheeks","Pass The Courvoisier Part II , Busta Rhymes Featuring P. Diddy & Pharrell","Underneath Your Clothes , Shakira","Always On Time , Ja Rule Featuring Ashanti","Always On Time , Ja Rule Featuring Ashanti","Wasting My Time , Default","Wasting My Time , Default","Wasting My Time , Default","Wherever You Will Go , The Calling","Wherever You Will Go , The Calling","Wherever You Will Go , The Calling","Wherever You Will Go , The Calling","Underneath Your Clothes , Shakira","Down A** Chick , Ja Rule Featuring Charli ""Chuck"" Baltimore","Down A** Chick , Ja Rule Featuring Charli ""Chuck"" Baltimore","Down A** Chick , Ja Rule Featuring Charli ""Chuck"" Baltimore","I Need A Girl (Part Two) , P. Diddy & Ginuwine Featuring Loon, Mario Winans & Tammy Ruggeri","All You Wanted , Michelle Branch","All You Wanted , Michelle Branch","Full Moon , Brandy","Nothin' , N.O.R.E.","Nothin' , N.O.R.E.","Days Go By , Dirty Vegas","Gangsta Lovin' , Eve Featuring Alicia Keys","Addictive , Truth Hurts Featuring Rakim","Addictive , Truth Hurts Featuring Rakim","Foolish , Ashanti","Without Me , Eminem","Without Me , Eminem","I'm Gonna Be Alright , Jennifer Lopez Featuring Nas","I'm Gonna Be Alright , Jennifer Lopez Featuring Nas","Hey Ma , Cam'Ron Featuring Juelz Santana, Freekey Zekey & Toya","Hey Ma , Cam'Ron Featuring Juelz Santana, Freekey Zekey & Toya","Trade It All , Fabolous Featuring P. Diddy & Jagged Edge","Hero , Chad Kroeger Featuring Josey Scott","Hero , Chad Kroeger Featuring Josey Scott","Luv U Better , LL Cool J","Nothin' , N.O.R.E.","The Game Of Love , Santana Featuring Michelle Branch","The Game Of Love , Santana Featuring Michelle Branch","Goodbye To You , Michelle Branch","dontchange , Musiq","dontchange , Musiq","Po' Folks , Nappy Roots Featuring Anthony Hamilton","When The Last Time , Clipse","When The Last Time , Clipse","When The Last Time , Clipse","When The Last Time , Clipse","When The Last Time , Clipse","When The Last Time , Clipse","Like I Love You , Justin Timberlake","Die Another Day , Madonna","Family Portrait , P!nk","Family Portrait , P!nk"
21,"Caramel , City High Featuring Eve","Caramel , City High Featuring Eve","Caramel , City High Featuring Eve","Roll Out (My Business) , Ludacris","Roll Out (My Business) , Ludacris","Roll Out (My Business) , Ludacris","What About Us? , Brandy","Differences , Ginuwine","Caramel , City High Featuring Eve","Caramel , City High Featuring Eve","Caramel , City High Featuring Eve","Girlfriend , 'N Sync Featuring Nelly","Girlfriend , 'N Sync Featuring Nelly","I Love You , Faith Evans","The Whole World , OutKast Featuring Killer Mike","The Whole World , OutKast Featuring Killer Mike","The Whole World , OutKast Featuring Killer Mike","Don't Let Me Get Me , P!nk","The Whole World , OutKast Featuring Killer Mike","The Whole World , OutKast Featuring Killer Mike","Here Is Gone , Goo Goo Dolls","Saturday (Oooh! Ooooh!) , Ludacris Featuring Sleepy Brown","Saturday (Oooh! Ooooh!) , Ludacris Featuring Sleepy Brown","Saturday (Oooh! Ooooh!) , Ludacris Featuring Sleepy Brown","A New Day Has Come , Celine Dion","Hella Good , No Doubt","Hella Good , No Doubt","Hella Good , No Doubt","Oh Boy , Cam'Ron Featuring Juelz Santana","Ain't It Funny , Jennifer Lopez Featuring Ja Rule","Ain't It Funny , Jennifer Lopez Featuring Ja Rule","Wherever You Will Go , The Calling","Wherever You Will Go , The Calling","Wherever You Will Go , The Calling","Soak Up The Sun , Sheryl Crow","Wasting My Time , Default","U Don't Have To Call , Usher","U Don't Have To Call , Usher","Hella Good , No Doubt","halfcrazy , Musiq","halfcrazy , Musiq","Just Like A Pill , P!nk","Soak Up The Sun , Sheryl Crow","Soak Up The Sun , Sheryl Crow","Soak Up The Sun , Sheryl Crow","Cleanin' Out My Closet , Eminem","Still Fly , Big Tymers","Still Fly , Big Tymers","The Good Stuff , Kenny Chesney","The Good Stuff , Kenny Chesney","I'm Gonna Be Alright , Jennifer Lopez Featuring Nas","I'm Gonna Be Alright , Jennifer Lopez Featuring Nas","I Care 4 U , Aaliyah","Good Times , Styles","Good Times , Styles","Good Times , Styles","Just Like A Pill , P!nk","Trade It All , Fabolous Featuring P. Diddy & Jagged Edge","Trade It All , Fabolous Featuring P. Diddy & Jagged Edge","Trade It All , Fabolous Featuring P. Diddy & Jagged Edge","Po' Folks , Nappy Roots Featuring Anthony Hamilton","Po' Folks , Nappy Roots Featuring Anthony Hamilton","Landslide , Dixie Chicks","Love Of My Life (An Ode To Hip Hop) , Erykah Badu Featuring Common","Don't Mess With My Man , Nivea Featuring Brian & Brandon Casey","Don't Mess With My Man , Nivea Featuring Brian & Brandon Casey","A Moment Like This , Kelly Clarkson","Beautiful , Christina Aguilera","Beautiful , Christina Aguilera","Bump, Bump, Bump , B2K & P. Diddy","Who's Your Daddy? , Toby Keith","Your Body Is A Wonderland , John Mayer","Your Body Is A Wonderland , John Mayer"
22,"Only Time , Enya","Only Time , Enya","Only Time , Enya","7 Days , Craig David","Caramel , City High Featuring Eve","Caramel , City High Featuring Eve","Gone , 'N Sync","Livin' It Up , Ja Rule Featuring Case","The Whole World , OutKast Featuring Killer Mike","The Whole World , OutKast Featuring Killer Mike","Roll Out (My Business) , Ludacris","What's Luv? , Fat Joe Featuring Ashanti","What's Luv? , Fat Joe Featuring Ashanti","Family Affair , Mary J. Blige","Escape , Enrique Iglesias","Hands Clean , Alanis Morissette","Hands Clean , Alanis Morissette","A Thousand Miles , Vanessa Carlton","U Got It Bad , Usher","U Got It Bad , Usher","The Whole World , OutKast Featuring Killer Mike","Wasting My Time , Default","Wasting My Time , Default","Wasting My Time , Default","The Middle , Jimmy Eat World","Addictive , Truth Hurts Featuring Rakim","Addictive , Truth Hurts Featuring Rakim","Addictive , Truth Hurts Featuring Rakim","How You Remind Me , Nickelback","In The End , Linkin Park","In The End , Linkin Park","Ain't It Funny , Jennifer Lopez Featuring Ja Rule","Still Fly , Big Tymers","Still Fly , Big Tymers","Don't Let Me Get Me , P!nk","Full Moon , Brandy","Wasting My Time , Default","Wasting My Time , Default","All You Wanted , Michelle Branch","Blurry , Puddle Of Mudd","Blurry , Puddle Of Mudd","I Need A Girl (Part One) , P. Diddy Featuring Usher & Loon","The Good Stuff , Kenny Chesney","The Good Stuff , Kenny Chesney","The Good Stuff , Kenny Chesney","One Last Breath , Creed","Gotta Get Thru This , Daniel Bedingfield","Gotta Get Thru This , Daniel Bedingfield","Why Don't We Fall In Love , Amerie","Love At First Sight , Kylie Minogue","Long Time Gone , Dixie Chicks","Long Time Gone , Dixie Chicks","Good Times , Styles","Heaven , DJ Sammy & Yanou Featuring Do","Heaven , DJ Sammy & Yanou Featuring Do","Sk8er Boi , Avril Lavigne","Hot In Herre , Nelly","Happy , Ashanti","Happy , Ashanti","I Need A Girl (Part Two) , P. Diddy & Ginuwine Featuring Loon, Mario Winans & Tammy Ruggeri","Somebody Like You , Keith Urban","Somebody Like You , Keith Urban","Gotta Get Thru This , Daniel Bedingfield","Somebody Like You , Keith Urban","Air Force Ones , Nelly Featuring Kyjuan, Ali & Murphy Lee","Air Force Ones , Nelly Featuring Kyjuan, Ali & Murphy Lee","Complicated , Avril Lavigne","These Days , Rascal Flatts","These Days , Rascal Flatts","Your Body Is A Wonderland , John Mayer","Your Body Is A Wonderland , John Mayer","She'll Leave You With A Smile , George Strait","She'll Leave You With A Smile , George Strait"
23,"Where The Stars And Stripes And The Eagle Fly , Aaron Tippin","I Do!! , Toya","I Do!! , Toya","#1 , Nelly","#1 , Nelly","#1 , Nelly","Superman (It's Not Easy) , Five For Fighting","Lights, Camera, Action! , Mr. Cheeks","Lights, Camera, Action! , Mr. Cheeks","Lights, Camera, Action! , Mr. Cheeks","Lights, Camera, Action! , Mr. Cheeks","Roll Out (My Business) , Ludacris","Roll Out (My Business) , Ludacris","Roll Out (My Business) , Ludacris","Family Affair , Mary J. Blige","No More Drama , Mary J. Blige","No More Drama , Mary J. Blige","All You Wanted , Michelle Branch","I Need A Girl (Part One) , P. Diddy Featuring Usher & Loon","I Need A Girl (Part One) , P. Diddy Featuring Usher & Loon","My Sacrifice , Creed","Can't Fight The Moonlight , LeAnn Rimes","A New Day Has Come , Celine Dion","A New Day Has Come , Celine Dion","Can't Get You Out Of My Head , Kylie Minogue","A New Day Has Come , Celine Dion","A New Day Has Come , Celine Dion","Escape , Enrique Iglesias","halfcrazy , Musiq","Here Is Gone , Goo Goo Dolls","Here Is Gone , Goo Goo Dolls","In The End , Linkin Park","Full Moon , Brandy","Full Moon , Brandy","Full Moon , Brandy","Don't Let Me Get Me , P!nk","Just A Friend 2002 , Mario","Just A Friend 2002 , Mario","Blurry , Puddle Of Mudd","All You Wanted , Michelle Branch","All You Wanted , Michelle Branch","What's Luv? , Fat Joe Featuring Ashanti","I Need A Girl (Part One) , P. Diddy Featuring Usher & Loon","Move B***h , Ludacris Featuring Mystikal & Infamous 2.0","Move B***h , Ludacris Featuring Mystikal & Infamous 2.0","Soak Up The Sun , Sheryl Crow","The Good Stuff , Kenny Chesney","The Good Stuff , Kenny Chesney","Without Me , Eminem","Why Don't We Fall In Love , Amerie","The Good Stuff , Kenny Chesney","The Good Stuff , Kenny Chesney","The Middle , Jimmy Eat World","Work It , Missy ""Misdemeanor"" Elliott","Work It , Missy ""Misdemeanor"" Elliott","No Such Thing , John Mayer","Baby , Ashanti","Baby , Ashanti","Baby , Ashanti","Cleanin' Out My Closet , Eminem","Move B***h , Ludacris Featuring Mystikal & Infamous 2.0","Move B***h , Ludacris Featuring Mystikal & Infamous 2.0","Somebody Like You , Keith Urban","If I Could Go! , Angie Martinez Featuring Lil' Mo & Sacario","She Hates Me , Puddle Of Mudd","She Hates Me , Puddle Of Mudd","Baby , Ashanti","Your Body Is A Wonderland , John Mayer","Your Body Is A Wonderland , John Mayer","Who's Your Daddy? , Toby Keith","Miss You , Aaliyah","One Last Breath , Creed","One Last Breath , Creed"
24,"#1 , Nelly","#1 , Nelly","#1 , Nelly","Fallin' , Alicia Keys","The Whole World , OutKast Featuring Killer Mike","The Whole World , OutKast Featuring Killer Mike","The Whole World , OutKast Featuring Killer Mike","The Whole World , OutKast Featuring Killer Mike","Standing Still , Jewel","Standing Still , Jewel","Oops (Oh My) , Tweet","Hero , Enrique Iglesias","Hero , Enrique Iglesias","U Don't Have To Call , Usher","Get The Party Started , P!nk","Family Affair , Mary J. Blige","Family Affair , Mary J. Blige","More Than A Woman , Aaliyah","Pass The Courvoisier Part II , Busta Rhymes Featuring P. Diddy & Pharrell","Pass The Courvoisier Part II , Busta Rhymes Featuring P. Diddy & Pharrell","Underneath Your Clothes , Shakira","My Sacrifice , Creed","Rainy Dayz , Mary J. Blige Featuring Ja Rule","Rainy Dayz , Mary J. Blige Featuring Ja Rule","Hella Good , No Doubt","I Love You , Faith Evans","I Love You , Faith Evans","Hot In Herre , Nelly","Girlfriend , 'N Sync Featuring Nelly","Down A** Chick , Ja Rule Featuring Charli ""Chuck"" Baltimore","Down A** Chick , Ja Rule Featuring Charli ""Chuck"" Baltimore","Still Fly , Big Tymers","More Than A Woman , Aaliyah","More Than A Woman , Aaliyah","More Than A Woman , Aaliyah","Rainy Dayz , Mary J. Blige Featuring Ja Rule","Heaven , DJ Sammy & Yanou Featuring Do","Heaven , DJ Sammy & Yanou Featuring Do","Wasting My Time , Default","Hella Good , No Doubt","Hella Good , No Doubt","halfcrazy , Musiq","Courtesy Of The Red, White And Blue (The Angry American) , Toby Keith","halfcrazy , Musiq","halfcrazy , Musiq","Addictive , Truth Hurts Featuring Rakim","Soak Up The Sun , Sheryl Crow","Soak Up The Sun , Sheryl Crow","Love At First Sight , Kylie Minogue","If I Could Go! , Angie Martinez Featuring Lil' Mo & Sacario","Good Times , Styles","Good Times , Styles","Soak Up The Sun , Sheryl Crow","The Middle , Jimmy Eat World","The Middle , Jimmy Eat World","A Thousand Miles , Vanessa Carlton","A Thousand Miles , Vanessa Carlton","Just Like A Pill , P!nk","Just Like A Pill , P!nk","dontchange , Musiq","Goodbye To You , Michelle Branch","Goodbye To You , Michelle Branch","'03 Bonnie & Clyde , Jay-Z Featuring Beyonce Knowles","Po' Folks , Nappy Roots Featuring Anthony Hamilton","Gangsta Lovin' , Eve Featuring Alicia Keys","Gangsta Lovin' , Eve Featuring Alicia Keys","Somebody Like You , Keith Urban","A Moment Like This , Kelly Clarkson","A Moment Like This , Kelly Clarkson","These Days , Rascal Flatts","Family Portrait , P!nk","All I Have , Jennifer Lopez Featuring LL Cool J","All I Have , Jennifer Lopez Featuring LL Cool J"
25,"I'm Real , Jennifer Lopez Featuring Ja Rule","I'm Real , Jennifer Lopez Featuring Ja Rule","I'm Real , Jennifer Lopez Featuring Ja Rule","I Do!! , Toya","Break Ya Neck , Busta Rhymes","Break Ya Neck , Busta Rhymes","Break Ya Neck , Busta Rhymes","Break Ya Neck , Busta Rhymes","We Thuggin' , Fat Joe Featuring R. Kelly","We Thuggin' , Fat Joe Featuring R. Kelly","Superman (It's Not Easy) , Five For Fighting","Caramel , City High Featuring Eve","Caramel , City High Featuring Eve","Hands Clean , Alanis Morissette","Hands Clean , Alanis Morissette","Don't Let Me Get Me , P!nk","Don't Let Me Get Me , P!nk","Hands Clean , Alanis Morissette","Here Is Gone , Goo Goo Dolls","Here Is Gone , Goo Goo Dolls","Wasting My Time , Default","More Than A Woman , Aaliyah","The Middle , Jimmy Eat World","The Middle , Jimmy Eat World","Saturday (Oooh! Ooooh!) , Ludacris Featuring Sleepy Brown","My List , Toby Keith","My List , Toby Keith","halfcrazy , Musiq","I'm Gonna Be Alright , Jennifer Lopez Featuring Nas","How You Remind Me , Nickelback","How You Remind Me , Nickelback","Down A** Chick , Ja Rule Featuring Charli ""Chuck"" Baltimore","Pass The Courvoisier Part II , Busta Rhymes Featuring P. Diddy & Pharrell","Pass The Courvoisier Part II , Busta Rhymes Featuring P. Diddy & Pharrell","Wherever You Will Go , The Calling","Wherever You Will Go , The Calling","Down 4 U , Irv Gotti Presents The Inc. Featuring Ja Rule, Ashanti, Charli Baltimore & Vita","Down 4 U , Irv Gotti Presents The Inc. Featuring Ja Rule, Ashanti, Charli Baltimore & Vita","U Don't Have To Call , Usher","Dilemma , Nelly Featuring Kelly Rowland","Dilemma , Nelly Featuring Kelly Rowland","Full Moon , Brandy","halfcrazy , Musiq","Courtesy Of The Red, White And Blue (The Angry American) , Toby Keith","Courtesy Of The Red, White And Blue (The Angry American) , Toby Keith","The Good Stuff , Kenny Chesney","Why Don't We Fall In Love , Amerie","Why Don't We Fall In Love , Amerie","Still Fly , Big Tymers","Soak Up The Sun , Sheryl Crow","Unbroken , Tim McGraw","Unbroken , Tim McGraw","Ten Rounds With Jose Cuervo , Tracy Byrd","Like I Love You , Justin Timberlake","Like I Love You , Justin Timberlake","Heaven , DJ Sammy & Yanou Featuring Do","Somebody Like You , Keith Urban","Somebody Like You , Keith Urban","Somebody Like You , Keith Urban","Somebody Like You , Keith Urban","When The Last Time , Clipse","When The Last Time , Clipse","When The Last Time , Clipse","Gotta Get Thru This , Daniel Bedingfield","Somebody Like You , Keith Urban","Somebody Like You , Keith Urban","These Days , Rascal Flatts","Somebody Like You , Keith Urban","Somebody Like You , Keith Urban","Sk8er Boi , Avril Lavigne","I'm With You , Avril Lavigne","Dilemma , Nelly Featuring Kelly Rowland","Dilemma , Nelly Featuring Kelly Rowland"
