,2002-01-01,2002-01-06,2002-01-11,2002-01-16,2002-01-21,2002-01-26,2002-01-31,2002-02-05,2002-02-10,2002-02-15,2002-02-20,2002-02-25,2002-03-02,2002-03-07,2002-03-12,2002-03-17,2002-03-22,2002-03-27,2002-04-01,2002-04-06,2002-04-11,2002-04-16,2002-04-21,2002-04-26,2002-05-01,2002-05-06,2002-05-11,2002-05-16,2002-05-21,2002-05-26,2002-05-31,2002-06-05,2002-06-10,2002-06-15,2002-06-20,2002-06-25,2002-06-30,2002-07-05,2002-07-10,2002-07-15,2002-07-20,2002-07-25,2002-07-30,2002-08-04,2002-08-09,2002-08-14,2002-08-19,2002-08-24,2002-08-29,2002-09-03,2002-09-08,2002-09-13,2002-09-18,2002-09-23,2002-09-28,2002-10-03,2002-10-08,2002-10-13,2002-10-18,2002-10-23,2002-10-28,2002-11-02,2002-11-07,2002-11-12,2002-11-17,2002-11-22,2002-11-27,2002-12-02,2002-12-07,2002-12-12,2002-12-17,2002-12-22,2002-12-27
0,"How You Remind Me , Nickelback","How You Remind Me , Nickelback","How You Remind Me , Nickelback","U Got It Bad , Usher","U Got It Bad , Usher","U Got It Bad , Usher","U Got It Bad , Usher","U Got It Bad , Usher","U Got It Bad , Usher","U Got It Bad , Usher","Always On Time , Ja Rule Featuring Ashanti","Always On Time , Ja Rule Featuring Ashanti","Always On Time , Ja Rule Featuring Ashanti","Ain't It Funny , Jennifer Lopez Featuring Ja Rule","Ain't It Funny , Jennifer Lopez Featuring Ja Rule","Ain't It Funny , Jennifer Lopez Featuring Ja Rule","Ain't It Funny , Jennifer Lopez Featuring Ja Rule","Ain't It Funny , Jennifer Lopez Featuring Ja Rule","Ain't It Funny , Jennifer Lopez Featuring Ja Rule","Ain't It Funny , Jennifer Lopez Featuring Ja Rule","Ain't It Funny , Jennifer Lopez Featuring Ja Rule","Foolish , Ashanti","Foolish , Ashanti","Foolish , Ashanti","Foolish , Ashanti","Foolish , Ashanti","Foolish , Ashanti","Foolish , Ashanti","Foolish , Ashanti","Foolish , Ashanti","Foolish , Ashanti","Foolish , Ashanti","Foolish , Ashanti","Foolish , Ashanti","Foolish , Ashanti","Hot In Herre , Nelly","Hot In Herre , Nelly","Hot In Herre , Nelly","Hot In Herre , Nelly","Hot In Herre , Nelly","Hot In Herre , Nelly","Hot In Herre , Nelly","Hot In Herre , Nelly","Hot In Herre , Nelly","Hot In Herre , Nelly","Dilemma , Nelly Featuring Kelly Rowland","Dilemma , Nelly Featuring Kelly Rowland","Dilemma , Nelly Featuring Kelly Rowland","Dilemma , Nelly Featuring Kelly Rowland","Dilemma , Nelly Featuring Kelly Rowland","Dilemma , Nelly Featuring Kelly Rowland","Dilemma , Nelly Featuring Kelly Rowland","Dilemma , Nelly Featuring Kelly Rowland","Dilemma , Nelly Featuring Kelly Rowland","Dilemma , Nelly Featuring Kelly Rowland","A Moment Like This , Kelly Clarkson","A Moment Like This , Kelly Clarkson","Dilemma , Nelly Featuring Kelly Rowland","Dilemma , Nelly Featuring Kelly Rowland","Dilemma , Nelly Featuring Kelly Rowland","Dilemma , Nelly Featuring Kelly Rowland","Dilemma , Nelly Featuring Kelly Rowland","Lose Yourself , Eminem","Lose Yourself , Eminem","Lose Yourself , Eminem","Lose Yourself , Eminem","Lose Yourself , Eminem","Lose Yourself , Eminem","Lose Yourself , Eminem","Lose Yourself , Eminem","Lose Yourself , Eminem","Lose Yourself , Eminem","Lose Yourself , Eminem"
1,"U Got It Bad , Usher","U Got It Bad , Usher","U Got It Bad , Usher","How You Remind Me , Nickelback","How You Remind Me , Nickelback","How You Remind Me , Nickelback","How You Remind Me , Nickelback","How You Remind Me , Nickelback","How You Remind Me , Nickelback","How You Remind Me , Nickelback","How You Remind Me , Nickelback","How You Remind Me , Nickelback","How You Remind Me , Nickelback","Always On Time , Ja Rule Featuring Ashanti","Always On Time , Ja Rule Featuring Ashanti","Always On Time , Ja Rule Featuring Ashanti","Always On Time , Ja Rule Featuring Ashanti","In The End , Linkin Park","What's Luv? , Fat Joe Featuring Ashanti","What's Luv? , Fat Joe Featuring Ashanti","What's Luv? , Fat Joe Featuring Ashanti","What's Luv? , Fat Joe Featuring Ashanti","What's Luv? , Fat Joe Featuring Ashanti","What's Luv? , Fat Joe Featuring Ashanti","What's Luv? , Fat Joe Featuring Ashanti","What's Luv? , Fat Joe Featuring Ashanti","What's Luv? , Fat Joe Featuring Ashanti","What's Luv? , Fat Joe Featuring Ashanti","I Need A Girl (Part One) , P. Diddy Featuring Usher & Loon","I Need A Girl (Part One) , P. Diddy Featuring Usher & Loon","I Need A Girl (Part One) , P. Diddy Featuring Usher & Loon","I Need A Girl (Part One) , P. Diddy Featuring Usher & Loon","I Need A Girl (Part One) , P. Diddy Featuring Usher & Loon","I Need A Girl (Part One) , P. Diddy Featuring Usher & Loon","Hot In Herre , Nelly","Without Me , Eminem","Without Me , Eminem","Without Me , Eminem","Without Me , Eminem","Without Me , Eminem","Without Me , Eminem","Without Me , Eminem","Complicated , Avril Lavigne","Dilemma , Nelly Featuring Kelly Rowland","Dilemma , Nelly Featuring Kelly Rowland","Hot In Herre , Nelly","Hot In Herre , Nelly","Hot In Herre , Nelly","Hot In Herre , Nelly","Complicated , Avril Lavigne","Gangsta Lovin' , Eve Featuring Alicia Keys","Gangsta Lovin' , Eve Featuring Alicia Keys","Gangsta Lovin' , Eve Featuring Alicia Keys","Gangsta Lovin' , Eve Featuring Alicia Keys","Gangsta Lovin' , Eve Featuring Alicia Keys","Dilemma , Nelly Featuring Kelly Rowland","Dilemma , Nelly Featuring Kelly Rowland","A Moment Like This , Kelly Clarkson","A Moment Like This , Kelly Clarkson","Gangsta Lovin' , Eve Featuring Alicia Keys","Lose Yourself , Eminem","Lose Yourself , Eminem","Dilemma , Nelly Featuring Kelly Rowland","Work It , Missy ""Misdemeanor"" Elliott","Work It , Missy ""Misdemeanor"" Elliott","Work It , Missy ""Misdemeanor"" Elliott","Work It , Missy ""Misdemeanor"" Elliott","Work It , Missy ""Misdemeanor"" Elliott","Work It , Missy ""Misdemeanor"" Elliott","Work It , Missy ""Misdemeanor"" Elliott","Work It , Missy ""Misdemeanor"" Elliott","Work It , Missy ""Misdemeanor"" Elliott","Work It , Missy ""Misdemeanor"" Elliott"
2,"Family Affair , Mary J. Blige","Family Affair , Mary J. Blige","Family Affair , Mary J. Blige","Family Affair , Mary J. Blige","Always On Time , Ja Rule Featuring Ashanti","Always On Time , Ja Rule Featuring Ashanti","Always On Time , Ja Rule Featuring Ashanti","Always On Time , Ja Rule Featuring Ashanti","Always On Time , Ja Rule Featuring Ashanti","Always On Time , Ja Rule Featuring Ashanti","U Got It Bad , Usher","Ain't It Funny , Jennifer Lopez Featuring Ja Rule","Ain't It Funny , Jennifer Lopez Featuring Ja Rule","How You Remind Me , Nickelback","How You Remind Me , Nickelback","In The End , Linkin Park","In The End , Linkin Park","How You Remind Me , Nickelback","In The End , Linkin Park","In The End , Linkin Park","Foolish , Ashanti","Ain't It Funny , Jennifer Lopez Featuring Ja Rule","Ain't It Funny , Jennifer Lopez Featuring Ja Rule","Ain't It Funny , Jennifer Lopez Featuring Ja Rule","U Don't Have To Call , Usher","I Need A Girl (Part One) , P. Diddy Featuring Usher & Loon","I Need A Girl (Part One) , P. Diddy Featuring Usher & Loon","I Need A Girl (Part One) , P. Diddy Featuring Usher & Loon","What's Luv? , Fat Joe Featuring Ashanti","What's Luv? , Fat Joe Featuring Ashanti","What's Luv? , Fat Joe Featuring Ashanti","What's Luv? , Fat Joe Featuring Ashanti","Hot In Herre , Nelly","Hot In Herre , Nelly","I Need A Girl (Part One) , P. Diddy Featuring Usher & Loon","Foolish , Ashanti","Foolish , Ashanti","Foolish , Ashanti","Hero , Chad Kroeger Featuring Josey Scott","Hero , Chad Kroeger Featuring Josey Scott","Hero , Chad Kroeger Featuring Josey Scott","Complicated , Avril Lavigne","Dilemma , Nelly Featuring Kelly Rowland","Complicated , Avril Lavigne","Complicated , Avril Lavigne","Complicated , Avril Lavigne","Complicated , Avril Lavigne","Complicated , Avril Lavigne","Complicated , Avril Lavigne","Hot In Herre , Nelly","Complicated , Avril Lavigne","Complicated , Avril Lavigne","Complicated , Avril Lavigne","Complicated , Avril Lavigne","Complicated , Avril Lavigne","Gangsta Lovin' , Eve Featuring Alicia Keys","Gangsta Lovin' , Eve Featuring Alicia Keys","Gangsta Lovin' , Eve Featuring Alicia Keys","Gangsta Lovin' , Eve Featuring Alicia Keys","A Moment Like This , Kelly Clarkson","Hey Ma , Cam'Ron Featuring Juelz Santana, Freekey Zekey & Toya","Hey Ma , Cam'Ron Featuring Juelz Santana, Freekey Zekey & Toya","Work It , Missy ""Misdemeanor"" Elliott","Dilemma , Nelly Featuring Kelly Rowland","Underneath It All , No Doubt Featuring Lady Saw","Underneath It All , No Doubt Featuring Lady Saw","Underneath It All , No Doubt Featuring Lady Saw","Jenny From The Block , Jennifer Lopez Featuring Styles & Jadakiss","Jenny From The Block , Jennifer Lopez Featuring Styles & Jadakiss","Jenny From The Block , Jennifer Lopez Featuring Styles & Jadakiss","Jenny From The Block , Jennifer Lopez Featuring Styles & Jadakiss","Jenny From The Block , Jennifer Lopez Featuring Styles & Jadakiss","Jenny From The Block , Jennifer Lopez Featuring Styles & Jadakiss"
3,"Get The Party Started , P!nk","Get The Party Started , P!nk","Get The Party Started , P!nk","Get The Party Started , P!nk","Get The Party Started , P!nk","Get The Party Started , P!nk","Get The Party Started , P!nk","My Sacrifice , Creed","Ain't It Funny , Jennifer Lopez Featuring Ja Rule","Ain't It Funny , Jennifer Lopez Featuring Ja Rule","Ain't It Funny , Jennifer Lopez Featuring Ja Rule","In The End , Linkin Park","In The End , Linkin Park","In The End , Linkin Park","In The End , Linkin Park","How You Remind Me , Nickelback","How You Remind Me , Nickelback","Always On Time , Ja Rule Featuring Ashanti","Foolish , Ashanti","Foolish , Ashanti","In The End , Linkin Park","U Don't Have To Call , Usher","U Don't Have To Call , Usher","U Don't Have To Call , Usher","I Need A Girl (Part One) , P. Diddy Featuring Usher & Loon","U Don't Have To Call , Usher","U Don't Have To Call , Usher","U Don't Have To Call , Usher","U Don't Have To Call , Usher","U Don't Have To Call , Usher","U Don't Have To Call , Usher","Without Me , Eminem","Without Me , Eminem","Without Me , Eminem","Without Me , Eminem","I Need A Girl (Part One) , P. Diddy Featuring Usher & Loon","Oh Boy , Cam'Ron Featuring Juelz Santana","Oh Boy , Cam'Ron Featuring Juelz Santana","Oh Boy , Cam'Ron Featuring Juelz Santana","Complicated , Avril Lavigne","Complicated , Avril Lavigne","Hero , Chad Kroeger Featuring Josey Scott","I Need A Girl (Part Two) , P. Diddy & Ginuwine Featuring Loon, Mario Winans & Tammy Ruggeri","I Need A Girl (Part Two) , P. Diddy & Ginuwine Featuring Loon, Mario Winans & Tammy Ruggeri","I Need A Girl (Part Two) , P. Diddy & Ginuwine Featuring Loon, Mario Winans & Tammy Ruggeri","I Need A Girl (Part Two) , P. Diddy & Ginuwine Featuring Loon, Mario Winans & Tammy Ruggeri","Just A Friend 2002 , Mario","Just A Friend 2002 , Mario","Just A Friend 2002 , Mario","Gangsta Lovin' , Eve Featuring Alicia Keys","Hot In Herre , Nelly","Hot In Herre , Nelly","Cleanin' Out My Closet , Eminem","Cleanin' Out My Closet , Eminem","Cleanin' Out My Closet , Eminem","Complicated , Avril Lavigne","Complicated , Avril Lavigne","Hey Ma , Cam'Ron Featuring Juelz Santana, Freekey Zekey & Toya","Hey Ma , Cam'Ron Featuring Juelz Santana, Freekey Zekey & Toya","Hey Ma , Cam'Ron Featuring Juelz Santana, Freekey Zekey & Toya","Work It , Missy ""Misdemeanor"" Elliott","Work It , Missy ""Misdemeanor"" Elliott","Hey Ma , Cam'Ron Featuring Juelz Santana, Freekey Zekey & Toya","Luv U Better , LL Cool J","Luv U Better , LL Cool J","Luv U Better , LL Cool J","Luv U Better , LL Cool J","Underneath It All , No Doubt Featuring Lady Saw","Underneath It All , No Doubt Featuring Lady Saw","Underneath It All , No Doubt Featuring Lady Saw","Air Force Ones , Nelly Featuring Kyjuan, Ali & Murphy Lee","'03 Bonnie & Clyde , Jay-Z Featuring Beyonce Knowles","'03 Bonnie & Clyde , Jay-Z Featuring Beyonce Knowles"
4,"Always On Time , Ja Rule Featuring Ashanti","Hero , Enrique Iglesias","Hero , Enrique Iglesias","Always On Time , Ja Rule Featuring Ashanti","My Sacrifice , Creed","My Sacrifice , Creed","My Sacrifice , Creed","In The End , Linkin Park","In The End , Linkin Park","In The End , Linkin Park","In The End , Linkin Park","Hey Baby , No Doubt Featuring Bounty Killer","Hey Baby , No Doubt Featuring Bounty Killer","Hey Baby , No Doubt Featuring Bounty Killer","Wherever You Will Go , The Calling","Wherever You Will Go , The Calling","Wherever You Will Go , The Calling","What's Luv? , Fat Joe Featuring Ashanti","Girlfriend , 'N Sync Featuring Nelly","Girlfriend , 'N Sync Featuring Nelly","Girlfriend , 'N Sync Featuring Nelly","Girlfriend , 'N Sync Featuring Nelly","Girlfriend , 'N Sync Featuring Nelly","Girlfriend , 'N Sync Featuring Nelly","Ain't It Funny , Jennifer Lopez Featuring Ja Rule","Blurry , Puddle Of Mudd","Blurry , Puddle Of Mudd","A Thousand Miles , Vanessa Carlton","A Thousand Miles , Vanessa Carlton","A Thousand Miles , Vanessa Carlton","A Thousand Miles , Vanessa Carlton","Hot In Herre , Nelly","What's Luv? , Fat Joe Featuring Ashanti","What's Luv? , Fat Joe Featuring Ashanti","The Middle , Jimmy Eat World","Oh Boy , Cam'Ron Featuring Juelz Santana","Hero , Chad Kroeger Featuring Josey Scott","Hero , Chad Kroeger Featuring Josey Scott","Foolish , Ashanti","I Need A Girl (Part Two) , P. Diddy & Ginuwine Featuring Loon, Mario Winans & Tammy Ruggeri","I Need A Girl (Part Two) , P. Diddy & Ginuwine Featuring Loon, Mario Winans & Tammy Ruggeri","I Need A Girl (Part Two) , P. Diddy & Ginuwine Featuring Loon, Mario Winans & Tammy Ruggeri","Hero , Chad Kroeger Featuring Josey Scott","Just A Friend 2002 , Mario","Just A Friend 2002 , Mario","Just A Friend 2002 , Mario","I Need A Girl (Part Two) , P. Diddy & Ginuwine Featuring Loon, Mario Winans & Tammy Ruggeri","I Need A Girl (Part Two) , P. Diddy & Ginuwine Featuring Loon, Mario Winans & Tammy Ruggeri","I Need A Girl (Part Two) , P. Diddy & Ginuwine Featuring Loon, Mario Winans & Tammy Ruggeri","I Need A Girl (Part Two) , P. Diddy & Ginuwine Featuring Loon, Mario Winans & Tammy Ruggeri","Cleanin' Out My Closet , Eminem","Cleanin' Out My Closet , Eminem","Hot In Herre , Nelly","I Need A Girl (Part Two) , P. Diddy & Ginuwine Featuring Loon, Mario Winans & Tammy Ruggeri","I Need A Girl (Part Two) , P. Diddy & Ginuwine Featuring Loon, Mario Winans & Tammy Ruggeri","Cleanin' Out My Closet , Eminem","Hey Ma , Cam'Ron Featuring Juelz Santana, Freekey Zekey & Toya","Work It , Missy ""Misdemeanor"" Elliott","Work It , Missy ""Misdemeanor"" Elliott","Work It , Missy ""Misdemeanor"" Elliott","A Moment Like This , Kelly Clarkson","A Moment Like This , Kelly Clarkson","A Moment Like This , Kelly Clarkson","Hey Ma , Cam'Ron Featuring Juelz Santana, Freekey Zekey & Toya","Hey Ma , Cam'Ron Featuring Juelz Santana, Freekey Zekey & Toya","Hey Ma , Cam'Ron Featuring Juelz Santana, Freekey Zekey & Toya","The Game Of Love , Santana Featuring Michelle Branch","The Game Of Love , Santana Featuring Michelle Branch","The Game Of Love , Santana Featuring Michelle Branch","The Game Of Love , Santana Featuring Michelle Branch","'03 Bonnie & Clyde , Jay-Z Featuring Beyonce Knowles","Air Force Ones , Nelly Featuring Kyjuan, Ali & Murphy Lee","Air Force Ones , Nelly Featuring Kyjuan, Ali & Murphy Lee"
5,"My Sacrifice , Creed","Always On Time , Ja Rule Featuring Ashanti","Always On Time , Ja Rule Featuring Ashanti","My Sacrifice , Creed","Family Affair , Mary J. Blige","Family Affair , Mary J. Blige","Whenever, Wherever , Shakira","Get The Party Started , P!nk","Hey Baby , No Doubt Featuring Bounty Killer","Hey Baby , No Doubt Featuring Bounty Killer","Hey Baby , No Doubt Featuring Bounty Killer","U Got It Bad , Usher","U Got It Bad , Usher","Wherever You Will Go , The Calling","Hey Baby , No Doubt Featuring Bounty Killer","Blurry , Puddle Of Mudd","Blurry , Puddle Of Mudd","Girlfriend , 'N Sync Featuring Nelly","How You Remind Me , Nickelback","How You Remind Me , Nickelback","U Don't Have To Call , Usher","Blurry , Puddle Of Mudd","I Need A Girl (Part One) , P. Diddy Featuring Usher & Loon","I Need A Girl (Part One) , P. Diddy Featuring Usher & Loon","Blurry , Puddle Of Mudd","A Thousand Miles , Vanessa Carlton","A Thousand Miles , Vanessa Carlton","Blurry , Puddle Of Mudd","All You Wanted , Michelle Branch","Without Me , Eminem","Without Me , Eminem","A Thousand Miles , Vanessa Carlton","A Thousand Miles , Vanessa Carlton","A Thousand Miles , Vanessa Carlton","A Thousand Miles , Vanessa Carlton","The Middle , Jimmy Eat World","The Middle , Jimmy Eat World","The Middle , Jimmy Eat World","The Middle , Jimmy Eat World","Oh Boy , Cam'Ron Featuring Juelz Santana","Oh Boy , Cam'Ron Featuring Juelz Santana","Oh Boy , Cam'Ron Featuring Juelz Santana","Without Me , Eminem","Hero , Chad Kroeger Featuring Josey Scott","Hero , Chad Kroeger Featuring Josey Scott","Down 4 U , Irv Gotti Presents The Inc. Featuring Ja Rule, Ashanti, Charli Baltimore & Vita","Gangsta Lovin' , Eve Featuring Alicia Keys","Gangsta Lovin' , Eve Featuring Alicia Keys","Gangsta Lovin' , Eve Featuring Alicia Keys","Just A Friend 2002 , Mario","I Need A Girl (Part Two) , P. Diddy & Ginuwine Featuring Loon, Mario Winans & Tammy Ruggeri","I Need A Girl (Part Two) , P. Diddy & Ginuwine Featuring Loon, Mario Winans & Tammy Ruggeri","I Need A Girl (Part Two) , P. Diddy & Ginuwine Featuring Loon, Mario Winans & Tammy Ruggeri","One Last Breath , Creed","One Last Breath , Creed","One Last Breath , Creed","One Last Breath , Creed","Complicated , Avril Lavigne","Complicated , Avril Lavigne","Lose Yourself , Eminem","Gangsta Lovin' , Eve Featuring Alicia Keys","Gangsta Lovin' , Eve Featuring Alicia Keys","Underneath It All , No Doubt Featuring Lady Saw","Underneath It All , No Doubt Featuring Lady Saw","Dilemma , Nelly Featuring Kelly Rowland","Dilemma , Nelly Featuring Kelly Rowland","Jenny From The Block , Jennifer Lopez Featuring Styles & Jadakiss","Luv U Better , LL Cool J","Luv U Better , LL Cool J","'03 Bonnie & Clyde , Jay-Z Featuring Beyonce Knowles","Underneath It All , No Doubt Featuring Lady Saw","Beautiful , Christina Aguilera","Beautiful , Christina Aguilera"
6,"Whenever, Wherever , Shakira","My Sacrifice , Creed","My Sacrifice , Creed","Whenever, Wherever , Shakira","Whenever, Wherever , Shakira","Whenever, Wherever , Shakira","In The End , Linkin Park","A Woman's Worth , Alicia Keys","My Sacrifice , Creed","My Sacrifice , Creed","Wherever You Will Go , The Calling","Wherever You Will Go , The Calling","Wherever You Will Go , The Calling","U Got It Bad , Usher","What About Us? , Brandy","Can't Get You Out Of My Head , Kylie Minogue","Can't Get You Out Of My Head , Kylie Minogue","Blurry , Puddle Of Mudd","Blurry , Puddle Of Mudd","Blurry , Puddle Of Mudd","Blurry , Puddle Of Mudd","In The End , Linkin Park","Blurry , Puddle Of Mudd","Blurry , Puddle Of Mudd","Oops (Oh My) , Tweet","All You Wanted , Michelle Branch","All You Wanted , Michelle Branch","All You Wanted , Michelle Branch","Blurry , Puddle Of Mudd","Hot In Herre , Nelly","Hot In Herre , Nelly","U Don't Have To Call , Usher","The Middle , Jimmy Eat World","The Middle , Jimmy Eat World","What's Luv? , Fat Joe Featuring Ashanti","A Thousand Miles , Vanessa Carlton","I Need A Girl (Part One) , P. Diddy Featuring Usher & Loon","I Need A Girl (Part One) , P. Diddy Featuring Usher & Loon","Complicated , Avril Lavigne","The Middle , Jimmy Eat World","The Middle , Jimmy Eat World","The Middle , Jimmy Eat World","Just A Friend 2002 , Mario","Down 4 U , Irv Gotti Presents The Inc. Featuring Ja Rule, Ashanti, Charli Baltimore & Vita","Down 4 U , Irv Gotti Presents The Inc. Featuring Ja Rule, Ashanti, Charli Baltimore & Vita","Hero , Chad Kroeger Featuring Josey Scott","Down 4 U , Irv Gotti Presents The Inc. Featuring Ja Rule, Ashanti, Charli Baltimore & Vita","Down 4 U , Irv Gotti Presents The Inc. Featuring Ja Rule, Ashanti, Charli Baltimore & Vita","Long Time Gone , Dixie Chicks","Cleanin' Out My Closet , Eminem","Just A Friend 2002 , Mario","Just A Friend 2002 , Mario","One Last Breath , Creed","Hot In Herre , Nelly","Hot In Herre , Nelly","I Need A Girl (Part Two) , P. Diddy & Ginuwine Featuring Loon, Mario Winans & Tammy Ruggeri","Cleanin' Out My Closet , Eminem","One Last Breath , Creed","One Last Breath , Creed","Underneath It All , No Doubt Featuring Lady Saw","Luv U Better , LL Cool J","Luv U Better , LL Cool J","Luv U Better , LL Cool J","The Game Of Love , Santana Featuring Michelle Branch","The Game Of Love , Santana Featuring Michelle Branch","The Game Of Love , Santana Featuring Michelle Branch","Hey Ma , Cam'Ron Featuring Juelz Santana, Freekey Zekey & Toya","Gimme The Light , Sean Paul","Gimme The Light , Sean Paul","Air Force Ones , Nelly Featuring Kyjuan, Ali & Murphy Lee","The Game Of Love , Santana Featuring Michelle Branch","Bump, Bump, Bump , B2K & P. Diddy","Bump, Bump, Bump , B2K & P. Diddy"
7,"Hero , Enrique Iglesias","Whenever, Wherever , Shakira","Whenever, Wherever , Shakira","Hero , Enrique Iglesias","A Woman's Worth , Alicia Keys","A Woman's Worth , Alicia Keys","A Woman's Worth , Alicia Keys","Wherever You Will Go , The Calling","Wherever You Will Go , The Calling","Wherever You Will Go , The Calling","My Sacrifice , Creed","My Sacrifice , Creed","My Sacrifice , Creed","What About Us? , Brandy","Blurry , Puddle Of Mudd","What's Luv? , Fat Joe Featuring Ashanti","What's Luv? , Fat Joe Featuring Ashanti","Wherever You Will Go , The Calling","U Don't Have To Call , Usher","U Don't Have To Call , Usher","Oops (Oh My) , Tweet","Oops (Oh My) , Tweet","Oops (Oh My) , Tweet","Oops (Oh My) , Tweet","Girlfriend , 'N Sync Featuring Nelly","Don't Let Me Get Me , P!nk","Don't Let Me Get Me , P!nk","Don't Let Me Get Me , P!nk","The Middle , Jimmy Eat World","The Middle , Jimmy Eat World","The Middle , Jimmy Eat World","The Middle , Jimmy Eat World","U Don't Have To Call , Usher","U Don't Have To Call , Usher","Oh Boy , Cam'Ron Featuring Juelz Santana","Hero , Chad Kroeger Featuring Josey Scott","A Thousand Miles , Vanessa Carlton","A Thousand Miles , Vanessa Carlton","A Thousand Miles , Vanessa Carlton","A Thousand Miles , Vanessa Carlton","A Thousand Miles , Vanessa Carlton","Dilemma , Nelly Featuring Kelly Rowland","Down 4 U , Irv Gotti Presents The Inc. Featuring Ja Rule, Ashanti, Charli Baltimore & Vita","Heaven , DJ Sammy & Yanou Featuring Do","Heaven , DJ Sammy & Yanou Featuring Do","Just Like A Pill , P!nk","Just Like A Pill , P!nk","Just Like A Pill , P!nk","Down 4 U , Irv Gotti Presents The Inc. Featuring Ja Rule, Ashanti, Charli Baltimore & Vita","Happy , Ashanti","Happy , Ashanti","Happy , Ashanti","Happy , Ashanti","Just Like A Pill , P!nk","Just Like A Pill , P!nk","Hey Ma , Cam'Ron Featuring Juelz Santana, Freekey Zekey & Toya","Work It , Missy ""Misdemeanor"" Elliott","Underneath It All , No Doubt Featuring Lady Saw","Underneath It All , No Doubt Featuring Lady Saw","Luv U Better , LL Cool J","Underneath It All , No Doubt Featuring Lady Saw","Underneath It All , No Doubt Featuring Lady Saw","Die Another Day , Madonna","Die Another Day , Madonna","Jenny From The Block , Jennifer Lopez Featuring Styles & Jadakiss","Jenny From The Block , Jennifer Lopez Featuring Styles & Jadakiss","Gimme The Light , Sean Paul","'03 Bonnie & Clyde , Jay-Z Featuring Beyonce Knowles","'03 Bonnie & Clyde , Jay-Z Featuring Beyonce Knowles","Gimme The Light , Sean Paul","Don't Mess With My Man , Nivea Featuring Brian & Brandon Casey","Don't Mess With My Man , Nivea Featuring Brian & Brandon Casey","Don't Mess With My Man , Nivea Featuring Brian & Brandon Casey"
