74,"Nothing In This World , KeKe Wyatt Featuring Avant","Girls, Girls, Girls , JAY-Z","Girls, Girls, Girls , JAY-Z","From Her Mama (Mama Got A**) , Juvenile","Round And Round , Jonell & Method Man","Round And Round , Jonell & Method Man","Let's Stay Home Tonight , Joe","I'm Movin' On , Rascal Flatts","Brotha , Angie Stone","Brotha , Angie Stone","Anything , Jaheim Featuring Next","For You , Staind","For You , Staind","Run , George Strait","This Woman's Work , Maxwell","Where Were You (When The World Stopped Turning) , Alan Jackson","Where Were You (When The World Stopped Turning) , Alan Jackson","I Should Be Sleeping , Emerson Drive","Living And Living Well , George Strait","Living And Living Well , George Strait","Take Ya Home , Lil Bow Wow","Down A** Chick , Ja Rule Featuring Charli ""Chuck"" Baltimore","The Long Goodbye , Brooks & Dunn","The Long Goodbye , Brooks & Dunn","Roc The Mic , Beanie Sigel & Freeway","This Woman's Work , Maxwell","This Woman's Work , Maxwell","Days Go By , Dirty Vegas","My Heart Is Lost To You , Brooks & Dunn","Youth Of The Nation , P.O.D.","Youth Of The Nation , P.O.D.","Heaven , DJ Sammy & Yanou Featuring Do","Here To Stay , Korn","Here To Stay , Korn","My Neck, My Back , Khia Featuring DSD","What If She's An Angel , Tommy Shane Steiner","I Should Be Sleeping , Emerson Drive","I Should Be Sleeping , Emerson Drive","Where Are You Going , Dave Matthews Band","Good Times , Styles","Good Times , Styles","Good Times , Styles","Flake , Jack Johnson","Flake , Jack Johnson","Flake , Jack Johnson","I Don't Have To Be Me ('til Monday) , Steve Azar","Somewhere Out There , Our Lady Peace","Somewhere Out There , Our Lady Peace","I Do (Wanna Get Close To You) , 3LW Featuring P. Diddy & Loon","dontchange , Musiq","Work It , Missy ""Misdemeanor"" Elliott","Work It , Missy ""Misdemeanor"" Elliott","Sweetness , Jimmy Eat World","Sweetness , Jimmy Eat World","Sweetness , Jimmy Eat World","Flake , Jack Johnson","Braid My Hair , Mario","Braid My Hair , Mario","Braid My Hair , Mario","Braid My Hair , Mario","Ten Rounds With Jose Cuervo , Tracy Byrd","Ten Rounds With Jose Cuervo , Tracy Byrd","Forgive , Rebecca Lynn Howard","Ten Rounds With Jose Cuervo , Tracy Byrd","Trade It All , Fabolous Featuring P. Diddy & Jagged Edge","Trade It All , Fabolous Featuring P. Diddy & Jagged Edge","Oh Yeah! , Big Tymers Featuring Tateeze, Boo & Gotti","Every River , Brooks & Dunn","Every River , Brooks & Dunn","Every River , Brooks & Dunn","The Red , Chevelle","Gossip Folks , Missy ""Misdemeanor"" Elliott Featuring Ludacris","Gossip Folks , Missy ""Misdemeanor"" Elliott Featuring Ludacris"
75,"Chop Suey , System Of A Down","Wasting My Time , Default","Wasting My Time , Default","Dance With Me , 112","Goodbye , Jagged Edge","Goodbye , Jagged Edge","Emotion , Destiny's Child","Dig In , Lenny Kravitz","Round And Round , Jonell & Method Man","Round And Round , Jonell & Method Man","What If She's An Angel , Tommy Shane Steiner","Just Let Me Be In Love , Tracy Byrd","Just Let Me Be In Love , Tracy Byrd","Hush Lil' Lady , Corey Featuring Lil' Romeo","Where Were You (When The World Stopped Turning) , Alan Jackson","Wrapped Around , Brad Paisley","Wrapped Around , Brad Paisley","Wrong Impression , Natalie Imbruglia","Where Were You (When The World Stopped Turning) , Alan Jackson","Where Were You (When The World Stopped Turning) , Alan Jackson","That's Just Jessie , Kevin Denney","Feels Good (Don't Worry Bout A Thing) , Naughty By Nature Featuring 3LW","Crawling In The Dark , Hoobastank","Crawling In The Dark , Hoobastank","Toxicity , System Of A Down","What If A Woman , Joe","What If A Woman , Joe","What If A Woman , Joe","Drift & Die , Puddle Of Mudd","Nothin' , N.O.R.E.","Nothin' , N.O.R.E.","Here To Stay , Korn","Where Are You Going , Dave Matthews Band","Where Are You Going , Dave Matthews Band","Grindin' , Clipse","Move B***h , Ludacris Featuring Mystikal & Infamous 2.0","Running Away , Hoobastank","Running Away , Hoobastank","Two Wrongs , Wyclef Jean Featuring Claudette Ortiz","She Loves Me Not , Papa Roach","She Loves Me Not , Papa Roach","She Loves Me Not , Papa Roach","She Loves Me Not , Papa Roach","You Know That I Love You , Donell Jones","You Know That I Love You , Donell Jones","I'm Gonna Miss Her (The Fishin' Song) , Brad Paisley","Work In Progress , Alan Jackson","Work In Progress , Alan Jackson","American Child , Phil Vassar","Where Would You Be , Martina McBride","Sweetness , Jimmy Eat World","Sweetness , Jimmy Eat World","Landslide , Dixie Chicks","Stole , Kelly Rowland","Stole , Kelly Rowland","Long Time Gone , Dixie Chicks","The Ketchup Song (Hey Hah) , Las Ketchup","By The Way , Red Hot Chili Peppers","By The Way , Red Hot Chili Peppers","By The Way , Red Hot Chili Peppers","Bother , Stone Sour","Bother , Stone Sour","Dirrty , Christina Aguilera Featuring Redman","I Just Wanna Be Mad , Terri Clark","I Just Wanna Be Mad , Terri Clark","I Just Wanna Be Mad , Terri Clark","Aerials , System Of A Down","The Baby , Blake Shelton","The Baby , Blake Shelton","Prayer , Disturbed","Girl Talk , TLC","I'm Gonna Getcha Good! , Shania Twain","I'm Gonna Getcha Good! , Shania Twain"
76,"Defy You , The Offspring","Just Let Me Be In Love , Tracy Byrd","Just Let Me Be In Love , Tracy Byrd","Wasting My Time , Default","I Love You , Faith Evans","I Love You , Faith Evans","I'm Movin' On , Rascal Flatts","Hush Lil' Lady , Corey Featuring Lil' Romeo","My List , Toby Keith","My List , Toby Keith","That's When I Love You , Phil Vassar","Crawling In The Dark , Hoobastank","Crawling In The Dark , Hoobastank","Crawling In The Dark , Hoobastank","Insatiable , Darren Hayes","The World's Greatest , R. Kelly","The World's Greatest , R. Kelly","Any Other Night , Sharissa","Some Days You Gotta Dance , Dixie Chicks","Some Days You Gotta Dance , Dixie Chicks","Video , India.Arie","Oh Boy , Cam'Ron Featuring Juelz Santana","No More Drama , Mary J. Blige","No More Drama , Mary J. Blige","Crawling In The Dark , Hoobastank","Nothing In This World , KeKe Wyatt Featuring Avant","Nothing In This World , KeKe Wyatt Featuring Avant","This Woman's Work , Maxwell","How Come You Don't Call Me , Alicia Keys","Happy , Ashanti","Happy , Ashanti","Happy , Ashanti","Happy , Ashanti","Happy , Ashanti","Happy , Ashanti","Black Suits Comin' (Nod Ya Head) , Will Smith Featuring Tra-Knox","What If She's An Angel , Tommy Shane Steiner","What If She's An Angel , Tommy Shane Steiner","Too Bad , Nickelback","Too Bad , Nickelback","Too Bad , Nickelback","Gotta Get Thru This , Daniel Bedingfield","Way Of Life , Lil Wayne","My Heart Is Lost To You , Brooks & Dunn","My Heart Is Lost To You , Brooks & Dunn","Not A Day Goes By , Lonestar","Walking Away , Craig David","Walking Away , Craig David","Someone To Love You , Ruff Endz","Sweetness , Jimmy Eat World","Flake , Jack Johnson","Flake , Jack Johnson","Grindin' , Clipse","Electrical Storm , U2","Electrical Storm , U2","Electrical Storm , U2","I Keep Looking , Sara Evans","I Miss My Friend , Darryl Worley","I Miss My Friend , Darryl Worley","Down 4 U , Irv Gotti Presents The Inc. Featuring Ja Rule, Ashanti, Charli Baltimore & Vita","Crush Tonight , Fat Joe Featuring Ginuwine","Crush Tonight , Fat Joe Featuring Ginuwine","Crush Tonight , Fat Joe Featuring Ginuwine","Crush Tonight , Fat Joe Featuring Ginuwine","Cochise , Audioslave","Cochise , Audioslave","The Red , Chevelle","The Red , Chevelle","The Red , Chevelle","The Red , Chevelle","From Tha Chuuuch To Da Palace , Snoop Dogg","A Moment Like This , Kelly Clarkson","A Moment Like This , Kelly Clarkson"
77,"Wasting My Time , Default","Part II , Method Man & Redman","Part II , Method Man & Redman","Stuck In A Moment You Can't Get Out Of , U2","Defy You , The Offspring","Defy You , The Offspring","Son Of A Gun , Janet Featuring Missy Elliott, P. Diddy & Carly Simon","I Breathe In, I Breathe Out , Chris Cagle","Foolish , Ashanti","Foolish , Ashanti","Round And Round , Jonell & Method Man","Saturday (Oooh! Ooooh!) , Ludacris Featuring Sleepy Brown","Saturday (Oooh! Ooooh!) , Ludacris Featuring Sleepy Brown","In Another World , Joe Diffie","Drive (For Daddy Gene) , Alan Jackson","Hush Lil' Lady , Corey Featuring Lil' Romeo","Hush Lil' Lady , Corey Featuring Lil' Romeo","Hush Lil' Lady , Corey Featuring Lil' Romeo","That's Just Jessie , Kevin Denney","That's Just Jessie , Kevin Denney","Any Other Night , Sharissa","Rapture (Tastes So Sweet) , iio","That's Just Jessie , Kevin Denney","That's Just Jessie , Kevin Denney","What About Us? , Brandy","Crawling In The Dark , Hoobastank","Crawling In The Dark , Hoobastank","The Cowboy In Me , Tim McGraw","I'm Movin' On , Rascal Flatts","Quitame Ese Hombre , Pilar Montenegro","Quitame Ese Hombre , Pilar Montenegro","Can't Get You Out Of My Head , Kylie Minogue","What If A Woman , Joe","What If A Woman , Joe","Here To Stay , Korn","Happy , Ashanti","Say I Yi Yi , Ying Yang Twins","Say I Yi Yi , Ying Yang Twins","For All Time , Soluna","Love At First Sight , Kylie Minogue","Love At First Sight , Kylie Minogue","Makin' Good Love , Avant","When You Lie Next To Me , Kellie Coffey","Beautiful Mess , Diamond Rio","Beautiful Mess , Diamond Rio","Drift & Die , Puddle Of Mudd","American Child , Phil Vassar","American Child , Phil Vassar","Sweetness , Jimmy Eat World","Flake , Jack Johnson","The Rising , Bruce Springsteen","The Rising , Bruce Springsteen","The Rising , Bruce Springsteen","Don't Know Why , Norah Jones","Don't Know Why , Norah Jones","Love At First Sight , Kylie Minogue","Courtesy Of The Red, White And Blue (The Angry American) , Toby Keith","I Do (Wanna Get Close To You) , 3LW Featuring P. Diddy & Loon","I Do (Wanna Get Close To You) , 3LW Featuring P. Diddy & Loon","I Miss My Friend , Darryl Worley","Down 4 U , Irv Gotti Presents The Inc. Featuring Ja Rule, Ashanti, Charli Baltimore & Vita","Down 4 U , Irv Gotti Presents The Inc. Featuring Ja Rule, Ashanti, Charli Baltimore & Vita","Ten Rounds With Jose Cuervo , Tracy Byrd","Braid My Hair , Mario","Single For The Rest Of My Life , Isyss","Single For The Rest Of My Life , Isyss","Ordinary Day , Vanessa Carlton","Do That... , Baby Featuring P. Diddy","Do That... , Baby Featuring P. Diddy","Wanksta , 50 Cent","Cry , Faith Hill","No One Knows , Queens Of The Stone Age","No One Knows , Queens Of The Stone Age"
78,"The Long Goodbye , Brooks & Dunn","Fade , Staind","Fade , Staind","Fade , Staind","Stuck In A Moment You Can't Get Out Of , U2","Stuck In A Moment You Can't Get Out Of , U2","Wish You Were Here , Incubus","I'm Tryin' , Trace Adkins","Wrapped Up In You , Garth Brooks","Wrapped Up In You , Garth Brooks","Brotha , Angie Stone","Rapture (Tastes So Sweet) , iio","Rapture (Tastes So Sweet) , iio","Insatiable , Darren Hayes","Too Bad , Nickelback","Too Bad , Nickelback","Too Bad , Nickelback","Where Were You (When The World Stopped Turning) , Alan Jackson","Never , Amanda Perez","Never , Amanda Perez","Never , Amanda Perez","One Mic , Nas","Wish I Didn't Miss You , Angie Stone","Wish I Didn't Miss You , Angie Stone","That's Just Jessie , Kevin Denney","Roc The Mic , Beanie Sigel & Freeway","Roc The Mic , Beanie Sigel & Freeway","You Know That I Love You , Donell Jones","I Breathe In, I Breathe Out , Chris Cagle","Guess Who's Back , Scarface Featuring Jay-Z & Beanie Sigel","Guess Who's Back , Scarface Featuring Jay-Z & Beanie Sigel","That's When I Love You , Phil Vassar","Grindin' , Clipse","Grindin' , Clipse","One Mic , Nas","Here To Stay , Korn","The Impossible , Joe Nichols","The Impossible , Joe Nichols","The Impossible , Joe Nichols","Don't Say Goodbye , Paulina Rubio","Don't Say Goodbye , Paulina Rubio","Here Is Gone , Goo Goo Dolls","Sweetness , Jimmy Eat World","Sweetness , Jimmy Eat World","Sweetness , Jimmy Eat World","She Loves Me Not , Papa Roach","Po' Folks , Nappy Roots Featuring Anthony Hamilton","Po' Folks , Nappy Roots Featuring Anthony Hamilton","All Eyez On Me , Monica","Walking Away , Craig David","Don't Mess With My Man , Nivea Featuring Brian & Brandon Casey","Don't Mess With My Man , Nivea Featuring Brian & Brandon Casey","Don't Mess With My Man , Nivea Featuring Brian & Brandon Casey","Why Don't We Fall In Love , Amerie","Why Don't We Fall In Love , Amerie","Sweetness , Jimmy Eat World","Unbroken , Tim McGraw","React , Erick Sermon Featuring Redman","React , Erick Sermon Featuring Redman","I Do (Wanna Get Close To You) , 3LW Featuring P. Diddy & Loon","Flake , Jack Johnson","Flake , Jack Johnson","I Just Wanna Be Mad , Terri Clark","Single For The Rest Of My Life , Isyss","Ignition , R. Kelly","Ignition , R. Kelly","Cleanin' Out My Closet , Eminem","Single For The Rest Of My Life , Isyss","Single For The Rest Of My Life , Isyss","From Tha Chuuuch To Da Palace , Snoop Dogg","In A Little While , Uncle Kracker","Sick Of Being Lonely , Field Mob","Sick Of Being Lonely , Field Mob"
79,"The Star Spangled Banner , Whitney Houston","From Her Mama (Mama Got A**) , Juvenile","From Her Mama (Mama Got A**) , Juvenile","Chop Suey , System Of A Down","Uh Huh , B2K","Uh Huh , B2K","Defy You , The Offspring","Chop Suey , System Of A Down","Dig In , Lenny Kravitz","Dig In , Lenny Kravitz","Alive , P.O.D.","A Thousand Miles , Vanessa Carlton","A Thousand Miles , Vanessa Carlton","Any Other Night , Sharissa","Any Other Night , Sharissa","Any Other Night , Sharissa","Any Other Night , Sharissa","Wrapped Around , Brad Paisley","Insatiable , Darren Hayes","Insatiable , Darren Hayes","Feels Good (Don't Worry Bout A Thing) , Naughty By Nature Featuring 3LW","That's Just Jessie , Kevin Denney","Never , Amanda Perez","Never , Amanda Perez","The Long Goodbye , Brooks & Dunn","That's Just Jessie , Kevin Denney","That's Just Jessie , Kevin Denney","Crawling In The Dark , Hoobastank","This Woman's Work , Maxwell","Wish I Didn't Miss You , Angie Stone","Wish I Didn't Miss You , Angie Stone","Roc The Mic , Beanie Sigel & Freeway","For You , Staind","For You , Staind","Move B***h , Ludacris Featuring Mystikal & Infamous 2.0","For You , Staind","What If A Woman , Joe","What If A Woman , Joe","What If A Woman , Joe","Help Me Understand , Trace Adkins","Help Me Understand , Trace Adkins","Way Of Life , Lil Wayne","Here Is Gone , Goo Goo Dolls","She Loves Me Not , Papa Roach","She Loves Me Not , Papa Roach","In Da Wind , Trick Daddy Featuring Cee-Lo & Big Boi","I Do (Wanna Get Close To You) , 3LW Featuring P. Diddy & Loon","I Do (Wanna Get Close To You) , 3LW Featuring P. Diddy & Loon","Flake , Jack Johnson","Oh Yeah! , Big Tymers Featuring Tateeze, Boo & Gotti","Walking Away , Craig David","Walking Away , Craig David","When The Last Time , Clipse","Grindin' , Clipse","Grindin' , Clipse","In Da Wind , Trick Daddy Featuring Cee-Lo & Big Boi","Burnin' Up , Faith Evans Featuring Missy ""Misdemeanor"" Elliott","Two Wrongs , Wyclef Jean Featuring Claudette Ortiz","Two Wrongs , Wyclef Jean Featuring Claudette Ortiz","Two Wrongs , Wyclef Jean Featuring Claudette Ortiz","Two Wrongs , Wyclef Jean Featuring Claudette Ortiz","Two Wrongs , Wyclef Jean Featuring Claudette Ortiz","Single For The Rest Of My Life , Isyss","Good Times , Styles","Something , Lasgo","Something , Lasgo","Something , Lasgo","Somewhere Out There , Our Lady Peace","Somewhere Out There , Our Lady Peace","Stingy , Ginuwine","Every River , Brooks & Dunn","The Zephyr Song , Red Hot Chili Peppers","The Zephyr Song , Red Hot Chili Peppers"
80,"God Bless The USA , Lee Greenwood","Round And Round , Jonell & Method Man","Round And Round , Jonell & Method Man","Round And Round , Jonell & Method Man","Part II , Method Man & Redman","Part II , Method Man & Redman","Stuck In A Moment You Can't Get Out Of , U2","Defy You , The Offspring","Defy You , The Offspring","Defy You , The Offspring","Jigga , JAY-Z","Insatiable , Darren Hayes","Insatiable , Darren Hayes","Just Let Me Be In Love , Tracy Byrd","Hush Lil' Lady , Corey Featuring Lil' Romeo","halfcrazy , Musiq","halfcrazy , Musiq","Insatiable , Darren Hayes","Take Away , Missy ""Misdemeanor"" Elliott Featuring Ginuwine & Tweet","Take Away , Missy ""Misdemeanor"" Elliott Featuring Ginuwine & Tweet","Take You Home With Me a.k.a. Body , R. Kelly & Jay-Z","Take You Home With Me a.k.a. Body , R. Kelly & Jay-Z","Rapture (Tastes So Sweet) , iio","Rapture (Tastes So Sweet) , iio","Still Fly , Big Tymers","Take Ya Home , Lil Bow Wow","Take Ya Home , Lil Bow Wow","Nothing In This World , KeKe Wyatt Featuring Avant","Nothin' , N.O.R.E.","Hands Clean , Alanis Morissette","Hands Clean , Alanis Morissette","Grindin' , Clipse","Feels Good (Don't Worry Bout A Thing) , Naughty By Nature Featuring 3LW","Feels Good (Don't Worry Bout A Thing) , Naughty By Nature Featuring 3LW","For You , Staind","What If A Woman , Joe","I've Got You , Marc Anthony","I've Got You , Marc Anthony","A New Day Has Come , Celine Dion","Say I Yi Yi , Ying Yang Twins","Say I Yi Yi , Ying Yang Twins","Help Me Understand , Trace Adkins","Help Me Understand , Trace Adkins","For All Time , Soluna","For All Time , Soluna","Sweetness , Jimmy Eat World","Sweetness , Jimmy Eat World","Sweetness , Jimmy Eat World","Luv U Better , LL Cool J","The One , Gary Allan","Someone To Love You , Ruff Endz","Someone To Love You , Ruff Endz","She Was , Mark Chesnutt","The Rising , Bruce Springsteen","The Rising , Bruce Springsteen","Big Machine , Goo Goo Dolls","Flake , Jack Johnson","Flake , Jack Johnson","Flake , Jack Johnson","Flake , Jack Johnson","The Streets , WC Featuring Nate Dogg","The Streets , WC Featuring Nate Dogg","The Streets , WC Featuring Nate Dogg","The Streets , WC Featuring Nate Dogg","The Streets , WC Featuring Nate Dogg","The Streets , WC Featuring Nate Dogg","The Streets , WC Featuring Nate Dogg","Work In Progress , Alan Jackson","Work In Progress , Alan Jackson","Cry , Faith Hill","One Of Those Days , Whitney Houston","In A Little While , Uncle Kracker","In A Little While , Uncle Kracker"
81,"Stuck In A Moment You Can't Get Out Of , U2","With Me , Lonestar","With Me , Lonestar","Defy You , The Offspring","Chop Suey , System Of A Down","Chop Suey , System Of A Down","Goodbye , Jagged Edge","Goodbye , Jagged Edge","Chop Suey , System Of A Down","Chop Suey , System Of A Down","Dig In , Lenny Kravitz","Round And Round , Jonell & Method Man","Round And Round , Jonell & Method Man","Alive , P.O.D.","Bouncin' Back (Bumpin' Me Against The Wall) , Mystikal","Insatiable , Darren Hayes","Insatiable , Darren Hayes","Take Away , Missy ""Misdemeanor"" Elliott Featuring Ginuwine & Tweet","Video , India.Arie","Video , India.Arie","Wish I Didn't Miss You , Angie Stone","Wish I Didn't Miss You , Angie Stone","Any Other Night , Sharissa","Any Other Night , Sharissa","Wish I Didn't Miss You , Angie Stone","What About Us? , Brandy","What About Us? , Brandy","Wish I Didn't Miss You , Angie Stone","Wish I Didn't Miss You , Angie Stone","Modern Day Bonnie And Clyde , Travis Tritt","Modern Day Bonnie And Clyde , Travis Tritt","Young , Kenny Chesney","Awnaw , Nappy Roots","Awnaw , Nappy Roots","That's When I Love You , Phil Vassar","The Impossible , Joe Nichols","For All Time , Soluna","For All Time , Soluna","Say I Yi Yi , Ying Yang Twins","Makin' Good Love , Avant","Makin' Good Love , Avant","Too Bad , Nickelback","Rainy Dayz , Mary J. Blige Featuring Ja Rule","In Da Wind , Trick Daddy Featuring Cee-Lo & Big Boi","In Da Wind , Trick Daddy Featuring Cee-Lo & Big Boi","For All Time , Soluna","I'm Gonna Miss Her (The Fishin' Song) , Brad Paisley","I'm Gonna Miss Her (The Fishin' Song) , Brad Paisley","Way Of Life , Lil Wayne","All Eyez On Me , Monica","All Eyez On Me , Monica","All Eyez On Me , Monica","Days Go By , Dirty Vegas","Love Of My Life (An Ode To Hip Hop) , Erykah Badu Featuring Common","Love Of My Life (An Ode To Hip Hop) , Erykah Badu Featuring Common","Love Of My Life (An Ode To Hip Hop) , Erykah Badu Featuring Common","Love Of My Life (An Ode To Hip Hop) , Erykah Badu Featuring Common","I Keep Looking , Sara Evans","I Keep Looking , Sara Evans","Crush Tonight , Fat Joe Featuring Ginuwine","Unbroken , Tim McGraw","Unbroken , Tim McGraw","Flake , Jack Johnson","Rock The Party , Benzino","Rock The Party , Benzino","Rock The Party , Benzino","Rock The Party , Benzino","Goodbye To You , Michelle Branch","Goodbye To You , Michelle Branch","Single For The Rest Of My Life , Isyss","Spin , Lifehouse","Girl Talk , TLC","Girl Talk , TLC"
82,"Smooth Criminal , Alien Ant Farm","Defy You , The Offspring","Defy You , The Offspring","Drowning , Backstreet Boys","Love Of A Woman , Travis Tritt","Love Of A Woman , Travis Tritt","Part II , Method Man & Redman","Stuck In A Moment You Can't Get Out Of , U2","I'm Tryin' , Trace Adkins","I'm Tryin' , Trace Adkins","Chop Suey , System Of A Down","Alive , P.O.D.","Alive , P.O.D.","Never , Amanda Perez","Never , Amanda Perez","Never , Amanda Perez","Never , Amanda Perez","Never , Amanda Perez","Awnaw , Nappy Roots","Awnaw , Nappy Roots","Some Days You Gotta Dance , Dixie Chicks","Never , Amanda Perez","You Know That I Love You , Donell Jones","You Know That I Love You , Donell Jones","You Know That I Love You , Donell Jones","You Know That I Love You , Donell Jones","You Know That I Love You , Donell Jones","That's Just Jessie , Kevin Denney","My Neck, My Back , Khia Featuring DSD","My Neck, My Back , Khia Featuring DSD","My Neck, My Back , Khia Featuring DSD","Just A Friend 2002 , Mario","My Neck, My Back , Khia Featuring DSD","My Neck, My Back , Khia Featuring DSD","What If A Woman , Joe","I Don't Want You To Go , Carolyn Dawn Johnson","For You , Staind","For You , Staind","Love At First Sight , Kylie Minogue","I Should Be Sleeping , Emerson Drive","I Should Be Sleeping , Emerson Drive","If I Could Go! , Angie Martinez Featuring Lil' Mo & Sacario","If I Could Go! , Angie Martinez Featuring Lil' Mo & Sacario","Rainy Dayz , Mary J. Blige Featuring Ja Rule","Rainy Dayz , Mary J. Blige Featuring Ja Rule","Full Moon , Brandy","You Know That I Love You , Donell Jones","You Know That I Love You , Donell Jones","Burnin' Up , Faith Evans Featuring Missy ""Misdemeanor"" Elliott","She Loves Me Not , Papa Roach","I'm Gonna Miss Her (The Fishin' Song) , Brad Paisley","I'm Gonna Miss Her (The Fishin' Song) , Brad Paisley","Someone To Love You , Ruff Endz","I'd Rather , Luther Vandross","I'd Rather , Luther Vandross","Grindin' , Clipse","Sweetness , Jimmy Eat World","Courtesy Of The Red, White And Blue (The Angry American) , Toby Keith","Courtesy Of The Red, White And Blue (The Angry American) , Toby Keith","Burnin' Up , Faith Evans Featuring Missy ""Misdemeanor"" Elliott","I Keep Looking , Sara Evans","I Keep Looking , Sara Evans","Rock The Party , Benzino","Something , Lasgo","Crush Tonight , Fat Joe Featuring Ginuwine","Crush Tonight , Fat Joe Featuring Ginuwine","Starry Eyed Surprise , Oakenfold Featuring Shifty Shellshock","From Tha Chuuuch To Da Palace , Snoop Dogg","From Tha Chuuuch To Da Palace , Snoop Dogg","My Town , Montgomery Gentry","Dirrty , Christina Aguilera Featuring Redman","Cry , Faith Hill","Cry , Faith Hill"
83,"I'm A Slave 4 U , Britney Spears","Chop Suey , System Of A Down","Chop Suey , System Of A Down","Girls, Girls, Girls , JAY-Z","Drowning , Backstreet Boys","Drowning , Backstreet Boys","Chop Suey , System Of A Down","Part II , Method Man & Redman","Let's Stay Home Tonight , Joe","Let's Stay Home Tonight , Joe","Wrapped Up In You , Garth Brooks","Jigga , JAY-Z","Jigga , JAY-Z","Brotha , Angie Stone","I Should Be Sleeping , Emerson Drive","I Should Be Sleeping , Emerson Drive","I Should Be Sleeping , Emerson Drive","Hey Luv (Anything) , Mobb Deep Featuring 112","Hush Lil' Lady , Corey Featuring Lil' Romeo","Hush Lil' Lady , Corey Featuring Lil' Romeo","Take Away , Missy ""Misdemeanor"" Elliott Featuring Ginuwine & Tweet","Any Other Night , Sharissa","Still Fly , Big Tymers","Still Fly , Big Tymers","Never , Amanda Perez","Days Go By , Dirty Vegas","Days Go By , Dirty Vegas","Take Ya Home , Lil Bow Wow","Roc The Mic , Beanie Sigel & Freeway","Roc The Mic , Beanie Sigel & Freeway","Roc The Mic , Beanie Sigel & Freeway","Toxicity , System Of A Down","That's When I Love You , Phil Vassar","That's When I Love You , Phil Vassar","Young , Kenny Chesney","That's When I Love You , Phil Vassar","That's When I Love You , Phil Vassar","That's When I Love You , Phil Vassar","I Should Be Sleeping , Emerson Drive","If I Could Go! , Angie Martinez Featuring Lil' Mo & Sacario","If I Could Go! , Angie Martinez Featuring Lil' Mo & Sacario","What If A Woman , Joe","Down A** Chick , Ja Rule Featuring Charli ""Chuck"" Baltimore","I Do (Wanna Get Close To You) , 3LW Featuring P. Diddy & Loon","I Do (Wanna Get Close To You) , 3LW Featuring P. Diddy & Loon","I Do (Wanna Get Close To You) , 3LW Featuring P. Diddy & Loon","She Loves Me Not , Papa Roach","She Loves Me Not , Papa Roach","Walking Away , Craig David","Don't Mess With My Man , Nivea Featuring Brian & Brandon Casey","She Loves Me Not , Papa Roach","She Loves Me Not , Papa Roach","Walking Away , Craig David","Out Of My Heart (Into Your Head) , BBMak","Out Of My Heart (Into Your Head) , BBMak","Feel It Boy , Beenie Man Featuring Janet","In Da Wind , Trick Daddy Featuring Cee-Lo & Big Boi","Burnin' Up , Faith Evans Featuring Missy ""Misdemeanor"" Elliott","Burnin' Up , Faith Evans Featuring Missy ""Misdemeanor"" Elliott","I Keep Looking , Sara Evans","I'd Rather , Luther Vandross","I'd Rather , Luther Vandross","I'd Rather , Luther Vandross","Why I Love You , B2K","Spin , Lifehouse","Spin , Lifehouse","Spin , Lifehouse","Spin , Lifehouse","Spin , Lifehouse","Spin , Lifehouse","Single For The Rest Of My Life , Isyss","Through The Rain , Mariah Carey","Through The Rain , Mariah Carey"
