48,"Unwell , matchbox twenty","Harder To Breathe , Maroon 5","Gangsta Nation , Westside Connection Featuring Nate Dogg","Gangsta Nation , Westside Connection Featuring Nate Dogg","I Wanna Do It All , Terri Clark","Watch The Wind Blow By , Tim McGraw","Watch The Wind Blow By , Tim McGraw","Wat Da Hook Gon Be , Murphy Lee Featuring Jermaine Dupri","In My Life , Juvenile Featuring Mannie Fresh","Fallen , Sarah McLachlan","Fallen , Sarah McLachlan","Rubber Band Man , T.I.","Get Low , Lil Jon & The East Side Boyz Featuring Ying Yang Twins","Get Low , Lil Jon & The East Side Boyz Featuring Ying Yang Twins","Fallen , Sarah McLachlan","Unwell , matchbox twenty","Suga Suga , Baby Bash Featuring Frankie J","Suga Suga , Baby Bash Featuring Frankie J","No Better Love , Young Gunz Featuring Rell","American Soldier , Toby Keith","American Soldier , Toby Keith","Perfect , Sara Evans","Paint Me A Birmingham , Tracy Lawrence","I Miss You , Blink-182","I Miss You , Blink-182","Desperately , George Strait","8th World Wonder , Kimberley Locke","8th World Wonder , Kimberley Locke","If You Ever Stop Loving Me , Montgomery Gentry","Are You Gonna Be My Girl , Jet","You'll Think Of Me , Keith Urban","You'll Think Of Me , Keith Urban","White Flag , Dido","U Should've Known Better , Monica","U Should've Known Better , Monica","The First Cut Is The Deepest , Sheryl Crow","I Go Back , Kenny Chesney","100 Years , Five For Fighting","100 Years , Five For Fighting","Dirt Off Your Shoulder , JAY-Z","All Falls Down , Kanye West Featuring Syleena Johnson","All Falls Down , Kanye West Featuring Syleena Johnson","Headsprung , LL Cool J","One Thing , Finger Eleven","Feelin' Way Too Damn Good , Nickelback","Feelin' Way Too Damn Good , Nickelback","Feelin' Way Too Damn Good , Nickelback","Suds In The Bucket , Sara Evans","Suds In The Bucket , Sara Evans","She Thinks She Needs Me , Andy Griggs","Too Much Of A Good Thing , Alan Jackson","I Go Back , Kenny Chesney","I Go Back , Kenny Chesney","Too Much Of A Good Thing , Alan Jackson","Hush , LL Cool J Featuring 7 Aurelius","Hush , LL Cool J Featuring 7 Aurelius","Meant To Live , Switchfoot","Dare You To Move , Switchfoot","Dare You To Move , Switchfoot","Dare You To Move , Switchfoot","That's What It's All About , Brooks & Dunn","Yeah! , Usher Featuring Lil Jon & Ludacris","Yeah! , Usher Featuring Lil Jon & Ludacris","Yeah! , Usher Featuring Lil Jon & Ludacris","Sunshine , Lil' Flip Featuring Lea","Welcome To My Life , Simple Plan","Welcome To My Life , Simple Plan","This Love , Maroon 5","How Am I Doin' , Dierks Bentley","How Am I Doin' , Dierks Bentley","Awful, Beautiful Life , Darryl Worley","Beautiful Soul , Jesse McCartney","My Happy Ending , Avril Lavigne"
49,"Breathe , Michelle Branch","Sorry 2004 , Ruben Studdard","Harder To Breathe , Maroon 5","Harder To Breathe , Maroon 5","Watch The Wind Blow By , Tim McGraw","Dirt Off Your Shoulder , JAY-Z","Dirt Off Your Shoulder , JAY-Z","The Voice Within , Christina Aguilera","Headstrong , Trapt","I'm Still In Love With You , Sean Paul Featuring Sasha","I'm Still In Love With You , Sean Paul Featuring Sasha","Fallen , Sarah McLachlan","Are You Gonna Be My Girl , Jet","Are You Gonna Be My Girl , Jet","Damn! , YoungBloodZ Featuring Lil Jon","Perfect , Sara Evans","Unwell , matchbox twenty","Unwell , matchbox twenty","Suga Suga , Baby Bash Featuring Frankie J","Remember When , Alan Jackson","Remember When , Alan Jackson","Remember When , Alan Jackson","I Miss You , Blink-182","Desperately , George Strait","Desperately , George Strait","I Miss You , Blink-182","Let's Be Us Again , Lonestar","Let's Be Us Again , Lonestar","Are You Gonna Be My Girl , Jet","With You , Jessica Simpson","Ocean Avenue , Yellowcard","Ocean Avenue , Yellowcard","Numb , Linkin Park","Scandalous , Mis-Teeq","Scandalous , Mis-Teeq","White Flag , Dido","Dude , Beenie Man Featuring Ms. Thing","Talk About Our Love , Brandy Featuring Kanye West","Talk About Our Love , Brandy Featuring Kanye West","Somebody , Reba McEntire","She Will Be Loved , Maroon 5","She Will Be Loved , Maroon 5","I Got A Feelin' , Billy Currington","I Got A Feelin' , Billy Currington","Here Without You , 3 Doors Down","Here Without You , 3 Doors Down","No Problem , Lil Scrappy","She Thinks She Needs Me , Andy Griggs","She Thinks She Needs Me , Andy Griggs","Too Much Of A Good Thing , Alan Jackson","I Don't Wanna Know , Mario Winans Featuring Enya & P. Diddy","Let Me In , Young Buck","Let Me In , Young Buck","Freek-A-Leek , Petey Pablo","She Thinks She Needs Me , Andy Griggs","She Thinks She Needs Me , Andy Griggs","Too Much Of A Good Thing , Alan Jackson","Breathe , Fabolous","Jesus Walks , Kanye West","Jesus Walks , Kanye West","Breaking The Habit , Linkin Park","That's What It's All About , Brooks & Dunn","That's What It's All About , Brooks & Dunn","Dip It Low , Christina Milian","Let's Get It Started , The Black Eyed Peas","Let's Get It Started , The Black Eyed Peas","Let's Get It Started , The Black Eyed Peas","What You Waiting For? , Gwen Stefani","Awful, Beautiful Life , Darryl Worley","Awful, Beautiful Life , Darryl Worley","Mr. Mom , Lonestar","Nothing On But The Radio , Gary Allan","Gasolina , Daddy Yankee"
50,"Fallen , Sarah McLachlan","Fallen , Mya","I Love This Bar , Toby Keith","I Love This Bar , Toby Keith","Not Today , Mary J. Blige Featuring Eve","Fallen , Sarah McLachlan","Fallen , Sarah McLachlan","Fallen , Sarah McLachlan","You Can't Take The Honky Tonk Out Of The Girl , Brooks & Dunn","No Better Love , Young Gunz Featuring Rell","No Better Love , Young Gunz Featuring Rell","There Goes My Life , Kenny Chesney","In My Life , Juvenile Featuring Mannie Fresh","In My Life , Juvenile Featuring Mannie Fresh","Hot Mama , Trace Adkins","Hot Mama , Trace Adkins","Game Over (Flip) , Lil' Flip","Game Over (Flip) , Lil' Flip","Little Moments , Brad Paisley","Watch The Wind Blow By , Tim McGraw","Watch The Wind Blow By , Tim McGraw","American Soldier , Toby Keith","Remember When , Alan Jackson","Don't Tell Me , Avril Lavigne","Don't Tell Me , Avril Lavigne","8th World Wonder , Kimberley Locke","Meant To Live , Switchfoot","Meant To Live , Switchfoot","Don't Take Your Love Away , Avant","Everytime , Britney Spears","Toxic , Britney Spears","Toxic , Britney Spears","Scandalous , Mis-Teeq","Loco , David Lee Murphy","Loco , David Lee Murphy","Southside , Lloyd Featuring Ashanti","Whats Happnin! , Ying Yang Twins Featuring Trick Daddy","Welcome Back , Mase","Welcome Back , Mase","Welcome Back , Mase","Hey Mama , The Black Eyed Peas","Hey Mama , The Black Eyed Peas","Don't Tell Me , Avril Lavigne","Feelin' Way Too Damn Good , Nickelback","Girls Lie Too , Terri Clark","Girls Lie Too , Terri Clark","I Got A Feelin' , Billy Currington","Too Much Of A Good Thing , Alan Jackson","Too Much Of A Good Thing , Alan Jackson","Breathe, Stretch, Shake , Mase Featuring P. Diddy","Whiskey Lullaby , Brad Paisley Featuring Alison Krauss","Accidentally In Love , Counting Crows","Accidentally In Love , Counting Crows","Accidentally In Love , Counting Crows","Drop It Like It's Hot , Snoop Dogg Featuring Pharrell","Drop It Like It's Hot , Snoop Dogg Featuring Pharrell","Go D.J. , Lil Wayne","Stays In Mexico , Toby Keith","In A Real Love , Phil Vassar","In A Real Love , Phil Vassar","Baby It's You , JoJo Featuring Bow Wow","I Don't Want To Be , Gavin DeGraw","I Don't Want To Be , Gavin DeGraw","Stays In Mexico , Toby Keith","Stays In Mexico , Toby Keith","Somebody Told Me , The Killers","Somebody Told Me , The Killers","Somebody Told Me , The Killers","Bring Em Out , T.I.","Bring Em Out , T.I.","How Am I Doin' , Dierks Bentley","How Am I Doin' , Dierks Bentley","Just Lose It , Eminem"
51,"Hotel , Cassidy Featuring R. Kelly","(There's Gotta Be) More To Life , Stacie Orrico","American Soldier , Toby Keith","American Soldier , Toby Keith","Why Can't I? , Liz Phair","Little Moments , Brad Paisley","Little Moments , Brad Paisley","Little Moments , Brad Paisley","Runnin (Dying To Live) , Tupac Featuring The Notorious B.I.G.","Wanna Get To Know You , G-Unit Featuring Joe","Wanna Get To Know You , G-Unit Featuring Joe","Perfect , Simple Plan","100 Years , Five For Fighting","100 Years , Five For Fighting","Perfect , Sara Evans","Falls On Me , Fuel","Sweet Southern Comfort , Buddy Jewell","Sweet Southern Comfort , Buddy Jewell","I Can't Wait , Sleepy Brown Featuring OutKast","Dude , Beenie Man Featuring Ms. Thing","Dude , Beenie Man Featuring Ms. Thing","Dude , Beenie Man Featuring Ms. Thing","Come Clean , Hilary Duff","Let's Be Us Again , Lonestar","Let's Be Us Again , Lonestar","Let's Be Us Again , Lonestar","Whiskey Girl , Toby Keith","Whiskey Girl , Toby Keith","Jesus Walks , Kanye West","I Miss You , Blink-182","Welcome Back , Mase","Welcome Back , Mase","When The Sun Goes Down , Kenny Chesney & Uncle Kracker","Live Like You Were Dying , Tim McGraw","Live Like You Were Dying , Tim McGraw","Lean Back , Terror Squad","Talk About Our Love , Brandy Featuring Kanye West","Redneck Woman , Gretchen Wilson","Redneck Woman , Gretchen Wilson","Culo , Pitbull Featuring Lil Jon","Why? , Jadakiss Featuring Anthony Hamilton","Why? , Jadakiss Featuring Anthony Hamilton","Scandalous , Mis-Teeq","Let's Get It Started , The Black Eyed Peas","Let's Get Away , T.I.","Let's Get Away , T.I.","On The Way Down , Ryan Cabrera","Here For The Party , Gretchen Wilson","Here For The Party , Gretchen Wilson","I Hate Everything , George Strait","I Hate Everything , George Strait","U Saved Me , R. Kelly","U Saved Me , R. Kelly","Flap Your Wings , Nelly","Flap Your Wings , Nelly","Flap Your Wings , Nelly","Stays In Mexico , Toby Keith","Live Like You Were Dying , Tim McGraw","Here For The Party , Gretchen Wilson","Here For The Party , Gretchen Wilson","Shorty Wanna Ride , Young Buck","Big Chips , R. Kelly & Jay-Z","Big Chips , R. Kelly & Jay-Z","Headsprung , LL Cool J","What You Waiting For? , Gwen Stefani","My Place , Nelly Featuring Jaheim","My Place , Nelly Featuring Jaheim","New York , Ja Rule Featuring Fat Joe & Jadakiss","True , Ryan Cabrera","True , Ryan Cabrera","True , Ryan Cabrera","Balla Baby , Chingy","When I Think About Cheatin' , Gretchen Wilson"
52,"Forthenight , Musiq","Yeah! , Usher Featuring Lil Jon & Ludacris","I Wanna Do It All , Terri Clark","I Wanna Do It All , Terri Clark","Little Moments , Brad Paisley","Toxic , Britney Spears","Toxic , Britney Spears","Runnin (Dying To Live) , Tupac Featuring The Notorious B.I.G.","I'm Still In Love With You , Sean Paul Featuring Sasha","This Love , Maroon 5","This Love , Maroon 5","Come Clean , Hilary Duff","Freek-A-Leek , Petey Pablo","Freek-A-Leek , Petey Pablo","You'll Think Of Me , Keith Urban","I Love You This Much , Jimmy Wayne","Mayberry , Rascal Flatts","Mayberry , Rascal Flatts","Watch The Wind Blow By , Tim McGraw","I Can't Wait , Sleepy Brown Featuring OutKast","I Can't Wait , Sleepy Brown Featuring OutKast","I Miss You , Blink-182","Hey Mama , The Black Eyed Peas","Rubber Band Man , T.I.","Rubber Band Man , T.I.","Meant To Live , Switchfoot","If You Ever Stop Loving Me , Montgomery Gentry","If You Ever Stop Loving Me , Montgomery Gentry","Whiskey Girl , Toby Keith","Culo , Pitbull Featuring Lil Jon","Desperately , George Strait","Desperately , George Strait","Loco , David Lee Murphy","That's What She Gets For Loving Me , Brooks & Dunn","That's What She Gets For Loving Me , Brooks & Dunn","I Go Back , Kenny Chesney","So Sexy , Twista Featuring R. Kelly","Pieces Of Me , Ashlee Simpson","Pieces Of Me , Ashlee Simpson","How Come , D12","Welcome Back , Mase","Welcome Back , Mase","Feelin' Way Too Damn Good , Nickelback","Girls Lie Too , Terri Clark","I Got A Feelin' , Billy Currington","I Got A Feelin' , Billy Currington","Here For The Party , Gretchen Wilson","Everytime , Britney Spears","Everytime , Britney Spears","Whats Happnin! , Ying Yang Twins Featuring Trick Daddy","Broken , Seether Featuring Amy Lee","Flap Your Wings , Nelly","Flap Your Wings , Nelly","1985 , Bowling For Soup","Stays In Mexico , Toby Keith","Stays In Mexico , Toby Keith","In A Real Love , Phil Vassar","In A Real Love , Phil Vassar","Mr. Mom , Lonestar","Mr. Mom , Lonestar","Stays In Mexico , Toby Keith","No Problem , Lil Scrappy","No Problem , Lil Scrappy","Suds In The Bucket , Sara Evans","What U Gon' Do , Lil Jon & The East Side Boyz Featuring Lil Scrappy","Nolia Clap , Juvenile, Wacko & Skip","Nolia Clap , Juvenile, Wacko & Skip","How We Do , The Game Featuring 50 Cent","Somebody Told Me , The Killers","Somebody Told Me , The Killers","Numb/Encore , Jay-Z/Linkin Park","Since U Been Gone , Kelly Clarkson","Bless The Broken Road , Rascal Flatts"
53,"American Soldier , Toby Keith","Breathe , Michelle Branch","Watch The Wind Blow By , Tim McGraw","Watch The Wind Blow By , Tim McGraw","More & More , Joe","One Call Away , Chingy Featuring J. Weav","One Call Away , Chingy Featuring J. Weav","Change Clothes , JAY-Z","No Better Love , Young Gunz Featuring Rell","Rubber Band Man , T.I.","Rubber Band Man , T.I.","Hot Mama , Trace Adkins","Perfect , Sara Evans","Perfect , Sara Evans","I Love You This Much , Jimmy Wayne","Sweet Southern Comfort , Buddy Jewell","Falls On Me , Fuel","Falls On Me , Fuel","Bounce , Sarah Connor","Don't Take Your Love Away , Avant","Don't Take Your Love Away , Avant","Roses , OutKast","Don't Tell Me , Avril Lavigne","Dude , Beenie Man Featuring Ms. Thing","Dude , Beenie Man Featuring Ms. Thing","Sweet Southern Comfort , Buddy Jewell","Slow Motion , Juvenile Featuring Soulja Slim","Slow Motion , Juvenile Featuring Soulja Slim","8th World Wonder , Kimberley Locke","Leave (Get Out) , JoJo","Dip It Low , Christina Milian","Dip It Low , Christina Milian","You'll Think Of Me , Keith Urban","When The Sun Goes Down , Kenny Chesney & Uncle Kracker","When The Sun Goes Down , Kenny Chesney & Uncle Kracker","Whats Happnin! , Ying Yang Twins Featuring Trick Daddy","Letters From Home , John Michael Montgomery","Culo , Pitbull Featuring Lil Jon","Culo , Pitbull Featuring Lil Jon","All Falls Down , Kanye West Featuring Syleena Johnson","Locked Up , Akon Featuring Styles P.","Locked Up , Akon Featuring Styles P.","Let Me In , Young Buck","I Want To Live , Josh Gracin","I Believe , Fantasia","I Believe , Fantasia","She Thinks She Needs Me , Andy Griggs","I Hate Everything , George Strait","I Hate Everything , George Strait","Breakaway , Kelly Clarkson","Flap Your Wings , Nelly","Stays In Mexico , Toby Keith","Stays In Mexico , Toby Keith","Oye Mi Canto , N.O.R.E. Featuring Daddy Yankee, Nina Sky, Gem Star & Big Mato","That's What It's All About , Brooks & Dunn","That's What It's All About , Brooks & Dunn","That's What It's All About , Brooks & Dunn","Flap Your Wings , Nelly","That's What It's All About , Brooks & Dunn","That's What It's All About , Brooks & Dunn","Days Go By , Keith Urban","I Hate Everything , George Strait","I Hate Everything , George Strait","Breathe, Stretch, Shake , Mase Featuring P. Diddy","Somebody Told Me , The Killers","In A Real Love , Phil Vassar","In A Real Love , Phil Vassar","Karma , Lloyd Banks Featuring Avant","Disco Inferno , 50 Cent","Disco Inferno , 50 Cent","Somebody Told Me , The Killers","Hush , LL Cool J Featuring 7 Aurelius","How Am I Doin' , Dierks Bentley"
54,"(I Hate) Everything About You , Three Days Grace","(I Hate) Everything About You , Three Days Grace","My Baby , Bow Wow Featuring Jagged Edge","My Baby , Bow Wow Featuring Jagged Edge","My Baby , Bow Wow Featuring Jagged Edge","More & More , Joe","More & More , Joe","In My Daughter's Eyes , Martina McBride","Rubber Band Man , T.I.","Megalomaniac , Incubus","Megalomaniac , Incubus","100 Years , Five For Fighting","There Goes My Life , Kenny Chesney","There Goes My Life , Kenny Chesney","Falls On Me , Fuel","Mayberry , Rascal Flatts","In My Daughter's Eyes , Martina McBride","In My Daughter's Eyes , Martina McBride","Letters From Home , John Michael Montgomery","Roses , OutKast","Roses , OutKast","Paint Me A Birmingham , Tracy Lawrence","American Soldier , Toby Keith","8th World Wonder , Kimberley Locke","8th World Wonder , Kimberley Locke","Cold Hard Bitch , Jet","Cold Hard Bitch , Jet","Cold Hard Bitch , Jet","Cold Hard Bitch , Jet","Don't Take Your Love Away , Avant","99 Problems , JAY-Z","99 Problems , JAY-Z","Mayberry , Rascal Flatts","Southside , Lloyd Featuring Ashanti","Southside , Lloyd Featuring Ashanti","My Band , D12","Game Over (Flip) , Lil' Flip","Accidentally In Love , Counting Crows","Accidentally In Love , Counting Crows","Accidentally In Love , Counting Crows","If You Ever Stop Loving Me , Montgomery Gentry","If You Ever Stop Loving Me , Montgomery Gentry","One Thing , Finger Eleven","Days Go By , Keith Urban","Selfish , Slum Village Featuring Kanye West & John Legend","Selfish , Slum Village Featuring Kanye West & John Legend","Suds In The Bucket , Sara Evans","Just Like You , Three Days Grace","Just Like You , Three Days Grace","Just Like You , Three Days Grace","Stays In Mexico , Toby Keith","Nolia Clap , Juvenile, Wacko & Skip","Nolia Clap , Juvenile, Wacko & Skip","Stays In Mexico , Toby Keith","Let's Get Away , T.I.","Let's Get Away , T.I.","Dare You To Move , Switchfoot","That's What It's All About , Brooks & Dunn","Nothing On But The Radio , Gary Allan","Nothing On But The Radio , Gary Allan","I Like That , Houston Featuring Chingy, Nate Dogg & I-20","Stays In Mexico , Toby Keith","Stays In Mexico , Toby Keith","Some Beach , Blake Shelton","Suds In The Bucket , Sara Evans","Only U , Ashanti","Only U , Ashanti","Encore , Eminem, Dr. Dre & 50 Cent","Boulevard Of Broken Dreams , Green Day","Boulevard Of Broken Dreams , Green Day","1985 , Bowling For Soup","When I Think About Cheatin' , Gretchen Wilson","Mud On The Tires , Brad Paisley"
55,"More & More , Joe","I Love This Bar , Toby Keith","(There's Gotta Be) More To Life , Stacie Orrico","(There's Gotta Be) More To Life , Stacie Orrico","She's Not Just A Pretty Face , Shania Twain","In My Daughter's Eyes , Martina McBride","In My Daughter's Eyes , Martina McBride","In My Life , Juvenile Featuring Mannie Fresh","Hot Mama , Trace Adkins","Hot Mama , Trace Adkins","Hot Mama , Trace Adkins","When The Sun Goes Down , Kenny Chesney & Uncle Kracker","Hot Mama , Trace Adkins","Hot Mama , Trace Adkins","Megalomaniac , Incubus","Megalomaniac , Incubus","Megalomaniac , Incubus","Megalomaniac , Incubus","Roses , OutKast","I Miss You , Blink-182","I Miss You , Blink-182","Watch The Wind Blow By , Tim McGraw","Desperately , George Strait","Cold Hard Bitch , Jet","Cold Hard Bitch , Jet","Ride Wit U , Joe Featuring G-Unit","Ride Wit U , Joe Featuring G-Unit","Ride Wit U , Joe Featuring G-Unit","On Fire , Lloyd Banks","Heaven , Los Lonely Boys","Talk About Our Love , Brandy Featuring Kanye West","Talk About Our Love , Brandy Featuring Kanye West","Toxic , Britney Spears","Take My Breath Away , Jessica Simpson","Take My Breath Away , Jessica Simpson","I Like That , Houston Featuring Chingy, Nate Dogg & I-20","Slither , Velvet Revolver","Somebody , Reba McEntire","Somebody , Reba McEntire","Whiskey Lullaby , Brad Paisley Featuring Alison Krauss","Slither , Velvet Revolver","Slither , Velvet Revolver","Girls Lie Too , Terri Clark","Slither , Velvet Revolver","Don't Tell Me , Avril Lavigne","Don't Tell Me , Avril Lavigne","Just Like You , Three Days Grace","Whats Happnin! , Ying Yang Twins Featuring Trick Daddy","Whats Happnin! , Ying Yang Twins Featuring Trick Daddy","Save A Horse (Ride A Cowboy) , Big & Rich","Whats Happnin! , Ying Yang Twins Featuring Trick Daddy","Charlene , Anthony Hamilton","Charlene , Anthony Hamilton","Southside , Lloyd Featuring Ashanti","In A Real Love , Phil Vassar","In A Real Love , Phil Vassar","Feels Like Today , Rascal Flatts","Balla Baby , Chingy","Stays In Mexico , Toby Keith","Stays In Mexico , Toby Keith","Big Chips , R. Kelly & Jay-Z","Breaking The Habit , Linkin Park","Breaking The Habit , Linkin Park","Daughters , John Mayer","Welcome To My Life , Simple Plan","Karma , Lloyd Banks Featuring Avant","Karma , Lloyd Banks Featuring Avant","Awful, Beautiful Life , Darryl Worley","Tempted To Touch , Rupee","Tempted To Touch , Rupee","When I Think About Cheatin' , Gretchen Wilson","You're My Better Half , Keith Urban","You're My Better Half , Keith Urban"
56,"Watch The Wind Blow By , Tim McGraw","More & More , Joe","More & More , Joe","More & More , Joe","Honesty (Write Me A List) , Rodney Atkins","Why Can't I? , Liz Phair","Why Can't I? , Liz Phair","More & More , Joe","Megalomaniac , Incubus","Freek-A-Leek , Petey Pablo","Freek-A-Leek , Petey Pablo","Freek-A-Leek , Petey Pablo","When The Sun Goes Down , Kenny Chesney & Uncle Kracker","When The Sun Goes Down , Kenny Chesney & Uncle Kracker","In My Life , Juvenile Featuring Mannie Fresh","Game Over (Flip) , Lil' Flip","The Reason , Hoobastank","The Reason , Hoobastank","Dude , Beenie Man Featuring Ms. Thing","Bounce , Sarah Connor","Bounce , Sarah Connor","Desperately , George Strait","Perfect , Sara Evans","I Want You , Janet Jackson","I Want You , Janet Jackson","If You Ever Stop Loving Me , Montgomery Gentry","That's What She Gets For Loving Me , Brooks & Dunn","That's What She Gets For Loving Me , Brooks & Dunn","Culo , Pitbull Featuring Lil Jon","Cold Hard Bitch , Jet","Loco , David Lee Murphy","Loco , David Lee Murphy","That's What She Gets For Loving Me , Brooks & Dunn","Jook Gal (Wine Wine) , Elephant Man","Jook Gal (Wine Wine) , Elephant Man","That's What She Gets For Loving Me , Brooks & Dunn","That's What She Gets For Loving Me , Brooks & Dunn","99 Problems , JAY-Z","99 Problems , JAY-Z","Redneck Woman , Gretchen Wilson","I Got A Feelin' , Billy Currington","I Got A Feelin' , Billy Currington","I Want To Live , Josh Gracin","U Saved Me , R. Kelly","Just Like You , Three Days Grace","Just Like You , Three Days Grace","Too Much Of A Good Thing , Alan Jackson","Save A Horse (Ride A Cowboy) , Big & Rich","Save A Horse (Ride A Cowboy) , Big & Rich","I Want To Live , Josh Gracin","Just Like You , Three Days Grace","On Fire , Lloyd Banks","On Fire , Lloyd Banks","Let's Go , Trick Daddy Featuring Lil Jon & Twista","Dangerously In Love , Beyonce","Dangerously In Love , Beyonce","Dangerously In Love , Beyonce","Feels Like Today , Rascal Flatts","Feels Like Today , Rascal Flatts","Feels Like Today , Rascal Flatts","Shadow , Ashlee Simpson","The Woman With You , Kenny Chesney","The Woman With You , Kenny Chesney","Breaking The Habit , Linkin Park","How Am I Doin' , Dierks Bentley","How Am I Doin' , Dierks Bentley","How Am I Doin' , Dierks Bentley","How Am I Doin' , Dierks Bentley","Let's Get It Started , The Black Eyed Peas","Let's Get It Started , The Black Eyed Peas","Nobody's Home , Avril Lavigne","Nobody's Home , Avril Lavigne","Nothing On But The Radio , Gary Allan"
57,"Sorry 2004 , Ruben Studdard","American Soldier , Toby Keith","Breathe , Michelle Branch","Breathe , Michelle Branch","In My Daughter's Eyes , Martina McBride","She's Not Just A Pretty Face , Shania Twain","She's Not Just A Pretty Face , Shania Twain","No Better Love , Young Gunz Featuring Rell","Perfect , Sara Evans","I Can't Wait , Sleepy Brown Featuring OutKast","I Can't Wait , Sleepy Brown Featuring OutKast","Gangsta Nation , Westside Connection Featuring Nate Dogg","Falls On Me , Fuel","Falls On Me , Fuel","Just A Little While , Janet Jackson","Bounce , Sarah Connor","Bounce , Sarah Connor","Bounce , Sarah Connor","Don't Take Your Love Away , Avant","No Better Love , Young Gunz Featuring Rell","No Better Love , Young Gunz Featuring Rell","Don't Tell Me , Avril Lavigne","Dude , Beenie Man Featuring Ms. Thing","Solitaire , Clay Aiken","Solitaire , Clay Aiken","Move Ya Body , Nina Sky Featuring Jabba","Lying From You , Linkin Park","Lying From You , Linkin Park","That's What She Gets For Loving Me , Brooks & Dunn","That's What She Gets For Loving Me , Brooks & Dunn","Don't Take Your Love Away , Avant","Don't Take Your Love Away , Avant","U Should've Known Better , Monica","Diary , Alicia Keys Featuring Tony! Toni! Tone!","Diary , Alicia Keys Featuring Tony! Toni! Tone!","Sunshine , Lil' Flip Featuring Lea","When The Sun Goes Down , Kenny Chesney & Uncle Kracker","Slither , Velvet Revolver","Slither , Velvet Revolver","Let's Be Us Again , Lonestar","Whiskey Girl , Toby Keith","Whiskey Girl , Toby Keith","Slither , Velvet Revolver","Don't Tell Me , Avril Lavigne","Too Much Of A Good Thing , Alan Jackson","Too Much Of A Good Thing , Alan Jackson","Somebody , Reba McEntire","Culo , Pitbull Featuring Lil Jon","Culo , Pitbull Featuring Lil Jon","Broken , Seether Featuring Amy Lee","U Saved Me , R. Kelly","In A Real Love , Phil Vassar","In A Real Love , Phil Vassar","I Go Back , Kenny Chesney","You & Me , J-Kwon Featuring Sadiyyah","You & Me , J-Kwon Featuring Sadiyyah","Tilt Ya Head Back , Nelly & Christina Aguilera","Over And Over , Nelly Featuring Tim McGraw","Baby It's You , JoJo Featuring Bow Wow","Baby It's You , JoJo Featuring Bow Wow","The Woman With You , Kenny Chesney","Back When , Tim McGraw","Back When , Tim McGraw","What You Waiting For? , Gwen Stefani","Breaking The Habit , Linkin Park","Encore , Eminem, Dr. Dre & 50 Cent","Encore , Eminem, Dr. Dre & 50 Cent","Let's Get It Started , The Black Eyed Peas","Party For Two , Shania Twain With Billy Currington Or Mark McGrath","Party For Two , Shania Twain With Billy Currington Or Mark McGrath","Beautiful Soul , Jesse McCartney","Mud On The Tires , Brad Paisley","The Woman With You , Kenny Chesney"
