78,"Wave On Wave , Pat Green","Hell Yeah , Montgomery Gentry","Chicks Dig It , Chris Cagle","Chicks Dig It , Chris Cagle","Away From Me , Puddle Of Mudd","Breathe , Michelle Branch","Breathe , Michelle Branch","I Wish , Jo Dee Messina","She's Not Just A Pretty Face , Shania Twain","When I Look To The Sky , Train","When I Look To The Sky , Train","Hit That , The Offspring","You Can't Take The Honky Tonk Out Of The Girl , Brooks & Dunn","You Can't Take The Honky Tonk Out Of The Girl , Brooks & Dunn","More & More , Joe","I Am The Highway , Audioslave","I Am The Highway , Audioslave","I Am The Highway , Audioslave","I Love You This Much , Jimmy Wayne","Falls On Me , Fuel","Falls On Me , Fuel","Simple Life , Carolyn Dawn Johnson","Love's Divine , Seal","Love's Divine , Seal","Love's Divine , Seal","Love's Divine , Seal","The Outsider , A Perfect Circle","The Outsider , A Perfect Circle","Ride Wit U , Joe Featuring G-Unit","Sweet Southern Comfort , Buddy Jewell","Whats Happnin! , Ying Yang Twins Featuring Trick Daddy","Whats Happnin! , Ying Yang Twins Featuring Trick Daddy","Paint Me A Birmingham , Tracy Lawrence","Where Are We Runnin'? , Lenny Kravitz","Where Are We Runnin'? , Lenny Kravitz","Don't Take Your Love Away , Avant","Love Song , 311","Get No Better , Cassidy Featuring Mashonda","Get No Better , Cassidy Featuring Mashonda","Still In Love , Teena Marie Featuring Baby","Talk About Our Love , Brandy Featuring Kanye West","Talk About Our Love , Brandy Featuring Kanye West","Just Like You , Three Days Grace","Got It Twisted , Mobb Deep","Take Me Out , Franz Ferdinand","Take Me Out , Franz Ferdinand","Got It Twisted , Mobb Deep","Outrageous , Britney Spears","Outrageous , Britney Spears","Slither , Velvet Revolver","I Got A Feelin' , Billy Currington","Whats Happnin! , Ying Yang Twins Featuring Trick Daddy","Whats Happnin! , Ying Yang Twins Featuring Trick Daddy","Feelin' Way Too Damn Good , Nickelback","Take Me Out , Franz Ferdinand","Take Me Out , Franz Ferdinand","Girls Lie Too , Terri Clark","So Cold , Breaking Benjamin","Just Like You , Three Days Grace","Just Like You , Three Days Grace","So Cold , Breaking Benjamin","Real Big , Mannie Fresh","Real Big , Mannie Fresh","White Tee's , Dem Franchize Boyz","Take Me Home , Terror Squad","So Cold , Breaking Benjamin","So Cold , Breaking Benjamin","Knuck If You Buck , Crime Mob Featuring Lil Scrappy","Knuck If You Buck , Crime Mob Featuring Lil Scrappy","Knuck If You Buck , Crime Mob Featuring Lil Scrappy","Nolia Clap , Juvenile, Wacko & Skip","So Cold , Breaking Benjamin","So Cold , Breaking Benjamin"
79,"Still Frame , Trapt","Still Frame , Trapt","In My Life , Juvenile Featuring Mannie Fresh","In My Life , Juvenile Featuring Mannie Fresh","Hell Yeah , Montgomery Gentry","Freek-A-Leek , Petey Pablo","Freek-A-Leek , Petey Pablo","Breathe , Michelle Branch","Invisible , Clay Aiken","One Day At A Time , Tupac With Eminem Featuring The Outlawz","One Day At A Time , Tupac With Eminem Featuring The Outlawz","One Day At A Time , Tupac With Eminem Featuring The Outlawz","Hold On , Good Charlotte","Hold On , Good Charlotte","Neva Eva , Trillville","Work It (Reinvention) , Nelly","I Wanna Do It All , Terri Clark","I Wanna Do It All , Terri Clark","In My Life , Juvenile Featuring Mannie Fresh","Happy People , R. Kelly","Happy People , R. Kelly","Figured You Out , Nickelback","No Better Love , Young Gunz Featuring Rell","Figured You Out , Nickelback","Figured You Out , Nickelback","Solitaire , Clay Aiken","Love's Divine , Seal","Love's Divine , Seal","Got It Twisted , Mobb Deep","Jook Gal (Wine Wine) , Elephant Man","It Only Hurts When I'm Breathing , Shania Twain","It Only Hurts When I'm Breathing , Shania Twain","Where Are We Runnin'? , Lenny Kravitz","Selfish , Slum Village Featuring Kanye West & John Legend","Selfish , Slum Village Featuring Kanye West & John Legend","Selfish , Slum Village Featuring Kanye West & John Legend","Everything , Alanis Morissette","That's What She Gets For Loving Me , Brooks & Dunn","That's What She Gets For Loving Me , Brooks & Dunn","Let's Get Away , T.I.","Got It Twisted , Mobb Deep","Got It Twisted , Mobb Deep","Letters From Home , John Michael Montgomery","If You Ever Stop Loving Me , Montgomery Gentry","Still In Love , Teena Marie Featuring Baby","Still In Love , Teena Marie Featuring Baby","Ocean Avenue , Yellowcard","I Believe , Fantasia","I Believe , Fantasia","Everytime , Britney Spears","I Want To Live , Josh Gracin","Somebody Told Me , The Killers","Somebody Told Me , The Killers","Whiskey Lullaby , Brad Paisley Featuring Alison Krauss","Car Wash , Christina Aguilera Featuring Missy Elliott","Car Wash , Christina Aguilera Featuring Missy Elliott","Take Me Out , Franz Ferdinand","You & Me , J-Kwon Featuring Sadiyyah","King Of The Dancehall , Beenie Man","King Of The Dancehall , Beenie Man","Let Me Love You , Mario","If Nobody Believed In You , Joe Nichols","If Nobody Believed In You , Joe Nichols","Knuck If You Buck , Crime Mob Featuring Lil Scrappy","Knuck If You Buck , Crime Mob Featuring Lil Scrappy","I Hate Everything , George Strait","I Hate Everything , George Strait","So Cold , Breaking Benjamin","Karma , Alicia Keys","Karma , Alicia Keys","So Cold , Breaking Benjamin","In A Real Love , Phil Vassar","Come Home Soon , SHeDAISY"
80,"I Melt , Rascal Flatts","Rain On Me , Ashanti","Stacy's Mom , Fountains Of Wayne","Stacy's Mom , Fountains Of Wayne","I'm Still In Love With You , Sean Paul Featuring Sasha","Forthenight , Musiq","Forthenight , Musiq","Not Today , Mary J. Blige Featuring Eve","Neva Eva , Trillville","Neva Eva , Trillville","Neva Eva , Trillville","You , Ryan Duarte","You , Ryan Duarte","You , Ryan Duarte","Roses , OutKast","More & More , Joe","Neva Eva , Trillville","Neva Eva , Trillville","Love's Divine , Seal","Love's Divine , Seal","Love's Divine , Seal","Love's Divine , Seal","F.U.R.B. (F U Right Back) , Frankee","Leave (Get Out) , JoJo","Leave (Get Out) , JoJo","Perfect , Sara Evans","You Raise Me Up , Josh Groban","You Raise Me Up , Josh Groban","Love's Divine , Seal","Love Song , 311","Love Song , 311","Love Song , 311","Ch-Check It Out , Beastie Boys","Time's Up! , Jadakiss Featuring Nate Dogg","Time's Up! , Jadakiss Featuring Nate Dogg","Love Song , 311","Locked Up , Akon Featuring Styles P.","Float On , Modest Mouse","Float On , Modest Mouse","Freaks , Play-N-Skillz Featuring Krayzie Bone & Adina Howard","Jook Gal (Wine Wine) , Elephant Man","Jook Gal (Wine Wine) , Elephant Man","Got It Twisted , Mobb Deep","Hey Mama , The Black Eyed Peas","If You Ever Stop Loving Me , Montgomery Gentry","If You Ever Stop Loving Me , Montgomery Gentry","Outrageous , Britney Spears","Break Down Here , Julie Roberts","Break Down Here , Julie Roberts","Somebody , Reba McEntire","Slither , Velvet Revolver","King Of The Dancehall , Beenie Man","King Of The Dancehall , Beenie Man","Float On , Modest Mouse","So Cold , Breaking Benjamin","So Cold , Breaking Benjamin","So Cold , Breaking Benjamin","Girls Lie Too , Terri Clark","What You Waiting For? , Gwen Stefani","What You Waiting For? , Gwen Stefani","Used To Love U , John Legend","Knuck If You Buck , Crime Mob Featuring Lil Scrappy","Knuck If You Buck , Crime Mob Featuring Lil Scrappy","I Smoke, I Drank , Body Head Bangerz Featuring YoungBloodz","I Smoke, I Drank , Body Head Bangerz Featuring YoungBloodz","Dangerously In Love , Beyonce","Dangerously In Love , Beyonce","Getting Away With Murder , Papa Roach","Getting Away With Murder , Papa Roach","Getting Away With Murder , Papa Roach","Knuck If You Buck , Crime Mob Featuring Lil Scrappy","Cold , Crossfade","Cold , Crossfade"
81,"I'm Still In Love With You , Sean Paul Featuring Sasha","I'm Still In Love With You , Sean Paul Featuring Sasha","Pop That Booty , Marques Houston Featuring Jermaine ""JD"" Dupri","Pop That Booty , Marques Houston Featuring Jermaine ""JD"" Dupri","Cowboys Like Us , George Strait","(There's Gotta Be) More To Life , Stacie Orrico","(There's Gotta Be) More To Life , Stacie Orrico","My Baby , Bow Wow Featuring Jagged Edge","Drinkin' Bone , Tracy Byrd","Invisible , Clay Aiken","Invisible , Clay Aiken","Runnin (Dying To Live) , Tupac Featuring The Notorious B.I.G.","When I Look To The Sky , Train","When I Look To The Sky , Train","When I Look To The Sky , Train","Gangsta Nation , Westside Connection Featuring Nate Dogg","Love's Divine , Seal","Love's Divine , Seal","I Am The Highway , Audioslave","Ride Wit U , Joe Featuring G-Unit","Ride Wit U , Joe Featuring G-Unit","Ride Wit U , Joe Featuring G-Unit","Bounce , Sarah Connor","I Can't Wait , Sleepy Brown Featuring OutKast","I Can't Wait , Sleepy Brown Featuring OutKast","Dip It Low , Christina Milian","Simple Life , Carolyn Dawn Johnson","Simple Life , Carolyn Dawn Johnson","Scandalous , Mis-Teeq","Tear It Up , Yung Wun Featuring DMX, Lil' Flip & David Banner","Love's Divine , Seal","Love's Divine , Seal","Get No Better , Cassidy Featuring Mashonda","Get No Better , Cassidy Featuring Mashonda","Get No Better , Cassidy Featuring Mashonda","I Miss You , Blink-182","Get No Better , Cassidy Featuring Mashonda","Ch-Check It Out , Beastie Boys","Ch-Check It Out , Beastie Boys","Cold Hard Bitch , Jet","Let's Get Away , T.I.","Let's Get Away , T.I.","Let's Get Away , T.I.","Whiskey Girl , Toby Keith","Scandalous , Mis-Teeq","Scandalous , Mis-Teeq","If You Ever Stop Loving Me , Montgomery Gentry","Still In Love , Teena Marie Featuring Baby","Still In Love , Teena Marie Featuring Baby","Selfish , Slum Village Featuring Kanye West & John Legend","Call My Name , Prince","Slither , Velvet Revolver","Slither , Velvet Revolver","Call My Name , Prince","White Tee's , Dem Franchize Boyz","White Tee's , Dem Franchize Boyz","White Tee's , Dem Franchize Boyz","White Tee's , Dem Franchize Boyz","White Tee's , Dem Franchize Boyz","White Tee's , Dem Franchize Boyz","King Of The Dancehall , Beenie Man","Accidentally In Love , Counting Crows","Accidentally In Love , Counting Crows","Real Big , Mannie Fresh","Real Big , Mannie Fresh","Used To Love U , John Legend","Used To Love U , John Legend","Numb/Encore , Jay-Z/Linkin Park","So Cold , Breaking Benjamin","So Cold , Breaking Benjamin","That's What It's All About , Brooks & Dunn","I Changed My Mind , Keyshia Cole Featuring Shyne","Hush , LL Cool J Featuring 7 Aurelius"
82,"Me Against The Music , Britney Spears Featuring Madonna","In My Life , Juvenile Featuring Mannie Fresh","Still Frame , Trapt","Still Frame , Trapt","Pop That Booty , Marques Houston Featuring Jermaine ""JD"" Dupri","Long Black Train , Josh Turner","Long Black Train , Josh Turner","Forthenight , Musiq","One Day At A Time , Tupac With Eminem Featuring The Outlawz","The Voice Within , Christina Aguilera","The Voice Within , Christina Aguilera","Invisible , Clay Aiken","Alone , Lasgo","Alone , Lasgo","Alone , Lasgo","Neva Eva , Trillville","When I Look To The Sky , Train","When I Look To The Sky , Train","I'm Really Hot , Missy Elliott","In My Daughter's Eyes , Martina McBride","In My Daughter's Eyes , Martina McBride","Falls On Me , Fuel","Falls On Me , Fuel","Little Moments , Brad Paisley","Little Moments , Brad Paisley","Figured You Out , Nickelback","Megalomaniac , Incubus","Megalomaniac , Incubus","Jook Gal (Wine Wine) , Elephant Man","Love's Divine , Seal","Sweet Southern Comfort , Buddy Jewell","Sweet Southern Comfort , Buddy Jewell","This Way , Dilated Peoples Featuring Kanye West","This Way , Dilated Peoples Featuring Kanye West","This Way , Dilated Peoples Featuring Kanye West","Get No Better , Cassidy Featuring Mashonda","Float On , Modest Mouse","I Miss You , Blink-182","I Miss You , Blink-182","Don't Take Your Love Away , Avant","Still In Love , Teena Marie Featuring Baby","Still In Love , Teena Marie Featuring Baby","No Problem , Lil Scrappy","On The Way Down , Ryan Cabrera","Welcome Back , Mase","Welcome Back , Mase","Scandalous , Mis-Teeq","If You Ever Stop Loving Me , Montgomery Gentry","If You Ever Stop Loving Me , Montgomery Gentry","Break Down Here , Julie Roberts","Break Down Here , Julie Roberts","Break Down Here , Julie Roberts","Break Down Here , Julie Roberts","Breathe , Fabolous","King Of The Dancehall , Beenie Man","King Of The Dancehall , Beenie Man","Call My Name , Prince","She Thinks She Needs Me , Andy Griggs","Take Me Out , Franz Ferdinand","Take Me Out , Franz Ferdinand","Knuck If You Buck , Crime Mob Featuring Lil Scrappy","I Smoke, I Drank , Body Head Bangerz Featuring YoungBloodz","I Smoke, I Drank , Body Head Bangerz Featuring YoungBloodz","King Of The Dancehall , Beenie Man","Dangerously In Love , Beyonce","Stays In Mexico , Toby Keith","Stays In Mexico , Toby Keith","Big Chips , R. Kelly & Jay-Z","I Smoke, I Drank , Body Head Bangerz Featuring YoungBloodz","I Smoke, I Drank , Body Head Bangerz Featuring YoungBloodz","Gasolina , Daddy Yankee","Getting Away With Murder , Papa Roach","Take Me Home , Terror Squad"
83,"Love You More , Ginuwine","Stacy's Mom , Fountains Of Wayne","Shake That Monkey , Too Short Featuring Lil Jon & The East Side Boyz","Shake That Monkey , Too Short Featuring Lil Jon & The East Side Boyz","Shake That Monkey , Too Short Featuring Lil Jon & The East Side Boyz","Away From Me , Puddle Of Mudd","Away From Me , Puddle Of Mudd","Neva Eva , Trillville","Stunt 101 , G Unit","Change Clothes , JAY-Z","Change Clothes , JAY-Z","Alone , Lasgo","Hit That , The Offspring","Hit That , The Offspring","You Can't Take The Honky Tonk Out Of The Girl , Brooks & Dunn","When I Look To The Sky , Train","Work It (Reinvention) , Nelly","Work It (Reinvention) , Nelly","Behind Blue Eyes , Limp Bizkit","In My Life , Juvenile Featuring Mannie Fresh","In My Life , Juvenile Featuring Mannie Fresh","In My Daughter's Eyes , Martina McBride","Culo , Pitbull Featuring Lil Jon","Dip It Low , Christina Milian","Dip It Low , Christina Milian","Tear It Up , Yung Wun Featuring DMX, Lil' Flip & David Banner","99 Problems , JAY-Z","99 Problems , JAY-Z","I Want You , Janet Jackson","Turn Me On , Kevin Lyttle Featuring Spragga Benz","This Way , Dilated Peoples Featuring Kanye West","This Way , Dilated Peoples Featuring Kanye West","Tear It Up , Yung Wun Featuring DMX, Lil' Flip & David Banner","Paint Me A Birmingham , Tracy Lawrence","Paint Me A Birmingham , Tracy Lawrence","Lying From You , Linkin Park","Love's Divine , Seal","Love's Divine , Seal","Love's Divine , Seal","Ch-Check It Out , Beastie Boys","Game Over (Flip) , Lil' Flip","Game Over (Flip) , Lil' Flip","Loco , David Lee Murphy","Still In Love , Teena Marie Featuring Baby","Whiskey Girl , Toby Keith","Whiskey Girl , Toby Keith","Break Down Here , Julie Roberts","Ocean Avenue , Yellowcard","Ocean Avenue , Yellowcard","Oye Mi Canto , N.O.R.E. Featuring Daddy Yankee, Nina Sky, Gem Star & Big Mato","Oye Mi Canto , N.O.R.E. Featuring Daddy Yankee, Nina Sky, Gem Star & Big Mato","Call My Name , Prince","Call My Name , Prince","White Tee's , Dem Franchize Boyz","Southside , Lloyd Featuring Ashanti","Southside , Lloyd Featuring Ashanti","King Of The Dancehall , Beenie Man","Shake That Sh** , Shawnna Featuring Ludacris","Shake That Sh** , Shawnna Featuring Ludacris","Shake That Sh** , Shawnna Featuring Ludacris","White Tee's , Dem Franchize Boyz","Feels Like Today , Rascal Flatts","Feels Like Today , Rascal Flatts","Cold , Crossfade","So Cold , Breaking Benjamin","I Smoke, I Drank , Body Head Bangerz Featuring YoungBloodz","I Smoke, I Drank , Body Head Bangerz Featuring YoungBloodz","American Idiot , Green Day","I Changed My Mind , Keyshia Cole Featuring Shyne","I Changed My Mind , Keyshia Cole Featuring Shyne","I Changed My Mind , Keyshia Cole Featuring Shyne","Take Me Home , Terror Squad","Getting Away With Murder , Papa Roach"
84,"Gangsta Girl , Big Tymers Featuring R. Kelly","Gangsta Girl , Big Tymers Featuring R. Kelly","The Set Up , Obie Trice Featuring Nate Dogg","The Set Up , Obie Trice Featuring Nate Dogg","Freek-A-Leek , Petey Pablo","Neva Eva , Trillville","Neva Eva , Trillville","Honesty (Write Me A List) , Rodney Atkins","Forthenight , Musiq","You , Ryan Duarte","You , Ryan Duarte","Shake That Monkey , Too Short Featuring Lil Jon & The East Side Boyz","Gal Yuh Ah Lead , T.O.K.","Gal Yuh Ah Lead , T.O.K.","Gal Yuh Ah Lead , T.O.K.","You Can't Take The Honky Tonk Out Of The Girl , Brooks & Dunn","More & More , Joe","More & More , Joe","Ride Wit U , Joe Featuring G-Unit","Hot Mama , Trace Adkins","Hot Mama , Trace Adkins","Wild West Show , Big & Rich","I Am The Highway , Audioslave","What's It Like , Jagged Edge","What's It Like , Jagged Edge","I Can't Wait , Sleepy Brown Featuring OutKast","Got It Twisted , Mobb Deep","Got It Twisted , Mobb Deep","The Outsider , A Perfect Circle","whoknows , Musiq","Get No Better , Cassidy Featuring Mashonda","Get No Better , Cassidy Featuring Mashonda","It Only Hurts When I'm Breathing , Shania Twain","Love's Divine , Seal","Love's Divine , Seal","Tear It Up , Yung Wun Featuring DMX, Lil' Flip & David Banner","Don't Take Your Love Away , Avant","My Band , D12","My Band , D12","Get No Better , Cassidy Featuring Mashonda","No Problem , Lil Scrappy","No Problem , Lil Scrappy","Let's Be Us Again , Lonestar","Take Me Out , Franz Ferdinand","Outrageous , Britney Spears","Outrageous , Britney Spears","Whiskey Girl , Toby Keith","Who Is She 2 U , Brandy","Who Is She 2 U , Brandy","Somebody Told Me , The Killers","Somebody Told Me , The Killers","Away From The Sun , 3 Doors Down","Away From The Sun , 3 Doors Down","You're My Everything , Anita Baker","You're My Everything , Anita Baker","You're My Everything , Anita Baker","You're My Everything , Anita Baker","Call My Name , Prince","You & Me , J-Kwon Featuring Sadiyyah","You & Me , J-Kwon Featuring Sadiyyah","I Smoke, I Drank , Body Head Bangerz Featuring YoungBloodz","King Of The Dancehall , Beenie Man","King Of The Dancehall , Beenie Man","Shadow , Ashlee Simpson","Just Like You , Three Days Grace","American Idiot , Green Day","American Idiot , Green Day","Used To Love U , John Legend","Dangerously In Love , Beyonce","Dangerously In Love , Beyonce","You're The One , Guerilla Black Featuring Mario Winans","Knuck If You Buck , Crime Mob Featuring Lil Scrappy","In A Real Love , Phil Vassar"
85,"Walking In Memphis , Lonestar","Chicks Dig It , Chris Cagle","I'm Still In Love With You , Sean Paul Featuring Sasha","I'm Still In Love With You , Sean Paul Featuring Sasha","Chicks Dig It , Chris Cagle","Fallen , Mya","Fallen , Mya","Badaboom , B2K Featuring Fabolous","Breathe , Michelle Branch","Alone , Lasgo","Alone , Lasgo","Gal Yuh Ah Lead , T.O.K.","Invisible , Clay Aiken","Invisible , Clay Aiken","Ride Wit U , Joe Featuring G-Unit","Ride Wit U , Joe Featuring G-Unit","Wild West Show , Big & Rich","Wild West Show , Big & Rich","Wild West Show , Big & Rich","Wild West Show , Big & Rich","Wild West Show , Big & Rich","Behind Blue Eyes , Limp Bizkit","Leave (Get Out) , JoJo","Bounce , Sarah Connor","Bounce , Sarah Connor","Songs About Rain , Gary Allan","Perfect , Sara Evans","Perfect , Sara Evans","Rubber Band Man , T.I.","Ride Wit U , Joe Featuring G-Unit","whoknows , Musiq","whoknows , Musiq","Love's Divine , Seal","You're The Only One , Maria Mena","You're The Only One , Maria Mena","You're The Only One , Maria Mena","I Miss You , Blink-182","Everything , Alanis Morissette","Everything , Alanis Morissette","I Miss You , Blink-182","Don't Take Your Love Away , Avant","Don't Take Your Love Away , Avant","Still In Love , Teena Marie Featuring Baby","Dreams , Diana DeGarmo","Shake That Sh** , Shawnna Featuring Ludacris","Shake That Sh** , Shawnna Featuring Ludacris","Happy People , R. Kelly","Freaks , Play-N-Skillz Featuring Krayzie Bone & Adina Howard","Freaks , Play-N-Skillz Featuring Krayzie Bone & Adina Howard","Still In Love , Teena Marie Featuring Baby","Everytime , Britney Spears","I Got A Feelin' , Billy Currington","I Got A Feelin' , Billy Currington","Slither , Velvet Revolver","Feelin' Way Too Damn Good , Nickelback","Feelin' Way Too Damn Good , Nickelback","Feelin' Way Too Damn Good , Nickelback","King Of The Dancehall , Beenie Man","Call My Name , Prince","Call My Name , Prince","Take Me Out , Franz Ferdinand","White Tee's , Dem Franchize Boyz","White Tee's , Dem Franchize Boyz","White Houses , Vanessa Carlton","King Of The Dancehall , Beenie Man","Numb/Encore , Jay-Z/Linkin Park","Numb/Encore , Jay-Z/Linkin Park","I Smoke, I Drank , Body Head Bangerz Featuring YoungBloodz","Cold , Crossfade","Cold , Crossfade","Getting Away With Murder , Papa Roach","Nolia Clap , Juvenile, Wacko & Skip","Baby Girl , Sugarland"
86,"Weak And Powerless , A Perfect Circle","Shake That Monkey , Too Short Featuring Lil Jon & The East Side Boyz","Freek-A-Leek , Petey Pablo","Freek-A-Leek , Petey Pablo","Still Frame , Trapt","Hell Yeah , Montgomery Gentry","Hell Yeah , Montgomery Gentry","Fallen , Mya","You , Ryan Duarte","Dude , Beenie Man Featuring Ms. Thing","Dude , Beenie Man Featuring Ms. Thing","The Voice Within , Christina Aguilera","One Day At A Time , Tupac With Eminem Featuring The Outlawz","One Day At A Time , Tupac With Eminem Featuring The Outlawz","You , Ryan Duarte","Love's Divine , Seal","Ride Wit U , Joe Featuring G-Unit","Ride Wit U , Joe Featuring G-Unit","Long Black Train , Josh Turner","Baby I Love U , Jennifer Lopez","Baby I Love U , Jennifer Lopez","I Love You This Much , Jimmy Wayne","Dip It Low , Christina Milian","Maps , Yeah Yeah Yeahs","Maps , Yeah Yeah Yeahs","Maps , Yeah Yeah Yeahs","Come Clean , Hilary Duff","Come Clean , Hilary Duff","You Raise Me Up , Josh Groban","You Raise Me Up , Josh Groban","Tear It Up , Yung Wun Featuring DMX, Lil' Flip & David Banner","Tear It Up , Yung Wun Featuring DMX, Lil' Flip & David Banner","Sweet Southern Comfort , Buddy Jewell","Love Song , 311","Love Song , 311","Love's Divine , Seal","Lying From You , Linkin Park","Don't Take Your Love Away , Avant","Don't Take Your Love Away , Avant","8th World Wonder , Kimberley Locke","99 Problems , JAY-Z","99 Problems , JAY-Z","Talk About Our Love , Brandy Featuring Kanye West","Loco , David Lee Murphy","So Fly , NB Ridaz Featuring Gemini","So Fly , NB Ridaz Featuring Gemini","Hey Good Lookin' , Jimmy Buffett With Clint Black, Kenny Chesney, Alan Jackson, Toby Keith & George Strait","Scandalous , Mis-Teeq","Scandalous , Mis-Teeq","Outrageous , Britney Spears","Somebody , Reba McEntire","How Come , D12","How Come , D12","Away From The Sun , 3 Doors Down","Call My Name , Prince","Call My Name , Prince","Nasty Girl , Nitty","Nasty Girl , Nitty","Tilt Ya Head Back , Nelly & Christina Aguilera","Tilt Ya Head Back , Nelly & Christina Aguilera","You're My Everything , Anita Baker","Flap Your Wings , Nelly","Flap Your Wings , Nelly","Hot 2Nite , New Edition","White Tee's , Dem Franchize Boyz","Why? , Jadakiss Featuring Anthony Hamilton","Why? , Jadakiss Featuring Anthony Hamilton","I Hate Everything , George Strait","You're The One , Guerilla Black Featuring Mario Winans","You're The One , Guerilla Black Featuring Mario Winans","What You Waiting For? , Gwen Stefani","What You Waiting For? , Gwen Stefani","Knuck If You Buck , Crime Mob Featuring Lil Scrappy"
