18,"Read Your Mind , Avant","Step In The Name Of Love , R. Kelly","Step In The Name Of Love , R. Kelly","Step In The Name Of Love , R. Kelly","The First Cut Is The Deepest , Sheryl Crow","Through The Wire , Kanye West","Through The Wire , Kanye West","Sorry 2004 , Ruben Studdard","The First Cut Is The Deepest , Sheryl Crow","The First Cut Is The Deepest , Sheryl Crow","The First Cut Is The Deepest , Sheryl Crow","With You , Jessica Simpson","The First Cut Is The Deepest , Sheryl Crow","The First Cut Is The Deepest , Sheryl Crow","The First Cut Is The Deepest , Sheryl Crow","This Love , Maroon 5","Numb , Linkin Park","Numb , Linkin Park","Numb , Linkin Park","Naughty Girl , Beyonce","Naughty Girl , Beyonce","I'm Still In Love With You , Sean Paul Featuring Sasha","The Reason , Hoobastank","Hotel , Cassidy Featuring R. Kelly","Hotel , Cassidy Featuring R. Kelly","Toxic , Britney Spears","Toxic , Britney Spears","Toxic , Britney Spears","The Way You Move , OutKast Featuring Sleepy Brown","Move Ya Body , Nina Sky Featuring Jabba","Slow Motion , Juvenile Featuring Soulja Slim","Slow Motion , Juvenile Featuring Soulja Slim","On Fire , Lloyd Banks","Happy People , R. Kelly","Happy People , R. Kelly","Meant To Live , Switchfoot","Meant To Live , Switchfoot","Meant To Live , Switchfoot","Meant To Live , Switchfoot","Meant To Live , Switchfoot","Meant To Live , Switchfoot","Meant To Live , Switchfoot","U Should've Known Better , Monica","Heaven , Los Lonely Boys","Heaven , Los Lonely Boys","Heaven , Los Lonely Boys","This Love , Maroon 5","Locked Up , Akon Featuring Styles P.","Locked Up , Akon Featuring Styles P.","Headsprung , LL Cool J","Headsprung , LL Cool J","Headsprung , LL Cool J","Headsprung , LL Cool J","Move Ya Body , Nina Sky Featuring Jabba","The Reason , Hoobastank","The Reason , Hoobastank","One Thing , Finger Eleven","Drop It Like It's Hot , Snoop Dogg Featuring Pharrell","Let's Go , Trick Daddy Featuring Lil Jon & Twista","Let's Go , Trick Daddy Featuring Lil Jon & Twista","Pieces Of Me , Ashlee Simpson","Charlene , Anthony Hamilton","Charlene , Anthony Hamilton","Charlene , Anthony Hamilton","Diary , Alicia Keys Featuring Tony! Toni! Tone!","My Happy Ending , Avril Lavigne","My Happy Ending , Avril Lavigne","Dare You To Move , Switchfoot","Just Lose It , Eminem","Just Lose It , Eminem","Charlene , Anthony Hamilton","Dare You To Move , Switchfoot","Karma , Lloyd Banks Featuring Avant"
19,"Runnin (Dying To Live) , Tupac Featuring The Notorious B.I.G.","Runnin (Dying To Live) , Tupac Featuring The Notorious B.I.G.","White Flag , Dido","White Flag , Dido","Damn! , YoungBloodZ Featuring Lil Jon","Sorry 2004 , Ruben Studdard","Sorry 2004 , Ruben Studdard","Hotel , Cassidy Featuring R. Kelly","White Flag , Dido","Dirt Off Your Shoulder , JAY-Z","Dirt Off Your Shoulder , JAY-Z","Dirt Off Your Shoulder , JAY-Z","F**k It (I Don't Want You Back) , Eamon","F**k It (I Don't Want You Back) , Eamon","F**k It (I Don't Want You Back) , Eamon","Through The Wire , Kanye West","Wanna Get To Know You , G-Unit Featuring Joe","Wanna Get To Know You , G-Unit Featuring Joe","I'm Still In Love With You , Sean Paul Featuring Sasha","My Band , D12","My Band , D12","Wanna Get To Know You , G-Unit Featuring Joe","Splash Waterfalls , Ludacris","The Way You Move , OutKast Featuring Sleepy Brown","The Way You Move , OutKast Featuring Sleepy Brown","Hotel , Cassidy Featuring R. Kelly","The Way You Move , OutKast Featuring Sleepy Brown","The Way You Move , OutKast Featuring Sleepy Brown","Take My Breath Away , Jessica Simpson","Happy People , R. Kelly","I'm Still In Love With You , Sean Paul Featuring Sasha","I'm Still In Love With You , Sean Paul Featuring Sasha","Game Over (Flip) , Lil' Flip","Meant To Live , Switchfoot","Meant To Live , Switchfoot","Turn Me On , Kevin Lyttle Featuring Spragga Benz","Tipsy , J-Kwon","Roses , OutKast","Roses , OutKast","Dip It Low , Christina Milian","Overnight Celebrity , Twista","Overnight Celebrity , Twista","Heaven , Los Lonely Boys","Diary , Alicia Keys Featuring Tony! Toni! Tone!","This Love , Maroon 5","This Love , Maroon 5","She Will Be Loved , Maroon 5","This Love , Maroon 5","This Love , Maroon 5","Jesus Walks , Kanye West","Heaven , Los Lonely Boys","Breaking The Habit , Linkin Park","Breaking The Habit , Linkin Park","Breaking The Habit , Linkin Park","On The Way Down , Ryan Cabrera","On The Way Down , Ryan Cabrera","Breakaway , Kelly Clarkson","Headsprung , LL Cool J","Oye Mi Canto , N.O.R.E. Featuring Daddy Yankee, Nina Sky, Gem Star & Big Mato","Oye Mi Canto , N.O.R.E. Featuring Daddy Yankee, Nina Sky, Gem Star & Big Mato","Sunshine , Lil' Flip Featuring Lea","One Thing , Finger Eleven","One Thing , Finger Eleven","Balla Baby , Chingy","Balla Baby , Chingy","Dare You To Move , Switchfoot","Dare You To Move , Switchfoot","Soldier , Destiny's Child Featuring T.I. & Lil Wayne","Shorty Wanna Ride , Young Buck","Shorty Wanna Ride , Young Buck","Broken , Seether Featuring Amy Lee","Breathe , Fabolous","Goodies , Ciara Featuring Petey Pablo"
20,"Why Don't You & I , Santana Featuring Alex Band Or Chad Kroeger","Numb , Linkin Park","Numb , Linkin Park","Numb , Linkin Park","Holidae In , Chingy Featuring Ludacris & Snoop Dogg","Get Low , Lil Jon & The East Side Boyz Featuring Ying Yang Twins","Get Low , Lil Jon & The East Side Boyz Featuring Ying Yang Twins","Read Your Mind , Avant","One Call Away , Chingy Featuring J. Weav","Suga Suga , Baby Bash Featuring Frankie J","Suga Suga , Baby Bash Featuring Frankie J","The First Cut Is The Deepest , Sheryl Crow","Here Without You , 3 Doors Down","Here Without You , 3 Doors Down","Here Without You , 3 Doors Down","Someday , Nickelback","F**k It (I Don't Want You Back) , Eamon","F**k It (I Don't Want You Back) , Eamon","If I Ain't Got You , Alicia Keys","With You , Jessica Simpson","With You , Jessica Simpson","The First Cut Is The Deepest , Sheryl Crow","Game Over (Flip) , Lil' Flip","Splash Waterfalls , Ludacris","Splash Waterfalls , Ludacris","Splash Waterfalls , Ludacris","Take My Breath Away , Jessica Simpson","Take My Breath Away , Jessica Simpson","Mayberry , Rascal Flatts","Take My Breath Away , Jessica Simpson","Happy People , R. Kelly","Happy People , R. Kelly","Meant To Live , Switchfoot","Everytime , Britney Spears","Everytime , Britney Spears","Leave (Get Out) , JoJo","Dip It Low , Christina Milian","Dip It Low , Christina Milian","Dip It Low , Christina Milian","Overnight Celebrity , Twista","I Like That , Houston Featuring Chingy, Nate Dogg & I-20","I Like That , Houston Featuring Chingy, Nate Dogg & I-20","Goodies , Ciara Featuring Petey Pablo","Freek-A-Leek , Petey Pablo","Yeah! , Usher Featuring Lil Jon & Ludacris","Yeah! , Usher Featuring Lil Jon & Ludacris","On Fire , Lloyd Banks","Heaven , Los Lonely Boys","Heaven , Los Lonely Boys","Heaven , Los Lonely Boys","Leave (Get Out) , JoJo","Let's Get It Started , The Black Eyed Peas","Let's Get It Started , The Black Eyed Peas","Let's Get It Started , The Black Eyed Peas","One Thing , Finger Eleven","One Thing , Finger Eleven","Turn Me On , Kevin Lyttle Featuring Spragga Benz","Why? , Jadakiss Featuring Anthony Hamilton","Heaven , Los Lonely Boys","Heaven , Los Lonely Boys","Go D.J. , Lil Wayne","Wonderful , Ja Rule Featuring R. Kelly & Ashanti","Wonderful , Ja Rule Featuring R. Kelly & Ashanti","Let Me Love You , Mario","Charlene , Anthony Hamilton","Charlene , Anthony Hamilton","Charlene , Anthony Hamilton","Broken , Seether Featuring Amy Lee","Broken , Seether Featuring Amy Lee","Broken , Seether Featuring Amy Lee","Get Back , Ludacris","U Make Me Wanna , Jadakiss Featuring Mariah Carey","Dare You To Move , Switchfoot"
21,"Headstrong , Trapt","White Flag , Dido","The First Cut Is The Deepest , Sheryl Crow","The First Cut Is The Deepest , Sheryl Crow","Step In The Name Of Love , R. Kelly","Baby Boy , Beyonce Featuring Sean Paul","Baby Boy , Beyonce Featuring Sean Paul","F**k It (I Don't Want You Back) , Eamon","Tipsy , J-Kwon","Toxic , Britney Spears","Toxic , Britney Spears","My Immortal , Evanescence","You Don't Know My Name , Alicia Keys","You Don't Know My Name , Alicia Keys","It's My Life , No Doubt","I Don't Wanna Know , Mario Winans Featuring Enya & P. Diddy","Someday , Nickelback","Someday , Nickelback","Hey Ya! , OutKast","Freek-A-Leek , Petey Pablo","Freek-A-Leek , Petey Pablo","With You , Jessica Simpson","The First Cut Is The Deepest , Sheryl Crow","The First Cut Is The Deepest , Sheryl Crow","The First Cut Is The Deepest , Sheryl Crow","The First Cut Is The Deepest , Sheryl Crow","Hotel , Cassidy Featuring R. Kelly","Hotel , Cassidy Featuring R. Kelly","Redneck Woman , Gretchen Wilson","Redneck Woman , Gretchen Wilson","Redneck Woman , Gretchen Wilson","Redneck Woman , Gretchen Wilson","Jesus Walks , Kanye West","Dirt Off Your Shoulder , JAY-Z","Dirt Off Your Shoulder , JAY-Z","Don't Tell Me , Avril Lavigne","Heaven , Los Lonely Boys","Heaven , Los Lonely Boys","Heaven , Los Lonely Boys","Heaven , Los Lonely Boys","Heaven , Los Lonely Boys","Heaven , Los Lonely Boys","Everytime , Britney Spears","Yeah! , Usher Featuring Lil Jon & Ludacris","Meant To Live , Switchfoot","Meant To Live , Switchfoot","Meant To Live , Switchfoot","Meant To Live , Switchfoot","Meant To Live , Switchfoot","This Love , Maroon 5","This Love , Maroon 5","Heaven , Los Lonely Boys","Heaven , Los Lonely Boys","Heaven , Los Lonely Boys","Breaking The Habit , Linkin Park","Breaking The Habit , Linkin Park","Breaking The Habit , Linkin Park","Let's Get It Started , The Black Eyed Peas","Slow Motion , Juvenile Featuring Soulja Slim","Slow Motion , Juvenile Featuring Soulja Slim","Heaven , Los Lonely Boys","If I Ain't Got You , Alicia Keys","If I Ain't Got You , Alicia Keys","One Thing , Finger Eleven","Shorty Wanna Ride , Young Buck","Balla Baby , Chingy","Balla Baby , Chingy","Charlene , Anthony Hamilton","Charlene , Anthony Hamilton","Charlene , Anthony Hamilton","Baby It's You , JoJo Featuring Bow Wow","What U Gon' Do , Lil Jon & The East Side Boyz Featuring Lil Scrappy","What U Gon' Do , Lil Jon & The East Side Boyz Featuring Lil Scrappy"
22,"White Flag , Dido","Why Don't You & I , Santana Featuring Alex Band Or Chad Kroeger","Why Don't You & I , Santana Featuring Alex Band Or Chad Kroeger","Why Don't You & I , Santana Featuring Alex Band Or Chad Kroeger","Change Clothes , JAY-Z","Step In The Name Of Love , R. Kelly","Step In The Name Of Love , R. Kelly","Splash Waterfalls , Ludacris","Stand Up , Ludacris Featuring Shawnna","With You , Jessica Simpson","With You , Jessica Simpson","It's My Life , No Doubt","It's My Life , No Doubt","It's My Life , No Doubt","White Flag , Dido","White Flag , Dido","I'm Still In Love With You , Sean Paul Featuring Sasha","I'm Still In Love With You , Sean Paul Featuring Sasha","Someday , Nickelback","Sorry 2004 , Ruben Studdard","Sorry 2004 , Ruben Studdard","The Reason , Hoobastank","Wanna Get To Know You , G-Unit Featuring Joe","With You , Jessica Simpson","With You , Jessica Simpson","With You , Jessica Simpson","With You , Jessica Simpson","With You , Jessica Simpson","One Call Away , Chingy Featuring J. Weav","Hey Mama , The Black Eyed Peas","Hey Mama , The Black Eyed Peas","Hey Mama , The Black Eyed Peas","Everytime , Britney Spears","Leave (Get Out) , JoJo","Leave (Get Out) , JoJo","Dirt Off Your Shoulder , JAY-Z","All Falls Down , Kanye West Featuring Syleena Johnson","Lean Back , Terror Squad","Lean Back , Terror Squad","Naughty Girl , Beyonce","U Should've Known Better , Monica","U Should've Known Better , Monica","Pieces Of Me , Ashlee Simpson","Pieces Of Me , Ashlee Simpson","Why? , Jadakiss Featuring Anthony Hamilton","Why? , Jadakiss Featuring Anthony Hamilton","Why? , Jadakiss Featuring Anthony Hamilton","Burn , Usher","Burn , Usher","My Happy Ending , Avril Lavigne","Breaking The Habit , Linkin Park","Confessions Part II , Usher","Confessions Part II , Usher","On The Way Down , Ryan Cabrera","Heaven , Los Lonely Boys","Heaven , Los Lonely Boys","Let's Get It Started , The Black Eyed Peas","Heaven , Los Lonely Boys","Headsprung , LL Cool J","Headsprung , LL Cool J","Charlene , Anthony Hamilton","Balla Baby , Chingy","Balla Baby , Chingy","1985 , Bowling For Soup","On The Way Down , Ryan Cabrera","Broken , Seether Featuring Amy Lee","Broken , Seether Featuring Amy Lee","Baby It's You , JoJo Featuring Bow Wow","Baby It's You , JoJo Featuring Bow Wow","Baby It's You , JoJo Featuring Bow Wow","Only U , Ashanti","How We Do , The Game Featuring 50 Cent","U Make Me Wanna , Jadakiss Featuring Mariah Carey"
23,"Numb , Linkin Park","Gigolo , Nick Cannon Featuring R. Kelly","Headstrong , Trapt","Headstrong , Trapt","Salt Shaker , Ying Yang Twins Featuring Lil Jon & The East Side Boyz","Hotel , Cassidy Featuring R. Kelly","Hotel , Cassidy Featuring R. Kelly","With You , Jessica Simpson","With You , Jessica Simpson","White Flag , Dido","White Flag , Dido","White Flag , Dido","White Flag , Dido","White Flag , Dido","This Love , Maroon 5","Here Without You , 3 Doors Down","Burn , Usher","Burn , Usher","Salt Shaker , Ying Yang Twins Featuring Lil Jon & The East Side Boyz","Numb , Linkin Park","Numb , Linkin Park","Someday , Nickelback","With You , Jessica Simpson","Someday , Nickelback","Someday , Nickelback","Take My Breath Away , Jessica Simpson","You'll Think Of Me , Keith Urban","You'll Think Of Me , Keith Urban","The First Cut Is The Deepest , Sheryl Crow","Letters From Home , John Michael Montgomery","Letters From Home , John Michael Montgomery","Letters From Home , John Michael Montgomery","Hey Mama , The Black Eyed Peas","Hey Mama , The Black Eyed Peas","Hey Mama , The Black Eyed Peas","My Immortal , Evanescence","Lean Back , Terror Squad","U Should've Known Better , Monica","U Should've Known Better , Monica","U Should've Known Better , Monica","Naughty Girl , Beyonce","Naughty Girl , Beyonce","I Don't Wanna Know , Mario Winans Featuring Enya & P. Diddy","U Should've Known Better , Monica","Southside , Lloyd Featuring Ashanti","Southside , Lloyd Featuring Ashanti","Yeah! , Usher Featuring Lil Jon & Ludacris","Yeah! , Usher Featuring Lil Jon & Ludacris","Yeah! , Usher Featuring Lil Jon & Ludacris","Meant To Live , Switchfoot","Jesus Walks , Kanye West","Leave (Get Out) , JoJo","Leave (Get Out) , JoJo","This Love , Maroon 5","Let's Get It Started , The Black Eyed Peas","Let's Get It Started , The Black Eyed Peas","Heaven , Los Lonely Boys","Let's Go , Trick Daddy Featuring Lil Jon & Twista","The Reason , Hoobastank","The Reason , Hoobastank","Breathe , Fabolous","Pieces Of Me , Ashlee Simpson","Pieces Of Me , Ashlee Simpson","1, 2 Step , Ciara Featuring Missy Elliott","I Don't Want To Be , Gavin DeGraw","Diary , Alicia Keys Featuring Tony! Toni! Tone!","Diary , Alicia Keys Featuring Tony! Toni! Tone!","Balla Baby , Chingy","Lean Back , Terror Squad","Lean Back , Terror Squad","Shorty Wanna Ride , Young Buck","Go D.J. , Lil Wayne","Numb/Encore , Jay-Z/Linkin Park"
24,"Stunt 101 , G Unit","Headstrong , Trapt","Salt Shaker , Ying Yang Twins Featuring Lil Jon & The East Side Boyz","Salt Shaker , Ying Yang Twins Featuring Lil Jon & The East Side Boyz","Why Don't You & I , Santana Featuring Alex Band Or Chad Kroeger","Gigolo , Nick Cannon Featuring R. Kelly","Gigolo , Nick Cannon Featuring R. Kelly","Gigolo , Nick Cannon Featuring R. Kelly","Read Your Mind , Avant","My Immortal , Evanescence","My Immortal , Evanescence","Suga Suga , Baby Bash Featuring Frankie J","Gigolo , Nick Cannon Featuring R. Kelly","Gigolo , Nick Cannon Featuring R. Kelly","You Don't Know My Name , Alicia Keys","Wanna Get To Know You , G-Unit Featuring Joe","White Flag , Dido","White Flag , Dido","Freek-A-Leek , Petey Pablo","Someday , Nickelback","Someday , Nickelback","Game Over (Flip) , Lil' Flip","Someday , Nickelback","Take My Breath Away , Jessica Simpson","Take My Breath Away , Jessica Simpson","Someday , Nickelback","Someday , Nickelback","Someday , Nickelback","Happy People , R. Kelly","Slow Motion , Juvenile Featuring Soulja Slim","On Fire , Lloyd Banks","On Fire , Lloyd Banks","Don't Tell Me , Avril Lavigne","Don't Tell Me , Avril Lavigne","Don't Tell Me , Avril Lavigne","Heaven , Los Lonely Boys","U Should've Known Better , Monica","Tipsy , J-Kwon","Tipsy , J-Kwon","Roses , OutKast","Sunshine , Lil' Flip Featuring Lea","Sunshine , Lil' Flip Featuring Lea","Diary , Alicia Keys Featuring Tony! Toni! Tone!","Southside , Lloyd Featuring Ashanti","U Should've Known Better , Monica","U Should've Known Better , Monica","So Sexy , Twista Featuring R. Kelly","So Sexy , Twista Featuring R. Kelly","So Sexy , Twista Featuring R. Kelly","Breaking The Habit , Linkin Park","Let's Get It Started , The Black Eyed Peas","This Love , Maroon 5","This Love , Maroon 5","One Thing , Finger Eleven","Move Ya Body , Nina Sky Featuring Jabba","Move Ya Body , Nina Sky Featuring Jabba","The Reason , Hoobastank","Oye Mi Canto , N.O.R.E. Featuring Daddy Yankee, Nina Sky, Gem Star & Big Mato","Go D.J. , Lil Wayne","Go D.J. , Lil Wayne","Balla Baby , Chingy","1985 , Bowling For Soup","1985 , Bowling For Soup","Broken , Seether Featuring Amy Lee","Broken , Seether Featuring Amy Lee","One Thing , Finger Eleven","One Thing , Finger Eleven","On The Way Down , Ryan Cabrera","Balla Baby , Chingy","Balla Baby , Chingy","Just Lose It , Eminem","Karma , Lloyd Banks Featuring Avant","Encore , Eminem, Dr. Dre & 50 Cent"
25,"Wat Da Hook Gon Be , Murphy Lee Featuring Jermaine Dupri","Salt Shaker , Ying Yang Twins Featuring Lil Jon & The East Side Boyz","Runnin (Dying To Live) , Tupac Featuring The Notorious B.I.G.","Runnin (Dying To Live) , Tupac Featuring The Notorious B.I.G.","Through The Wire , Kanye West","F**k It (I Don't Want You Back) , Eamon","F**k It (I Don't Want You Back) , Eamon","Tipsy , J-Kwon","Dirt Off Your Shoulder , JAY-Z","Read Your Mind , Avant","Read Your Mind , Avant","Gigolo , Nick Cannon Featuring R. Kelly","Read Your Mind , Avant","Read Your Mind , Avant","I Don't Wanna Know , Mario Winans Featuring Enya & P. Diddy","It's My Life , No Doubt","Through The Wire , Kanye West","Through The Wire , Kanye West","F**k It (I Don't Want You Back) , Eamon","Hey Ya! , OutKast","Hey Ya! , OutKast","Numb , Linkin Park","White Flag , Dido","When The Sun Goes Down , Kenny Chesney & Uncle Kracker","When The Sun Goes Down , Kenny Chesney & Uncle Kracker","When The Sun Goes Down , Kenny Chesney & Uncle Kracker","The First Cut Is The Deepest , Sheryl Crow","The First Cut Is The Deepest , Sheryl Crow","Move Ya Body , Nina Sky Featuring Jabba","Here Without You , 3 Doors Down","Everytime , Britney Spears","Everytime , Britney Spears","Dude , Beenie Man Featuring Ms. Thing","Game Over (Flip) , Lil' Flip","Game Over (Flip) , Lil' Flip","Dip It Low , Christina Milian","Don't Tell Me , Avril Lavigne","Don't Tell Me , Avril Lavigne","Don't Tell Me , Avril Lavigne","I Like That , Houston Featuring Chingy, Nate Dogg & I-20","Diary , Alicia Keys Featuring Tony! Toni! Tone!","Diary , Alicia Keys Featuring Tony! Toni! Tone!","Southside , Lloyd Featuring Ashanti","Why? , Jadakiss Featuring Anthony Hamilton","Freek-A-Leek , Petey Pablo","Freek-A-Leek , Petey Pablo","Southside , Lloyd Featuring Ashanti","Southside , Lloyd Featuring Ashanti","Southside , Lloyd Featuring Ashanti","Burn , Usher","One Thing , Finger Eleven","On The Way Down , Ryan Cabrera","On The Way Down , Ryan Cabrera","Confessions Part II , Usher","This Love , Maroon 5","This Love , Maroon 5","I Like That , Houston Featuring Chingy, Nate Dogg & I-20","The Reason , Hoobastank","Charlene , Anthony Hamilton","Charlene , Anthony Hamilton","The Reason , Hoobastank","Heaven , Los Lonely Boys","Heaven , Los Lonely Boys","If I Ain't Got You , Alicia Keys","One Thing , Finger Eleven","Baby It's You , JoJo Featuring Bow Wow","Baby It's You , JoJo Featuring Bow Wow","Lean Back , Terror Squad","On The Way Down , Ryan Cabrera","On The Way Down , Ryan Cabrera","Hush , LL Cool J Featuring 7 Aurelius","Encore , Eminem, Dr. Dre & 50 Cent","Bring Em Out , T.I."
26,"Gigolo , Nick Cannon Featuring R. Kelly","Stunt 101 , G Unit","Stunt 101 , G Unit","Stunt 101 , G Unit","Gigolo , Nick Cannon Featuring R. Kelly","Why Don't You & I , Santana Featuring Alex Band Or Chad Kroeger","Why Don't You & I , Santana Featuring Alex Band Or Chad Kroeger","Step In The Name Of Love , R. Kelly","Walked Outta Heaven , Jagged Edge","Milkshake , Kelis","Milkshake , Kelis","Read Your Mind , Avant","This Love , Maroon 5","This Love , Maroon 5","Gigolo , Nick Cannon Featuring R. Kelly","I'm Still In Love With You , Sean Paul Featuring Sasha","Here Without You , 3 Doors Down","Here Without You , 3 Doors Down","My Band , D12","Solitaire , Clay Aiken","Solitaire , Clay Aiken","Sorry 2004 , Ruben Studdard","When The Sun Goes Down , Kenny Chesney & Uncle Kracker","Wanna Get To Know You , G-Unit Featuring Joe","Wanna Get To Know You , G-Unit Featuring Joe","You'll Think Of Me , Keith Urban","Mayberry , Rascal Flatts","Mayberry , Rascal Flatts","Letters From Home , John Michael Montgomery","Someday , Nickelback","Here Without You , 3 Doors Down","Here Without You , 3 Doors Down","Redneck Woman , Gretchen Wilson","Redneck Woman , Gretchen Wilson","Redneck Woman , Gretchen Wilson","U Should've Known Better , Monica","Dirt Off Your Shoulder , JAY-Z","Southside , Lloyd Featuring Ashanti","Southside , Lloyd Featuring Ashanti","Sunshine , Lil' Flip Featuring Lea","Roses , OutKast","Roses , OutKast","My Place , Nelly Featuring Jaheim","How Come , D12","She Will Be Loved , Maroon 5","She Will Be Loved , Maroon 5","U Should've Known Better , Monica","Headsprung , LL Cool J","Headsprung , LL Cool J","So Sexy , Twista Featuring R. Kelly","On The Way Down , Ryan Cabrera","Jesus Walks , Kanye West","Jesus Walks , Kanye West","Leave (Get Out) , JoJo","Breakaway , Kelly Clarkson","Breakaway , Kelly Clarkson","This Love , Maroon 5","Turn Me On , Kevin Lyttle Featuring Spragga Benz","Let's Get It Started , The Black Eyed Peas","Let's Get It Started , The Black Eyed Peas","Headsprung , LL Cool J","Hush , LL Cool J Featuring 7 Aurelius","Hush , LL Cool J Featuring 7 Aurelius","Hush , LL Cool J Featuring 7 Aurelius","Hush , LL Cool J Featuring 7 Aurelius","Hush , LL Cool J Featuring 7 Aurelius","Hush , LL Cool J Featuring 7 Aurelius","Hush , LL Cool J Featuring 7 Aurelius","One Thing , Finger Eleven","One Thing , Finger Eleven","Disco Inferno , 50 Cent","Boulevard Of Broken Dreams , Green Day","New York , Ja Rule Featuring Fat Joe & Jadakiss"
27,"So Far Away , Staind","Wat Da Hook Gon Be , Murphy Lee Featuring Jermaine Dupri","So Far Away , Staind","So Far Away , Staind","Runnin (Dying To Live) , Tupac Featuring The Notorious B.I.G.","Damn! , YoungBloodZ Featuring Lil Jon","Damn! , YoungBloodZ Featuring Lil Jon","Damn! , YoungBloodZ Featuring Lil Jon","Gigolo , Nick Cannon Featuring R. Kelly","Gigolo , Nick Cannon Featuring R. Kelly","Gigolo , Nick Cannon Featuring R. Kelly","American Soldier , Toby Keith","Suga Suga , Baby Bash Featuring Frankie J","Suga Suga , Baby Bash Featuring Frankie J","Wanna Get To Know You , G-Unit Featuring Joe","If I Ain't Got You , Alicia Keys","If I Ain't Got You , Alicia Keys","If I Ain't Got You , Alicia Keys","Me, Myself And I , Beyonce","Overnight Celebrity , Twista","Overnight Celebrity , Twista","Slow Jamz , Twista Featuring Kanye West & Jamie Foxx","Sorry 2004 , Ruben Studdard","You'll Think Of Me , Keith Urban","You'll Think Of Me , Keith Urban","Confessions Part II , Usher","When The Sun Goes Down , Kenny Chesney & Uncle Kracker","When The Sun Goes Down , Kenny Chesney & Uncle Kracker","100 Years , Five For Fighting","The Way You Move , OutKast Featuring Sleepy Brown","Don't Tell Me , Avril Lavigne","Don't Tell Me , Avril Lavigne","Happy People , R. Kelly","My Band , D12","My Band , D12","Happy People , R. Kelly","My Immortal , Evanescence","Diary , Alicia Keys Featuring Tony! Toni! Tone!","Diary , Alicia Keys Featuring Tony! Toni! Tone!","Diary , Alicia Keys Featuring Tony! Toni! Tone!","Pieces Of Me , Ashlee Simpson","Pieces Of Me , Ashlee Simpson","Naughty Girl , Beyonce","Everytime , Britney Spears","So Sexy , Twista Featuring R. Kelly","So Sexy , Twista Featuring R. Kelly","Locked Up , Akon Featuring Styles P.","U Should've Known Better , Monica","U Should've Known Better , Monica","Southside , Lloyd Featuring Ashanti","Meant To Live , Switchfoot","Yeah! , Usher Featuring Lil Jon & Ludacris","Yeah! , Usher Featuring Lil Jon & Ludacris","Jesus Walks , Kanye West","Breathe, Stretch, Shake , Mase Featuring P. Diddy","Breathe, Stretch, Shake , Mase Featuring P. Diddy","Breathe, Stretch, Shake , Mase Featuring P. Diddy","Breathe, Stretch, Shake , Mase Featuring P. Diddy","Dip It Low , Christina Milian","Dip It Low , Christina Milian","1985 , Bowling For Soup","The Reason , Hoobastank","The Reason , Hoobastank","My Place , Nelly Featuring Jaheim","Dare You To Move , Switchfoot","On The Way Down , Ryan Cabrera","On The Way Down , Ryan Cabrera","One Thing , Finger Eleven","Hush , LL Cool J Featuring 7 Aurelius","Hush , LL Cool J Featuring 7 Aurelius","What U Gon' Do , Lil Jon & The East Side Boyz Featuring Lil Scrappy","Some Beach , Blake Shelton","Oye Mi Canto , N.O.R.E. Featuring Daddy Yankee, Nina Sky, Gem Star & Big Mato"
